date,username,to,replies,retweets,text,mentions,hashtags,permalink
2019-12-15 14:48:59,micheal_olainn,tonypatt2000,1,0,The rift was too great and my feelings too strong easily to return. I suspect that I shall remain politically homeless. I’m considering a move to Scotland. There may be a refuge for Remainers there. Thank you for the kind words. Johnson’s Britain is not my Britain.,,,https://twitter.com/micheal_olainn/status/1206224641913696258
2019-12-15 14:47:44,dikbutshirtpant,rocketqueenlisa,0,0,Micheal ps hayes. Sweet,,,https://twitter.com/dikbutshirtpant/status/1206224327580012546
2019-12-15 14:46:38,stump54jumper,Tactical_review,0,0,micheal moore hunting a Big Mac &amp; a large order of fries!! ,,,https://twitter.com/stump54jumper/status/1206224048755220482
2019-12-15 14:45:25,farfallabianxa,,0,0,micheal buble: micheal buble a natale: ,,,https://twitter.com/farfallabianxa/status/1206223743175024645
2019-12-15 14:45:04,pmcdonough44,,0,0,"Miles sanders, devin Singletary, Aaron jones and Sony micheal... need 2 of 4, rb do not get points til 50 yards rushing, double points for passing/recieving tds bonuses for 20+ carriers @Jeff_Meller",@Jeff_Meller,,https://twitter.com/pmcdonough44/status/1206223656659107840
2019-12-15 14:44:57,tonypatt2000,micheal_olainn,1,1,"I take Ian's point that to be able to vote we need to join now. Reading your tweets, Michael, you are exactly the kind of person that Labour needs at the moment.",,,https://twitter.com/tonypatt2000/status/1206223626019753984
2019-12-15 14:44:13,PaiLagit,Fedmyster,0,0,Micheal is gonna find some way to kill you all of you do,,,https://twitter.com/PaiLagit/status/1206223441743040514
2019-12-15 14:43:26,Nesara311T,,0,0,There are many above the law. The awaken know many of the. But hunter Hilary Bill Barry Micheal Just a few Add in bush Jamie diamond,,,https://twitter.com/Nesara311T/status/1206223245634080768
2019-12-15 14:43:14,aaronmc26,,0,0,Micheal Keane runs like he has a throbbing erection #stiffy,,#stiffy,https://twitter.com/aaronmc26/status/1206223194824294400
2019-12-15 14:42:57,micheal_olainn,campbellclaret,0,0,Good point.,,,https://twitter.com/micheal_olainn/status/1206223122833321990
2019-12-15 14:42:04,kirchprincess,,0,0,@nbcthegoodplace @Harry_Styles i can even see Micheal welcoming people at the fake good place with this song ugh ,@nbcthegoodplace @Harry_Styles,,https://twitter.com/kirchprincess/status/1206222898383462400
2019-12-15 14:41:37,Micheal_Lagain,fionamitchell56,0,0,"Apparently Nationalism only has a minority of 40% in the North.....or so Varadkar said on the radio yesterday, yet we now have more Nationalist MPs than Unionist MPs now.",,,https://twitter.com/Micheal_Lagain/status/1206222788350136321
2019-12-15 14:41:30,safeco10,vicbaker69,0,0,The Micheal Slater of New Zealand,,,https://twitter.com/safeco10/status/1206222757773447169
2019-12-15 14:41:05,PaulOMahony5,ZoeHealy3,1,0,The parents said so.,,,https://twitter.com/PaulOMahony5/status/1206222652752515072
2019-12-15 14:41:04,micheal_olainn,tonypatt2000,2,0,I left Labour and will wait to see if I will return. I still voted Labour in the GE.,,,https://twitter.com/micheal_olainn/status/1206222650151972864
2019-12-15 14:39:54,micheal_olainn,IanDunt,0,0,"It would be a pity to see an internecine dispute within Labour, disabling it as an opposition party. That would play into the hands of the Tories.",,,https://twitter.com/micheal_olainn/status/1206222355481157637
2019-12-15 14:39:33,AllmanMarcus,LibertyHangout,0,0,"WTF is Micheal Heil going to do, being a 50 year old virgin?",,,https://twitter.com/AllmanMarcus/status/1206222267740565504
2019-12-15 14:38:14,ShaheenFarooqi,RWPUSA,0,0,"Micheal Cohen must be released immediately. In the end, he turned out be a good, patriotic man",,,https://twitter.com/ShaheenFarooqi/status/1206221934121357318
2019-12-15 14:38:10,micheal_olainn,thejournal_ie,0,0,Homophobia.,,,https://twitter.com/micheal_olainn/status/1206221917172174853
2019-12-15 14:37:43,micheal_olainn,eoinyk,0,0,I know of no true patriot who ever self described as a patriot.,,,https://twitter.com/micheal_olainn/status/1206221805842837505
2019-12-15 14:36:45,micheal_olainn,KOSullivanIT,0,0,We now fiddle whilst we continue to make the climate less hospitable to and even hostile to human life on this planet. It may already be an academic debate in terms of unavoidable real outcomes.,,,https://twitter.com/micheal_olainn/status/1206221562132733954
2019-12-15 14:36:14,aliciaajackson,TheRightMelissa,0,0,The Micheal he is referring to Mike Mullen's (retired Navy officer) son. He also mentioned Deborah (Mike's wife) and Jack (Mike's other son).,,,https://twitter.com/aliciaajackson/status/1206221431689949190
2019-12-15 14:36:07,JeromeDavies1,dasvee,1,0,They said that after Micheal Foot's defeat and the SDP. Though to be fair Foot was a far better leader than Corbyn.,,,https://twitter.com/JeromeDavies1/status/1206221403638419457
2019-12-15 14:35:11,danverbarnes,,0,0,Losing my shit waiting for Micheal and holly to fall in love all over again,,,https://twitter.com/danverbarnes/status/1206221167155171335
2019-12-15 14:34:36,micheal_olainn,LunchtimeLiveNT,0,0,"I am not aware of any celebrities who have had the opportunity to meet me but I know many wise and enlightened people, not celebrities, whom I’ve met and been inspired by.",,,https://twitter.com/micheal_olainn/status/1206221020480331777
2019-12-15 14:29:46,micheal_olainn,Bankofisland,0,0,Brexit Broadcasting Corporation.,,,https://twitter.com/micheal_olainn/status/1206219804501315584
2019-12-15 14:28:56,next_raikage,pradaa_ky,4,2,#7 low-key has a Micheal Jackson vibe ,,,https://twitter.com/next_raikage/status/1206219595075506176
2019-12-15 14:27:33,MichealJ72,,0,0,Check out Micheal Jones Jr on @Hudl http://www.hudl.com/profile/11534085 #hudl,@Hudl,#hudl,https://twitter.com/MichealJ72/status/1206219247023742980
2019-12-15 14:27:20,micheal_olainn,john_mcguirk,2,0,It is critically important for the Far Right that they can persuade as many people as possible to listen to their hate ideology in the hope of spreading their infection base. It is like a hate virus. It needs to be spread. Exposure is needed.,,,https://twitter.com/micheal_olainn/status/1206219192594239489
2019-12-15 14:26:52,HyperbolicDub,Trickstersworld,0,1,He was brilliant. ✊,,,https://twitter.com/HyperbolicDub/status/1206219074956607489
2019-12-15 14:26:35,PatriotHistoria,mtracey,0,1,Micheal this government and Congress is in need of a reset. It needs a #ConventionOfStates,,#ConventionOfStates,https://twitter.com/PatriotHistoria/status/1206219005050142720
2019-12-15 14:26:22,TheCrazyMeifwa,,0,0,"@Maxy_Waxy_ Hey, VSauce! Micheal here. Have you ever wondered how many fictional characters you have absorbed into your being? ",@Maxy_Waxy_,,https://twitter.com/TheCrazyMeifwa/status/1206218947990884352
2019-12-15 14:25:57,MissRay312,Thims_twinkie,0,0,Only use D&G Light Blue👌🏽💖but any Micheal Kors is doable😊,,,https://twitter.com/MissRay312/status/1206218842772508672
2019-12-15 14:25:34,ace_steverogers,,1,0,Im a simple person. I love micheal myers. I also love every single other serial killer character who happens across my radar. And thats all there is to it.,,,https://twitter.com/ace_steverogers/status/1206218746689282048
2019-12-15 14:25:26,amieraged,PaanYNWA,0,2,"Nothing will ever go wrong with Micheal Bay &amp; Ray Reynolds, it's a MUST WATCH MOVIE!!! ",,,https://twitter.com/amieraged/status/1206218715072589824
2019-12-15 14:25:07,lnvertedRole,BlancoAbhi,1,0,"Kobe Bryant, Micheal Jordan and LeBron all look the same lol",,,https://twitter.com/lnvertedRole/status/1206218635263406080
2019-12-15 14:24:38,SimplyDanW,RamsPolls,1,0,1. Micheal Hector - Chelsea CB. Won players the season at swfc. Frank owes us one. 2. Jack Clarke - Spurs. If he goes back in Jan from Leeds 3. Lukas Jutkiewicz - Blues. Need a guy in his mold. But can’t see them selling their best performer.,,,https://twitter.com/SimplyDanW/status/1206218511506382848
2019-12-15 14:24:38,Emaxx2044,TheRealPamIAm,0,0,Yea! It’s you Micheal! And your traitor husband @BarackObama Jail Coming,@BarackObama,,https://twitter.com/Emaxx2044/status/1206218510441078785
2019-12-15 14:22:11,OliviaTaylar,ImaniDH,0,0,Micheal b Jordan and Dave east ,,,https://twitter.com/OliviaTaylar/status/1206217897426722823
2019-12-15 14:19:52,Hachenn_thegent,foxinks,0,0,"Hm, immediate thought is Micheal Cera lol ",,,https://twitter.com/Hachenn_thegent/status/1206217313755770880
2019-12-15 14:18:50,micheal_olainn,sanepolitico,0,0,"If there is not unrestricted right to engage in hate speech, it will be much more difficult for the extreme right to gain political traction. The far right and the extreme right depend on hate speech.",,,https://twitter.com/micheal_olainn/status/1206217054958899201
2019-12-15 14:17:53,JillManns1,Calypsoasis,1,0,Happy Sunday to you 🌞,,,https://twitter.com/JillManns1/status/1206216812632924161
2019-12-15 14:17:02,Brianquizmaster,Afinkingman,0,0,Not for some time Micheal,,,https://twitter.com/Brianquizmaster/status/1206216601059627009
2019-12-15 14:15:43,BrandonJRomero_,micheal_SLC,1,1,He def made America great again 👏🏽👏🏽👏🏽 THANK YOU USMAN. Should’ve beat his ass some more,,,https://twitter.com/BrandonJRomero_/status/1206216270439469056
2019-12-15 14:15:33,BaileyMalia,,0,0,yes i sometimes cry while listening to micheal jackson essentials album. what about it?,,,https://twitter.com/BaileyMalia/status/1206216224725704704
2019-12-15 14:15:19,julieefleck,_letsblade,0,0,Or Micheal Kors wallets hidden behind my diffusers with the ink tags ripped off them bc someone was gonna steal but changed their minds lolol or cleaning up shampoo or ‘unicorn slime’ on my displays 🙃,,,https://twitter.com/julieefleck/status/1206216167003688960
2019-12-15 14:15:18,ay_midee,olamicheal_,1,0,Micheal?? Did someone steal your phone?,,,https://twitter.com/ay_midee/status/1206216163040153601
2019-12-15 14:14:34,kierradanyel_,donahue_micheal,0,0,....... is that a battery 😂,,,https://twitter.com/kierradanyel_/status/1206215977198923776
2019-12-15 14:14:29,micheal_olainn,OxfordDiplomat,1,0,"When you get to my advanced years, you end up not giving a toss what other people think of your views and you may even get a curmudgeonly enjoyment in provoking irritation. I wind up pro Brexiters and watch their incandescent rage. My wife thinks that I’m going to get a beating",,,https://twitter.com/micheal_olainn/status/1206215956969725952
2019-12-15 14:14:02,TheRobertI,,0,0,"#6undergound Was a intense, horrifying stunts, more blasts and even more fun from @VancityReynolds. I thought ""am I watching a 64K ultra HD quality film!"", so much clarity and amazing. We want this kinda films from Micheal Bay. @netflix, you should have released this in theatres",@VancityReynolds @netflix,#6undergound,https://twitter.com/TheRobertI/status/1206215846986575872
2019-12-15 14:11:55,TJR1878,,0,0,God micheal keane is so fucking wet,,,https://twitter.com/TJR1878/status/1206215312212922370
2019-12-15 14:11:13,micheal_olainn,conor_pope,0,0,"If one were to be somewhat cynical, it takes big printers to print big lies in sufficient volume.",,,https://twitter.com/micheal_olainn/status/1206215136903663617
2019-12-15 14:10:21,TheRealUCFKent,InsideTheMagic,0,0,Not complete without the most essential character...according to Micheal Scott. ,,,https://twitter.com/TheRealUCFKent/status/1206214916677472256
2019-12-15 14:10:11,micheal_olainn,pmaceinri,0,0,Exactly so. Well said.,,,https://twitter.com/micheal_olainn/status/1206214875762057217
2019-12-15 14:10:01,5DimesSB,,2,7,ICYMI: This is how Kamaru Usman finished the trash-talking Colby Covington via TKO at 4:10 of the fifth round in the main event of #UFC245! (📹 @micheal_SLC),@micheal_SLC,#UFC245,https://twitter.com/5DimesSB/status/1206214833311490048
2019-12-15 14:09:37,micheal_olainn,IrishTimes,0,0,It may be too late at this point. Negative feedback loops are already starting and we are seeing early indicators of some potential tipping points. We needed Ms Thunberg 15 years ago or more. We left it too late. Now the only chance is a break through carbon sequestration.,,,https://twitter.com/micheal_olainn/status/1206214732455325697
2019-12-15 14:08:33,1LxrdGook,SneakersNWings,1,0,Lol Micheal you're no competition ,,,https://twitter.com/1LxrdGook/status/1206214463029944320
2019-12-15 14:07:16,football3661,,0,0,"Micheal Oliver typical......no yellow, but another gutless call... #MUNEVE",,#MUNEVE,https://twitter.com/football3661/status/1206214143369449473
2019-12-15 14:06:34,Craigx22CB,,1,0,"(1/2) Ok so Micheal Bottomley from Limitless Tattoo is claiming, because he has a no refund policy (under ANY circumstances) he does not have to refund me. Correct me if I’m wrong but he breaches the contract by not fulfilling his side to the agreement (by not turning up)",,,https://twitter.com/Craigx22CB/status/1206213966474686465
2019-12-15 14:06:09,squibb32,divs1981,0,0,You wana tune into sky sports at half 4 mate......great film Zulu one of Micheal Caines best ones 😉😉,,,https://twitter.com/squibb32/status/1206213860300115970
2019-12-15 14:05:54,Micheal_Ayor,Alex_Houseof308,0,0,Usher ray!!!!! 😂😂😂😂😂😂,,,https://twitter.com/Micheal_Ayor/status/1206213798815817728
2019-12-15 14:05:41,micheal_olainn,TalbertSwan,0,0,A rather mono racial and homogenous bunch. I saw such faces on the Axis side in the Second World War but not on the Allies side. Trump is a harbinger and enabler of Fascism in the US.,,,https://twitter.com/micheal_olainn/status/1206213741823610880
2019-12-15 14:05:13,pmaceinri,micheal_olainn,2,1,"I don't think it's on the radar at all schools and third level institutions here. Critical thinking must include an ability to judge sources and claims but too often 'facts' are taken at face value, with social media influence all-pervasive",,,https://twitter.com/pmaceinri/status/1206213625175855104
2019-12-15 14:04:31,Soudai_Meigen,,0,0,The greatest education in the world is watching the masters at work. Micheal Jackson&gt;,,,https://twitter.com/Soudai_Meigen/status/1206213450529034241
2019-12-15 14:04:00,terryan11210907,TheRealPamIAm,0,1,"Micheal Obama is right for once. There is a Racial problem in America. Him ,his wife Barry ,Al Sharpton, Pudacus Booker &amp; every race baiting Liberal demwit Socialist ",,,https://twitter.com/terryan11210907/status/1206213317997580290
2019-12-15 14:03:05,micheal_olainn,williamhboney1,1,0,Many centrists are far more sympathetic to the extreme right than to the extreme left.,,,https://twitter.com/micheal_olainn/status/1206213088241958914
2019-12-15 14:02:20,MaryVSchmidt1,TheRealPamIAm,0,0,"Hey Micheal, I have two words and one finger for you and yours.",,,https://twitter.com/MaryVSchmidt1/status/1206212899573772296
2019-12-15 14:02:11,micheal_olainn,pmaceinri,1,0,Excellent idea. It is part of critical thinking.,,,https://twitter.com/micheal_olainn/status/1206212864731746304
2019-12-15 14:01:32,micheal_911,,0,0,"@thereallisaann I'm going to keep on tweeting about this until it happens. Lisa Please get your ass and tits back to what it use to be (BIG, FAT, BEAUTIFUL) #bringlisaannback",@thereallisaann,#bringlisaannback,https://twitter.com/micheal_911/status/1206212700449234945
2019-12-15 14:01:30,CindyW03075788,,0,0,"@VP well, I think micheal Pence should be in jail too. Hypocrite. He is as bad as the rest of them, I hope this is the end of his political career.",@VP,,https://twitter.com/CindyW03075788/status/1206212692215844869
2019-12-15 14:01:25,micheal_olainn,,0,0,I suggest a new preliminary indicative test for senility and obsolescence of older males. Show them a photograph of Greta Thunberg and see their reaction. Then play one of her speeches to them. Frothing mouths are an indicator.,,,https://twitter.com/micheal_olainn/status/1206212671265267717
2019-12-15 14:00:42,aidso67,Micheal_Lagain,0,0,"Lol came on radio Ulster during Sunday sequence, lying with a hangover, thought I died and went to hell 🥴😭",,,https://twitter.com/aidso67/status/1206212488376864768
2019-12-15 13:59:34,micheal_olainn,MiricaEoo,0,0,Sadly that is the very essence of what is happening. Thank you for calling it out.,,,https://twitter.com/micheal_olainn/status/1206212204950884353
2019-12-15 13:59:20,jenniferzhu888,,0,0,Enjoyed the Beautiful event very much! Thank you Micheal R Michael R Foroutan Micheal R Michael R Foroutan IV Stunning Dress 👗 by Will Franco Thank you 😊 Hollywood#pool#holidays#party#redcarpet#unici#annual#society#mondrianhotel ,,,https://twitter.com/jenniferzhu888/status/1206212147321040896
2019-12-15 13:58:35,MiricaEoo,OrlaGleans,1,1,"""Make Ireland white again""",,,https://twitter.com/MiricaEoo/status/1206211956497100801
2019-12-15 13:57:39,Anaas_B,Tijjani_ahmad,1,0,This movie would appeal to ten year old me. It's my fault Sha. I saw Micheal Bay and thought we'd get something good 🤣,,,https://twitter.com/Anaas_B/status/1206211720013848577
2019-12-15 13:57:31,micheal_olainn,OrlaGleans,0,0,So many proud Far Right Irish men have dental nerve problems and need to wear face masks to cover their faces.,,,https://twitter.com/micheal_olainn/status/1206211689911328768
2019-12-15 13:57:27,matthewc10884,utdxtra,0,0,micheal oliver is the referee so idk,,,https://twitter.com/matthewc10884/status/1206211671431241728
2019-12-15 13:57:05,NofNews_Ghana,,0,0,Ghanaian U20 midfielder Micheal Baidoo is eyeing a return to Danish top-flight side Midtjylland FC after excelling away on loan in... ,,,https://twitter.com/NofNews_Ghana/status/1206211577927495680
2019-12-15 13:56:57,Micheal_Ayor,Mjayjay_,0,0,Don't stress it's just aids,,,https://twitter.com/Micheal_Ayor/status/1206211545333678085
2019-12-15 13:56:14,ZoeHealy3,PaulOMahony5,5,1,How do u know that?,,,https://twitter.com/ZoeHealy3/status/1206211366467645441
2019-12-15 13:55:55,Micheal_Lagain,aidso67,1,0,Was it sung in deepest Portavogie? May have just been a deep Antrim accent 🤔,,,https://twitter.com/Micheal_Lagain/status/1206211284565315585
2019-12-15 13:55:20,micheal_olainn,IzzyKamikaze,0,0,Quickly hiding my wooly hat. I’m paid €45k a year by the State to wear it.,,,https://twitter.com/micheal_olainn/status/1206211138087723011
2019-12-15 13:55:15,Cluster_dx,,0,0,15/12/2019 13:55 27545 30RC571 USB SP 26SW037 WKD 5/8 Ssludos Micheal 73s Adi Yorkshire,,,https://twitter.com/Cluster_dx/status/1206211117887954944
2019-12-15 13:54:22,micheal_olainn,ciarakellydoc,0,0,"Johnson’s lies, the manipulative techniques of Cummings, a largely hostile media, banner phrases such as “Get Brexit Done” and the dushinest use of disinformation on social media also played a role. Ultimately, the charismatic lies of charismatic Johnson held popular appeal.",,,https://twitter.com/micheal_olainn/status/1206210893719076864
2019-12-15 13:54:14,DenZzOfzew,jackasshec,1,0,Imma tell my kids this was Micheal Jackson 🕺🏻 ,,,https://twitter.com/DenZzOfzew/status/1206210860831723520
2019-12-15 13:53:28,VPonder,johnmark,0,0,"Micheal Mcdonald was in the Doobie Brothers, another group that got airplay in black homes.",,,https://twitter.com/VPonder/status/1206210670963900417
2019-12-15 13:53:01,Calypsoasis,kfurlong45,3,0,Happy Sunday everyone 🥰,,,https://twitter.com/Calypsoasis/status/1206210557180813312
2019-12-15 13:52:42,Micheal_Lagain,,0,0,Good man.,,,https://twitter.com/Micheal_Lagain/status/1206210477048635393
2019-12-15 13:51:28,Micheal_Ayor,royzkingin,0,0,Lol no please,,,https://twitter.com/Micheal_Ayor/status/1206210166645022720
2019-12-15 13:50:51,micheal_olainn,Donal_OKeeffe,0,0,One of the problems with the rise of the Far Right is the type of malevolent people it will bring into prominence and influence.,,,https://twitter.com/micheal_olainn/status/1206210009585082368
2019-12-15 13:50:40,Micheal_Lagain,andreemurphy,0,0,What the hell is wrong with these people. Do they not understand she is just human like everyone else. This prejudice and malice directed at female politicians or ex as the case may be has to stop. It's pure misogyny and needs to be treated as a hate crime.,,,https://twitter.com/Micheal_Lagain/status/1206209966094327809
2019-12-15 13:50:14,CarylDineen,krlstenmckenzie,0,0,"From Saturday Night Live’s Micheal Che to one million moms/Hallmark over pulling ad of same sex kiss: “Ladies relax; if your kid is watching the Hallmark channel, he already gay as hell!”🤣🤣🤣🤣🤣🙌🙌🌈",,,https://twitter.com/CarylDineen/status/1206209857474498560
2019-12-15 13:49:32,cllrtrisosborne,michael_chessum,1,0,Actually Micheal. They are coming for your legacy at conference. Literally. ,,,https://twitter.com/cllrtrisosborne/status/1206209678830686208
2019-12-15 13:48:25,micheal_olainn,john_mcguirk,0,0,Comic talent.,,,https://twitter.com/micheal_olainn/status/1206209396428156928
2019-12-15 13:47:03,micheal_olainn,MiricaEoo,0,0,And that is precisely what I shall do. Excellent suggestion. I think that colonialism lies at the poisonous heart of racism. Thank you very much for that suggestion.,,,https://twitter.com/micheal_olainn/status/1206209056123367424
2019-12-15 13:46:53,BrianMicheal6,1971genx,0,0,Queue Micheal Bennett in your mentions.... it’s mine! Mine!,,,https://twitter.com/BrianMicheal6/status/1206209013089787904
2019-12-15 13:46:46,TheSecretCove,,0,0,NFL: Boycott NFL 2020 Pro Bowl For allowing Micheal Vick to be Honored NFL Shame on you - Sign the Petition! http://chng.it/6Dy7YMg2 via @ChangeFrance,@ChangeFrance,,https://twitter.com/TheSecretCove/status/1206208983855439874
2019-12-15 13:45:45,Micheal_Lagain,JoeMatthews91,0,0,It suits the EU now. The problem is Leo Varadkar and his blue shirt government held aloft by Fianna Fail who are more British than the British themselves.,,,https://twitter.com/Micheal_Lagain/status/1206208725423476737
2019-12-15 13:45:44,jmw589,boyd_micheal,0,0,It’s literally a prank pulled by a website called 4chan.,,,https://twitter.com/jmw589/status/1206208721111650307
2019-12-15 13:45:12,Tuchi3,,0,0,Micheal Bay will make an explosion out of anything,,,https://twitter.com/Tuchi3/status/1206208590693961730
2019-12-15 13:45:10,lottoraiser,,0,0,Play Online http://ballinrobegaaclub.com/club5050/ Results for 13th December Congrats Winners: €440 John Cleary; €20 House Prize - Micheal John Naughton; €20 House Prize - John Niland ,,,https://twitter.com/lottoraiser/status/1206208581240012802
2019-12-15 13:45:04,ballinrobegaa,,0,0,Play Online http://ballinrobegaaclub.com/club5050/ Results for 13th December Congrats Winners: €440 John Cleary; €20 House Prize - Micheal John Naughton; €20 House Prize - John Niland ,,,https://twitter.com/ballinrobegaa/status/1206208554249703424
2019-12-15 13:44:59,micheal_kaluba,Patiflafla,0,0,Thank and Same to You Ma'm,,,https://twitter.com/micheal_kaluba/status/1206208535442460675
2019-12-15 13:43:50,Micheal_Lagain,,0,2,Damian Green Conservatives MP saying on LBC that we should move towards an insurance system to pay for our care. Not even 24 hours after the election and it's begun. The demise of the NHS presided over by the Tory Party and voted for by the DUP.,,,https://twitter.com/Micheal_Lagain/status/1206208244370362373
2019-12-15 13:43:06,micheal_kaluba,,0,0,Updates:The Secret Occult Message at Hollywood Blvd https://youtu.be/rBd4fg9cgXw via @YouTube,@YouTube,,https://twitter.com/micheal_kaluba/status/1206208058457829381
2019-12-15 13:42:01,num3nut5,iucounu,0,1,"It was a shit excuse at the time and it's a shit excuse now. No-one had to vote for labour, no-one should have voted Tory. There are other parties. While Corbyn has a lot to answer for other people's stupidity is not one of them.",,,https://twitter.com/num3nut5/status/1206207786134179841
2019-12-15 13:41:51,5_stelly,,0,0,This may get me blocked but i need micheal thomas to not catch a single pass this game and the saints defense to suck Sorry im gambling,,,https://twitter.com/5_stelly/status/1206207746091167744
2019-12-15 13:41:43,JoeThaKidd,,0,0,I love tha shit outta Micheal Jordan but he ain't never gave me nothing.....,,,https://twitter.com/JoeThaKidd/status/1206207711764987906
2019-12-15 13:41:16,Coroutines19,art_dannier,0,0,thank u Micheal P,,,https://twitter.com/Coroutines19/status/1206207597851885569
2019-12-15 13:39:01,AlsAmatoxx,nfrealmusicfan,0,0,"Micheal, you really do come up with the best tweets!",,,https://twitter.com/AlsAmatoxx/status/1206207031155314688
2019-12-15 13:38:44,jimo4show,,0,0,@officialnairam1 Dz guy is here to entertain us I won't surprise if people are passing out at his concert in nearest future just like Micheal Jackson ,@officialnairam1,,https://twitter.com/jimo4show/status/1206206961450180608
2019-12-15 13:38:42,HousewifeManiac,,2,0,I want Ashley to divorce Micheal then get full custody and keep the high rise apartment 😍 #RHOP,,#RHOP,https://twitter.com/HousewifeManiac/status/1206206952864407552
2019-12-15 13:36:17,zoomermage,deletedgoodbye7,1,0,Micheal wheeler invented heart eyes for william Byers ,,,https://twitter.com/zoomermage/status/1206206344908410881
2019-12-15 13:34:18,CorollaTE27,Figgitaboutit,0,1,No surprise. Micheal is also call Big MIKE !!!,,,https://twitter.com/CorollaTE27/status/1206205846574784512
2019-12-15 13:33:33,vicbandzz_,dbforeal614,0,0,lil baby can’t remix a micheal Jackson song,,,https://twitter.com/vicbandzz_/status/1206205656241496066
2019-12-15 13:33:32,KyleCuffeSr,CoachMantegna,0,3,Great job @CoachMantegna @blairbucs @kylecuffejr and @JaylenBlakes. Let’s get another one today at 11:45am and Mt Saint Micheal’s. 💪🏽💪🏽 ,@CoachMantegna @blairbucs @kylecuffejr @JaylenBlakes,,https://twitter.com/KyleCuffeSr/status/1206205654760861696
