date,username,to,replies,retweets,text,mentions,hashtags,permalink
2019-12-15 00:55:01,Skeet_mh,micheal_SLC,1,0,"Key word being might, not enough evidence too support it but that paired with the teams performance this year is alarming",,,https://twitter.com/Skeet_mh/status/1206014764620664835
2019-12-15 00:53:49,micheal_SLC,Skeet_mh,1,0,Fair assessment.,,,https://twitter.com/micheal_SLC/status/1206014462693498880
2019-12-15 00:53:08,JimMorr46622225,nealerichmond,0,0,Micheal Martin Flip Flopped on this for at least 18 months. First it was two budgets. Then it was Brexit. Cant control his own party in #votegate and now John Mcguinness is about to defy him.,,#votegate,https://twitter.com/JimMorr46622225/status/1206014291998126080
2019-12-15 00:53:01,micheal_SLC,,0,0,Patty Mills!!!!,,,https://twitter.com/micheal_SLC/status/1206014263132704768
2019-12-15 00:52:57,micheal_SLC,Keyfrom3,0,0,"Will they, please?? The Jazz need SOMEONE. LMAO",,,https://twitter.com/micheal_SLC/status/1206014243801161729
2019-12-15 00:50:50,BennyTheJet2017,Coltifus,2,0,Spoiler: he doesn't have a cannon and never has,,,https://twitter.com/BennyTheJet2017/status/1206013714283028480
2019-12-15 00:50:43,SenseiTre_,,0,0,"My suitemate just said fuck Micheal Vick, wow 🤦🏾‍♂️",,,https://twitter.com/SenseiTre_/status/1206013682871701504
2019-12-15 00:50:35,Teebowvski,,1,0,You know she gotta go when she thinks micheal bay is boring,,,https://twitter.com/Teebowvski/status/1206013648050806789
2019-12-15 00:50:34,aztattude,,0,0,Micheal Petty proving why he has that last name. Bet he wore a pink vag hat at the last protest. https://twitter.com/aztattude/status/1206002722622672896,,,https://twitter.com/aztattude/status/1206013647501348865
2019-12-15 00:50:13,AngelDawn8212,kfurlong45,1,0,Happy weekend to you all everyone! 🥳🥳🎉🎉,,,https://twitter.com/AngelDawn8212/status/1206013557533532160
2019-12-15 00:50:08,Skeet_mh,micheal_SLC,1,0,Pop cut Bam for Mason Plumlee this summer he very well might be washed,,,https://twitter.com/Skeet_mh/status/1206013537585422336
2019-12-15 00:49:36,1BigKappa,,0,0,This nigga NBA Youngboy sound just like Micheal Jackson on Dirty Iyanna🤦🏽‍♂️,,,https://twitter.com/1BigKappa/status/1206013403426426883
2019-12-15 00:49:32,Coltifus,BennyTheJet2017,2,0,"So you’re saying his arm strength went from not good to cannon on roughly a year? I mean he didn’t just hit a growth spurt, his arm strength last year was equally as good as it is now. The biggest difference now is the offensive scheme and preparation.",,,https://twitter.com/Coltifus/status/1206013386544353280
2019-12-15 00:49:12,MuckZuckerburg,,0,0,"(KU) Porky Pig, Bullwinkle, Deez Nuts, Micheal Jaxon, Diarrhea Fart, George Mashington, Speedy Gonzalez, Robert Alomar Jr, Betty Poop, George Washington",,,https://twitter.com/MuckZuckerburg/status/1206013304080097281
2019-12-15 00:48:49,micheal_SLC,,1,0,I've seen several Spurs fans back and forth on the matter so I'll just ask.. Is the Spurs' problem a Coach Pop issue? Or a personnel issue? Cause I could see both sides points.,,,https://twitter.com/micheal_SLC/status/1206013205698375680
2019-12-15 00:48:02,CadoudalChouan,micheal_olainn,1,2,"It is absurd to suggest that an African, Asian or East European who comes to live in Ireland is Irish. If the proportion of ethnic Irish in Ireland is decreasing then Ireland is becoming less Irish. And supporters of this replacement are the ones who hate; they hate the Irish.",,,https://twitter.com/CadoudalChouan/status/1206013009098952704
2019-12-15 00:47:42,disgruntlednbr,micheal_olainn,0,0,"‘Anti immigration’ is not as racist as prioritising mostly white Europeans over Africans, Asians, Americans, Australians... Treating all the same would be the opposite! It may be nationalist, but not racist!",,,https://twitter.com/disgruntlednbr/status/1206012925657391106
2019-12-15 00:47:17,JimMorr46622225,KevDoyle_Indo,0,0,"Bad news day, Micheal Martin has Flip Flopped on this for two years. Leo has consistantly said June/May 2020. No doubt you mentioned this in the article. #NeilRichmond #FineGael",,#NeilRichmond #FineGael,https://twitter.com/JimMorr46622225/status/1206012820871110658
2019-12-15 00:46:31,WillLauder2,,0,0,Former Ram Micheal Tertsea played 19 minutes against St Bonaventure and had 6 points and 2 rebounds.,,,https://twitter.com/WillLauder2/status/1206012626976657414
2019-12-15 00:45:56,marianalevstek,JillManns1,0,0,😂😂😂😂hahahahaha,,,https://twitter.com/marianalevstek/status/1206012480234893312
2019-12-15 00:43:48,huntersexy345,,0,0,Bruhhh Kelsie Reed Raven Micheal Owens ,,,https://twitter.com/huntersexy345/status/1206011942625787906
2019-12-15 00:43:19,AngelDawn8212,Julie_birch1210,0,0,You’re welcome. xx,,,https://twitter.com/AngelDawn8212/status/1206011820068220934
2019-12-15 00:42:53,TheReelDeel294,LilyPichu,0,0,Micheal knows you’re looking at him. He can sense it. He tazed himself too much and now he has ascended.,,,https://twitter.com/TheReelDeel294/status/1206011713096564736
2019-12-15 00:42:13,Julie_birch1210,AngelDawn8212,1,0,Thank you xx,,,https://twitter.com/Julie_birch1210/status/1206011546536534016
2019-12-15 00:41:52,AngelDawn8212,Julie_birch1210,1,1,Awe. I’m so sorry. I can understand that. xx,,,https://twitter.com/AngelDawn8212/status/1206011457869103104
2019-12-15 00:41:43,Jigganiggah,melatwitz,3,0,"I never said dey r irrelevant, http://K.dot at a point won 5 for one night &amp; yet he's still compared to Kendrick dat has none Santana tied Micheal Jackson 8 Grammy award 4 one night do u even knw Santana??? I guess not. But I und wat ure driving at but not always valid",,,https://twitter.com/Jigganiggah/status/1206011419407372288
2019-12-15 00:41:20,WineTryb4ubuy,,0,0,I just added this listing on Poshmark: Micheal kors backpack maroon w/ gold hardware. https://posh.mk/pVGTxwHrq2 via @poshmarkapp #shopmycloset,@Poshmarkapp,#shopmycloset,https://twitter.com/WineTryb4ubuy/status/1206011320534851584
2019-12-15 00:40:55,Julie_birch1210,AngelDawn8212,1,0,I know had to get my oldest over to help bury her was sad.. Meant to go work later but don't know if I can x 😢,,,https://twitter.com/Julie_birch1210/status/1206011218382741504
2019-12-15 00:40:15,TheonetrueBoxm1,TheonetrueBoxm1,1,0,It won’t fucking let me add you can Micheal do it?,,,https://twitter.com/TheonetrueBoxm1/status/1206011048081477632
2019-12-15 00:40:10,Mejor_Intelecto,,0,0,Feel like micheal jackson moonwalkin..,,,https://twitter.com/Mejor_Intelecto/status/1206011028003282947
2019-12-15 00:39:07,AngelDawn8212,Julie_birch1210,1,1,Hi Julie. I’m sorry to hear that. It’s so sad when our fur babies pass. 💔💔😞😞,,,https://twitter.com/AngelDawn8212/status/1206010765104291840
2019-12-15 00:38:57,marianalevstek,Darzys,1,0,Love it this gif!!!! ❤,,,https://twitter.com/marianalevstek/status/1206010724599906304
2019-12-15 00:38:29,marianalevstek,JillManns1,0,0,Goooood evening my love❤❤❤😁 how are ya? Xx,,,https://twitter.com/marianalevstek/status/1206010604240199684
2019-12-15 00:38:10,TylerDierking,TheBestFooteFWD,1,0,"I’d probably go for Luis Campusano (instead of Adrian Morejon), Ryan Weathers, and Micheal Baez. I love MJ Melendez though, which makes the Campusano addition hard for me. But I think at this point, Campusano has the one-up on Melendez and would rise in the system faster.",,,https://twitter.com/TylerDierking/status/1206010525680898048
2019-12-15 00:37:28,garym54,tw_bass4trump,0,0,That’s the hand symbol for Micheal come here!,,,https://twitter.com/garym54/status/1206010350472192000
2019-12-15 00:36:59,OBADOLZ,,0,0,Felt like micheal Jackson moonwalking,,,https://twitter.com/OBADOLZ/status/1206010227595894784
2019-12-15 00:36:35,Kameron_Micheal,,0,0,Download Voicemod now for FREE! 🤑 The best weapon for players and content creators -&gt; - The best real-time Voice Changer 📣 - Amazing Soundboard 🎛️ - Collection of over 70 original voices 😱 - Voice Maker 🎚 Troll like a PRO! 🤯 http://bit.ly/2PO8Qj0 #Voicechanger,,#Voicechanger,https://twitter.com/Kameron_Micheal/status/1206010128887095296
2019-12-15 00:36:24,DarnellEGL,,0,0,"micheal jordan hitting the biggest lick , dude redropping the same shoes every year nd investin in prisons ..allat should b bringing in billions",,,https://twitter.com/DarnellEGL/status/1206010079683784709
2019-12-15 00:36:12,zachskeen10,,0,0,man it always hurts to hear a old friend passes. till we meet again micheal ! rip 🤞🏼,,,https://twitter.com/zachskeen10/status/1206010031310802949
2019-12-15 00:35:16,channndler96,thrash_micheal,0,0,Bad take.,,,https://twitter.com/channndler96/status/1206009796794691584
2019-12-15 00:34:36,ShaunTheCHB,RealCCG_YT,1,0,"Dear God or Satan.......we will give you Brad Shepard, Corey Graves, Micheal Cole.....all three at the same time....but please give us back Ashley.",,,https://twitter.com/ShaunTheCHB/status/1206009629727051776
2019-12-15 00:34:08,micheal_SLC,Keyfrom3,0,0,I expect to see a video on LA again. Lmao,,,https://twitter.com/micheal_SLC/status/1206009509728022528
2019-12-15 00:33:53,blanco_micheal,kisselroberts,0,0,Naw my G that's rich nigga motives 😭☝️🤟,,,https://twitter.com/blanco_micheal/status/1206009446872289282
2019-12-15 00:33:47,georgiouuu1,ExoticHvntress,0,0,I needed to see this.,,,https://twitter.com/georgiouuu1/status/1206009422755061760
2019-12-15 00:32:15,blanco_micheal,TomBrady,0,0,You still will loose Tom come on na 😭😭 I ant seen u scramble out the pocket since i noticed your name in 03🤷🏽‍♂️🤦🏾‍♂️,,,https://twitter.com/blanco_micheal/status/1206009035180384256
2019-12-15 00:31:04,ExoticHvntress,Micheal_VT,0,0,Thanks bro 😎🤙,,,https://twitter.com/ExoticHvntress/status/1206008738353516544
2019-12-15 00:30:33,EnnisKings,,0,0,2 Nd period is on 24 seconds left in Micheal’s penalty,,,https://twitter.com/EnnisKings/status/1206008610465038336
2019-12-15 00:30:13,Julie_birch1210,Julie_birch1210,3,0,Sorry been quiet my youngest Paige a cat passed away this evening I thought she was sleeping till I Went to wake her.. but wouldn't wake xx 😢😢💔,,,https://twitter.com/Julie_birch1210/status/1206008523584417793
2019-12-15 00:30:02,CocoLow17,,0,0,Who let Micheal Bay make another movie?! @VancityReynolds was it you?! @netflix who did this. #6Underground #ImStillWatching,@VancityReynolds @netflix,#6Underground #ImStillWatching,https://twitter.com/CocoLow17/status/1206008477858041856
2019-12-15 00:27:50,KingPenticost_A,JoelE_Edet,0,0,It would have make sense if you can tag Ayo_Micheal himself. 👀👀 Oblorblor,,,https://twitter.com/KingPenticost_A/status/1206007926911119361
2019-12-15 00:27:07,carnes_micheal,Wildcardxoxo,0,0,I like it.,,,https://twitter.com/carnes_micheal/status/1206007742747553792
2019-12-15 00:26:32,leeagasguang,,0,0,yup..as i expected.. he's the right man for micheal bay! 🥰🥳🎉 ,,,https://twitter.com/leeagasguang/status/1206007597784018946
2019-12-15 00:26:01,2Relevant4u,MiaFarrow,0,0,Everything he does is totally inappropriate...what's the point here?! 😒🤔,,,https://twitter.com/2Relevant4u/status/1206007467550707713
2019-12-15 00:24:58,bilbobeilish,mygodowesme,0,0,BARTEBWKWJIW IK DAMN WELL U AINT SAY MICHEAL JACKSON,,,https://twitter.com/bilbobeilish/status/1206007205033586689
2019-12-15 00:24:17,tali1974love,RealMMyers78,0,0,I wouldn’t be turning back I will run in the movies they want to see and wait idiots run it’s fucking micheal Myers 😱,,,https://twitter.com/tali1974love/status/1206007031053869062
2019-12-15 00:24:08,Micheal_VT,hxstlerette,0,0,Felt this 💯,,,https://twitter.com/Micheal_VT/status/1206006992298532865
2019-12-15 00:23:18,micheal_SLC,,0,0,"Don't watch, @BaynesFanClub",@BaynesFanClub,,https://twitter.com/micheal_SLC/status/1206006785833721856
2019-12-15 00:23:06,LucasOCorcora,KevDoyle_Indo,1,0,"Has anyone forgotten that the Taoiseach literally wrote to @MichealMartinTD last year suggesting a May election? Commit to that Micheál - and don’t accuse us of ‘spin’. This sly, mud-throwing game is not how politics should work. ",@MichealMartinTD,,https://twitter.com/LucasOCorcora/status/1206006735091195905
2019-12-15 00:22:54,micheal_oy,,0,0,Put her on She gonna catch up eventually 🤞,,,https://twitter.com/micheal_oy/status/1206006684801478657
2019-12-15 00:22:42,Micheal_VT,ExoticHvntress,1,0,Congrats 🤟🏼,,,https://twitter.com/Micheal_VT/status/1206006634725728257
2019-12-15 00:20:41,micheal_oy,uzbekting,0,0,Why the fuck is this me 😂😂😂😭😭,,,https://twitter.com/micheal_oy/status/1206006127005196288
2019-12-15 00:20:01,GreenStonesman,MichaelBennet,0,0,I admire Micheal Bennet for his innate ability to look within the core of human nature inside all of us and find a policy idea we will all fucking hate. ,,,https://twitter.com/GreenStonesman/status/1206005959816028160
2019-12-15 00:19:17,dylanlockemp3,iKingRPGYT,1,0,i wish. the weekend by micheal gray,,,https://twitter.com/dylanlockemp3/status/1206005772242608129
2019-12-15 00:18:29,AstroBotKaitlyn,,0,1,Ran into another Coca-Cola Scholarship Semi-Finalist today at my #FTC meet! Huge congratulations to my friend Micheal @chenouttaten !! @FIRSTweets @cokescholars #CokeScholarsSF @oneclayschools,@chenouttaten @FIRSTweets @cokescholars @oneclayschools,#FTC #CokeScholarsSF,https://twitter.com/AstroBotKaitlyn/status/1206005573478686720
2019-12-15 00:17:38,oFiCiAl_SaLt,,0,0,Well that would be one for micheal. *flushes toilet* #HuniCast @kovox @AshNicholsArt,@kovox @AshNicholsArt,#HuniCast,https://twitter.com/oFiCiAl_SaLt/status/1206005359166386176
2019-12-15 00:16:33,MissyHorror,JohnnieGuilbert,0,0,Me yesterday ranting about how the hell micheal Vick is playing football again,,,https://twitter.com/MissyHorror/status/1206005084133289984
2019-12-15 00:16:18,MuckZuckerburg,,0,0,"(BS) Hall of Fart candidates: Porky Pig, Micheal Jaxon, Fart Albert, Justin Bieber, Jacqooow Joanz, Hello Kitty, Goofy, Fozzy Bear, Snupey, Pew",,,https://twitter.com/MuckZuckerburg/status/1206005021567000576
2019-12-15 00:13:27,felipe11002750,,0,0,Micheal fought Bob and Cactus clotheslineed his jaw,,,https://twitter.com/felipe11002750/status/1206004303263141888
2019-12-15 00:13:25,_titotheburrito,WBBMRachel,0,0,For Micheal Jordan coon ass.... ,,,https://twitter.com/_titotheburrito/status/1206004297525321730
2019-12-15 00:13:12,KunumiO,,0,0,When Micheal Scott got back his position with Dunder Mifflin and ejected Idris Elba &gt;&gt;&gt;&gt;,,,https://twitter.com/KunumiO/status/1206004243964088321
2019-12-15 00:13:02,EnnisKings,,0,0,Micheal’s to the box for the Kings,,,https://twitter.com/EnnisKings/status/1206004198342455296
2019-12-15 00:11:51,Fb1River,,0,5,Congratulations to the following all state 3A 2nd team selections: Alex Castillo (defensive backs) Zach Hammett (KO returner) Also honorable mention: Micheal Dulin (Oline) Brenan Gladeau (Dline),,,https://twitter.com/Fb1River/status/1206003902073593856
2019-12-15 00:10:26,LibertyImplac,MichaelBennet,0,0,Someone post the Micheal Malice quote ,,,https://twitter.com/LibertyImplac/status/1206003546157715460
2019-12-15 00:09:44,khalifa__D,risuali,1,0,Lmfao bro I deadass believed 50% it was micheal jackson🤣,,,https://twitter.com/khalifa__D/status/1206003368944123904
2019-12-15 00:08:58,bam_kole,micheal__og,0,0,Good job sir 👊🏻,,,https://twitter.com/bam_kole/status/1206003177004371968
2019-12-15 00:08:56,BennyTheJet2017,D_SAUC3Y,1,0,I know that. But Joe was no where close to the QB Haskins was last year. The offensive system didn't help...but his accuracy wasn't very good and his arm strength still wasn't great.,,,https://twitter.com/BennyTheJet2017/status/1206003169312083968
2019-12-15 00:08:01,JoeElli26099972,JoeElli26099972,0,0,Micheal I do love a nice cup of tea .. but prefer a bud .. dm I u need some one to talk 2 .. never be alone,,,https://twitter.com/JoeElli26099972/status/1206002936242941952
2019-12-15 00:07:54,micheal__og,TunjiDisu1,1,0,Good job sir,,,https://twitter.com/micheal__og/status/1206002909160325120
2019-12-15 00:07:28,Joek72,,0,0,Micheal Warren is Jeff's Backup as Anthem Singer Now I Guess. Been There a Couple Times Now. #LetsGoPens,,#LetsGoPens,https://twitter.com/Joek72/status/1206002799508635649
2019-12-15 00:07:23,CtCleveland,xonymsaj,1,0,Tha Micheal b Jordan pick for the win,,,https://twitter.com/CtCleveland/status/1206002777509572613
2019-12-15 00:05:47,96_micheal,missingmileven,0,0,Ik but i see ppl talking about time travel in s4 so i think we might see him again ? I mean that's the only reason why he still show up in ST cons,,,https://twitter.com/96_micheal/status/1206002377934946305
2019-12-15 00:05:27,bjettadams,,1,0,"⁦Two people I admire tremendously — Mary O’Connor @MKOConnor1018 English major extraordinaire (BA now!) and Micheal Crafton, integrity and everything that matters most about teaching personified. (He did not teach me to avoid awkward sentences. Clearly no one did.) ",@MKOConnor1018,,https://twitter.com/bjettadams/status/1206002293411319808
2019-12-15 00:04:21,okayifyousayso,michaelfrench52,0,0,Micheal you get me every time with your sarcasm. 😂😂😂😂Stop It!🤣🤣🤣🤣,,,https://twitter.com/okayifyousayso/status/1206002015752654854
2019-12-15 00:04:08,D_SAUC3Y,BennyTheJet2017,1,0,Urban told Joe to leave because he knew he was talented. Joe was in competition with Haskins for the starting job before he injured his hand.,,,https://twitter.com/D_SAUC3Y/status/1206001962304622597
2019-12-15 00:02:56,Kenny_Onions,spentfoo,0,0,Imagine an 80 year old Micheal Caine kicking ass!,,,https://twitter.com/Kenny_Onions/status/1206001659991797766
2019-12-15 00:00:26,MuckZuckerburg,,0,0,"(WA) Smurf, Bad Breath, Ronald McDonald, Micheal Jaxon, Billy Vogner, Cow, Linus, Dog Poo Darren, Andy Pettttitttte, Mr. McGoo. Submit your ballots now!",,,https://twitter.com/MuckZuckerburg/status/1206001028786774016
2019-12-15 00:00:11,trafficjockey,,0,0,"I remember Micheal Foot, he was a genuine nice guy who had socialist values and that were ridiculed by the press. The same has happened to Jeremy Corbyn but it went a bit deeper this time. George... https://www.facebook.com/story.php?story_fbid=10156800276706770&amp;id=530391769",,,https://twitter.com/trafficjockey/status/1206000966081888257
2019-12-14 23:59:44,Khelsyee,,0,0,My favorite story is the one with micheal and his “titttaaaaaaaays”,,,https://twitter.com/Khelsyee/status/1206000852667916288
2019-12-14 23:59:30,JoeElli26099972,AnaglogsDaughtr,1,0,Micheal I don’t know u .. but I’ll tell you something fight through it .. better days to come .. it’s hard but worth it ..,,,https://twitter.com/JoeElli26099972/status/1206000793490472961
2019-12-14 23:56:48,TobyOLouis,chelseamar30,0,0,Who else can see Micheal Jackson in this video? #TMOLFest #TachaTheHost,,#TMOLFest #TachaTheHost,https://twitter.com/TobyOLouis/status/1206000115829428225
2019-12-14 23:56:44,Khelsyee,,0,0,Micheal : BENADRYL AND BEER,,,https://twitter.com/Khelsyee/status/1206000098783748097
2019-12-14 23:56:41,justinspire85,Soo_u_jeALous,1,0,"Micheal Jordan was born in BK, Ny then moved to NC. 😂😂😂😂 We gave y’all MJ. J Cole yeah although he did go to St Johns for “Higher Education” #JustSaying",,#JustSaying,https://twitter.com/justinspire85/status/1206000085739462657
2019-12-14 23:56:21,YouKnowTheVib,,1,0,"Micheal Jordan would NEVER get ran over like LeBron got ran over on this play , but that’s y’all GOAT HA! ",,,https://twitter.com/YouKnowTheVib/status/1206000002008584192
2019-12-14 23:56:01,Son_DeeRRF,NetflixUK,0,0,This new @VancityReynolds movie is like Netflix gave Micheal Moore a literal swimming pool for of coke and let him make a movie. ,@VancityReynolds,,https://twitter.com/Son_DeeRRF/status/1205999918021857280
2019-12-14 23:54:29,Schrumford,thrash_micheal,0,0,You honestly believe Buckeye Nation is salty about Joey?,,,https://twitter.com/Schrumford/status/1205999531629920257
2019-12-14 23:53:07,taki_seesayme,,0,0,Micheal B Jordan 🥺😭😭😭😭 ,,,https://twitter.com/taki_seesayme/status/1205999187168509959
2019-12-14 23:52:56,Iamokorie,1MYK3L,1,0,"I have seen this car with someone picture.. Micheal, confess",,,https://twitter.com/Iamokorie/status/1205999140062121984
2019-12-14 23:50:04,OdysseyMarioBot,,0,0,Micheal Scott Got http://Mr.Netflix,,,https://twitter.com/OdysseyMarioBot/status/1205998419183046656
2019-12-14 23:48:50,nadiyahbanks,,0,0,I’m just knowing Micheal Jackson throwing up 4kt in his grave💚😂,,,https://twitter.com/nadiyahbanks/status/1205998108305477633
2019-12-14 23:48:23,615Dbg,FootballChris03,0,0,Haskins is a rookie starting for the Redskins if you judge him for being thrown into a bad situation you just suck because most of these great QBs didn’t have a great rookie year 🤦🏻‍♂️,,,https://twitter.com/615Dbg/status/1205997995478724609
2019-12-14 23:46:21,LillianButler00,SoFreekedKiddo,0,0,Yeen have to do my man Micheal like that 😒,,,https://twitter.com/LillianButler00/status/1205997483781951488
2019-12-14 23:45:40,Notkener1,LeafsAllDayy,0,0,Micheal Hutchinson isn't starting??,,,https://twitter.com/Notkener1/status/1205997314764095490
2019-12-14 23:45:20,missingmileven,96_micheal,1,0,Nah he’s long gone we haven’t seen him since season 1💀,,,https://twitter.com/missingmileven/status/1205997227610521602
2019-12-14 23:44:36,babylovedisco39,,2,1,@StagecoachMCSL can u help? We used the 111 to return from lostock hall at about before 11pm. But my disabled father in law has lost his wallet en route. Can u see if it been handed in? It’s Micheal dalton. Many thanks xx,@StagecoachMCSL,,https://twitter.com/babylovedisco39/status/1205997045015891968
2019-12-14 23:44:31,Tru_Soulz4,gucciruq,0,0,Micheal Jackson and Janet Jackson.. ,,,https://twitter.com/Tru_Soulz4/status/1205997025139015680
2019-12-14 23:44:14,FroQueen_Af,,0,0,Watching Stumptown has kept me in the house all day and Micheal Ealy 🤤,,,https://twitter.com/FroQueen_Af/status/1205996950774075393
2019-12-14 23:43:45,BennyTheJet2017,jmunderwood64,1,0,By A LOT. Joe 2018 couldn't hold Haskins jock,,,https://twitter.com/BennyTheJet2017/status/1205996831207051264
2019-12-14 23:43:37,KarisPilkBoyne,,0,0,Micheal B Jordan is that YOU in Snoh’s video boy man wow gowan,,,https://twitter.com/KarisPilkBoyne/status/1205996795479953408
2019-12-14 23:42:53,megwriharts,AB84,0,0,"Jeff Heath, Tom Brady, and Micheal Jordan are all home Free with their wives 🙄🤔",,,https://twitter.com/megwriharts/status/1205996611534512128
2019-12-14 23:41:05,micheal_olainn,damianfahy5gma1,0,0,Herman Kelly reminds me of the Second World War but not the Allies part.,,,https://twitter.com/micheal_olainn/status/1205996160479043584
2019-12-14 23:40:35,marymmcgowan,keithodwyer,0,0,Great to see you back Micheál . Hope it goes well .,,,https://twitter.com/marymmcgowan/status/1205996033039327232
2019-12-14 23:39:51,Rosieo770,KevDoyle_Indo,0,0,"Never mind Leo and Micheal exchanging letters what's Lisa Chambers up to now, pressing the wrong button again?",,,https://twitter.com/Rosieo770/status/1205995848087277568
2019-12-14 23:39:46,micheal_olainn,Liam_Baxter31,0,0,Antifa is a necessary and an appropriate response to the rise of the Extreme Right and fascism.,,,https://twitter.com/micheal_olainn/status/1205995829686915072
2019-12-14 23:39:12,ChoWrongieee,LilyPichu,0,0,micheal looks like his planning something evil to lily,,,https://twitter.com/ChoWrongieee/status/1205995686862278662
2019-12-14 23:38:23,Domentorana,jonathan_sorby,1,0,Same as Micheal Smith,,,https://twitter.com/Domentorana/status/1205995481400258560
2019-12-14 23:37:39,stinkydogagain,JdWpink,0,0,Thinking of you my amazing beautiful friend💙💜,,,https://twitter.com/stinkydogagain/status/1205995297077370885
2019-12-14 23:37:27,Ry4wood,tnoieNDI,0,0,Soooooo bad. Walton could only talk about Micheal Warren.,,,https://twitter.com/Ry4wood/status/1205995244413693959
2019-12-14 23:36:26,Lonelywhiteiris,,0,0,"Having watched Micheal talk about his opinions on this episode on h3h3, I'm very happy to finally sit down and watch it",,,https://twitter.com/Lonelywhiteiris/status/1205994990427656192
2019-12-14 23:36:00,micheal_olainn,MaximilianJans2,0,0,In time this internecine recrimination within the Labour Party will need to stop and a real process of self examination will Ned to start. Anger is not a reform policy.,,,https://twitter.com/micheal_olainn/status/1205994878540419075
2019-12-14 23:35:15,druneave3,KCJHoop,0,1,"This plus under 15,000 attendance. Micheal it’s over. Clean house",,,https://twitter.com/druneave3/status/1205994691214360578
2019-12-14 23:34:21,JnJAYY_Everyday,,2,3,Why did Micheal Jordan wear #12 instead of his traditional #23 in a #NBA game against the Orlando Magic? #jnjayyeverydaytrivia,,#NBA #NBA #jnjayyeverydaytrivia,https://twitter.com/JnJAYY_Everyday/status/1205994464436793344
2019-12-14 23:33:35,thompsonb2569,Michael35459858,2,1,Amen brother Michael. So true. Faith without works is dead. Love and blessings to you brother Micheal. 🕊️❣️,,,https://twitter.com/thompsonb2569/status/1205994270500573192
2019-12-14 23:33:15,micheal_olainn,gemmentedod1,0,0,But can you expect anything different from the merchants of hate?,,,https://twitter.com/micheal_olainn/status/1205994189206573057
2019-12-14 23:32:38,prunuus,OfflineTV,0,0,Feds holding a taser behind Micheal’s back probably,,,https://twitter.com/prunuus/status/1205994034369564672
2019-12-14 23:32:35,Pogopatterson42,Pogopatterson42,0,0,...of GDP from shell companies. You're staring armageddon in the face but someone has sounded the unionist dog whistle so you're distracted & you'll walk blithely off the same cliff as u did in 2008.,,,https://twitter.com/Pogopatterson42/status/1205994021631471617
2019-12-14 23:29:57,49rango,mikethaloc,0,1,Feel like Micheal Jackson moooooooon walking,,,https://twitter.com/49rango/status/1205993356926566402
