date,username,to,replies,retweets,text,mentions,hashtags,permalink
2019-12-14 15:00:46,Philip96420329,BarackObama,0,0,Who actually cares about you and sister if she’s really your sister because everything about you is horrific lies. Your extremely barbaric evil evil crimes against Americans and humanity will be punished severely. Imposter’s Obama and Micheal. Stand up America. Justice time,,,https://twitter.com/Philip96420329/status/1205865217344843782
2019-12-14 14:57:28,BrozenRepFred,FlorianFuerste1,1,0,It is a guess but it can be true.But I am 100% sure that Adam is Mikkel/Micheal.No one knows what happened after he hanged himself which also provides reasons for Adams's neck mark like Jonas.Adam/mikkel is playing mindgames.What happened after he hanged himself willbe shown inS3,,,https://twitter.com/BrozenRepFred/status/1205864386042068992
2019-12-14 14:57:26,ElmagicoContigo,realDonaldTrump,0,0,"“He doesn’t give you questions, he doesn’t give you orders,” Cohen said. “He speaks in a code, and I understand the code because I’ve been around him for a decade.” Micheal Cohen",,,https://twitter.com/ElmagicoContigo/status/1205864378245025797
2019-12-14 14:56:59,SFM1010,InRodWeTrustMTL,1,0,I think the only candidate who could make me vote is Micheal Fortier but his chances are small I guess,,,https://twitter.com/SFM1010/status/1205864267544698880
2019-12-14 14:55:59,_LiamEast,,0,0,"Annalise said she’s Martin fucking lurther king, and she just said she’s Micheal Jordan don’t keep me on the bench. Gunshot! #HowToGetAwayWithMurder",,#HowToGetAwayWithMurder #HowToGetAwayWithMurder,https://twitter.com/_LiamEast/status/1205864016142389251
2019-12-14 14:54:27,cocoabrown22,,0,0,Check out what I just added to my closet on Poshmark: Green MK Pants Micheal Kors. https://poshmark.com/listing/5df4eec6b3e917f0a1cc5138?utm_campaign=referral_code%3DINCOCOASCLOSET&amp;utm_source=tw_sh&amp;utm_content=feature%3Dsh_li_el_ios%26rfuid%3D58bef02848e68a405c09ebfd%26ext_trk%3Dbranch via @poshmarkapp #shopmycloset,@Poshmarkapp,#shopmycloset,https://twitter.com/cocoabrown22/status/1205863627997270017
2019-12-14 14:53:46,Abbie_tom,,0,1,Big Micheal - @stormzy - on repeat 🔥🔥🔁,@stormzy,,https://twitter.com/Abbie_tom/status/1205863455095435264
2019-12-14 14:52:08,eminah03,madschristinax,1,0,MICHEAL,,,https://twitter.com/eminah03/status/1205863046188535810
2019-12-14 14:51:42,MACZAIOFFICIAL,,0,0,If she bad micheal jack ima let her know!!! And if she do what I say I can’t let her gooo!! Nooo,,,https://twitter.com/MACZAIOFFICIAL/status/1205862936515710977
2019-12-14 14:51:07,HoldenRose3,LilyPichu,0,0,Micheal looks like he bouta commit a hate crime,,,https://twitter.com/HoldenRose3/status/1205862789811777536
2019-12-14 14:50:14,trimble_twitch,Cathy34298202,0,0,Micheal Coles,,,https://twitter.com/trimble_twitch/status/1205862565328408578
2019-12-14 14:49:28,Paul81Zachary,,0,0,"Xfiles last episode wants a Raider gym at sunrise cyclery for Micheal BTR. Or Dare I and I rasp, ROMEO T.E.A.M. Watch the video ",,,https://twitter.com/Paul81Zachary/status/1205862374848290817
2019-12-14 14:47:22,Jackeulade10,JujuLaBelle,1,1,You listen Micheal Bubble. I stan ,,,https://twitter.com/Jackeulade10/status/1205861846474993664
2019-12-14 14:46:12,HtownBetterr,LakeShowBoy24,1,0,"Harden averages 39 ppg on 24 FGA this year, when Micheal Jordan averaged 37.1 ppg he averaged 27 FGA. When Kobe averaged 35.4 ppg he averaged 27 FGA. 🧐",,,https://twitter.com/HtownBetterr/status/1205861550801772545
2019-12-14 14:43:49,djkujho,,0,0,Oh and go watch 6 Underground it was dope! Start to finish.... nothing groundbreaking but plenty of Action Micheal Bay was in his bag.... it’s not for the squeamish,,,https://twitter.com/djkujho/status/1205860952673017856
2019-12-14 14:42:54,PaulStetson13,MichaelRCaputo,0,0,"Micheal, it is no surprise, in fact it is statistically proven that Fox News makes people LESS educated Keeping people stupid is very 'KGB' ",,,https://twitter.com/PaulStetson13/status/1205860722510647296
2019-12-14 14:42:19,TomGoodison14,paddyOcooke,1,0,Micheal was robbed that this masterpiece never had the recognition it deserved,,,https://twitter.com/TomGoodison14/status/1205860573914624000
2019-12-14 14:41:52,Liv_is_lovely,charleswills2,1,0,Micheal's Oldest son just got deployed again. Shipped out on Wednesday. Hugs to you on this difficult anniversary.❤❤❤,,,https://twitter.com/Liv_is_lovely/status/1205860460471431168
2019-12-14 14:40:04,Liv_is_lovely,chefcliff,1,0,That's the fucking pits! Let me know if we can help out in any way. Micheal is excellent with a wrench,,,https://twitter.com/Liv_is_lovely/status/1205860007692193793
2019-12-14 14:39:45,micheal_oy,YESEEGHOSTS,0,0,This ain’t it,,,https://twitter.com/micheal_oy/status/1205859929803898881
2019-12-14 14:37:46,BlvckBvbe,,1,0,My little cousin on Facebook calling Micheal Jackson underrated...help,,,https://twitter.com/BlvckBvbe/status/1205859431352819712
2019-12-14 14:36:50,haidy__12,,0,0,I truly hope that one day my boss would be micheal scott❤️,,,https://twitter.com/haidy__12/status/1205859194521444352
2019-12-14 14:35:58,streetspirit_01,,1,0,"⚠️SPOILER ALERT⚠️ ° ° ° ° ° ° ° ° ° ° ° ° ° ° ° SO ROWENA'S BACK AS THE QUEEN OF HELL I'M SO HAPPY ABOUT IT, SHE SLAYSS Also Adam is back, and I like the relationship between him and Micheal BUT THE LAST SCENES BDHSJDKSHD STILL FREAKING OUT ABOUT EM DAMN CHUCK ",,,https://twitter.com/streetspirit_01/status/1205858978791673856
2019-12-14 14:34:50,JodilynnSpearm1,AnnieClaireBO,0,0,"Sorry, Annie, love you, you're a great reporter and do yourself right by all women in your field. But, when listening to Micheal Chong speaking about GST, Carbon Tax then copying California, I just imagined our money soaring up, up and away. ",,,https://twitter.com/JodilynnSpearm1/status/1205858691758473216
2019-12-14 14:34:47,posiedonv,oconnellhugh,0,0,"1)Obviously hasn't clue about reality or history like rest Party suppose says Micheal Collins founded party a decade after his death. This reality and lived live of circumstances for majority of Irish has never been this bad so many fronts, health, Defence Forces, housing,poverty",,,https://twitter.com/posiedonv/status/1205858679150563329
2019-12-14 14:34:06,Oluwafemi_Cr,_Your_Admirer,0,0,Micheal Jackson,,,https://twitter.com/Oluwafemi_Cr/status/1205858507565805568
2019-12-14 14:33:14,oye_kembi,Mellowmane_,1,0,"Its an okay film with amazing action! Some of the best micheal bay action sequences, and yeah the first 10 mins the most entertaining part of the movie. The screen play was all over the place though",,,https://twitter.com/oye_kembi/status/1205858288883003394
2019-12-14 14:29:47,micheal_oy,theStrapped,0,0,Dark Queen,,,https://twitter.com/micheal_oy/status/1205857418963570690
2019-12-14 14:29:17,JRivera_1950,,0,0,Good morning ladies and gents if you still hate micheal vick stop fucking your dog and get over it. Thanks for coming to my TED talk,,,https://twitter.com/JRivera_1950/status/1205857294312976384
2019-12-14 14:28:57,SadekMerchant,,0,0,"6 Underground is a typical Micheal Bay film. Over the top action, the plot is thinner than the hair on an infant's tush, the edit is quicker than a Cheetah on fire &amp; Deadpool plays @VancityReynolds . I like it! #6Underground #Review #RyanReynolds",@VancityReynolds,#6Underground #Review #RyanReynolds,https://twitter.com/SadekMerchant/status/1205857210871341057
2019-12-14 14:28:07,UnivWestGa,,0,0,"Dr. Micheal Crafton, our interim president, is listing some of UWG’s points of pride from 2019. We have a lot to be proud of! #UWG19 #GoWestGoGrad #ForeverWest",,#UWG19 #GoWestGoGrad #ForeverWest,https://twitter.com/UnivWestGa/status/1205857002045558786
2019-12-14 14:24:49,jackste8,12voltman60,0,0,Like Micheal scott declaring bankruptcy,,,https://twitter.com/jackste8/status/1205856171053211654
2019-12-14 14:24:08,13slj,,0,0,"I can confirm Micheal bay has not lost his touch, 4:30 mins into 6 underground and 5 cars have flipped 4 explosions and a town square ruined",,,https://twitter.com/13slj/status/1205856000491872256
2019-12-14 14:23:18,Zwesta_dj,skhumbi,0,0,Eeh 😂 Micheal Jackson came back to check up on you? Aaaai Legend baba 🙌🏾😂😂 ,,,https://twitter.com/Zwesta_dj/status/1205855789031796736
2019-12-14 14:23:00,HaleyCarpenterr,,0,0,I bought Micheal an AR-15 for Christmas😅,,,https://twitter.com/HaleyCarpenterr/status/1205855712800395264
2019-12-14 14:22:43,BlizzUganda,,1,0,Struggling singer King Micheal has vowed to sue media personality Miles Rwamiti for naming him among musicians that use witchcraft to win favors. Full Story: https://blizz.co.ug/1630/King-Micheal-Threatens-to-Sue-Miles-Rwamiti-for-Pinning-Him-for-Using-Witchcraft,,,https://twitter.com/BlizzUganda/status/1205855641094545410
2019-12-14 14:22:08,Auntie_Balmain,pinkmatter25,0,0,Try that,,,https://twitter.com/Auntie_Balmain/status/1205855496885981184
2019-12-14 14:21:47,marshal_fanatic,McFaul,0,0,Micheal your right professors should be held accountable for disinformation. This include liberal professors like the ones who were called to discuss their view of the constitution.,,,https://twitter.com/marshal_fanatic/status/1205855409355083777
2019-12-14 14:20:54,nazerethfox,,0,1,"RED BAND ANTI HERO COMIC BOOK ADAPTATION KNIGHT DARKEST BEFORE THE DAWN. FEATURE FILM STARS NAZERETH LOVE JONES AS MICHEAL, A TEENAGE LAW STUDENT FROM A ROYAL BLOOD LINE SQUANDERING HIS INHERITANCE COMING SOON. ",,,https://twitter.com/nazerethfox/status/1205855184016101376
2019-12-14 14:20:43,KIKOMEKOMUSA,,0,0,"""Any fool can write code that a computer can understand. Good programmers write code that humans can understand."" ~sharpmos This should be an eye-opener if you are learning how to code. Micheal Omar Marvin Sendikaddiwa Andela Uganda Kikomekomusa's TALE",,,https://twitter.com/KIKOMEKOMUSA/status/1205855140399501314
2019-12-14 14:19:17,dory_violent,de_stroya,0,0,"""Golden Boy"" probably",,,https://twitter.com/dory_violent/status/1205854778921750528
2019-12-14 14:18:56,Benthedinosuar,cloudybecca,0,0,He looks like young micheal sheen but like deformed ,,,https://twitter.com/Benthedinosuar/status/1205854690535247872
2019-12-14 14:18:06,Clarkyboi01,kfurlong45,0,0,Catchee hope it goes well xx,,,https://twitter.com/Clarkyboi01/status/1205854478534160387
2019-12-14 14:17:58,MTahakhalid,,0,2,"In this latest issue of the IMM we have featured capoteindustry on the front cover. Along with the following artists. @VSDeluxe , micheal_maltos_jr , @Aubreezy5150 , osky401 IV, @Getlikemedashon, @lxismusic Harvey,… https://www.instagram.com/p/B6Dk8OJn7Zl/?igshid=tybzovjfo1lo",@VSDeluxe @Getlikemedashon @LXisMusic,,https://twitter.com/MTahakhalid/status/1205854448238628864
2019-12-14 14:17:26,BlizzUganda,,0,0,Struggling singer King Micheal has vowed to sue media personality Miles Rwamiti for naming him among musicians that use witchcraft to win favors. Full Story: https://blizz.co.ug/1629/Complete-List-Of-Abryanz-Style-and-Fashion-Awards-ASFA-Winners-2019,,,https://twitter.com/BlizzUganda/status/1205854312045395970
2019-12-14 14:13:03,LegendofSirGeek,,0,1,Micheal Turner's Godfall Superman is incredible. I loved this Framed Comic Book. ,,,https://twitter.com/LegendofSirGeek/status/1205853211338383362
2019-12-14 14:12:20,micheal_debarra,Sagemidleton,0,1,Treat yourselves!!!,,,https://twitter.com/micheal_debarra/status/1205853027858563072
2019-12-14 14:07:25,coachlarryuwood,,0,0,@TheEllenShow I had the hardest time sleeping until I watch your video with Micheal B. Jordan visiting the community center. Seeing what you and your team did for him was extremely awesome. Congrats to Frank Gilmore!!!,@TheEllenShow,,https://twitter.com/coachlarryuwood/status/1205851790639554560
2019-12-14 14:05:22,marianalevstek,kfurlong45,4,0,Happy Saturday 🤗💞🤗💞🤗💞 Karen and everyone 😃❤!!!!!,,,https://twitter.com/marianalevstek/status/1205851276426260486
2019-12-14 14:04:31,micheal_mor,micheal_mor,0,0,A&E’s are a national crises but we’ve got so used to it it’s become accepted as normal!! It’s not normal or acceptable. Staff are wondeful but desperate for help!! Do they need to walk out & let more patients die b4 you’ll listen Josepha? #ERCrises,,#ERCrises,https://twitter.com/micheal_mor/status/1205851063905067008
2019-12-14 14:02:30,kfurlong45,Clarkyboi01,1,0,Have a healing now xx chat later,,,https://twitter.com/kfurlong45/status/1205850552594259968
2019-12-14 14:01:46,spicysheen,,0,0,i used to spell michael as 'micheal'. i really thought it was just another spelling of michael...,,,https://twitter.com/spicysheen/status/1205850369995227136
2019-12-14 14:01:43,micheal_mor,josephamadigan,2,2,"Tell that to those dying in A&E, war zones!staff can’t cope, missing obvious red flags!My mam in a coma thanks to 10hrs in Connolly without seeing doctor despite 79 head injury blood thinners vomiting severe headache, drowsiness. Had to cardiac arrest to get scanned! It’s BROKEN",,,https://twitter.com/micheal_mor/status/1205850355487182848
2019-12-14 14:00:55,Clarkyboi01,Clarkyboi01,1,1,No bad had a brill sleep so just chilling now put coupon on so feet up and enjoy! U?,,,https://twitter.com/Clarkyboi01/status/1205850158191325184
2019-12-14 14:00:40,mature_kidd,MichaelVaughan,0,0,Public to Micheal :- ,,,https://twitter.com/mature_kidd/status/1205850092072140801
2019-12-14 13:59:37,kfurlong45,kay_fralick,1,1,Have a great day kay,,,https://twitter.com/kfurlong45/status/1205849830565830656
2019-12-14 13:59:17,AssCarton,CrabsAndScience,0,0,"How's life been without Micheal, William?",,,https://twitter.com/AssCarton/status/1205849743458521093
2019-12-14 13:58:38,NorthernWrites,,1,0,"No films were made between 1993 and 1996, due to the overacting in the Micheal Keaton batman movies. Those films used up all of the available pauses, distant looks beyond the camera and anguished faces available in Hollywood at that time.",,,https://twitter.com/NorthernWrites/status/1205849582535610369
2019-12-14 13:57:26,MTN180,kunle_aderounmu,0,0,"Y`ello Micheal, be rest assured that once its available, you will be informed. However, there are other exciting data bundle offers you can make on your line. Dial *131*1#to activate. ~BN",,,https://twitter.com/MTN180/status/1205849280340254720
2019-12-14 13:56:43,ScottAtTheBoar,,2,1,Just a pic of Micheal Gove ,,,https://twitter.com/ScottAtTheBoar/status/1205849098819133441
2019-12-14 13:54:41,twangothan,micheal_olainn,2,0,You replace the leader and the new leader corrects the massive flaws. That's what leaders do.,,,https://twitter.com/twangothan/status/1205848586581430273
2019-12-14 13:54:04,ginalovesians,Lyricoldrap,0,0,Guys if even they do click bait titles for there videos it’s acting I know Bridgett and micheal love each other and there beautiful daughter and micheal really doesn’t hate his sister,,,https://twitter.com/ginalovesians/status/1205848433849974785
2019-12-14 13:53:18,DivinelyTy,Buckets44,0,0,I just can’t believe Ribbon In The Sky is black famous...then again Micheal did sing it at Thelma’s wedding on Good Times 😐,,,https://twitter.com/DivinelyTy/status/1205848237795614721
2019-12-14 13:52:57,bigconzchalmzo,,2,0,the more i hear that Coldplay Christmas song the more it grows on me. I fear this is the beginning of the eventual decline of my music taste. When it gets too bad and I'm actively attending the Micheal Buble Christmas tours someone please put a bullet in the back of my head.,,,https://twitter.com/bigconzchalmzo/status/1205848152005365760
2019-12-14 13:51:16,kay_fralick,kfurlong45,4,0,Good Saturday Karen & people 🤗 Have a good weekend w your loved ones 🥰,,,https://twitter.com/kay_fralick/status/1205847726040199168
2019-12-14 13:50:50,robinlynnemabin,,0,0,"The Best Of Smooth Jazz, The Lady Wants To Know- Micheal Franks I AM STREAMING VIBES-LIVE RADIO",,,https://twitter.com/robinlynnemabin/status/1205847616900259840
2019-12-14 13:47:32,breakyourwaves,Micheal__Winter,0,0,The streamys,,,https://twitter.com/breakyourwaves/status/1205846788462305280
2019-12-14 13:46:02,Mellowmane_,,1,0,"#6Underground is insane. In the first 10 minutes, you'll know exactly what you signed up for. You wanna check out, that's when you do it. This is probably what Micheal Bay has wanted to make for a long time. 6.5/10 just good enough to pass time.",,#6Underground,https://twitter.com/Mellowmane_/status/1205846412576972801
2019-12-14 13:46:02,JphUeSeR,,0,1,Ava Markowski 📍St Micheal’s School Height 5’7” Favorite 🍕 - Pizza Favorite 🎶 - “Memories” Favorite 🏀 - Warriors @NELasersHoops @markowski_andy @jaime_markowski,@NELasersHoops @markowski_andy @jaime_markowski,,https://twitter.com/JphUeSeR/status/1205846408743530496
2019-12-14 13:45:57,tendo_micheal,FFameica,0,0,Nicest,,,https://twitter.com/tendo_micheal/status/1205846391672725504
2019-12-14 13:45:37,enovisions,,0,0,"The character Micheal Cera gets type casted as, has to be me in real time because my life has been filled with awkward moments, misunderstandings and the unbelievable. I’m convinced my life is a Sundance film for a film festival.",,,https://twitter.com/enovisions/status/1205846303919529984
2019-12-14 13:43:41,de_stroya,micheal_SLC,1,0,What is this from,,,https://twitter.com/de_stroya/status/1205845821239046144
2019-12-14 13:43:36,felipe11002750,,0,0,Micheal fought Bill and Go 2 Sleeped his face,,,https://twitter.com/felipe11002750/status/1205845798501703680
2019-12-14 13:42:51,Crownpull,,0,0,You 100 years behind. Happy death Micheal.,,,https://twitter.com/Crownpull/status/1205845609116254213
2019-12-14 13:41:30,mizzoukid7,Erikschultz16,0,0,I’m buying packs but my coins are not moving and my shit is popping up in my binder and I’m pissed cus I pulled a platinum micheal Thomas,,,https://twitter.com/mizzoukid7/status/1205845270841442304
2019-12-14 13:39:39,rickthereduk,AlbertBrigham4,1,0,"At the end of the day, Micheal is saying something that is wrong, 100 per cent. He says Martial should be there to make them go left. That may be possible if ALL on the press, but that’s not what he’s saying.",,,https://twitter.com/rickthereduk/status/1205844804761989121
2019-12-14 13:38:36,micheal_oy,JDaIey,0,0,Drake,,,https://twitter.com/micheal_oy/status/1205844541040926723
2019-12-14 13:38:01,Micheal__Winter,breakyourwaves,1,0,Which event was this,,,https://twitter.com/Micheal__Winter/status/1205844393229459456
2019-12-14 13:36:37,_fatimahxo,,0,0,Micheal b Jordan 🤝 a 5 course meal tf ,,,https://twitter.com/_fatimahxo/status/1205844039532240896
2019-12-14 13:36:00,ERommana,,0,0,fourth test with micheal ,,,https://twitter.com/ERommana/status/1205843885898915840
2019-12-14 13:35:56,_G0ldfinger,,0,0,"The first 20 Minutes chase scene of 6 underground was inspired by the movie ""Saving Private Ryan"" by Spielberg. Micheal Bay destroy this movie. Fvcking incredible 🔥🔥🔥🔥",,,https://twitter.com/_G0ldfinger/status/1205843867083386880
2019-12-14 13:35:37,itsmentall,superhungryyy,1,0,Nothing 😭 only 6'3 Micheal has the power to stop u now 😂,,,https://twitter.com/itsmentall/status/1205843790629613569
2019-12-14 13:34:29,leastalive,,0,0,"Can't help but laugh at the Corbynistas. They sound like Micheal Jackson, ""blame it on the sunshine, blame it on the moonlight, blame it on the good times, blame it on the boogie.",,,https://twitter.com/leastalive/status/1205843502640377857
2019-12-14 13:33:42,GivingUpBot,,0,0,I gave up on thinking because Jane and Micheal is overrated.,,,https://twitter.com/GivingUpBot/status/1205843305977860096
2019-12-14 13:32:58,x__FuckinnLegit,,0,0,I wanna meet Micheal Blanco,,,https://twitter.com/x__FuckinnLegit/status/1205843120811913216
2019-12-14 13:31:07,DoGood_Yukki12,NetflixIsAJoke,0,0,We on any Micheal Bay is a stunne #netflixandchill,,#netflixandchill,https://twitter.com/DoGood_Yukki12/status/1205842658532433921
2019-12-14 13:30:14,aftertastenasa,GwsGorgeous,0,0,"you, arisbubbly, imaginesaturn, successful rem, nick, alex, micheal.",,,https://twitter.com/aftertastenasa/status/1205842435818975232
2019-12-14 13:30:06,mbxlee,ogechi_micheal,0,0,😂💀dead,,,https://twitter.com/mbxlee/status/1205842400318492673
2019-12-14 13:28:13,PeterWilliamde1,,0,1,"We rejected Marxism under Micheal Foot. We rejected Marxism under Ed Miliband. Both of these Labour leaders were smarter and more savvy than Corbyn who lacked the gravitas to be anyone’s leader, who lacked the capability to be patriotic to his country. We rejected Marxism Corbyn",,,https://twitter.com/PeterWilliamde1/status/1205841927435894784
2019-12-14 13:27:31,jasydreamz,Mrawesome96,1,0,"Micheal Dapaah a british actor, rapper and comedian",,,https://twitter.com/jasydreamz/status/1205841751061217281
2019-12-14 13:26:39,aabu_ade,,0,0,😺✏ — A lot of things actually; topmost of them is fucking Chad Micheal Murray... ,,,https://twitter.com/aabu_ade/status/1205841531535609856
2019-12-14 13:24:20,galileoeni,micheal__og,0,0,"Not when I ""Float like a butterfly, sting like a bee""",,,https://twitter.com/galileoeni/status/1205840949429067781
2019-12-14 13:22:26,DeHosure,,0,0,"When you finish watching ""Goodbye Micheal"" ",,,https://twitter.com/DeHosure/status/1205840472540712960
2019-12-14 13:22:21,micheal__og,galileoeni,1,0,😄😄😄 just what I'm saying,,,https://twitter.com/micheal__og/status/1205840448843067392
2019-12-14 13:22:20,galileoeni,micheal__og,0,0,"Engineer micheal don't forget It's not bragging if you can back it up.""",,,https://twitter.com/galileoeni/status/1205840444434927616
2019-12-14 13:21:25,Karlprime1,_STEFAN_55,1,0,Top top Micheal Bay production ,,,https://twitter.com/Karlprime1/status/1205840214968741888
2019-12-14 13:20:32,atoba_micheal,xiivcxv,0,0,Is this the same soakaway I know,,,https://twitter.com/atoba_micheal/status/1205839993429745670
2019-12-14 13:20:03,galileoeni,micheal__og,1,0,"""It's hard to keep quiet when you're as great as Ali."" ""Not only do I knock'em out , I pick the round.""",,,https://twitter.com/galileoeni/status/1205839873409601536
2019-12-14 13:18:39,micheal__og,galileoeni,2,0,Eni can make mouth 🤪,,,https://twitter.com/micheal__og/status/1205839520106725376
2019-12-14 13:18:09,ostara1099,,0,0,beer and bones ~ John Micheal Montgomery https://youtu.be/o0i8RbGMHHY via @YouTube,@YouTube,,https://twitter.com/ostara1099/status/1205839391853285376
2019-12-14 13:15:18,micheal_1979,,0,0,@realDonaldTrump instead of having the press Christmas party. Why not invite some of us that support you that dont have as much money to back your fundraising but back you in every other way,@realDonaldTrump,,https://twitter.com/micheal_1979/status/1205838675390685184
2019-12-14 13:14:08,AhmedOlawale14,Peruzi_VIBES,0,0,Micheal,,,https://twitter.com/AhmedOlawale14/status/1205838382733185024
2019-12-14 13:13:19,felipe11002750,,0,0,Micheal fought Phil and Dragon whiped his throat,,,https://twitter.com/felipe11002750/status/1205838179061968896
2019-12-14 13:12:16,NormanStanmore,Michael2_t,0,1,Retweeted Micheal 👍🇬🇧🤝🇺🇸 ,,,https://twitter.com/NormanStanmore/status/1205837914892058624
2019-12-14 13:10:11,JacobFoxworth,kiwi_filmmaker,1,0,Lt was by far my favorite mut level player. That spin move cheese was crazy on 18 or 17 whichever one he was on. I'm a Falcons fan so I wish they'd show us more love with a Roddy White card or Jonathan Abraham Micheal Turner or even Steven Jackson card would be insane,,,https://twitter.com/JacobFoxworth/status/1205837388209147904
2019-12-14 13:08:59,chrisbuckley16,doco_67,1,0,Are you having a drink tonight Micheal,,,https://twitter.com/chrisbuckley16/status/1205837088211554305
2019-12-14 13:07:19,FreePlaysPicks,,0,0,NHL Vancouver LW Micheal Ferland (head) is out Saturday. G Thatcher Demko (undisclosed) is out indefinitely,,,https://twitter.com/FreePlaysPicks/status/1205836665467658240
2019-12-14 13:06:38,freeplays,,0,0,NHL Vancouver LW Micheal Ferland (head) is out Saturday. G Thatcher Demko (undisclosed) is out indefinitely,,,https://twitter.com/freeplays/status/1205836496978292738
2019-12-14 13:06:16,kfurlong45,JillManns1,0,0,Oh my,,,https://twitter.com/kfurlong45/status/1205836401234894848
2019-12-14 13:04:38,TrishDeseine,micheal_debarra,1,0,Thank you! Super.,,,https://twitter.com/TrishDeseine/status/1205835993686986752
2019-12-14 13:04:13,pokeymarley,Micheal_Lagain,0,0,Says Mr O Leogain....aka Mr Pooter....LOL...,,,https://twitter.com/pokeymarley/status/1205835886061064192
2019-12-14 13:03:35,kfurlong45,Clarkyboi01,0,0,How are you Clark,,,https://twitter.com/kfurlong45/status/1205835727403200512
2019-12-14 13:03:00,Clarkyboi01,kfurlong45,4,0,Morning tean,,,https://twitter.com/Clarkyboi01/status/1205835582959751168
2019-12-14 13:01:57,MattChan25,,0,1,Y’all makeup be looking horrible 😕 shit make y’all look like micheal after the bleach,,,https://twitter.com/MattChan25/status/1205835314771705856
2019-12-14 13:01:05,SajonEnt,syrupconsumer,1,0,and ｍｉｃｈｅａｌ been such a good boy this year,,,https://twitter.com/SajonEnt/status/1205835097737445376
2019-12-14 13:00:53,micheal_kai,IAmSteveHarvey,0,0,I pray so 🙏❤,,,https://twitter.com/micheal_kai/status/1205835049142239234
2019-12-14 13:00:45,kfurlong45,JillManns1,2,0,Naughty is good,,,https://twitter.com/kfurlong45/status/1205835016313475074
2019-12-14 13:00:23,pinkmatter25,Auntie_Balmain,1,0,What babe?,,,https://twitter.com/pinkmatter25/status/1205834922033848320
2019-12-14 13:00:08,NathSert,JillManns1,0,0,😂😂no way 😂,,,https://twitter.com/NathSert/status/1205834861266841601
2019-12-14 12:59:35,JillManns1,kfurlong45,1,0,Only joking Just having fun with it 😆,,,https://twitter.com/JillManns1/status/1205834721378422784
2019-12-14 12:59:26,Liv_is_lovely,,0,0,I called Micheal's dick a todger last night and he thought I said toddler and now I can't ever stop laughing.,,,https://twitter.com/Liv_is_lovely/status/1205834683797389313
