date,username,to,replies,retweets,text,mentions,hashtags,permalink
2019-12-15 23:59:11,rfilsinger,mikeBithell,0,0,I had fun. It knew what it was. Batman + mission impossible + micheal bay. And accepted it hard core. And somehow wasn’t a wreck.,,,https://twitter.com/rfilsinger/status/1206363101945307139
2019-12-15 23:58:11,andreinengland,,5,0,Maybe micheal Jackson actually was good I just listened to dirty Diana fr for the first time,,,https://twitter.com/andreinengland/status/1206362850786234374
2019-12-15 23:57:50,its_micheal_2_u,BleacherReport,0,0,They're toying with them...lol,,,https://twitter.com/its_micheal_2_u/status/1206362761724383232
2019-12-15 23:56:47,couldntbearsed_,,0,0,Also imma fuck Micheal d Higgins up the arse pure rough and dry which is the ultimate power move to show my dominance vote for me cunts,,,https://twitter.com/couldntbearsed_/status/1206362496963096582
2019-12-15 23:56:12,its_micheal_2_u,,0,0,"Jourdan Lewis, our best defensive back this season.",,,https://twitter.com/its_micheal_2_u/status/1206362350212788226
2019-12-15 23:54:33,delcastillojea1,,0,0,Micheal&amp;daryll❤ ,,,https://twitter.com/delcastillojea1/status/1206361938264899584
2019-12-15 23:54:12,micheal_mor,rte,0,0,And pricing is a rip off!!,,,https://twitter.com/micheal_mor/status/1206361846795689984
2019-12-15 23:54:08,its_micheal_2_u,923TheFan,0,0,Well damn.,,,https://twitter.com/its_micheal_2_u/status/1206361833810137090
2019-12-15 23:53:59,_PsAndQs,,0,0,Who is Micheal Jordan man,,,https://twitter.com/_PsAndQs/status/1206361794660519938
2019-12-15 23:51:47,MSAEKC,micheal_olainn,0,0,"@micheal_olainn I wouldn’t be bragging about the number of terrorist-sympathising, paedophile-led, masked, communist-flag flying nutjobs you had show up at that Goebbels-styled “peace” rally. If anything, I’d play down those numbers if I were you. 🤣",@micheal_olainn,,https://twitter.com/MSAEKC/status/1206361242320936961
2019-12-15 23:51:35,tmillerpix,fromthenorth57,0,0,That would be a Giants Causeway,,,https://twitter.com/tmillerpix/status/1206361190286278656
2019-12-15 23:51:30,ShufordBobby,KylieJenner,0,0,Damn!! Y’all Micheal Jackson Bad!!,,,https://twitter.com/ShufordBobby/status/1206361170401251329
2019-12-15 23:49:32,drbeno,,1,0,"@realDonaldTrump why you are shaking so much Donald ? why all the Hate Propaganda why you never stop whining Donald ? like Michael Cohen have say you have a special kind to tell what to do , but this time isn't going the Micheal Cohen / Trump way Donald ! it is your mistake that",@realDonaldTrump,,https://twitter.com/drbeno/status/1206360676077322240
2019-12-15 23:49:13,Alanfloyd20,PrepUtah,0,0,"Micheal Floyd #4 RB 6'2"" 195 3.0 GPA 4.6 40 yd 9.2 per carry for career 17 TD only 2 lost fumbles in entire life. ",,,https://twitter.com/Alanfloyd20/status/1206360595089506307
2019-12-15 23:49:11,markolver,,3,0,"Started watching 6 Underground yesterday. It’s the new Micheal Bay film on Netflix with Ryan Reynolds. The most expensive Netflix original ever. Watched the first scene. And it is bad. Really bad. And frankly, I cannot WAIT to watch the rest of it.",,,https://twitter.com/markolver/status/1206360585279016962
2019-12-15 23:47:56,wolf_hunter2001,BloggingTheBoys,0,0,I think micheal loves the boys toooo much to pick the eagles just to jinx them. I just could never see it or forgive it,,,https://twitter.com/wolf_hunter2001/status/1206360273507930112
2019-12-15 23:47:52,ErrowhTombyap,,0,0,"Grand Chief Sir Micheal Somare, spoken at the first 12, students graduation in 1980, he is shaking hands with Norman Sike. ",,,https://twitter.com/ErrowhTombyap/status/1206360253228441600
2019-12-15 23:45:14,its_micheal_2_u,,0,0,"Kellen Moore calling these plays, these sure ain't Jason Garrett's play-sheet.",,,https://twitter.com/its_micheal_2_u/status/1206359593556815873
2019-12-15 23:43:45,Tim_A_Roberts,,0,0,Micheal Foot is now the owner of the 2nd longest suicide note,,,https://twitter.com/Tim_A_Roberts/status/1206359217323626497
2019-12-15 23:42:46,dezbade1,,0,0,"When it comes to action movies, not many do it better than Micheal Bay.",,,https://twitter.com/dezbade1/status/1206358972804083715
2019-12-15 23:42:00,Micheal_Jam,sajadalrubayii1,1,0,"I’ll show you once I get it on photoshop everything I got rn is either In my head, in my notes app, or drawn out😂",,,https://twitter.com/Micheal_Jam/status/1206358777517297664
2019-12-15 23:40:25,sajadalrubayii1,Micheal_Jam,1,0,Shiii brodie lemme Watchu got,,,https://twitter.com/sajadalrubayii1/status/1206358378240512000
2019-12-15 23:40:03,Micheal_Jam,sajadalrubayii1,1,0,Actual good designs this time that I’m drawing out and shit not that stuff😂,,,https://twitter.com/Micheal_Jam/status/1206358289346379780
2019-12-15 23:39:25,Micheal_Jam,sajadalrubayii1,0,0,No bro that shit been dead😂,,,https://twitter.com/Micheal_Jam/status/1206358128608075777
2019-12-15 23:39:20,AmericasComic,,1,6,Had a roommate who was a manager (tech start-up) who bragged to me that they once declared it “Bazinga Day” at the office and forced the employees to wear Bazinga t-shirts and pressured them to play the “Bazinga Olympics” which is the most IRL Micheal Scott shit I’ve ever heard,,,https://twitter.com/AmericasComic/status/1206358108622217216
2019-12-15 23:38:58,sajadalrubayii1,Micheal_Jam,2,0,Do better?,,,https://twitter.com/sajadalrubayii1/status/1206358016666275845
2019-12-15 23:38:41,Christina_North,Mcd5000Michael,1,0,"Hi Micheal, sorry you are having a ruff time. Stay strong. ",,,https://twitter.com/Christina_North/status/1206357942662057985
2019-12-15 23:38:12,Alice94320038,,0,0,Me: is more excited for MCR reunion than Christmas Mariah Carey/Micheal Buble Stans: ,,,https://twitter.com/Alice94320038/status/1206357821706686465
2019-12-15 23:38:04,JimmyK58426410,MW55,0,0,Micheal that movie was very good and very touching had no idea what you have went through. 😎,,,https://twitter.com/JimmyK58426410/status/1206357789150470145
2019-12-15 23:38:01,Cassie_Caserole,,0,2,When Micheal proposes to Holly in a Yoda voice 🥺🥺🥺,,,https://twitter.com/Cassie_Caserole/status/1206357774176784390
2019-12-15 23:37:14,MoriahPoppyChan,emmaiswet,1,0,Me & Micheal. At first I thought it was them coming out lol,,,https://twitter.com/MoriahPoppyChan/status/1206357580488101888
2019-12-15 23:37:09,Lakesho15903111,DevontaeD28,1,0,"Micheal Finley, Allan Houston, AI, shareef, mcgrady, micheal redd, wade, reggie Miller, Vince Carter, Ray Allen, joe Johnson, manu ginobli, kevin Martin, Jerry stackhouse, Jason Richardson, Brandon Roy sheesh",,,https://twitter.com/Lakesho15903111/status/1206357558841266176
2019-12-15 23:37:03,boowhoareu,,0,0,Micheal Scott resonates with me and tbh im kinda scared,,,https://twitter.com/boowhoareu/status/1206357531846688773
2019-12-15 23:35:54,Micheal_Lagain,BelTel,1,0,And not a £20 million bridge to Scotland?,,,https://twitter.com/Micheal_Lagain/status/1206357243609964544
2019-12-15 23:35:25,Micheal_Lagain,,0,0,Maybe he's been taken into a 'hospital' for wearing a duster on his head and getting a BJ at the same time while holding a plastic rifle. Just a thought.,,,https://twitter.com/Micheal_Lagain/status/1206357123376001031
2019-12-15 23:35:00,anitrarw2,,0,0,If Micheal Thomas caught it then Dez caught it!!! @NFLonFOX @DezBryant,@NFLonFOX @DezBryant,,https://twitter.com/anitrarw2/status/1206357017524342784
2019-12-15 23:34:50,CDButler_7,,0,0,Micheal Smith is one miserable fucking bastard,,,https://twitter.com/CDButler_7/status/1206356976063660032
2019-12-15 23:34:43,lfcredynwa,99redmanmike,1,0,"Terrible yes, worse than Micheal Owen no.",,,https://twitter.com/lfcredynwa/status/1206356946841997316
2019-12-15 23:34:14,gulnaaz_97,Ibrahim11455216,1,0,1-micheal eternal love 2-New empire alittle braver,,,https://twitter.com/gulnaaz_97/status/1206356823495913472
2019-12-15 23:33:39,Charlie99567803,lancelotaustin,0,0,"I personaly have never disliked micheal bays action and directing but this one was just awful for me,",,,https://twitter.com/Charlie99567803/status/1206356677814976517
2019-12-15 23:33:25,tay_careee,,1,0,And the old lady was doing the Stanley leg yo Micheal Jackson 😂,,,https://twitter.com/tay_careee/status/1206356619438804995
2019-12-15 23:33:02,itfcRadders,,1,0,Micheal Smith &amp; Rob Cross both out in the 2nd round. 2 of the best 4 in the world are out #WHDarts,,#WHDarts,https://twitter.com/itfcRadders/status/1206356521694769153
2019-12-15 23:32:38,CreditJuliana,,0,0,"#90DayFiance can’t wait until Micheal rolls up to his new home in BFE Georgia that he’s sharing with 6 grandkids, grand memaw and egg donor daughter! ",,#90DayFiance,https://twitter.com/CreditJuliana/status/1206356422746943488
2019-12-15 23:30:45,JeanneXJean,,1,0,and who ever they are trying to be I already killed all 3 devils plus micheal and my friend john is dead so who are are you frauds trying to be? The deads? cause I watch the devils died with my own eyes N none of you girls have natural platinum blonde hair...#God #haitian #vegan,,#God #haitian #vegan,https://twitter.com/JeanneXJean/status/1206355947897180160
2019-12-15 23:30:44,iATEEKSTER,,0,0,That being said. This was the most Micheal Bayest movie ever. #6Underground https://twitter.com/iATEEKSTER/status/1206354313729183744,,#6Underground,https://twitter.com/iATEEKSTER/status/1206355944688570369
2019-12-15 23:29:34,Cynthia52976491,,0,0,What about those cowboys Micheal lol,,,https://twitter.com/Cynthia52976491/status/1206355650982236160
2019-12-15 23:29:26,kingstoken,,1,0,"I hate how Ben plays Micheal, because you know that Micheal is not in any headspace to challenge him. Its taking advantage of someone at their weakest.",,,https://twitter.com/kingstoken/status/1206355616740057094
2019-12-15 23:29:09,afton_lora,Purpl3Kill3r,1,0,''no your keeping her safe and Micheal safe please'',,,https://twitter.com/afton_lora/status/1206355543541071872
2019-12-15 23:27:59,LighthouseRadi1,,0,0,#NowPlaying Make Your Home In Me by Micheal Frye ,,#NowPlaying,https://twitter.com/LighthouseRadi1/status/1206355252049588224
2019-12-15 23:27:54,Quincyszn,LamarHeisman,2,0,that bald fuck Micheal Jordan could never have niggas acting like this... another reason why Wardell Stephen Curry II is the greatest basketball player of all time. ,,,https://twitter.com/Quincyszn/status/1206355231560347648
2019-12-15 23:27:24,CorryDartsNL,,0,0,"Micheal ""bully bull""Smith out 😱 🎯🎯🎯 #WKDARTS2020",,#WKDARTS2020,https://twitter.com/CorryDartsNL/status/1206355103462154240
2019-12-15 23:26:35,chumbamac,,0,0,Micheal Smith &amp; Rob Cross gone early doors 😱,,,https://twitter.com/chumbamac/status/1206354899757391872
2019-12-15 23:25:52,calebthagawd,,0,0,"Feel like Micheal Jackson, Moooooooonwalkin",,,https://twitter.com/calebthagawd/status/1206354717879787521
2019-12-15 23:25:51,gregorywhotho,,0,0,Still sick but Micheal made me feel a lot better. Merry Christmas to me💕 ,,,https://twitter.com/gregorywhotho/status/1206354712255066112
2019-12-15 23:25:08,Micheal_Lagain,,0,4,Loyalists from Springmartin attacking Springfield Park with petrol bombs?,,,https://twitter.com/Micheal_Lagain/status/1206354535326912516
2019-12-15 23:23:46,Getagripa,micheal_olainn,0,0,What lies? As opposite Labour lies?,,,https://twitter.com/Getagripa/status/1206354189087105024
2019-12-15 23:23:07,its_micheal_2_u,,0,0,I don't recognize THESE Cowboys. Where they been?,,,https://twitter.com/its_micheal_2_u/status/1206354028378120192
2019-12-15 23:22:00,CorinnaZehner,,1,0,"@realDonaldTrump Pick one. Micheal, Gabriel",@realDonaldTrump,,https://twitter.com/CorinnaZehner/status/1206353743207206912
2019-12-15 23:21:20,Demonthewolf,chelsea_weiand,0,0,"“Did you know Lana said Rusev is sex addict and divorced him!!!!?? It’s BoSS TIME!! BIG DOG!! FREE FOR NEW MEMBERS!!”, says the Micheal Cole robot. ",,,https://twitter.com/Demonthewolf/status/1206353577729544192
2019-12-15 23:20:44,ImDanFlan,slazo,0,0,Micheal,,,https://twitter.com/ImDanFlan/status/1206353426168393730
2019-12-15 23:18:30,paulmurphy68,Micheal_Lagain,0,0,With a gaelic road sign. What could go wrong?,,,https://twitter.com/paulmurphy68/status/1206352865138266112
2019-12-15 23:17:57,Its_Rxse,,0,0,"""you need a job micheal"" ""have you been applying to jobs micheal"" ""i dont want you getting a job micheal"" ""if you want that then get a job micheal"" ""walk your ass into the stores and ask for the application micheal"" "" i pay you $5 why cant you afford anything micheal""",,,https://twitter.com/Its_Rxse/status/1206352725329530882
2019-12-15 23:17:57,micheal_ristick,,0,0,My face got skinny thank you lord,,,https://twitter.com/micheal_ristick/status/1206352724029100032
2019-12-15 23:17:47,Kay_Goddess1130,smilexmj,0,0,This used to go BRAZYYYY on the Micheal Jackson the experience game😭 ,,,https://twitter.com/Kay_Goddess1130/status/1206352682388271104
2019-12-15 23:17:33,stephaknee__,,0,0,"My dad was on the phone with Sirus XM & was talking to them about a flyer.. they asked what the code was on the flyer.. & he rattles off “M2WD.......” the guy repeated it back & my dad said “no that’s wrong... it’s “M as in Micheal, 2, W as in Win, D as in... dumb” 🤷🏼‍♀️ nice Dad!",,,https://twitter.com/stephaknee__/status/1206352626104913925
2019-12-15 23:17:24,Micheal_Korleon,,0,0,I’m not ya slatt nor ya slime 🗣,,,https://twitter.com/Micheal_Korleon/status/1206352589341806593
2019-12-15 23:16:24,roodog,Micheal_Lagain,0,0,Has to be the @lanPaisleyMP bridge,@lanPaisleyMP,,https://twitter.com/roodog/status/1206352333900328964
2019-12-15 23:16:18,lilwitchsinner,lilwitchsinner,1,0,"Cigarette into someone's wine glass then took Micheal's hand and pulled him into a corner. Leaning up to place a kiss on his lips before taking his wine glass, finishing the drink. ""Before we have our fun, let's go into the kitchen and grab us some bottles of wine.""",,,https://twitter.com/lilwitchsinner/status/1206352311418785792
2019-12-15 23:16:08,MtfMaz,Winged_Box_MTF,1,0,Micheal Bay Transformers sucked-,,,https://twitter.com/MtfMaz/status/1206352267126988800
2019-12-15 23:15:45,Phornt4reelz,ALCOFRE22,0,0,Or Trump's daughter who somehow awarded more than a dozen Chinese trademarks (Micheal Jordan had to fight to trademark his own image) amidst a trade war with China. ,,,https://twitter.com/Phornt4reelz/status/1206352171962425344
2019-12-15 23:15:07,POTFW_,,0,12,I genuinely wish I could have attended a Micheal Jackson concert while he was alive. It would’ve been groundbreaking and unforgettable.,,,https://twitter.com/POTFW_/status/1206352012708855808
2019-12-15 23:15:04,kingstoken,,1,0,"Oh, he knew which names to drop to get Micheal to cooperate, Sun, Sawyer, Claire, although I don't know why he name dropped Jack, Micheal and him weren't that close, if I remember correctly",,,https://twitter.com/kingstoken/status/1206351999844995073
2019-12-15 23:14:29,Micheal_Lagain,paulmurphy68,2,0,The Pan Nationalist Unionist Gaelic Scots Irish Roadway Bridge......Toll Road.......Thing.,,,https://twitter.com/Micheal_Lagain/status/1206351854466154501
2019-12-15 23:13:11,mraldjade,,0,0,"in the words of @bowenyang ""my ass is dead micheal, sorry, deadass.""",@bowenyang,,https://twitter.com/mraldjade/status/1206351527922806791
2019-12-15 23:12:39,StacyBlanding,,0,0,Micheal knew Toby could have went on that beach trip. He hate that man guts!!,,,https://twitter.com/StacyBlanding/status/1206351393298272256
2019-12-15 23:12:35,HayseIsaiah,,0,1,"Great camp with @TheChrisRubio had fun competing with @GregTarr2 @nwalker_50 @IsaacHatfield13 Micheal Florentine, and Payton Cramer in the finals ",@TheChrisRubio @GregTarr2 @nwalker_50 @IsaacHatfield13,,https://twitter.com/HayseIsaiah/status/1206351377552809984
2019-12-15 23:11:01,its_micheal_2_u,,0,0,Got the first half ball. ✅,,,https://twitter.com/its_micheal_2_u/status/1206350980041912325
2019-12-15 23:10:52,Its_Rxse,,2,0,"""you better get your damn license micheal"" ""you better join the military micheal"" ""your grades better be good micheal"" ""why dont you spend time with us micheal"" ""why dont you have a girlfriend micheal"" ""why dont you have any friends micheal"" "" who are you talking to micheal""",,,https://twitter.com/Its_Rxse/status/1206350941882081281
2019-12-15 23:09:51,daxxdrake,JewishChron,0,0,Micheal Gove has found religion ? The end of days cannot be far off.🤠,,,https://twitter.com/daxxdrake/status/1206350688281866246
2019-12-15 23:07:44,kingstoken,,1,0,Poor Micheal can't get away from killing,,,https://twitter.com/kingstoken/status/1206350156901363713
2019-12-15 23:07:33,HWoodWoman323,nbcsnl,0,0,"So when Scarlett Johansson dumps @ColinJost, is she gonna make Lorne Micheal’s fire him? #SNL",@ColinJost,#SNL,https://twitter.com/HWoodWoman323/status/1206350110445072384
2019-12-15 23:06:11,ehcrain,,0,0,Micheal ready for his countertop clinic yesterday. #SATLServicesEvents #D149ServicesEvents @XConnollyJr @jsh_thd @TeamCashAtTHD @gloria_terri @ToddAbbott4631,@XConnollyJr @jsh_thd @TeamCashAtTHD @gloria_terri @ToddAbbott4631,#SATLServicesEvents #D149ServicesEvents,https://twitter.com/ehcrain/status/1206349766201921538
2019-12-15 23:05:50,JuJuBreauxD,iammikelowe,0,0,"Man, Fuck Oprah, both Micheal and Russell have receipts of the lies told on them, she needs to take down Harvey Weinstein because he’s about to get away with it!",,,https://twitter.com/JuJuBreauxD/status/1206349676070539268
2019-12-15 23:05:31,MalGot_it,TweetOrSTFU,0,0,This is basically how a convo would’ve went if someone talked to Micheal Jordan about going MLB.....”it might not work out how you think it’s going too” 😂,,,https://twitter.com/MalGot_it/status/1206349598094217217
2019-12-15 23:03:57,pavol_matula,,0,0,"6 Underground almost feels like Micheal Bay´s parody of Michael Bay movies. Or what people think of when they hear ""A Michael Bay movie"". This film is pure insanity! But Bay is still the best at what he does. Easily. #Bayhem #6Underground #MichaelBay",,#Bayhem #6Underground #MichaelBay,https://twitter.com/pavol_matula/status/1206349201384361984
2019-12-15 23:03:20,JBW90,,0,0,"Micheal Irvin after watching that first half, probably ",,,https://twitter.com/JBW90/status/1206349048619454464
2019-12-15 23:02:15,Ryan24067256,kfurlong45,0,1,I like that x,,,https://twitter.com/Ryan24067256/status/1206348774186135553
2019-12-15 23:01:02,alexsangels_doi,,0,0,me whenever we get an Alex and Micheal pic ,,,https://twitter.com/alexsangels_doi/status/1206348469625114627
2019-12-15 23:01:00,AntsTheGreatest,nnffmusic,1,0,It's like Micheal Bay decided to make a knockoff of his own movies that started with one of the most lackluster chase scenes I ever seen,,,https://twitter.com/AntsTheGreatest/status/1206348459588149253
2019-12-15 23:00:46,jesuisTarr,Micky_jatta,0,0,Thank you Micheal❤,,,https://twitter.com/jesuisTarr/status/1206348400872042496
2019-12-15 23:00:18,Mad4tlas,JRS_Royale,1,0,"hes not a legend. he makes money but the long arc of time will not remember him like they will remember nat king cole, loise armstrong, whitney houston, jennifer holiday, micheal jackson or prince",,,https://twitter.com/Mad4tlas/status/1206348282466881537
2019-12-15 22:58:29,kingstoken,,1,0,"Man, even with all the terrible stuff Micheal did, I still hoped that Walt and him would find peace once they left the island",,,https://twitter.com/kingstoken/status/1206347828760588291
2019-12-15 22:58:04,checkmatebil,moonlightbil,0,0,nah that shoulda been Micheal jackson ,,,https://twitter.com/checkmatebil/status/1206347722355294208
2019-12-15 22:57:05,micheal_olainn,ethelcrowley2,0,0,I hope that he can be funded to bring a case.,,,https://twitter.com/micheal_olainn/status/1206347475558252545
2019-12-15 22:56:56,glocksinner,TheRealDukedawg,1,0,Micheal Irvin for head coach &gt;&gt;&gt;&gt;&gt;,,,https://twitter.com/glocksinner/status/1206347438740721664
2019-12-15 22:56:08,Shooterrising13,shannonrwatts,0,0,I’m sure Micheal Bloomberg’s millions have nothing to do with your “growth” 🤣,,,https://twitter.com/Shooterrising13/status/1206347236264873984
2019-12-15 22:56:05,owenpryor_,itsdomyoutube,0,0,Micheal,,,https://twitter.com/owenpryor_/status/1206347221056315392
2019-12-15 22:55:17,Michael611695,wwwdotdogdotcom,0,0,"Hey beauty, I’m micheal ... I'm looking for a honest sugar baby and I'd love to know if you are interested. You can reach me on 325 3059 191 and lets talk arrangements...",,,https://twitter.com/Michael611695/status/1206347020400766978
2019-12-15 22:54:44,creber_linzy,,0,0,Catch me live tonight 11 pm GMT Playing 90 mins of pure house music . showing support to - Disco Ball'z DJ TONKA Micheal Jackson Doc Link Grant Nelson Linzy Creber GHoney Ian Pooley Mixtek Mood II Swing Ruben Næss Terry Groves Link 👇🏼👇🏼👇🏼👇🏼 http://www.house-techno.com,,,https://twitter.com/creber_linzy/status/1206346881619701760
2019-12-15 22:54:27,_Dark_Victory_,mariobros1632,1,0,when the friendly sparring with mario and luigi turns serious! micheal: ,,,https://twitter.com/_Dark_Victory_/status/1206346811557982209
2019-12-15 22:54:16,theFLICKpick,,31,18,"#6Underground is the most obnoxious, self indulgent Bay movie I've ever witnessed. It feels like a Micheal Bay parody film.... I had no intention of reviewing this, but now I have to.",,#6Underground,https://twitter.com/theFLICKpick/status/1206346767480082432
2019-12-15 22:53:24,micheal_ristick,FatKidAdam_,0,0,Let’s go get some,,,https://twitter.com/micheal_ristick/status/1206346546544959490
2019-12-15 22:53:22,RawaneStylinson,5sosmutuaIss,0,0,Micheal ♡,,,https://twitter.com/RawaneStylinson/status/1206346540559847430
2019-12-15 22:50:48,its_micheal_2_u,dallascowboys,0,0,"I went to the kitchen, then this happened...",,,https://twitter.com/its_micheal_2_u/status/1206345893777203201
2019-12-15 22:50:43,bigtomtit,UnbalancedMemes,0,0,Micheal Jackson is alive and he's got the deer to prove it.,,,https://twitter.com/bigtomtit/status/1206345872260382722
2019-12-15 22:50:25,majordjohnson,MrKenShabby,1,0,"Micheal Gothard (The Dove) as a drunk Russian sailor claiming asylum an Rula Lenska as a political officer. Tel an Arthur sort immigration, an still have time for a slimline VaT an a Carlsberg down the Winchester. ",,,https://twitter.com/majordjohnson/status/1206345796377071616
2019-12-15 22:50:01,micheal_hellen,,0,0,Try TextNow - I got a free phone number with unlimited texting and calling to USA & Canada! Download it from http://www.textnow.com,,,https://twitter.com/micheal_hellen/status/1206345694421954560
2019-12-15 22:49:19,AndySmi83720202,MarkMeadows,0,0,If Micheal Jackson was still alive he could play a skit as her in SNL.,,,https://twitter.com/AndySmi83720202/status/1206345521096536065
2019-12-15 22:49:09,digger1964,SuzanneEvans1,0,0,"He is the reason why Labour are no longer a credible opposition Party ! So Delusional, Unbelievably so far Left , I thought Micheal Foot was Extreme but this fella knocks him for six !",,,https://twitter.com/digger1964/status/1206345476884377600
2019-12-15 22:48:06,TheKingMajestic,ToMXII_,0,0,Help micheal first lmao,,,https://twitter.com/TheKingMajestic/status/1206345214195097601
2019-12-15 22:47:42,eyevixen_atl,,0,0,It’s something about Micheal Jenkins beard. 🤣🤣,,,https://twitter.com/eyevixen_atl/status/1206345112680378371
2019-12-15 22:46:24,micheal_mor,Independent_ie,0,0,"@LeoVaradkar ‘it’s wrong, it’s terrible, it does happen’ but Your going to do nothing about it! Need solutions not resignation....Some of these kids could be treated in community infusion clinics or at home if the Will was there",@LeoVaradkar,,https://twitter.com/micheal_mor/status/1206344784681619457
2019-12-15 22:46:23,celestiictown,Sleephyead,1,0,it was sister location custom night the micheal afton cutscenes that dude is mike schmidt,,,https://twitter.com/celestiictown/status/1206344783620382721
2019-12-15 22:45:36,KyngTearz,cushbomb,0,0,i just realized that i've never seen a micheal bay movie. hoping this erases some of those bad decisions i made earlier this decade.,,,https://twitter.com/KyngTearz/status/1206344586085519360
2019-12-15 22:45:17,rommunism,dilfsarek,2,0,YES dont worry i just ended up reading the one where spock leaves audio messages for micheal its so good,,,https://twitter.com/rommunism/status/1206344504225226753
2019-12-15 22:43:41,kingstoken,,1,0,Could you be more vague Micheal?,,,https://twitter.com/kingstoken/status/1206344103618842625
2019-12-15 22:43:21,felipe11002750,,0,0,Micheal fought Micheal and Somersault leg droped his legs,,,https://twitter.com/felipe11002750/status/1206344017241354241
2019-12-15 22:42:19,HK_Bubbz,,0,0,She say she wanna fuck another bitch i made it happen feel like Micheal Jackson moonwalking #RoddyRick,,#RoddyRick,https://twitter.com/HK_Bubbz/status/1206343758108868608
2019-12-15 22:42:06,RY4N_5M1TH,Justin_B3hanna4,1,0,Exactly what I say you expect them to be perfect in everything. Micheal Thomas the best WR and he dropped one last week.,,,https://twitter.com/RY4N_5M1TH/status/1206343705235460096
2019-12-15 22:41:52,Kennykwh1120,CindyKendrick11,0,0,Yep. Micheal is getting ready for it... Michael can feel it ! ,,,https://twitter.com/Kennykwh1120/status/1206343643927392256
2019-12-15 22:40:11,Magssteenkamp,DWImpala67,0,0,I hate this where is Micheal with that grace?? ,,,https://twitter.com/Magssteenkamp/status/1206343222999617537
2019-12-15 22:40:07,chibuzo_no99,,0,1,"micheal jackson couldn’t do a backflip on beat, don’t disrespect Chris Brown",,,https://twitter.com/chibuzo_no99/status/1206343207082188800
2019-12-15 22:39:26,NandiSibiya,Jabavu_,0,2,What if Micheal Jackson wasn’t bad? ,,,https://twitter.com/NandiSibiya/status/1206343032561438721
