date,username,to,replies,retweets,text,mentions,hashtags,permalink
2020-02-05 21:51:39,TrumanKelly,AidanJDaly,1,1,"We trusted Fianna Fail to manage the country. They drove it off a cliff. We trusted Fine Gael to solve the homeless crisis, the housing crisis, the unaffordable rents crisis, the waiting list crisis. They made it worse. FGFF have a long history of corruption &amp; incompetence.",,,https://twitter.com/TrumanKelly/status/1225175175441809413
2020-02-05 21:51:26,AndrewLowth1,,1,0,"Reiterates his line about waking up next week with a Fianna Fáil or Sinn Fein led government ‘or worse, both of them together’ #GE2020",,#GE2020,https://twitter.com/AndrewLowth1/status/1225175120974622721
2020-02-05 21:50:54,Jonathankeane31,,0,0,Anyone who votes for fine Gael or fianna fail with the disaster they made of the country over the past 15 years deserves the terrible services they are getting #GE2020,,#GE2020,https://twitter.com/Jonathankeane31/status/1225174989386735618
2020-02-05 21:49:09,wall_pit,,0,0,#Rtenews #Fiannafail and #FineGael dont give 2 shits about Paul Quinn or his mother. They are using this tragedy as political Gain #GE20,,#Rtenews #Fiannafail #FineGael #GE20,https://twitter.com/wall_pit/status/1225174547101634560
2020-02-05 21:49:08,paulied1970,fiannafailparty,0,0,he speaks the truth does stevo #GE2020 #fiannafail 😳 👇 ,,#GE2020 #fiannafail,https://twitter.com/paulied1970/status/1225174541871329280
2020-02-05 21:46:41,Joem22878263,StephenNolan,0,0,"Very good fat ballix u bringing any other peoples familes on like the mcords, the dorrians, the familes of the ormeau road bookies whose anniversaries are today....nah didnt think so coz that wouldnt suit fianna fail or fianna geal would it now.....wank stain.....",,,https://twitter.com/Joem22878263/status/1225173925572808704
2020-02-05 21:46:01,Ordinaryman13,aNobleIreland,5,15,Remember Michael has Bertie I want to be president so I had a Bank account it just wasn't I my name I won the .money on a Horse A digout A brown Envelope And the PSNI didn't tell me a About Criminality And Paul Quinn And you didn't Bankrupt the country with me in Fianna Fail ,,,https://twitter.com/Ordinaryman13/status/1225173758316613646
2020-02-05 21:44:56,bobby9496,FineGael,0,0,"Sorry, but I think you mean, Vote fine Gael, get fine Gael plus Fianna Fáil as a bonus prize ! 🙄 ",,,https://twitter.com/bobby9496/status/1225173488325009409
2020-02-05 21:42:50,BerAngley,DecLawn,0,0,Agree was not bad one problem Miriam O'Callaghan needed to step aside in the interest of fairness as her brother is standing for election for Fianna Fail More professionalism from RTE please. ,,,https://twitter.com/BerAngley/status/1225172957938573312
2020-02-05 21:42:31,snapwhiply,TheGreenMcCabe,0,0,I wish I could. But a vote for greens is a vote for Fine Gael/Fianna Fail. Your integrity seems to desert you when there’s a sniff of power in the air. You never factor in the working poor when you draft your « we’re all able to afford more taxes to save the planet » policies.,,,https://twitter.com/snapwhiply/status/1225172879031132164
2020-02-05 21:40:55,PeteColeman11,,0,0,‘Corruption was both endemic and systemic’ and it ‘affected every level of government’ This is the real Fianna Fail. Less we forget. ,,,https://twitter.com/PeteColeman11/status/1225172477267136514
2020-02-05 21:38:49,urlofcork,,0,0,""" Is that show about #SinnFein or #FiannaFail ?"" ""What show ?"" ""The one where they change how ppl see you and you end up followed by loads of people and you get rid of all your excess baggage"" "" Eeem that would be #OperationTransformation ...but I see where your going #ge2020 """,,#SinnFein #FiannaFail #OperationTransformation #ge2020,https://twitter.com/urlofcork/status/1225171946335240192
2020-02-05 21:37:41,Aiden_Corkery,,0,0,"Heather Humphreys rallies party members at FG rally in Virginia m, Cavan - “When we entered Government, the house was burning down around us. Fine Gael have put out the fire and rebuilt the country. Do not hand the box of matches back to Fianna Fail this weekend!” #GE2020",,#GE2020,https://twitter.com/Aiden_Corkery/status/1225171661357506560
2020-02-05 21:37:00,AndrewLowth1,,0,0,Heather Humphreys is up next. “Fine Gael have put out the fire and rebuilt the country. “Do not hand the box of matches back to Fianna Fail this weekend.” #GE2020,,#GE2020,https://twitter.com/AndrewLowth1/status/1225171490980683776
2020-02-05 21:36:33,oconnellhugh,,8,3,"Heather Humphreys speaking now ""When we entered Government, the house was burning down around us. ""Fine Gael have put out the fire and rebuilt the country. ""Do not hand the box of matches back to Fianna Fail this weekend!"" 🔥",,,https://twitter.com/oconnellhugh/status/1225171378548236288
2020-02-05 21:36:20,theedbutler,,1,1,"""Do not hand the box of matches back to Fianna Fáil"" fighting talk from @HHumphreysFG in Virginia tonight",@HHumphreysFG,,https://twitter.com/theedbutler/status/1225171323397267456
2020-02-05 21:36:11,vincekearney,,1,3,".@FineGael minister @HHumphreysFG fires up crowd at Co Cavan @LeoVaradkar event - “When we entered Government, the house was burning down around us. Fine Gael have put out the fire ....... Do not hand the box of matches back to Fianna Fail this weekend!” @rtenews #GE2020",@FineGael @HHumphreysFG @LeoVaradkar @rtenews,#GE2020,https://twitter.com/vincekearney/status/1225171286214705152
2020-02-05 21:35:23,gomurchu,KOBrien1977,1,0,"Interesting comment - you do realize that Sinn Féin, Fianna Fáil and Fine Gael share DNA, though somewhat diluted and revised!!",,,https://twitter.com/gomurchu/status/1225171084393226242
2020-02-05 21:35:06,chrisadonnelly,electionlit,5,32,The ‘law & order/gunmen’ attack strategy as employed in 1932 against Dev’s Fianna Fáil. Passing of time (&amp; personnel) rendering it a strategy with diminishing returns today. We’ll know more by Sunday. ,,,https://twitter.com/chrisadonnelly/status/1225171011215282177
2020-02-05 21:33:29,ClareEcho,,1,1,"Joe Carey - “There is a history to this, Ennis changed its format when Fianna Fáil were in power”. Says the war to keep Ennis open was lost years ago. “The reason Ennis doesn’t have an A&amp;E is because it was unsafe”. “It’s not like turning on a switch” of calls to reopen A&amp;E.",,,https://twitter.com/ClareEcho/status/1225170606880063489
2020-02-05 21:33:04,ZazaFL,,0,0,Fine Gael and Fianna Fáil need to wake up to the fact the cosy duopoly is over - http://Independent.ie https://www.independent.ie/opinion/comment/fine-gael-and-fianna-fail-need-to-wake-up-to-the-fact-the-cosy-duopoly-is-over-38928133.html #GE2020 #VoteLeft #VoteSocialist #VotePBP #VoteSolidarityPBP,,#GE2020 #VoteLeft #VoteSocialist #VotePBP #VoteSolidarityPBP,https://twitter.com/ZazaFL/status/1225170500177088512
2020-02-05 21:32:12,michaelclark99,,0,4,"I was delighted to lead one of four canvass teams tonight on behalf of Cllr Cormac Devlin ahead of Saturday’s election. To change the government, we need to elect a Fianna Fáil TD in Dún Laoghaire! #AnIrelandForAll #GE2020",,#AnIrelandForAll #GE2020,https://twitter.com/michaelclark99/status/1225170283230826496
2020-02-05 21:32:11,PhizHicks,Sean_Rea_,0,0,"Typical #FiannaFail. Lovely #SinnFein canvasser came to our house yesterday, they brought flowers, cakes and a nice bottle of wine. Just like Santa. 😀",,#FiannaFail #SinnFein,https://twitter.com/PhizHicks/status/1225170278659121155
2020-02-05 21:32:10,SiCarswell,OrlaONeill19,3,0,"Yes, you are. Then Fianna Fáil Taoiseach Bertie Ahern came out a month later (in December 2007) to say Paul Quinn was not involved in criminality - via @IrishTimes - https://www.irishtimes.com/news/ahern-says-quinn-not-a-criminal-1.992814",@IrishTimes,,https://twitter.com/SiCarswell/status/1225170272438968322
2020-02-05 21:30:57,BernardJMolloy6,ArmaghPatrick,1,0,im all for questioning sinn feins past if fine gael & fianna fail receive questioning about its past too. the media smearing campaign here is sickening.,,,https://twitter.com/BernardJMolloy6/status/1225169967550795781
2020-02-05 21:30:43,williamwallbook,FineGael,0,1,Might just vote Number 1 Fianna Fáil and Number 2 Sinn Féin then. Thanks for the advice.,,,https://twitter.com/williamwallbook/status/1225169908771762176
2020-02-05 21:29:10,AJoyForever83,paulodonoghue93,0,0,"This is the future if you vote in Fine Gael or Fianna Faíl again, they are pro rich landlords and rent hikes and they are pro keeping people homeless and living in poverty. #VoteThemOut #GE2020",,#VoteThemOut #GE2020,https://twitter.com/AJoyForever83/status/1225169518948954112
2020-02-05 21:29:07,PeteColeman11,,0,0,Fianna Fáil TDs accused of ‘premeditated assault’ on democratic process | Less we forget. http://IrishExaminer.com,,,https://twitter.com/PeteColeman11/status/1225169505392955394
2020-02-05 21:28:56,collumbo,NursepollyRgn,1,0,Well Mary Lou started political life in Fianna Fail &amp; you may end up a partner with them next week,,,https://twitter.com/collumbo/status/1225169458341257216
2020-02-05 21:28:40,RuthieFizz,,3,7,i can only assume both fianna fáil and fine gael think none of us have ever heard of google.,,,https://twitter.com/RuthieFizz/status/1225169390943002625
2020-02-05 21:25:53,Pint_Baby,,0,1,"Fianna Fail candidate came canvassing earlier &amp; I (politely) told her I'm voting Sinn Fein &amp; that I will be voting only left leaning parties down the ballot. She then goes ""well maybe you will consider putting me down as we need more women in politics"" um NO sorry hun get a grip?",,,https://twitter.com/Pint_Baby/status/1225168692499156997
2020-02-05 21:25:26,MuireannMchalee,,0,0,fianna fáil and fine gael stop giving me ads on youtube challenge,,,https://twitter.com/MuireannMchalee/status/1225168579521327105
2020-02-05 21:21:49,Marchick19,lichamber,0,0,"Seriously?! From a Fianna Fail member, the corrupt party who destroyed this country with its taxes, whose “leader” of the time told people to commit suicide! You have the absolute gall to slag off SF when ur party are the reason that these measures have to be taken! #novote #ever",,#novote #ever,https://twitter.com/Marchick19/status/1225167670972223491
2020-02-05 21:21:11,damienmulley,FineGael,0,0,"Vote Fianna Fáil, get Fine Gael. Vote Fine Gael, get Fianna Fáil. ",,,https://twitter.com/damienmulley/status/1225167511597068290
2020-02-05 21:20:33,FrankBurke16,malcolmbyrne,0,0,If Fianna Fáil weren't so obsessed with Sinn Féin they would probably be doing better in the polls although maybe not as you were complicit in keeping Fine Gael in Government despite their pitiful performance in Health and Housing and using Brexit as an excuse. Keep trying though,,,https://twitter.com/FrankBurke16/status/1225167349436833792
2020-02-05 21:20:08,AineNicOisin,,0,0,RTE defends Miriam O'Callaghan after bias accusations over Fianna Fail brother #GE2020,,#GE2020,https://twitter.com/AineNicOisin/status/1225167243937505280
2020-02-05 21:19:14,MarkAgitprop,,3,39,"Facebook spending by political parties in last 7 days compared with public engagement: Fianna Fáil: €31,506 Fine Gael: €31,160 Labour: €7,972 Sinn Féin: €4,180 Greens: €1,632 SocDems: €1,049 PBP: €643 Aontú: €258 #GE2020",,#GE2020,https://twitter.com/MarkAgitprop/status/1225167018686586881
2020-02-05 21:19:01,ZazaFL,,0,0,Great article by @RBoydBarrett #GE2020 Break the cycle of Fianna Fáil and Fine Gael control. https://villagemagazine.ie/?p=19132 #VoteLeft #VoteSocialist #VotePBP #VoteSolidarityPBP,@RBoydBarrett,#GE2020 #VoteLeft #VoteSocialist #VotePBP #VoteSolidarityPBP,https://twitter.com/ZazaFL/status/1225166966593400833
2020-02-05 21:18:59,BryanMallonOFF,,2,4,"Another exceptional canvass for @cllrjamesbyrne in Drogheda this evening. Although I could only give an hour of my time, these hours add up! So get out when you can! What a positive reaction though. Drogheda and Meath Coast will get it’s Fianna Fáil TD! #AnIrelandForAll #GE2020",@cllrjamesbyrne,#AnIrelandForAll #GE2020,https://twitter.com/BryanMallonOFF/status/1225166957290364929
2020-02-05 21:18:40,RummHammm,,0,0,"Says a lot about ""our society"" that more people (girls) care more about voting people off love island than they do voting bad people(Fianna Fail and Fine Gael) off our love(ly) island",,,https://twitter.com/RummHammm/status/1225166876575240192
2020-02-05 21:17:44,damianstack,marksugruek,1,0,Fianna Fáil are the Ferengi surely?,,,https://twitter.com/damianstack/status/1225166639701864449
2020-02-05 21:17:07,FineGael,,136,26,"Vote Fianna Fáil, get Sinn Fein? Think carefully before you cast your vote this Saturday. ",,,https://twitter.com/FineGael/status/1225166488052682754
2020-02-05 21:10:45,oneillquigley,,1,1,"RTE, Fianna Fáil and Fine Gael all milking comments made over a decade ago. Scraping the bottom of the barrel, trying to find something, ANYTHING, to blunt Sinn Féin’s growing popularity.",,,https://twitter.com/oneillquigley/status/1225164884180111361
2020-02-05 21:10:01,Irishprolifer,,0,1,"""Know your #GE2020 Candidates: Mark McSharry, TD, Fianna Fáil ✔ #SligoLeitrim ""Voted NO to the abortion bill in 2018, voted for pro-life amendments, opposed repeal of the 8th Amendment."" https://thelifeinstitute.net/campaigns/election-2020-connacht-ulster",,#GE2020 #SligoLeitrim,https://twitter.com/Irishprolifer/status/1225164698670325760
2020-02-05 21:09:44,ElElectoral,,2,1,"🇮🇪 Además, el último sondeo publicado (Ipsos para @IrishTimes) da al Sinn Féin como primera fuerza (variación respecto a enero) Sinn Féin 25 % (+4) Fianna Fáil 23 % (-2) Fine Gael 20 % (-3) Verdes 8 % (=) Laborista 4 % (-1)",@IrishTimes,,https://twitter.com/ElElectoral/status/1225164628285689857
2020-02-05 21:09:44,higginsdavidw,FionaCuffed,2,1,Sinn Féin has alleged ties to the IRA in about the same way as Fianna Fáil has alleged ties to Bertie Ahern. #ge2020,,#ge2020,https://twitter.com/higginsdavidw/status/1225164628130398212
2020-02-05 21:09:42,WesternPeople,,0,0,"""All you hear about is Fine Gael and Fianna Fáil even though a lot of people don’t seem to like them.” Mayo students have their say ahead of Saturday's General Election ",,,https://twitter.com/WesternPeople/status/1225164618210979842
2020-02-05 21:09:12,Fozman1,,0,0,@rtenews The people can see the anti @sinnfeinireland rhetoric from RTE and other broadcasters. Disgraceful partisan behaviour which will backfire at the ballot box. #RTEbias #GE2020 #FiannaFail #FineGael #smokescreen,@rtenews @sinnfeinireland,#RTEbias #GE2020 #FiannaFail #FineGael #smokescreen,https://twitter.com/Fozman1/status/1225164493530988546
2020-02-05 21:08:15,sineadstewart_,bhearnon,2,0,It’ll help if SF in Donegal positively push that they’d want Thomas in there instead of Fianna Fáil it Fine Gael &amp; at eproactive in calling for transfers to Pringle,,,https://twitter.com/sineadstewart_/status/1225164256259248132
2020-02-05 21:03:32,RiobardCrowley,RiobardCrowley,0,0,Front bench pretty depleted this election #GeneralElection2020 #FiannaFail ,,#GeneralElection2020 #FiannaFail,https://twitter.com/RiobardCrowley/status/1225163069879353344
2020-02-05 20:57:47,SrTz7Yo3O6SqGpq,Independent_ie,0,1,How long was Fianna Fail reigning over the Magdalene Laundries and industrial schools ? Any apology for those ? ,,,https://twitter.com/SrTz7Yo3O6SqGpq/status/1225161621938626560
2020-02-05 20:54:11,daithiburke,cardagh,0,1,VoteArdaghNo1 in Dublin South Central! #fiannafail #irelandforall,,#fiannafail #irelandforall,https://twitter.com/daithiburke/status/1225160715343888386
2020-02-05 20:50:59,Bankofisland,,1,3,Break the cycle of Fianna Fáil and Fine Gael control. ,,,https://twitter.com/Bankofisland/status/1225159908351528963
2020-02-05 20:48:40,KarlBrophy,jaymckeown1988,1,0,"You know that it was members of the IRA that killed Paul Quinn, yeah? Fianna Fáil, for all their faults, don’t actually have a paramilitary wing. IRA members are, literally, Sinn Féin TDs.",,,https://twitter.com/KarlBrophy/status/1225159327897522176
2020-02-05 20:47:15,rebeldispatch50,TesstessToron,0,0,"You still dont get it,a man got beaten to death because he insults the big mans son And all some can do is what absolutism and weren't we all at it",,,https://twitter.com/rebeldispatch50/status/1225158968772907009
2020-02-05 20:45:39,czarkye,,1,0,Irlandia 🇮🇪 | MRBI Sinn Fein (GUE/NGL) - 25% Fianna Fáil (RE) - 23% Fine Gael (EPP) - 20% Partia Zielonych - 8% Partia Pracy (S&amp;D) - 4% Ludzie Przed Zyskiem (GUE/NGL) - 2%,,,https://twitter.com/czarkye/status/1225158566757183488
2020-02-05 20:43:35,VirginMediaNews,,1,6,"💬“My first preference, and I think the best Government of change, would be a Government without Fianna Fáil and without Fine Gael” Sinn Féin leader Mary Lou McDonald tells #VMNews about her coalition preferences @sinnfeinireland | @MaryLouMcDonald | #GE2020",@sinnfeinireland @MaryLouMcDonald,#VMNews #GE2020,https://twitter.com/VirginMediaNews/status/1225158048890703874
2020-02-05 20:40:47,punchedmonet_,,0,0,Am gonna join a party that supports armed struggle just because people keep messaging me dumb things about Fianna Fáil,,,https://twitter.com/punchedmonet_/status/1225157341009580035
2020-02-05 20:40:32,betaburns,NursepollyRgn,2,14,Fianna Fail: never known for their enthusiasm for providing women with choice. ,,,https://twitter.com/betaburns/status/1225157278007013376
2020-02-05 20:32:24,Irishprolifer,,0,1,"Know your #GE2020 Candidates: Shane Ellis, Fianna Fáil ❌❌❌ #SligoLeitrim ""Signed National Women's Council Pledge supporting abortion and seeking to ban pro-life vigils. Party leadership campaigned for abortion on demand and to repeal the 8th"" https://thelifeinstitute.net/campaigns/election-2020-connacht-ulster",,#GE2020 #SligoLeitrim,https://twitter.com/Irishprolifer/status/1225155234844024834
2020-02-05 20:32:11,Phil_LFCDT,little_football,1,0,A lot our age feel that way and up til now id be in the same boat. But I fully expect some form of leftist version with fianna fail leading.,,,https://twitter.com/Phil_LFCDT/status/1225155176807485440
2020-02-05 20:31:28,TarynDeVere,NursepollyRgn,2,0,can't believe Fianna Fail cancelled Nurse Polly! :(,,,https://twitter.com/TarynDeVere/status/1225154997572243458
2020-02-05 20:31:00,dickclerkin8,davidrafferty10,1,0,"Those odds reflect the amount of variables involved in Fianna Fail + Minor party coalition. 9 I think in total...So many permutations increase the individual odds. Any Fianna Fail+Minority coalition would be odds on I reckon., though not offered anywhere",,,https://twitter.com/dickclerkin8/status/1225154882216263681
2020-02-05 20:30:51,btmple64,edbrophy,0,0,The State was formed out of Violence and Fine Gael and Fianna Fail were formed from it .,,,https://twitter.com/btmple64/status/1225154844379557894
2020-02-05 20:30:45,JAMBONJOVl,,0,0,"""rotate the board!!!"" smug fianna fáil at the back",,,https://twitter.com/JAMBONJOVl/status/1225154815946383360
2020-02-05 20:30:32,DowningHelen,OpinionatedIri1,0,0,That’s what happens when powers that be are running scared supported by media expect more in nxt few days want to reduce support to ashes Please ignore & keep fighting Many of powerful got so much to lose Take heart,,,https://twitter.com/DowningHelen/status/1225154761407725568
2020-02-05 20:25:06,mrdavidflane,,6,1,Final revision... #FiannaFail: 54 #FineGael: 40 #SinnFein: 28 #Labour: 7 #Greens: 9 #SocDems: 3 #Solidarity/#PBP/#RISE: 4 #Aontu: 1 #Independents: 14 #GE2020,,#FiannaFail #FineGael #SinnFein #Labour #Greens #SocDems #Solidarity #PBP #RISE #Aontu #Independents #GE2020,https://twitter.com/mrdavidflane/status/1225153395880878081
2020-02-05 20:21:39,DowningHelen,Mappermick,0,0,Ná bí buartha Mick Don’t be despondent @sinnfeinireland support among my friends of all ages not changed Amazed at their reaction to @rtenews thought they would lose support as many borderline on board Now due to propaganda against convinced doing right thing,@sinnfeinireland @rtenews,,https://twitter.com/DowningHelen/status/1225152525675962376
2020-02-05 20:20:42,OrlaLeyden,,0,0,Fianna Fáil will reinstate the state pension (transition) as an interim measure to people aged 65 and over. They will establish a commission on pensions which will examine the age of eligibility and defer the planned rise scheduled for 2021. #AnIrelandForAll #FiannaFail #GE2020,,#AnIrelandForAll #FiannaFail #GE2020,https://twitter.com/OrlaLeyden/status/1225152287942881287
2020-02-05 20:19:26,Limerick_Leader,,0,1,LISTEN: Limerick Leader general election podcast with Fianna Fail's Willie O'Dea #limerickdecides #GE2020,,#limerickdecides #GE2020,https://twitter.com/Limerick_Leader/status/1225151969519636482
2020-02-05 20:15:01,NewStatesman,,1,5,"Faced with a deepening housing crisis and a troubled health system, Ireland’s voters are challenging the historic duopoly of Fianna Fáil and Fine Gael. ",,,https://twitter.com/NewStatesman/status/1225150858205310976
2020-02-05 20:10:44,johnofladublin,,1,0,"@JackieLeonard01 @JSavageTweets I’m also available to give pronunciation guides to Fianna Fáil, Fine Gael, Sinn Féin and Mícheál Martin (the latter was pronounced Michelle and Michael on the R4 news the other night). Obvs that won’t happen on @bbcworldservice!",@JackieLeonard01 @JSavageTweets @bbcworldservice,,https://twitter.com/johnofladublin/status/1225149782253019140
2020-02-05 20:09:10,PaulAnthonyWard,GregHughes2,1,0,"Dunno about this analysis. Seems pretty clear cut, 2 Sinn Féin, 2 Fianna Fáil &amp; 1 Fine Gael. ",,,https://twitter.com/PaulAnthonyWard/status/1225149386721845251
2020-02-05 20:04:33,mickkennedy1960,walterford2014,0,0,Yep. None of these would have happened under.Fianna Fail.,,,https://twitter.com/mickkennedy1960/status/1225148224257871872
2020-02-05 20:03:28,CormacDevlin,,2,6,"Thanks to everyone who came out to canvass tonight, especially Ógra Fianna Fáil members from UCD. Really appreciate support from Barry Andrews MEP, Cllr Michael Clark &amp; Justin Moylan who lead teams across the constituency. Only 2 days to go #GE2020 🤞",,#GE2020,https://twitter.com/CormacDevlin/status/1225147953389670400
2020-02-05 20:03:22,D_C_H_A,,0,0,@DeirdreHeney just called to my door canvassing and I'm still hopping with rage due to her callous indifference to what so many are facing in this country today and her party's role in it. Never fianna fail.,@DeirdreHeney,,https://twitter.com/D_C_H_A/status/1225147925996675073
2020-02-05 20:00:43,NoonanJoe,ICCLtweet,0,0,Safe zones - see the Fianna Fáil view. #GE2020 #repealed,,#GE2020 #repealed,https://twitter.com/NoonanJoe/status/1225147258091515907
2020-02-05 19:58:35,1billmurphy,paddycullivan,0,0,Jesus christ the unbridled arrogance . Fianna fail unveiled,,,https://twitter.com/1billmurphy/status/1225146723812696067
2020-02-05 19:56:34,WatchPopulistIr,,1,0,"Quite Orwellian that the Wikipedia entry for @MaryLouMcDonald has been edited to remove her days in @fiannafailparty The path to radical change is we are told voting for a leader who is ex Fianna Fail, radical change is clearly elsewhere. #GE2020",@MaryLouMcDonald @fiannafailparty,#GE2020,https://twitter.com/WatchPopulistIr/status/1225146216624861184
2020-02-05 19:52:36,greenshame,,0,0,#ireland has been ravished by crime from foreign &amp; domestic crime gangs for the last 10yrs.! #FineGael #FiannaFail have cut Garda resources as thugs have terrorized the country.! Now they talk of #SCC in response to their political opponents.! #GE2020 Vote Left..! Vote Sinn Féin,,#ireland #FineGael #FiannaFail #SCC #GE2020,https://twitter.com/greenshame/status/1225145218565070848
2020-02-05 19:46:53,northbitchburn,,1,0,What??? Fianna Fail founded by de Valera and co and Fine Gael founded by Michael Collins &amp; co refuse to work with Sinn Fein because of their association with armed struggle?,,,https://twitter.com/northbitchburn/status/1225143778874470400
2020-02-05 19:45:40,BhiCampbell,A_bubbly_boi,1,0,The benefit of living in the US is that I dont get Fianna Fail ads. The downside is that I've seen so many ads for Michael Bloomberg that I can recite them from memory.,,,https://twitter.com/BhiCampbell/status/1225143470811156480
2020-02-05 19:44:49,TesstessToron,rebeldispatch50,1,0,"Shocking I agree, nor will the people dying on our streets, nor will the hundreds of silent deaths that occurred due to suicide following policies of @fiannaFail. Blood on all their hands no difference.",@fiannafail,,https://twitter.com/TesstessToron/status/1225143256931016705
2020-02-05 19:40:49,ressemblanch,cusackandrew,0,0,Fianna Fáil is so passé. ,,,https://twitter.com/ressemblanch/status/1225142250369421313
2020-02-05 19:40:48,hmantegazzi,ElElectoral,0,0,"A riesgo de una simplificación exagerada, esto es más o menos como que acá el PC estuviese marcando 1/4 de las preferencias electorales a una semana de las elecciones. Fianna Fáil y Fine Gael vendrían a ser como PPD-PR y DC-RN, los partidos tradicionales. ",,,https://twitter.com/hmantegazzi/status/1225142246170857472
2020-02-05 19:37:29,1billmurphy,willoconnell,0,0,"It will be this or the next, more than likely the next but this election is laying the groundwork.. if all left thinking voters and politicians work together and vote left transfer left . Fianna fail could plummet though if more voters open their eyes, so it may happen .",,,https://twitter.com/1billmurphy/status/1225141412167110656
2020-02-05 19:36:40,ElElectoral,,2,18,"IRLANDA 🇮🇪| Subida del izquierdista Sinn Féin en la semana previa a las elecciones legislativas, que les hace situarse por encima del Fine Gael y a solo 1 punto del Fianna Fáil https://elelectoral.com/2020/02/irlanda-importante-subida-izquierdista-sinn-fein-semana-previa-elecciones/",,,https://twitter.com/ElElectoral/status/1225141208265175041
