date,username,to,replies,retweets,text,mentions,hashtags,permalink
2020-02-09 12:14:26,natashamurtagh,,1,4,40% of the votes have been counted in Wicklow. Fine Gael are in the lead with 26% Sinn Féin close behind with 24% Fianna Fáil are on 14% #GeneralElection2020 #wicklow,,#GeneralElection2020 #wicklow,https://twitter.com/natashamurtagh/status/1226479468434350087
2020-02-09 12:14:12,EXECUTIVESTEVE,joemuggs,0,0,"Exit polls say 1% of voters felt Brexit was the most important election issue, Sinn Fein are surfing a wave of absolute fury at FG mismanagement of a housing crisis and a health crisis, both of which can also be blamed on Fianna Fáil. Anti-Brit sentiment not really a factor tbh.",,,https://twitter.com/EXECUTIVESTEVE/status/1226479408938135552
2020-02-09 12:13:19,_SomeDad,NewstalkFM,1,0,Fianna Fail's Mary Lou McDonald will be embarrassed about this #GE2020,,#GE2020,https://twitter.com/_SomeDad/status/1226479184148561921
2020-02-09 12:13:18,RTEwaterford,,0,2,"POLL TOPPERS: With all the boxes tallied Sinn Féin’s David Cullinane looks to get nearly double the 2016 quota, with Fianna Fáil’s Mary Butler on 12% down from 2016. #GE2020 First count expected between 3pm and 4pm here. @rtenews",@rtenews,#GE2020,https://twitter.com/RTEwaterford/status/1226479180512145414
2020-02-09 12:12:29,garycaffrey,,0,0,Contemplating Fianna Fail being voted in but realising it might at least be at the expense of Fine Gael #GE2020,,#GE2020,https://twitter.com/garycaffrey/status/1226478977868587011
2020-02-09 12:12:28,_m_dooley_,,0,0,If Fianna Fail's Mary Fitzpatrick gets a seat in Dublin Central I'm going to stalk through the streets of Cabra breaking into houses looking for blueshirts in wardrobes,,,https://twitter.com/_m_dooley_/status/1226478973846196229
2020-02-09 12:12:28,TrumanKelly,EoinPoil,1,1,Dessie Ellis Sinn Fein 44% 1st preferences. That must be very painful for you Eoin. 😂 We've had enough of Civil War politics. Just wait til the next GE when we finally get rid of Fine Gael &amp; Fianna Fail corruption &amp; incompetence.,,,https://twitter.com/TrumanKelly/status/1226478971266662401
2020-02-09 12:12:05,EwanMacKenna,,4,1,"Fianna Fail director of elections reduced to telling is exit polls are not an exact science. After the break he might inform us the earth is not flat, who knows? This is so much fun. The stuttering, bumbling, justification of abject failure. #GE2020",,#GE2020,https://twitter.com/EwanMacKenna/status/1226478874827132928
2020-02-09 12:11:27,Arju19596322,,0,0,"Irish general election: Counting begins across the country https://ift.tt/2SoweWM Exit poll suggests little difference between Fine Gael, Fianna Fáil and Sinn Féin. source ",,,https://twitter.com/Arju19596322/status/1226478714957041664
2020-02-09 12:11:20,Longford_Leader,,0,0,"Troy occupies second seat position Sinn Féin's Sorca Clarke still occupies top position, but second spot now belongs to Fianna Fáil's Robert Troy with 5,406 first preferences, over 1,000 votes ahead of party... via 24liveblog ",,,https://twitter.com/Longford_Leader/status/1226478687882706946
2020-02-09 12:11:06,radiokerrynews,,0,1,"12.10pm Kerry Tally Update: #GE2020 161 boxes out of 261 John Bowler, Irish Freedom Party: 256 John Brassil, Fianna Fáil: 3,167 Ted Cronin, Independent: 227 Pa Daly, Sinn Féin: 9,953 Norma Foley, Fianna Fáil: 4,411 So... via 24liveblog https://24live.co/live/Ue8zp",,#GE2020,https://twitter.com/radiokerrynews/status/1226478626604036096
2020-02-09 12:10:46,hupohthat,,1,0,The Fianna Fáil general secretary looks like Micheal Martin after a hard weekend of pints #GE2020 #SinnFéin abú ❤️,,#GE2020 #SinnF,https://twitter.com/hupohthat/status/1226478545075085312
2020-02-09 12:10:32,koldanews,,0,0,"Législatives en Irlande : Fine Gael, Sinn Fein et Fianna Fail au coude-à-coude ",,,https://twitter.com/koldanews/status/1226478487311089664
2020-02-09 12:08:59,BrendaMcGlynn1,,0,0,The Irish establishment has been rocked to it's foundations. No one saw the surge for Sinn Fein coming not even @SinnFeinIreland The Taoiseach is polling behind Sinn Fein in his constituency. Disastrous election for @FineGael @FiannaFail @Labour #GE2020,@sinnfeinireland @FineGael @fiannafail @labour,#GE2020,https://twitter.com/BrendaMcGlynn1/status/1226478096276213760
2020-02-09 12:08:37,therealgerlynch,,1,0,"If an English person did to this country what Fianna Fail and Fine Gail have, we'd be singing songs for generations and condemning from a height. But when it's our own, we just keep voting them in. When will this country wake up. #GE2020",,#GE2020,https://twitter.com/therealgerlynch/status/1226478004492214274
2020-02-09 12:08:31,BarryJo66816500,,0,0,Political commentators from @FineGael and Fianna Fáil @OgraFiannaFail saying nobody saw this coming is the most alarming thing I've heard during the #GeneralElection2020 .Shows obviously how out of touch they have become. Every dog on the street saw @sinnfeinireland were coming,@FineGael @OgraFiannaFail @sinnfeinireland,#GeneralElection2020,https://twitter.com/BarryJo66816500/status/1226477977195700225
2020-02-09 12:08:26,koldanews,,0,0,"Législatives en Irlande : Fine Gael, Sinn Fein et Fianna Fail au coude-à-coude https://www.koldanews.com/2020/02/09/legislatives-en-irlande-fine-gael-sinn-fein-et-fianna-fail-au-coude-a-coude-a1128498.html",,,https://twitter.com/koldanews/status/1226477958396891137
2020-02-09 12:08:18,ClareChampion,,0,0,"Fianna Fail's Michael Mc Tigue and Marian Dormer look on at the Clare General Election 2020 count in The Falls Hotel, Ennistymon. Photograph by John Kelly. #GECLARE2020 #GE2020",,#GECLARE2020 #GE2020,https://twitter.com/ClareChampion/status/1226477922892034054
2020-02-09 12:08:09,jfwduffield,Effiedeans,0,0,They really are not. Historical Sinn Fein/IRA had the backing of the Irish people has expressed in the 1918 General Election. Once Irish independence was secured Cumann na nGaedheal/Fine Gael became stridently constitutional. Fianna Fail quickly followed.,,,https://twitter.com/jfwduffield/status/1226477886955282432
2020-02-09 12:08:02,LFCmickey,,0,0,Sinn Fein got roughly 43 percent of first preference votes. If ever there was an indication that Fianna Fail and Fine Gael failed the county.,,,https://twitter.com/LFCmickey/status/1226477854864674818
2020-02-09 12:06:55,irishexaminer,,0,5,#GE2020: #MeathWest final tally: Sinn Féin's Johnny Guirke predicted to top poll with 30% of the vote. Peadar Tóibín is deemed likely to hold onto his seat with 20% of the vote. Fianna Fáil - 16%. Fine Gael - 12%. Greens - 5%. ,,#GE2020 #MeathWest,https://twitter.com/irishexaminer/status/1226477575490416641
2020-02-09 12:06:53,PaschalSheehy,,1,10,"Final tally (all but three boxes tallied) in ⁦@RTEcorkSTHCENT⁩ indicates Sinn Féin’s Donnchadh Ó Laoghaire will top the poll; Fianna Fáil will hold their two seats and Simon Coveney will also be re-elected. All change and no change, if you get what I mean! ⁦@rtenews⁩",@RTEcorkSTHCENT @rtenews,,https://twitter.com/PaschalSheehy/status/1226477566250422274
2020-02-09 12:06:36,Sandyshark,RTEdublinWEST,0,1,So fianna fail and solidarity are neck and neck for the third seat. We may have to wait for an elimination to get a result,,,https://twitter.com/Sandyshark/status/1226477495383359490
2020-02-09 12:05:50,LMacMuiris,LMacMuiris,1,0,"Fianna Fáil, traditionally the most popular and influential party, are responsible for destroying Ireland's economy a decade ago. Fine Gael, the current leaders (barely), have overseen an explosion in homelessness and a health service catastrophe, and are regarded as out of touch",,,https://twitter.com/LMacMuiris/status/1226477303913492485
2020-02-09 12:05:19,joe_okoh1,,0,0,What we have so far from Wexford: Averages of Fianna Fàil and Fine Gaèl tallies with 65% of the boxes tallied. @griffithcollege @NewstalkFM @fiannafailparty @FineGael @sineadspain #GE2020,@griffithcollege @NewstalkFM @fiannafailparty @FineGael @sineadspain,#GE2020,https://twitter.com/joe_okoh1/status/1226477173877432320
2020-02-09 12:05:05,RTEDublinFingal,,0,3,"Weather brightening up in Swords as 89% votes are tallied, Sinn Féin's O'Reilly is in the lead, followed by Darragh O'Brien for Fianna Fáil and the Green Party's Joe O'Brien #GE2020",,#GE2020,https://twitter.com/RTEDublinFingal/status/1226477116109283328
2020-02-09 12:03:58,CaelainnH,RTEdunlaoghaire,1,1,"The only person to tell me they voted Fianna Fáil yesterday was a 20-year-old in Blackrock voting the way his dad did. He didn't want more money given to people who ""don't work"". This is my constituency, where people support the inequality that benefits them. #GE2020",,#GE2020,https://twitter.com/CaelainnH/status/1226476833463578629
2020-02-09 12:03:47,dj_breathnach,Independent_ie,0,0,Fine Gael are founded on fascist principles and Fianna Fáil held a civic reception for a prominent Commander in the SS under Charlie Haughey. Why don't any of you care about that?,,,https://twitter.com/dj_breathnach/status/1226476787003219968
2020-02-09 12:03:19,OwenOShea,,0,0,"There's Castlegregory's finest, former senator, Seán Dorgan, General Secretary of Fianna Fáil ",,,https://twitter.com/OwenOShea/status/1226476670426787840
2020-02-09 12:02:51,Rosstifer64,Independent_ie,0,0,Crimes...... Bankers .... Fianna fail...... Get a grip,,,https://twitter.com/Rosstifer64/status/1226476552768151552
2020-02-09 12:02:51,lospiegone,,1,0,"🇮🇪 Gli exit poll delle elezioni irlandesi tenutesi ieri mostrano un testa a testa tra Fine Gael, partito del primo ministro, i centristi di Fianna Fáil e i nazionalisti irlandesi di Sinn Féin.",,,https://twitter.com/lospiegone/status/1226476551178530816
2020-02-09 12:02:28,patdon801,leiamurr,1,0,"I love the ""how can people vote for a party that was linked to violence?"" narrative from folk who seem to have no idea about the history of Fianna Fáil or Fine Gael.",,,https://twitter.com/patdon801/status/1226476456378851328
2020-02-09 12:02:15,mrdavidflane,RTEcorkSTHCENT,0,1,"#SinnFein come in ahead of the outgoing Tanaiste, the leader of #FiannaFail and that party's Finance spokesperson. Remarkable. #CorkSC #GE2020",,#SinnFein #FiannaFail #CorkSC #GE2020,https://twitter.com/mrdavidflane/status/1226476399675965440
2020-02-09 12:02:14,AdrianKavanagh,macdarabueller,2,1,"Looking like one seat here for Richard Boyd-Barrett (Sol-PBP), Jennifer Carroll MacNeill (FG) and Ossian Smyth (Green). Mary Mitchell O'Connor in battle with Fianna Fáil (probably Cormac Devlin) for the final seat #GE2020",,#GE2020,https://twitter.com/AdrianKavanagh/status/1226476396345774081
2020-02-09 12:02:14,siobhanmulv,,0,4,"Regardless of how this is spun by the establishment media, this election is absolutely a win for left wing politics in Ireland. We have officially smashed the rotating two-party state of Fianna Fail and Fine Gael. Thank you to everyone who voted SF and voted left #GE2020",,#GE2020,https://twitter.com/siobhanmulv/status/1226476395934646273
2020-02-09 12:02:01,dmacthomais,,2,0,General Secretary of Fianna Fáil looks exactly like Micheál Martin. *shivers* #GE2020🗳,,#GE2020,https://twitter.com/dmacthomais/status/1226476342637682688
2020-02-09 12:01:36,andyoconnell,,5,1,"Democracy truly works when you see Fine Gael’s Eoghan Murphy, Fianna Fáil’s Jim O’Callaghan, Labour’s Joan Burton and Independent ministers Shane Ross and Katherine Zappone all fighting for their lives. #GE2020",,#GE2020,https://twitter.com/andyoconnell/status/1226476238166011905
2020-02-09 12:01:15,77spionkopite,echolivecork,2,0,"My own constituency... O' Sullivan's office is in Dillons Cross but I bet you he garnered all his votes from the more 'affluent' areas of Bishopstown, whitechurch, little island and parts of Glanmire. A prime example of tactical votes from Fianna Fail (the clue is in the name).",,,https://twitter.com/77spionkopite/status/1226476148210720768
2020-02-09 12:00:55,Galwaybayfmnews,,0,1,"Galway Bay fm News @Galwaybayfmnews News@12 Fianna Fail in with chance of second seat in Galway West Sean Canney in strong position as tally nears end in Galway East Denis Naughton, Claire Kirrane and Eugene Murphy battling for second seat in roscommon galway",@Galwaybayfmnews,,https://twitter.com/Galwaybayfmnews/status/1226476065008291840
2020-02-09 12:00:37,AindriuB,,0,0,Imagine journalists in this country had the same vitriol towards Fine Gael over homelessness and Fianna Fáil over the financial crisis as they do towards Sinn Féin over historic links with the troubles? #GE2020,,#GE2020,https://twitter.com/AindriuB/status/1226475990987296768
2020-02-09 12:00:01,RTErosGalway,,0,1,"69 boxed tallied of 140. At roughly the halfway point of the first tally, Michael Fitzmaurice extends his lead over fellow Independent Denis Naughton, with Sinn Féin's Claire Kerrane and Fianna Fáil's Eugene Murphy rounding out the top four. #GE2020 – at Dr. Hyde Park",,#GE2020,https://twitter.com/RTErosGalway/status/1226475839694479360
2020-02-09 11:59:14,Jennifer_Bray,,3,9,"Dublin North West - Fine Gael’s Noel Rock closed the gap with Fianna Fáil’s Paul McAuliffe but probably not enough to retain his seat. But stranger things have happened. Dessie Ellie taking 44pc, Roisin Shortall 19 pc #GE2020",,#GE2020,https://twitter.com/Jennifer_Bray/status/1226475641945624576
2020-02-09 11:59:13,byrne_padraig,,0,0,Fianna Fáil still hopeful of taking 2 seats here in #Wexford #GE2020,,#Wexford #GE2020,https://twitter.com/byrne_padraig/status/1226475636761468929
2020-02-09 11:58:57,kclr96fm,,0,0,"NATIONALLY - Fianna Fail TD Eugene Murphy is in danger of losing his seat in Roscommon-Galway, as early tallies indicate he's behind Sinn Fein's Claire Kerrane in the battle for the third and final seat.",,,https://twitter.com/kclr96fm/status/1226475571158405120
2020-02-09 11:58:48,stress_express,,0,0,Imagine falling in love with someone and finding out they voted for Fianna Fáil...,,,https://twitter.com/stress_express/status/1226475533262901248
2020-02-09 11:57:27,DrShaunMcDaid,,1,0,"“The story that Fine Gael and Fianna Fail have concocted, the narrative they control, and which the media largely supports, is one of success and progress.”",,,https://twitter.com/DrShaunMcDaid/status/1226475192433750016
2020-02-09 11:57:02,Jonathankeane31,Independent_ie,0,0,"No wonder print media is dying with blatant biased and propaganda like this. don't forget the imf coming in and losing our sovereign right to govern. Fine Gael and fianna fail will never represent me, they also hid the churches abuse for years so get off your morale high horse",,,https://twitter.com/Jonathankeane31/status/1226475088876359681
2020-02-09 11:56:04,jfwduffield,Effiedeans,2,0,Provisional Sinn Fein are not the historical Sinn Fein. Cumann na nGaedheal/Fine Gael have been committed to constitutional politics since 1922. Fianna Fail since 1932. There is no comparison at all. ,,,https://twitter.com/jfwduffield/status/1226474847015968768
2020-02-09 11:55:27,sickboydub,,0,1,"Great idea by Fianna Fail and Fine Gael to run so many candidates, now we get to enjoy , seeing them tear strips off each other , for the scraps , ready the popcorn for me and the Salt for FFFG #RateatRat #TimestheyareaChanging #FiannaFail #FineGael #GE2020",,#RateatRat #TimestheyareaChanging #FiannaFail #FineGael #GE2020,https://twitter.com/sickboydub/status/1226474688706236416
2020-02-09 11:55:13,irishcule,VanishingPoin_t,1,0,He was in Fianna Fáil as he left Sinn Fein in 1924.,,,https://twitter.com/irishcule/status/1226474629629403137
2020-02-09 11:54:52,mamaisucra,,0,0,THATS A BIG FUCK YOU TO FINE GAEL AND FIANNA FAIL YE SCUMS,,,https://twitter.com/mamaisucra/status/1226474540919934976
2020-02-09 11:54:36,doctorcdf,,0,0,Ireland has been through a period of terrible economic pain; it never occurred to Fine Gael / Fianna Fail that now the worst of the storms have passed that it was time to take care of the people. Complacency may be the most lethal poison in politics. #GE2020,,#GE2020,https://twitter.com/doctorcdf/status/1226474474394001408
2020-02-09 11:53:59,ShaneHannon01,,0,2,Looking like @sinnfeinireland will take 2 seats here in #CavanMonaghan with @mattcarthy &amp; Pauline Tully polling well. FG will retain Heather Humphreys’ seat with Fianna Fáil’s Niamh Smyth also likely. 5th seat could be between Brendan Smith FF &amp; Sarah O’Reilly Aontú. @NewstalkFM,@sinnfeinireland @mattcarthy @NewstalkFM,#CavanMonaghan,https://twitter.com/ShaneHannon01/status/1226474319666122752
2020-02-09 11:53:34,ShawnPogatchnik,,0,0,"Latest tallies with 60% of boxes open show Sinn Féin's O'Rourke with 25.1% of votes. Fine Gael's Helen McEntee 2nd with 17.3%, Fianna Fail's Thomas Byrne 13.8%, FG's Doherty 9.97%, Greens' Séan McCabe 7.3%. Byrne topped poll and was elected on 1st count in 2016. #GE2020",,#GE2020,https://twitter.com/ShawnPogatchnik/status/1226474216263946240
2020-02-09 11:52:35,SiCarswell,,1,1,"Sign of Sinn Féin's Ruairí Ó Murchú doing very well in #Louth: he took 60 votes in Knockbridge, home base of Fianna Fáil's Declan Breathnach who took 96 votes here, tallies show https://www.irishtimes.com/news/politics/election-2020-counting-begins-as-exit-poll-indicates-dead-heat-between-fg-ff-and-sf-1.4166984 - via @IrishTimes",@IrishTimes,#Louth,https://twitter.com/SiCarswell/status/1226473968720367617
2020-02-09 11:52:25,TiarnanHeaney,,0,0,"Fine Gael, Fianna Fáil, Labour and Aontú election HQs this morning... #GE2020",,#GE2020,https://twitter.com/TiarnanHeaney/status/1226473924940136449
2020-02-09 11:51:07,echolivecork,,0,9,"Final tally complete for Cork North-West and Fianna Fáil candidate, Aindrias Moynihan is topping the pole with 9,335 votes. His party colleague Michael Moynihan has 8,410 votes. Fine Gael’s Michael Creed has 8,091 votes, followed by John Paul O’Shea at 6,913 votes #GE2020",,#GE2020,https://twitter.com/echolivecork/status/1226473598992424961
2020-02-09 11:50:23,KieranKearns37,,1,0,"If anyone thinks this is a populist surge or a protest vote, clearly are blind sighted by thier love of FF-FG...Facts below👇 Combined vote of Fine Gael and Fianna Fáil: 1977 - 81.1% 1989 - 73.5% 2007 - 68.9% 2020 - 44.6% The times are changing, and no spin can change that!",,,https://twitter.com/KieranKearns37/status/1226473416485724160
2020-02-09 11:49:34,doctorcdf,,0,0,"A Fine Gael and Fianna Fail coalition will cement the idea in the voters' minds that they're ""two cheeks of the same arse"". #GE2020",,#GE2020,https://twitter.com/doctorcdf/status/1226473211107454976
2020-02-09 11:48:13,upsinnfein,Independent_ie,0,1,"fine gael and fianna fail are directly responsible for a health and housing crisis that affects working class young voters, why wouldnt they vote for change? also fine gael used to be fascists send tweet ",,,https://twitter.com/upsinnfein/status/1226472868344717312
2020-02-09 11:48:03,AlanFox_,,0,0,"This is bizarre, but it’s looking like this could potentially quite a poor election for Fianna Fáil, particularly in Dublin where there’s a few seats which they would have considered bankers that are now by no means foregone conclusions.",,,https://twitter.com/AlanFox_/status/1226472826779074560
2020-02-09 11:47:21,rituparnasarm10,IrishTimes,1,0,"Exit poll #GE2020 also going on in Ireland election,#postbrexit,economy,free trade r main point in Election,Exit poll results show present ruling Nationalist Sinn Fein party unlikely to form govt,main opposition Fianna Fail will become single largest party,but fail to majority ",,#GE2020 #postbrexit,https://twitter.com/rituparnasarm10/status/1226472651192819712
2020-02-09 11:46:34,allanholloway,Effiedeans,2,0,"Not really true, the present country was founded by the precursors of Fine Gael who supported the 1921 Treaty. The IRA opposed the Treaty and waged a Civil War against it killing their founder, Michael Collins. They became Fianna Fail when normal politics resumed in 1927.",,,https://twitter.com/allanholloway/status/1226472452974370817
2020-02-09 11:45:59,GazzaONuallain,hapennyplace,0,0,"Bollocks excuse. Sinn Féin got the most first preferences in every demographic except 65+. Are you telling me all of them didn't live through the troubles? If Sinn Féin are the IRA, then Fianna Fáil are also the IRA, and Fine Gael are fascists.",,,https://twitter.com/GazzaONuallain/status/1226472309231357953
2020-02-09 11:45:53,mrdavidflane,,0,0,Roscommon-Galway to return neither a #FiannaFail nor a #FineGael TD? #GE2020,,#FiannaFail #FineGael #GE2020,https://twitter.com/mrdavidflane/status/1226472280647229440
2020-02-09 11:45:42,PlunkettCiara,,0,2,#KildareNorth looking like: 1 X Sinn Fein 1 X Social Democrats 1 X Fianna Fáil 1X Fine Gael #GE2020,,#KildareNorth #GE2020,https://twitter.com/PlunkettCiara/status/1226472234761510912
2020-02-09 11:45:35,IrishTimes,,1,3,Exit poll analysis: 51% voters think Fine Gael and Fianna Fáil are wrong to rule out going into government with Sinn Féin #GE2020 https://www.irishtimes.com/news/politics/detailed-election-2020-exit-poll-results-how-voters-answered-15-questions-1.4167016,,#GE2020,https://twitter.com/IrishTimes/status/1226472208723333120
2020-02-09 11:45:19,CMcGin2006,,0,9,Could Sinn Féin’s Donnchadh Ó Laoghaire top the poll in Cork South Central and beat Fianna Fáil leader Michéal Martin &amp; Tánaiste Simon Coveney? YES he can! #GE2020,,#GE2020,https://twitter.com/CMcGin2006/status/1226472140465168384
2020-02-09 11:44:24,RobHudsonPhoto,IrishTimes,0,0,If Fianna Fáil and Sinn Féin merged they’d have the best acronym in the whole of politics. ,,,https://twitter.com/RobHudsonPhoto/status/1226471909845585921
2020-02-09 11:44:03,oheochaidh,,0,0,"#ge2020 if #finegael and #fiannafail if ignore the people's votes, hell hat no fury if we have to go to the polls again.",,#ge2020 #finegael #fiannafail,https://twitter.com/oheochaidh/status/1226471821475794944
2020-02-09 11:43:33,IanRH64,dearaunty,2,0,Astounding to think that it’s possible that Fine Gael and Fianna Fáil may be incapable of forming a “grand coalition” with an overall majority.,,,https://twitter.com/IanRH64/status/1226471694665211905
2020-02-09 11:43:19,colmmacn,irish2witter,0,0,"War of Independence IRA, mind you, or are Fianna Fail AND Fine Gael looking less attractive to you all of a sudden?",,,https://twitter.com/colmmacn/status/1226471638218235907
2020-02-09 11:42:14,sickboydub,,0,0,"Stephen Donnelly the Irish Chuka , he's jumped more ships than Evil Knieval . Will Fine Gael be his next Port in a storm, because no one else wants him #FiannaFail #StephenDonnelly #WhereNext",,#FiannaFail #StephenDonnelly #WhereNext,https://twitter.com/sickboydub/status/1226471362308530178
2020-02-09 11:40:43,AdrianKavanagh,,0,1,"Kerry - No change in party breakdown of seats likely, but will be chages of personnel. Both Healy-Raes polling well and SF's Pa Daly. Fine Gael and Fianna Fáil will hold seats, but looks as if Norma Foley will replace John Brassil as the FF TD #GE2020",,#GE2020,https://twitter.com/AdrianKavanagh/status/1226470982799577088
2020-02-09 11:40:29,maevmac,maevmac,1,0,"The next govt will have either Fianna Fáil or Fine Gael in it, so it’s not like the two main parties have gone away. But you could argue it’s the signs of a more normal political alignment coming into existence, with FF and FG representing the centre right and SF the centre left",,,https://twitter.com/maevmac/status/1226470922598731777
2020-02-09 11:40:26,PhizHicks,,0,0,Good news for all - Shane Ross in trouble. #ge2020 #sinnfeinsurge #FiannaFail #FineGael #SocialDemocrats,,#ge2020 #sinnfeinsurge #FiannaFail #FineGael #SocialDemocrats,https://twitter.com/PhizHicks/status/1226470911945166848
2020-02-09 11:39:56,kclr96fm,,0,3,"Former Fine Gael Senator Pat O'Neill says as it stands it looks like Fianna Fail might get three seats, Fine Gael will lose one, and that the Green candidate is a contender #GE2020 #CWKK",,#GE2020 #CWKK,https://twitter.com/kclr96fm/status/1226470782877995009
2020-02-09 11:39:25,funkymonkey877,,1,0,Whoever STILL voted fine gael or fianna fail your moms a hoe. 🖕,,,https://twitter.com/funkymonkey877/status/1226470655551582209
2020-02-09 11:37:55,Jonathankeane31,Independent_ie,0,0,"More criminals hid in Europe and elsewhere by fine Gael and fianna fail , silly article",,,https://twitter.com/Jonathankeane31/status/1226470278026399745
2020-02-09 11:37:50,worldnewsdotcom,,0,0,"Election 2020: Exit poll confirms health, housing, homelessness of most concern to voters #IrelandElections #FineGael #FiannaFáil https://article.worldnews.com/view/2020/02/09/Election_2020_Exit_poll_confirms_health_housing_homelessness/",,#IrelandElections #FineGael #FiannaF,https://twitter.com/worldnewsdotcom/status/1226470254408237062
2020-02-09 11:37:15,susmitchellSBP,,4,3,Thought-provoking piece from Elaine Byrne on the class divisions stirred up by Fianna Fáil and Sinn Fein @ElaineByrne https://www.businesspost.ie/election2020/comment-stirring-up-class-division-could-backfire-on-politicians-c83e099e?utm_campaign=article&amp;utm_source=twitter&amp;utm_medium=web via @businessposthq,@ElaineByrne @businessposthq,,https://twitter.com/susmitchellSBP/status/1226470110405242880
2020-02-09 11:36:45,caaitlinkelly,,0,0,good morning to everyone except people who voted fianna fáil and fine gael #GE2020,,#GE2020,https://twitter.com/caaitlinkelly/status/1226469984995508224
2020-02-09 11:35:23,mrwalshbud,MrColinBrowne,1,0,Some fools around thinking Fine Gael or Fianna Fáil are the answer,,,https://twitter.com/mrwalshbud/status/1226469637853978624
2020-02-09 11:35:14,IrelandElects,RTEwaterford,0,1,Sinn Féin look likely to have a big surplus in Waterford. Fianna Fáil’s Mary Butler looks safe but the last two seats could go anyway #GE2020,,#GE2020,https://twitter.com/IrelandElects/status/1226469600356945920
