date,username,to,replies,retweets,text,mentions,hashtags,permalink
2020-02-07 10:48:51,caollai,,7,18,I heard the end of this morning's radio broadcast by outgoing TD Regina Doherty attacking a Fianna Fáil TD and lawyer for representing in court someone connected to Sinn Féin. This must qualify her as the greatest amadán of this general election season. What a clown.,,,https://twitter.com/caollai/status/1225733151735123968
2020-02-07 10:43:06,Muinchille,flanobrien,1,0,"Please to demonstrate the existence of a military wing or structure of Fianna Fáil? Whereas Fine Gael = CnanG + Army Comrades Association (Blueshirts) + Unionists, who all had military wings. Labour merged with the Stickies. No military wing in the Greens, though (yet).",,,https://twitter.com/Muinchille/status/1225731707099369473
2020-02-07 10:36:53,elten_eleven,echolivecork,0,0,shameless propaganda piece for Fianna Fail/Gael.,,,https://twitter.com/elten_eleven/status/1225730143068524545
2020-02-07 10:36:29,crying_gosling,,0,0,can’t wait to not vote fine gael and fianna fail,,,https://twitter.com/crying_gosling/status/1225730043101548546
2020-02-07 10:27:04,TheEconomist,,0,15,Fine Gael and Fianna Fail have pledged to shun Sinn Fein. But making a government without it will be hard ,,,https://twitter.com/TheEconomist/status/1225727670933237765
2020-02-07 10:22:09,KennyAKE,,0,0,@ReginaDo says people cannot trust Fianna Fáil when they say they won't go into Government with Sinn Féin and she said the party will go into Government with anyone because they just want power #todaysor @rtenews,@ReginaDo @rtenews,#todaysor,https://twitter.com/KennyAKE/status/1225726432946593795
2020-02-07 10:19:59,electionlit,,0,0,Leaflet from Caitríona McClean -Fianna Fáil – Dublin Mid-West #GE2020 http://irishelectionliterature.com/2020/02/07/leaflet-from-caitriona-mcclean-fianna-fail-dublin-mid-west-ge2020/,,#GE2020,https://twitter.com/electionlit/status/1225725889314541568
2020-02-07 10:17:49,tvcritics,,0,2,There's Fianna Fáil &amp; Fine Gael men on @PatKennyNT talking about building social housing. You couldn't make it up. #GE2020,@PatKennyNT,#GE2020,https://twitter.com/tvcritics/status/1225725343862001666
2020-02-07 10:16:25,drgs100,,1,0,What really is the difference between Fine Gael and Fianna Fáil? Hot takes required.,,,https://twitter.com/drgs100/status/1225724989799895040
2020-02-07 10:15:55,fintancox,,7,3,"If u are a fine gael voter right across the counties of carlow,kilkenny,dublin,kerry,longford weseath and louth where there are marginal fianna fail seats you have no choice but to vote for the fianna fail candidate going for the final seat to keep sinn fein out of government",,,https://twitter.com/fintancox/status/1225724865044533255
2020-02-07 10:15:42,declanganley,,4,4,"The disinheritance & relegation to 'Backwoodsmen' status of the 'small c' conservative bases of both Fianna Fail &amp; Fine Gael has largely alienated those with different instincts from Sinn Fein 4.0. There's quite a lot of them backwoodsmen, I'm one.",,,https://twitter.com/declanganley/status/1225724812519190528
2020-02-07 10:14:50,seanfhealy,,0,0,@ReginaDo seriously grasping at straws on @TodaySOR trying to mud sling a barrister for doing his job. She’d be better off out canvassing to try and save her floundering election chances. #FiannaFail,@ReginaDo @TodaySOR,#FiannaFail,https://twitter.com/seanfhealy/status/1225724593303932928
2020-02-07 10:13:30,fintancox,,0,1,This must be one of the dumbest segments in the history of radio on @TodaySOR jim o callaghan writes a letter for Adam's in a defamation case and now fianna fail will go in with Sinn fein,@TodaySOR,,https://twitter.com/fintancox/status/1225724258879492097
2020-02-07 10:13:27,KennyAKE,,1,0,Fianna Fail's @OCallaghanJim has said he could not discriminate against someone because of their politics #todaysor,@OCallaghanJim,#todaysor,https://twitter.com/KennyAKE/status/1225724243226304513
2020-02-07 10:13:08,RayMinehane,PatJCurran,0,0,Open Fianna Fáil supporters? My god such a rare thing. ,,,https://twitter.com/RayMinehane/status/1225724163954036737
2020-02-07 10:11:46,JohnSq64,BillyKelleherEU,0,1,Any comment on the creepy Fianna Fáil knock-knock in Waterford? ,,,https://twitter.com/JohnSq64/status/1225723820637655042
2020-02-07 10:10:59,bear_nagata,,0,0,"go on -> 'Fianna Fáil justice spokesman Jim O'Callaghan, who claims Sinn Féin is unfit to be a coalition partner, has been providing legal services to the party's former president Gerry Adams' Revealed: FF TD’s work on legal case for Gerry Adams ",,,https://twitter.com/bear_nagata/status/1225723622645325824
2020-02-07 10:10:54,kenibyk,,0,0,"It's funny, you always hear about a media bias against #SinnFein and think people are being a bit tinfoil hatty but oh boy did that thesis get proven this week! #RTEbias #GeneralElection #GeneralElection2020 #ge20 #FineGael #FiannaFail",,#SinnFein #RTEbias #GeneralElection #GeneralElection2020 #ge20 #FineGael #FiannaFail,https://twitter.com/kenibyk/status/1225723601648791552
2020-02-07 10:10:38,RMcGreevy1301,,15,6,"“Yes, I do want them to admit they were wrong and, as Seamus Mallon said, to admit the IRA’s campaign was 40 years of failure."" Could this be the price of Sinn Féin's involvement in coalition with Fianna Fáil? It's an offer they could not possibly except. ",,,https://twitter.com/RMcGreevy1301/status/1225723537413091328
2020-02-07 10:10:16,Joeboycermd,TheLiberal_ie,0,0,Just a note to fianna fail if you try and form a government with them then their will be another election in no time and Sinn Fein will take even more votes off you,,,https://twitter.com/Joeboycermd/status/1225723444752461824
2020-02-07 10:08:25,LesHaricotsVert,,1,0,"Irish Electorate: I’m never falling for Fianna Fáil’s lies, deceit and corruption again! Also Irish Electorate: So now I’m voting Sinn Féin.",,,https://twitter.com/LesHaricotsVert/status/1225722977074974720
2020-02-07 10:08:04,SimonHarrisTD,,550,39,Did @MichealMartinTD know that his legal advisor at the time was also providing legal advice to Gerry Adams? When did the Fianna Fail Justice Spokesperson last appear in court representing Gerry Adams? Two keys questions that need to be answered,@MichealMartinTD,,https://twitter.com/SimonHarrisTD/status/1225722892098338816
2020-02-07 10:04:28,1MadIrishMan1,RonanMaher,0,0,Vote Green get Fianna Fáil,,,https://twitter.com/1MadIrishMan1/status/1225721983066943488
2020-02-07 09:58:59,YJB57,PatLeahyIT,0,2,"I don't recall any of you ""journalists"" asking any @fiannafail people about Mary Boyle. How come?",@fiannafail,,https://twitter.com/YJB57/status/1225720604839510017
2020-02-07 09:58:53,JohnHedges109,,1,29,Have ⁦@MichealMartinTD⁩ ⁦⁦@lichamber⁩ said anything about this? #GE20 #GE2020 📰 A Fianna Fáil candidate has refused to apologise for liking a tweet calling the Sinn Féin president Mary Lou McDonald a “c***”.⁦ ,@MichealMartinTD @lichamber,#GE20 #GE2020,https://twitter.com/JohnHedges109/status/1225720577836638208
2020-02-07 09:56:48,fallon_donal,,2,10,"1930s Fianna Fail poster against the paying of Land Annuities to Britain, referencing the Black and Tans. Peadar O'Donnell lit the bonfire on the Land Annuities campaign and FF followed. ",,,https://twitter.com/fallon_donal/status/1225720053934542848
2020-02-07 09:51:52,Yourmannugget,mcgarrigle1,1,0,Why isn't this being out to Fianna Fail but RTE and other media? Surprised Mary Lou hasn't got the blame. Happy to use anyone else's suffering for political footballs but not this. ,,,https://twitter.com/Yourmannugget/status/1225718815075577856
2020-02-07 09:50:08,MarcasSuibhne,IrishTimes,0,1,"No - Fine Gael/Fianna Fáil and their media outlet’s rehortic is dangerous. Vote Green, Vote Sinn Féin, Vote anyone but Fine Gael and Fianna Fáil. #GE2020",,#GE2020,https://twitter.com/MarcasSuibhne/status/1225718378670829568
2020-02-07 09:48:01,paulatgreid1,,0,1,Remember Fine Gael and Fianna Fáil TDs wanted to commemorate the Black &amp;Tans #GE2020 Don't reward them with you vote. Consign the to history.,,#GE2020,https://twitter.com/paulatgreid1/status/1225717845054697473
2020-02-07 09:41:22,MarieTerese4,,1,0,Fianna Fáil's Thomas Byrne refuses to apologise for liking abusive tweet on McDonald ,,,https://twitter.com/MarieTerese4/status/1225716170843660289
2020-02-07 09:41:12,JohnSq64,,0,3,Fianna Fáil now has a big problem in Waterford. Damien Tiernan @wlrfm has more on the story after ten.,@wlrfm,,https://twitter.com/JohnSq64/status/1225716129865310209
2020-02-07 09:40:28,kevteljeur,,0,0,"It's as if having Fine Gael or Fianna Fáil back in is actually preferable to having a broad spectrum of interests getting represented. I don't understand it. Yes, every party has its flaws and problems. All of them. Even if you can't see them, they're there.",,,https://twitter.com/kevteljeur/status/1225715945018208257
2020-02-07 09:38:31,FillerPolly,BattenFf,0,0,This is what you have to look forward to with #FiannaFail and #FineGael. They’ve sold your future down the drain... #TimeForChange #GeneralElection2020 #GE2020 #FiannaFailGael,,#FiannaFail #FineGael #TimeForChange #GeneralElection2020 #GE2020 #FiannaFailGael,https://twitter.com/FillerPolly/status/1225715453265432578
2020-02-07 09:37:38,FillerPolly,ReginaDo,0,0,This is what you have to look forward to with #FiannaFail and #FineGael. They’ve sold your future down the drain... #TimeForChange #GeneralElection2020 #GE2020 #FiannaFailGael,,#FiannaFail #FineGael #TimeForChange #GeneralElection2020 #GE2020 #FiannaFailGael,https://twitter.com/FillerPolly/status/1225715232431013889
2020-02-07 09:36:56,Patch_Thompson,,0,4,"This from @PronouncedAlva is a really good on Sinn Féin's surge in the polls &amp; some of the social issues in Ireland that might push voters away from Fine Gael and Fianna Fáil, as well as why there are plenty of voters who will never back Sinn Féin: ",@PronouncedAlva,,https://twitter.com/Patch_Thompson/status/1225715054835838978
2020-02-07 09:33:46,kevteljeur,,2,1,"I get that not every party is everyone else's cup of tea. But I'm still amazed that much of the Left focuses so much of its energy on taking down not Fine Gael/Fianna Fáil, not Labour, but specifically the Green Party. This is active polarisation to achieve a binary outcome.",,,https://twitter.com/kevteljeur/status/1225714256638808066
2020-02-07 09:31:22,irishpoint,,0,1,"#GE2020 Fianna Fáil justice spokesman Jim O'Callaghan, who claims Sinn Féin is unfit to be a coalition partner, has been providing legal services to the party's former president Gerry Adams. #TonightVMT #rtept #cblive #twip @rtenews",@rtenews,#GE2020 #TonightVMT #rtept #cblive #twip,https://twitter.com/irishpoint/status/1225713656240971776
2020-02-07 09:31:08,callmejustsean,,0,0,"#GE2020 #VoteThemOut2020 , a Kind reminder of the sort of shyte #FineGael #FiannaFail put people thru Add , Maurice McCabe , Homeless, abject poverty, the robbibg of the pension reserve fund, Vulture funds etc to that list ",,#GE2020 #VoteThemOut2020 #FineGael #FiannaFail,https://twitter.com/callmejustsean/status/1225713596056862720
2020-02-07 09:29:53,IanChopperLowry,ThomasR86344338,1,0,"Wow Thomas, what a hot take. I'd love to hear many more from yourself, a Fianna Fáil/ Fine Gael apologist no doubt.",,,https://twitter.com/IanChopperLowry/status/1225713279009423362
2020-02-07 09:29:14,JoeEDwyer,,3,5,Have Fianna Fáil ever held onto any of their stated principles? 💁‍♂️ - outline of one of their first ever flip-flops below - when de Valera swallowed the oath of allegiance to the British Crown … ,,,https://twitter.com/JoeEDwyer/status/1225713117541302272
2020-02-07 09:28:12,NorthernRook,LeoVaradkar,0,2,"This is the false narrative that fooled the people for a century, Fianna Fáil or Fine Gael. They are two cheeks of the same establishment arse that thinks they are born to rule. It's time to #VoteLeft #GE2020 They are the crisis, watch this instead: https://youtu.be/JCAVXheVuE8",,#VoteLeft #GE2020,https://twitter.com/NorthernRook/status/1225712855732948993
2020-02-07 09:26:47,marty_healy,theechristoff,1,0,I work it off the bedding odds haha 3/1 the other day for a coallition with Fianna Fail. Martin’s 1/12 to become next taoiseach,,,https://twitter.com/marty_healy/status/1225712502098612225
2020-02-07 09:24:57,Antcon7062,damianstack,1,0,Tone did a piece to camera extolling Bertie in a Fianna Fáil party political broadcast in 2007.,,,https://twitter.com/Antcon7062/status/1225712038644789248
2020-02-07 09:20:36,_SomeDad,,0,0,Fianna Fail canvasser at the door the other night pitching for a candidate that cannot win and telling me same. #GE2020,,#GE2020,https://twitter.com/_SomeDad/status/1225710946393501697
2020-02-07 09:15:00,ClareFM,,0,0,"Now on Morning Focus, Fianna Fáil leader, Micheál Martin joins us on the line to make final plea for them to receive your vote. Listen on 96.4FM or http://www.clare.fm Text or WhatsApp us on 086 1800964!",,,https://twitter.com/ClareFM/status/1225709534573813761
2020-02-07 09:12:06,BenSweeneyF1,,0,1,"Busy show this morning - in the next few minutes Fianna Fail leader @MichealMartinTD joins @ClareFM's Morning Focus, and after 10am Taoiseach @LeoVaradkar will be in studio. More incl Clare' returning officer, and a recap of the campaign here. 🎙96.4 or http://clare.fm",@MichealMartinTD @ClareFM @LeoVaradkar,,https://twitter.com/BenSweeneyF1/status/1225708807151640576
2020-02-07 09:11:21,involve_d6_d6w,,0,2,@ODonovanDeirdre thank you so much for coming to our meeting last night &amp; for sharing your story @involve_d6_d6w. Wishing you all the very best for Sat. Let’s keep the conversation going #OurChildrenMatter #GE2020 #FiannaFail ,@ODonovanDeirdre @involve_d6_d6w,#OurChildrenMatter #GE2020 #FiannaFail,https://twitter.com/involve_d6_d6w/status/1225708615606116352
2020-02-07 09:10:37,michael_mq,jboyle25,1,0,"Or as bad, if not worse, Fianna Fail",,,https://twitter.com/michael_mq/status/1225708432256360449
2020-02-07 09:08:52,oheochaidh,HelenGuinane,0,0,"A vote for #fiannafail is a vote to put more anti choice TDs back in the next dail, so please vote for anyone who is not anti choice ",,#fiannafail,https://twitter.com/oheochaidh/status/1225707992894640134
2020-02-07 09:05:41,franmcnulty,,15,13,"Final day of campaigning in #GE2020 we met @MichealMartinTD in Cork &amp; asked him why should people vote Fianna Fáil over any other party, his last push ahead of today’s broadcast moratorium on coverage – at Trinity Bridge",@MichealMartinTD,#GE2020,https://twitter.com/franmcnulty/status/1225707191216242688
2020-02-07 09:02:38,wallacemick,,4,20,"In the last ten years we have seen #FiannaFail #FineGael #Labour #Greens in Government and all supported the US Military use of #Shannon, facilitating the destruction of the lives of millions. Vote for candidates that will put a stop to this madness...",,#FiannaFail #FineGael #Labour #Greens #Shannon,https://twitter.com/wallacemick/status/1225706421720952832
2020-02-07 09:02:34,SeanOLoughlin0,ColinPower71,0,0,"Former #FiannaFail TD who was aware of paedophiles #ChildAbuse and did nothing, canvassing on behalf of @fiannafailparty &amp; @MaryButlerTD, calls to door of one the abused. @MichealMartinTD #NotFitForOffice #GE2020",@fiannafailparty @MaryButlerTD @MichealMartinTD,#FiannaFail #ChildAbuse #NotFitForOffice #GE2020,https://twitter.com/SeanOLoughlin0/status/1225706407242104832
2020-02-07 08:56:58,ClareFM,,1,1,"Today on Morning Focus we're joined on the line by Fianna Fáil leader Micheál Martin, our Head of News, Gavin Grace will join us to discuss the General Election and Taoiseach, Leo Varadkar will be in studio following our Friday Panel. Tune in from 9am on 96.4 FM! ",,,https://twitter.com/ClareFM/status/1225704995473018880
2020-02-07 08:56:54,franmcnulty,,4,2,On an early morning canvass in Cork @MichealMartinTD urges people to vote tomorrow &amp; says he expects smaller parties to perform well with Fianna Fáil in a position to lead a Government of change #GE2020 – at Trinity Bridge,@MichealMartinTD,#GE2020,https://twitter.com/franmcnulty/status/1225704978385375233
2020-02-07 08:55:08,EwanMacKenna,,8,4,"Good to see Fianna Fail haven't changed. All about the morals when power to be had, with the one exception of when there's money to be had. Same old... ",,,https://twitter.com/EwanMacKenna/status/1225704535433318400
2020-02-07 08:51:57,PaulAnthonyWard,Philip_Ryan,1,0,Bar of Ireland rules SPECIFICALLY states you cannot refuse to represent a client based on politics. So... meh. Gonna respond to this like a Shinner. TOTAL ANTI-FIANNA FÁIL BIAS! ESTABLISHMENT CONSPIRACY! SHOWING YOUR TRUE COLOURS! INDO? MORE LIKE SPINDO! AMIRIGHT? 🤬😡🤯 ,,,https://twitter.com/PaulAnthonyWard/status/1225703733323030528
2020-02-07 08:50:12,bouldirishmammy,,0,0,So @MiriamOCal brotherJim O'Callaghan Fianna Fáil is working as Gerry Adams barrister.,@MiriamOCal,,https://twitter.com/bouldirishmammy/status/1225703293957103617
2020-02-07 08:42:22,KeepinItSureal,carolineamorrin,0,0,"It’s so hard to pick between which ministers need a career break, so many choices it sets my brian into overdrive. Remember Ireland, we don’t need to pick just one! #Ireland #FineGael #FiannaFail #VoteThemOut #NotOnePreference #GE2020 #Dail #VoteForChange #Election2020 #VoteLeft",,#Ireland #FineGael #FiannaFail #VoteThemOut #NotOnePreference #GE2020 #Dail #VoteForChange #Election2020 #VoteLeft,https://twitter.com/KeepinItSureal/status/1225701324198678528
2020-02-07 08:41:24,seanystewy,EFFanning,0,0,"Fianna Fail politician ‘interfered in murder case’ Ann Doherty, whose twin sister went missing in 1977 Mark Tighe Sunday May 01 2016, 12.01am, The Sunday Times..... Did Micheál Martin confirm when asked was the interferent a member of FIANNA FÁIL ?",,,https://twitter.com/seanystewy/status/1225701078307491846
2020-02-07 08:36:50,TedLeddy,cha_doran,2,0,Fianna Fáil and the Greens,,,https://twitter.com/TedLeddy/status/1225699931454935040
2020-02-07 08:32:42,PaulAnthonyWard,CllrKRedmond,2,0,Oh you’re voting Fianna Fáil so?,,,https://twitter.com/PaulAnthonyWard/status/1225698891695190016
2020-02-07 08:31:26,PaulTyredagh81,ShaneCassells,1,0,SDLP hobnobbing with Fianna Fáil today. Other SDLP canvassing for Fine Gael &amp; Irish Labour. What a confused Party. 🤔 ,,,https://twitter.com/PaulTyredagh81/status/1225698573364252672
2020-02-07 08:30:07,TheLiberal_ie,,2,3,"More of the same - Leo Varadkar doesn't rule out going back in with Fianna Fail ""as a last resort"" - https://theliberal.ie/more-of-the-same-leo-varadkar-doesnt-rule-out-going-back-in-with-fianna-fail-as-a-last-resort/",,,https://twitter.com/TheLiberal_ie/status/1225698239929708544
2020-02-07 08:24:17,phunt72,eoinodr,1,0,I don’t see any real surge for Fianna Fáil people are talking up shay Brennan’s chances for example,,,https://twitter.com/phunt72/status/1225696773273862144
2020-02-07 08:23:20,RichieJohnLynch,,0,0,@Independent_ie @JohnDowning2 @rtenews now advertising is appearing for Fianna Fail on the http://independent.ie website. This is unacceptable from a national paper. Does it break @The_ASAI rules or electioneering rule?,@Independent_ie @JohnDowning2 @rtenews @The_ASAI,,https://twitter.com/RichieJohnLynch/status/1225696531547713537
2020-02-07 08:16:07,DarranMarshall,,3,2,"Fianna Fáil justice spokesman Jim O'Callaghan, who claims Sinn Féin is unfit to be a coalition partner, has been providing legal services to the party's former president Gerry Adams. https://www.independent.ie/irish-news/election-2020/revealed-ff-tds-work-on-legal-case-for-gerry-adams-38934927.html",,,https://twitter.com/DarranMarshall/status/1225694715997089793
2020-02-07 08:15:18,TarynDeVere,,1,16,"We wonder why our rural towns are dying - well this is why. Fine Gael and Fianna Fail invited vulture funds over and the banks we taxpayers bailed out, are selling our land to these vulture funds. Colette is angry. I'm angry too. Think on Colette when you cast your vote #GE2020",,#GE2020,https://twitter.com/TarynDeVere/status/1225694511482884097
2020-02-07 08:10:39,Declan1497,,0,1,FIANNA FAIL COULD HAVE VOTED NO CONFIDENCE IN SIMON HARRIS EOGHAN MURPHY NO CREDIBILITY WHEN TALKING ABOUT HEALTH HOUSING VOTE FOR CHANGE . ,,,https://twitter.com/Declan1497/status/1225693341875990528
2020-02-07 08:00:18,Thomasb64631717,,0,0,"Just commented on @thejournal_ie: Fine Gael and Fianna Fáil spend up to €1,000 on ads criticising each other ov - ",@thejournal_ie,,https://twitter.com/Thomasb64631717/status/1225690738240839680
2020-02-07 08:00:00,electiontrackin,,0,0,Fianna Fáil has a chance to form the new Irish government leading a coalition of smaller parties and independent MPs; plan B is to seek agreement with Fine Gael #Ireland #Forecast #government #coalition #Election2020 #Parliament,,#Ireland #Forecast #government #coalition #Election2020 #Parliament,https://twitter.com/electiontrackin/status/1225690661514600448
2020-02-07 07:59:09,ruxtab,NursepollyRgn,0,0,"Fianna Fail Headquarters, a brandy or two. They have their own carpark and everything.",,,https://twitter.com/ruxtab/status/1225690449135861762
2020-02-07 07:58:05,BernardJMolloy6,ElaineYoung94,3,1,hopefully sinn fein wins. fine gael & fianna fail are the same party &amp; corrupt. hopefully the RoI public will remember stuff like this:- ,,,https://twitter.com/BernardJMolloy6/status/1225690180431925248
2020-02-07 07:53:38,spdonlan,,1,0,"(ii) despite identifying as centre left, neither Labour nor the Social Democrats are likely to be particularly successful or enter Government (iii) I've no faith that Fianna Fáil's positions matter, given the fluidity of their populist-nationalist ideological commitments 4/5",,,https://twitter.com/spdonlan/status/1225689059684564992
2020-02-07 07:52:21,watbanner,,0,1,"#FineGael Gael #FiannaFail spend up to €1,000 on ads criticising each other over Sinn Féin (via @thejournal_ie) https://jrnl.ie/4996141 #BroadLeftCoalition now possible in #Ireland End nepotisic cartel #FFFG created since FOUNDATION OF 🇮🇪STATE ❎❎❎❎❎ ✔️✔️✔️✔️✔️",@thejournal_ie,#FineGael #FiannaFail #BroadLeftCoalition #Ireland #FFFG,https://twitter.com/watbanner/status/1225688735355830278
2020-02-07 07:52:06,MaryKenny4,RuthDE,0,0,"I seem to remember Todd Andrews telling Robert Kee in an interview ‘We were just as bad as the Provos in our day.’ That is, the IRA back in the 1920s. Still, they settled down to become - Fianna Fail.",,,https://twitter.com/MaryKenny4/status/1225688672386764800
2020-02-07 07:50:49,RayHall9991,,1,2,Fianna Fáil's Thomas Byrne refuses to apologise for liking abusive tweet on McDonald ,,,https://twitter.com/RayHall9991/status/1225688350662594561
2020-02-07 07:50:31,SW1AIrish,,0,0,"Fine Gael and Fianna Fáil display “something of a double standard” by insisting Northern Irish enter government with Sinn Féin in the North while ruling out a coalition with the party in the Republic, DUP MP Jeffrey Donaldson has said. ",,,https://twitter.com/SW1AIrish/status/1225688276436058113
2020-02-07 07:48:53,spdonlan,,1,0,"The second number reflects the ideological affinity of the party to me, according to the http://whichcandidate.ie site. 1 (2 (tie)) Fine Gael 2 (2 (tie)) Labour 3 (5) Social Democrats 4 (2 (tie)) Green 5 (1) Fianna Fáil 2/5",,,https://twitter.com/spdonlan/status/1225687861791354880
2020-02-07 07:41:06,CapersColly,,1,12,So a member of @Fiannafail calls the President of Sinn Féin a cu*t and a FF outgoing TD gives it a 'like'. How disgusting is that? #ToxicTwins #GE2020,@fiannafail,#ToxicTwins #GE2020,https://twitter.com/CapersColly/status/1225685906520035329
2020-02-07 07:37:37,JohnSupple8,mmcgrathtd,0,0,"What is your stance on 1350 supervisors 21,000 participants and 100 of Communities groups heading for strike next week...Will fianna fail make a statement of support for CE Supervisor s pensions to resolve it before we hit the poles tomorrow??",,,https://twitter.com/JohnSupple8/status/1225685028954206209
2020-02-07 07:37:16,PeteFarrell15,BreathnachLouth,0,0,If you can make sure that you have no one out on bail in your party you may have my vote.,,,https://twitter.com/PeteFarrell15/status/1225684941553356800
2020-02-07 07:36:37,v_twamley,,0,0,"For anyone who's considering voting fianna fail or finne Gael please take a minute to watch my video which describes how a student living in Dublin will be affected. Please dont vote with your wallet, vote with your head. #GE2020 #GeneralElection2020",,#GE2020 #GeneralElection2020,https://twitter.com/v_twamley/status/1225684777371500550
2020-02-07 07:36:06,michaelpierse,,1,0,"""The establishment - and RTE is part of it - doesn’t like change, but it’s coming hurtling down the tracks because the people are demanding an end to the Punch and Judy politics between Fine Gael and Fianna Fail."" ",,,https://twitter.com/michaelpierse/status/1225684644609155074
2020-02-07 07:34:15,kceire,Independent_ie,0,0,All the big media outlets running with the same story today. Denis O’ Brien must feel the Galway tent shaking in the wind. No mention of all the women atill@waiting@on cervical cancer results or apologies From Fianna Fail or Fianna Gael.,,,https://twitter.com/kceire/status/1225684182820474880
2020-02-07 07:32:26,JohnSupple8,,1,2,"#FineGael #FiannaFail #Labour #SinnFein 1350 Supervisors 21,000 participants and hundreds of Communities head into strike action next week with no voice of resolution, Labour Court recommendation ignored #RTE #reginadoherty #pascald",,#FineGael #FiannaFail #Labour #SinnFein #RTE #reginadoherty #pascald,https://twitter.com/JohnSupple8/status/1225683725456789505
2020-02-07 07:21:08,thefaaside,BreathnachLouth,0,0,Bruce Springsteen has changed!,,,https://twitter.com/thefaaside/status/1225680882100391937
