date,username,to,replies,retweets,text,mentions,hashtags,permalink
2020-02-09 17:06:48,kippaxireland,,0,0,@sinnfeinireland lads Please remember that Fianna Fáil ruined this country 12 years ago.,@sinnfeinireland,,https://twitter.com/kippaxireland/status/1226553044718047232
2020-02-09 17:06:18,owiedub,,0,0,"That sure sounds like @MichealMartinTD saying he’ll work with @MaryLouMcDonald just now on @RTERadio1 . @fiannafailparty will do what’s best for @fiannafail, have no doubt about that. #GE2020 #VoteLeftTransferLeft",@MichealMartinTD @MaryLouMcDonald @RTERadio1 @fiannafailparty @fiannafail,#GE2020 #VoteLeftTransferLeft,https://twitter.com/owiedub/status/1226552916187717633
2020-02-09 17:06:11,paulied1970,,0,0,#GE2020 i heard on @RTERadio1 the #fiannafail leader who under no circumstances would go into government with sf is now rowing back a horrible power hungry gang of hoors.,@RTERadio1,#GE2020 #fiannafail,https://twitter.com/paulied1970/status/1226552889981755392
2020-02-09 17:06:03,oheochaidh,,0,0,#GE2020 #marylou price of going into coalition with #fiannafail following on from #votetochange should be that #sinnfein takes the office of #taoiseach,,#GE2020 #marylou #fiannafail #votetochange #sinnfein #taoiseach,https://twitter.com/oheochaidh/status/1226552854724386817
2020-02-09 17:05:50,ClareChampion,,0,0,"Fianna Fail's Pat Daly outlines how @CllrCathalCrowe 's stance on the planned RIC commemoration ""put the wind behind him"" in his #ge2020 campaign while noting Sinn Fein's vote as ""extraordinary"". He is speaking live to @OwenRyan3 on our live broadcast at",@OwenRyan3,#ge2020,https://twitter.com/ClareChampion/status/1226552801817485312
2020-02-09 17:04:56,DannyDonoghue2,,3,0,"@sinnfeinireland have @Donnchadhol getting more votes than Fianna Fáil leader Michael Martin and the Tanaiste Simon Coveney and Paul Donnolly getting more votes than the Taoiseach, what a time to be alive 🇮🇪🇮🇪🇮🇪🇮🇪",@sinnfeinireland @Donnchadhol,,https://twitter.com/DannyDonoghue2/status/1226552572997185536
2020-02-09 17:03:57,darrwynne,Independent_ie,0,1,"""I’m a democrat. I listen to the people. I respect the decision of the people..."" Micheal and Fianna Fail are incredibly out of touch with the people. They don't stand for anything except votes and that's been very apparent in this election. #GE2020",,#GE2020,https://twitter.com/darrwynne/status/1226552327047434240
2020-02-09 17:03:39,constanceshortc,rosdub,0,0,"That song begins,🤣🎶On the one road,sharing the one load,on the road to God knows where🎶🤣Its appropriate as Sinn Féin &amp;amp; Fianna Fáil will have some ""journey""to go,while they work out a programme for Government,but make no mistake,this will be our Gov for the next 5 yrs.",,,https://twitter.com/constanceshortc/status/1226552249444438017
2020-02-09 17:03:20,Damiensmith1970,KevDoyle_Indo,0,0,"The fianna fail cough is finnaly softening, which was always going to happen",,,https://twitter.com/Damiensmith1970/status/1226552171824590854
2020-02-09 17:02:39,BigFatFenian,rtenews,0,2,Fuck Fine Gael and fuck Fianna Fáil ,,,https://twitter.com/BigFatFenian/status/1226551998713073664
2020-02-09 17:02:38,YngvePL,,0,0,"piękny przykład dla polskiej #Lewica płynie z Irlandii, gdzie scena polityczna przez lata zdominowana była przez prawicę (liberalną Fianna Fáil i chrześcijańską Fine Gael) wygląda na to, że wybory #GE2020 wygra lewicowa Sinn Féin.",,#Lewica #GE2020,https://twitter.com/YngvePL/status/1226551995806384130
2020-02-09 17:02:28,CrescentEagle,sinnfeinireland,0,0,"80+ years of domination by Fianna Faìl and Fine Gael may have finally come to an end. These 2 major parties have failed the people, just as the Liberals and Conservatives have here in Canada. We must end their reigns of failure and elect the NDP in the next election. ",,,https://twitter.com/CrescentEagle/status/1226551954421272579
2020-02-09 17:02:25,mmccallion95,JArmstrong95,2,0,"If I were a betting man, I would put my money on Aontú losing out to Fianna Fáil, judging by the candidates whose transfers would be available. Their voters would likely have voted to ""keep Tóibín out""",,,https://twitter.com/mmccallion95/status/1226551942299758593
2020-02-09 17:01:37,Breaking24Seven,,0,0,Irish FF leader says looks like his party may be largest #ireland #fiannafail #election,,#ireland #fiannafail #election,https://twitter.com/Breaking24Seven/status/1226551737152131074
2020-02-09 16:59:52,LustraSkye,,0,4,"Early vote tallies show Irish election result on a knife-edge It represents a remarkable breakthrough for Sinn Fein, which for the first time is challenging the 90-year power duopoly of Fine Gael and Fianna Fail. ",,,https://twitter.com/LustraSkye/status/1226551298012729344
2020-02-09 16:59:00,EoinySocial,,0,3,@MaryLouMcDonald BEFORE the election. I love Ballet dancing. @MichealMartinTD that's because the IRA love Ballet dancing. @MaryLouMcDonald AFTER the election. I love Ballet dancing. @MichealMartinTD where's my tutu 🙈 #GE2020 #SinnFéin #FiannaFail #Elections2020 #marylou,@MaryLouMcDonald @MichealMartinTD @MaryLouMcDonald @MichealMartinTD,#GE2020 #SinnF #FiannaFail #Elections2020 #marylou,https://twitter.com/EoinySocial/status/1226551081825640449
2020-02-09 16:58:50,Television_Crit,,0,0,"#MicheálMartin must not become #Taoiseach, he will alongside his counterparts in #FiannaFáil will BANKRUPT the country again #GE2020",,#Miche #Taoiseach #FiannaF #GE2020,https://twitter.com/Television_Crit/status/1226551037915467776
2020-02-09 16:58:33,Unlikely___hero,,0,0,Watch the next two seats go to P**dar T***n and Fianna Fail,,,https://twitter.com/Unlikely___hero/status/1226550965454589952
2020-02-09 16:57:53,thomaspower4,,0,1,"Sinn Féin's Donnchadh O Laoghaire is the first TD to be elected to the 33rd Dáil. He garnered 14,057 votes in the first count in Cork South Central, ahead of Fianna Fáil leader Micheál Martin who got 11,023 votes.",,,https://twitter.com/thomaspower4/status/1226550799507083264
2020-02-09 16:57:52,ChiuauaTeardrop,,1,0,"""Micheál Martin does not want to be the first leader of Fianna Fáil who didn't go on to be Taoiseach."". Jesus. What are we like?",,,https://twitter.com/ChiuauaTeardrop/status/1226550797112090628
2020-02-09 16:57:34,0valgo,SergioSanzSA,0,0,"Y en Irlanda Fianna Fáil y Fine Gael son ejemplos que cuadran perfectamente. Los restos de Unió han acabado de comparsas del PSC. No me gusta esa decisión, pero en realidad no tenían recorrido con Convergencia mutando al pruses.",,,https://twitter.com/0valgo/status/1226550719030927361
2020-02-09 16:57:28,ChloeNiD,,0,1,All these people who voted for Fianna Fáil obviously have some memory loss,,,https://twitter.com/ChloeNiD/status/1226550694766874624
2020-02-09 16:56:46,paulatgreid1,caulmick,0,1,He needs to get off his high horse and start listening to the people. Fianna Fáil and Fine Gael have had a loud shot across their bow and need to sit up and take heed or they will be consigned to history.,,,https://twitter.com/paulatgreid1/status/1226550520594259968
2020-02-09 16:56:45,CianByNature,,2,0,"Gut feeling would be that I’d hate to see SF enter a coalition with Fianna Fáil. Mostly because, politically, Micheál Martin is the biggest snake going #ge2020",,#ge2020,https://twitter.com/CianByNature/status/1226550515426873344
2020-02-09 16:56:34,PolDeBuitleir,,0,0,Tops the poll above Fianna Fáil leader Mícheál Martin and Tánaiste Simon Coveney Sinn Féin's Ó Laoghaire first TD elected to 33rd Dáil http://www.rte.ie/news/election-2020/2020/0209/1114204-sinn-feins-o-laoghaire-first-td-elected-to-33rd-dail/ via @RTENewsNow,@RTENewsNow,,https://twitter.com/PolDeBuitleir/status/1226550468102545409
2020-02-09 16:56:24,dunyanin_secimi,,1,0,#seçim #irlanda İrlanda'da yapılan genel seçimler: Seçime katılım oranı: 61.9 160 milletvekilinin seçileceği parlamentoda henüz 4 koltuğun sahibi belirlendi. Sinn Fein (Merkez Sol): 3 Fianna Fail (Liberal): 1,,#se #irlanda,https://twitter.com/dunyanin_secimi/status/1226550426251776001
2020-02-09 16:55:43,FredericFaravel,sinnfeinireland,0,0,Ce serait tellement fort que l’Irlande 🇮🇪 est un gouvernement sans Fine Gael ou Fianna Fáil: une première depuis 1922 ✊🏻✊🏻✊🏻#GE2020 @sinnfeinireland Tiocfaidh ár lá !!!,@sinnfeinireland,#GE2020,https://twitter.com/FredericFaravel/status/1226550256273444864
2020-02-09 16:55:12,dev_discourse,,0,0,Ireland's #FiannaFail says it expects to win most seats in election ,,#FiannaFail,https://twitter.com/dev_discourse/status/1226550124966531072
2020-02-09 16:55:01,cronny86,,0,1,Rte are talking shite here. It's very simple. People were not looked after correctly after they bailed out the banks so now fine gael and fianna fail are feeling the bite.,,,https://twitter.com/cronny86/status/1226550076283244545
2020-02-09 16:54:44,GaryHynds,KevDoyle_Indo,1,0,Here we go. Micheál Martin softening his stance already & we've barely had any results yet. I suspect we might well see a Fianna Fáil &amp; Sinn Fein government at this rate. Unless Fine Gael instead agree to prop them up. Martin wants to be PM. ,,,https://twitter.com/GaryHynds/status/1226550005504364544
2020-02-09 16:54:43,DarranMarshall,,1,9,A week is a long time in Irish politics... Today : Fianna Fáil leader leaves door open to a coalition with Sinn Féin. #ge20202,,#ge20202,https://twitter.com/DarranMarshall/status/1226550001716932622
2020-02-09 16:54:17,OTWWebb,NzPredictor,1,0,Which Fianna Fail candidate are you predicting though?,,,https://twitter.com/OTWWebb/status/1226549895726862337
2020-02-09 16:54:03,fmcomment,,1,1,Micheal Martin stuck to his principles all of 7 hours after they started counting votes.. Surely a Fianna Fail record. #GeneralElection2020,,#GeneralElection2020,https://twitter.com/fmcomment/status/1226549836801101834
2020-02-09 16:53:19,irishexaminer,,6,2,#GE2020: comment Micheál Martin has said that “significant incompatibilities” still exist between Fianna Fáil and Sinn Féin but stopped short of ruling out working with the party in the next government. ,,#GE2020,https://twitter.com/irishexaminer/status/1226549651198922753
2020-02-09 16:53:10,kclr96fm,,0,1,NATIONALLY - Sinn Fein's Paul Donnelly look set to top the poll in the Taoiseach’s constituency of Dublin West with the first count due in the next few minutes. Leo Varadkar should come in second and Fianna Fail’s Jack Chambers looks set to take the third seat #GE2020,,#GE2020,https://twitter.com/kclr96fm/status/1226549613609529345
2020-02-09 16:52:55,PabloRbNv,,1,0,"🇮🇪 | De los 160 escaños del #Dáil, el Sinn Féin solo ha presentado candidatura en 42. Podrían superar los 30, según las proyecciones. El Fianna Fail (centro-derecha) se ha abierto a iniciar conversaciones con los nacionalistas si no suma con el conservador Fine Gael.",,#D,https://twitter.com/PabloRbNv/status/1226549547679322112
2020-02-09 16:52:52,tferrerm,rtenews,1,0,"Michéal Martin, el líder de Fianna Fáil, se declara ""decepcionado"" con los resultados electorales de su partido: ""a nivel nacional no hemos ganado los escaños que esperábamos conseguir"" ",,,https://twitter.com/tferrerm/status/1226549537403265025
2020-02-09 16:52:06,VirginMediaNews,,0,4,#GE2020 Elected so far: 🔴Sinn Féin’s Donnchadh Ó Laoghaire in #CorkSouthCentral 🔴Sinn Féin's Eoin Ó Broin in #DublinMidWest 🔴Sinn Féin's Johnny Guirke in #MeathWest 🔴Fianna Fáil's Seán Ó Fearghaíl in #KildareSouth We'll have the latest on #VMNews from 5:10pm,,#GE2020 #CorkSouthCentral #DublinMidWest #MeathWest #KildareSouth #VMNews,https://twitter.com/VirginMediaNews/status/1226549344872148997
2020-02-09 16:51:18,wall_pit,,1,0,Its very arrogant of FineGael and Fiannafail to decide who they want as partners in government when they are not the Leading party #GE2020,,#GE2020,https://twitter.com/wall_pit/status/1226549141037252608
2020-02-09 16:51:15,IrishTimes,,6,1,"Simon Harris says Fine Gael is still willing to talk about a grand coalition with Fianna Fáil, 'as a last resort' #GE2020",,#GE2020,https://twitter.com/IrishTimes/status/1226549129792442368
2020-02-09 16:51:15,eoinmauricedaly,,1,0,"A big question now is, if they are close in seat share will SF demand a 'rotating Taoiseach' arrangement in any coalition with Fianna Fáil?",,,https://twitter.com/eoinmauricedaly/status/1226549128655753218
2020-02-09 16:51:06,_maeveconnolly,UnaMullally,0,0,Fine Gael and Fianna Fáil - two legs of the same pair of trousers 😂,,,https://twitter.com/_maeveconnolly/status/1226549091662024704
2020-02-09 16:50:51,RTElimerick,,0,0,Fianna Fáil’s Niall Collins arrives at the Limerick county count centre. #GE2020 @rtenews – at Limerick Racecourse,@rtenews,#GE2020,https://twitter.com/RTElimerick/status/1226549029456183297
2020-02-09 16:50:49,BelTel,,7,4,Sinn Fein's Mary Lou McDonald hopes to lead Irish government without Fine Gael and Fianna Fail https://www.belfasttelegraph.co.uk/news/republic-of-ireland/sinn-feins-mary-lou-mcdonald-hopes-to-lead-irish-government-without-fine-gael-and-fianna-fail-38939947.html,,,https://twitter.com/BelTel/status/1226549019968708608
2020-02-09 16:49:59,LizCarolan,,4,0,Can we have a Sinn Fein / Fianna Fáil coalition agreed without a commitment to a border poll?,,,https://twitter.com/LizCarolan/status/1226548812082184193
2020-02-09 16:49:09,MallowNews,,2,13,"The nightclub is emptying, the DJ is playing the national anthem and Fianna Fáil, desperate for the shift, start making moves towards Sinn Fein not knowing they’re already messaging the Green Party on Bumble #Ge2020",,#Ge2020,https://twitter.com/MallowNews/status/1226548603365330944
2020-02-09 16:48:05,rtenews,,41,10,Micheál Martin says he is disappointed that Fianna Fáil is not going to be making the gains it had identified before the election campaign #GE2020,,#GE2020,https://twitter.com/rtenews/status/1226548332157448195
2020-02-09 16:47:45,BBCPropaganda,,0,0,"Throughout the election Fianna Fail point blank ruled out coalition with Sinn Fein Now they are saying there are ""significant incompatibilities"" but they are thinking about it PR means they win, folks",,,https://twitter.com/BBCPropaganda/status/1226548249030463488
2020-02-09 16:47:41,KevDoyle_Indo,,35,63,🚨🚨Fianna Fáil leader Micheál Martin is no longer saying that there are no circumstances under which he would enter government with Sinn Fein. He hasn't opened the door - but he has unlocked it in case Mary Lou McDonald comes knocking. #GE2020,,#GE2020,https://twitter.com/KevDoyle_Indo/status/1226548233238913026
2020-02-09 16:47:27,caulmick,,0,4,"Former Fianna Fáil Minister, Mary Hanafin hasn't a hope in Dun Laoghaire. #GE2020 ( they wheel out Conor Lenihan)",,#GE2020,https://twitter.com/caulmick/status/1226548172484464641
2020-02-09 16:47:21,cormacjpb,,0,0,It is just me or do others feel that Fianna Fáil has just lost this election #ge2020,,#ge2020,https://twitter.com/cormacjpb/status/1226548147998031873
2020-02-09 16:47:15,THECASHMAN8,cooper_m,0,0,"Martin said ""Oh what a beautiful dream If it could only come true, you know, you know What we need is a great big melting pot Big enough enough enough to take The world and all its got And keep it stirring for a hundred years or more And turn out Fianna Fáil people by the score""",,,https://twitter.com/THECASHMAN8/status/1226548122702229507
2020-02-09 16:47:04,Ocionnaith,,2,1,"Fianna Fail leader @MichealMartinTD has been on @rtenews in the past few mins. Asked about talks with SF's @MaryLouMcDonald he said: * he is a ""democratic"" and respects the views of voters * but that the next gov must be coherent in terms of policies #GE2020 #GE20 @rtepolitics",@MichealMartinTD @rtenews @MaryLouMcDonald @rtepolitics,#GE2020 #GE20,https://twitter.com/Ocionnaith/status/1226548075784802305
2020-02-09 16:46:30,ShawnPogatchnik,,1,0,"Thomas Byrne ain't topping the Meath East poll, but his Fianna Fáil team's cupcakes could provide a burst of energy as we await the first count. Sinn Féin's Darren Rourke the certain top vote-getter, Helen McEntee second, while Byrne is best positioned for the third, final seat. ",,,https://twitter.com/ShawnPogatchnik/status/1226547936466743296
2020-02-09 16:46:06,dunyanin_secimi,,1,0,#seçim #irlanda İrlanda'da yapılan genel seçimler: Seçime katılım oranı: 61.9 160 milletvekilinin seçileceği parlamentoda henüz 2 koltuğun sahibi belirlendi. Sinn Fein (Merkez Sol): 1 Fianna Fail (Liberal): 1,,#se #irlanda,https://twitter.com/dunyanin_secimi/status/1226547834087972869
2020-02-09 16:45:55,Journo_lady,,0,0,"Aidan told @echolivecork “We knew we were fighting for the third seat, we just expected the fight to be with Fianna Fāil! “So we are exactly where we expected to be, but against a different candidate.”",@echolivecork,,https://twitter.com/Journo_lady/status/1226547787455717376
2020-02-09 16:45:32,kenfoxe,,1,2,There are always a few things in opinion polls that leave you very curious ... like for instance the 14% of Sinn Féin voters who think Fianna Fáil and Fine Gael are right to rule out coalition with Sinn Féin. Perhaps they're very Machiavellian #GE2020 https://www.irishtimes.com/opinion/fintan-o-toole-election-2020-shows-old-political-system-in-ireland-is-finished-1.4167053,,#GE2020,https://twitter.com/kenfoxe/status/1226547690537918465
2020-02-09 16:45:17,NoelWelch8,CllrNiamhDoris,0,0,People are fed up with Fine Gael Labour and Fianna Fail. Sinn Fein will help the people who have been forgotten over many years. 👍,,,https://twitter.com/NoelWelch8/status/1226547628973924352
2020-02-09 16:45:16,dean_litchfield,,3,1,People voted Fianna Fáil on the basis of our leader ruling out entirely the prospect of a FF-SF coalition. We should respect that vote. #GE2020,,#GE2020,https://twitter.com/dean_litchfield/status/1226547624561532929
2020-02-09 16:45:01,newschambers,,4,1,"Mary Lou says she knows plenty of people in Fine Gael and Fianna Fáil who would go into government with Sinn Féin. She accepts there are people who are concerned at SF not being ""tested"" in Govt in the Republic. McDonald says message to them is ""give us a chance"". #ge2020",,#ge2020,https://twitter.com/newschambers/status/1226547560908836865
2020-02-09 16:44:51,AndrewSB49,,1,1,Fianna Fáil Leader now. #GE2020,,#GE2020,https://twitter.com/AndrewSB49/status/1226547520756682754
2020-02-09 16:44:46,caitlin42078738,stellagordxn,1,0,Yes the big Fianna Fáil supporter will definitely understand !!,,,https://twitter.com/caitlin42078738/status/1226547498753327105
2020-02-09 16:44:41,hawthornberries,,0,1,'The best government doesn't have Fianna Fáil or Fine Gael' https://www.bbc.co.uk/news/live/world-europe-51401447?ns_mchannel=social&amp;ns_source=twitter&amp;ns_campaign=bbc_live&amp;ns_linkname=5e40217edca6c8066956d19b%26%27The%20best%20government%20doesn%27t%20have%20Fianna%20F%C3%A1il%20or%20Fine%20Gael%27%262020-02-09T15%3A23%3A02.098Z&amp;ns_fee=0&amp;pinned_post_locator=urn:asset:bd16f9ed-6aac-4775-8e49-393bce7c62f5&amp;pinned_post_asset_id=5e40217edca6c8066956d19b&amp;pinned_post_type=share via @BBCNews,@BBCNews,,https://twitter.com/hawthornberries/status/1226547476792061952
2020-02-09 16:44:25,EthingsG,harrymcgee,0,0,"Yes, SF mopping up all the residual republicanism of Fianna Fail. ",,,https://twitter.com/EthingsG/status/1226547412367486977
2020-02-09 16:44:15,IanBroughall,,0,0,"Sinn Féin president Mary Lou McDonald has described the Irish general election as ""something of a revolution in the ballot box"". Indications suggest there is little difference in percentage terms between Fine Gael, Sinn Féin and Fianna Fáil. ",,,https://twitter.com/IanBroughall/status/1226547366951628800
2020-02-09 16:44:11,seanpurcellart,colmtobin,0,0,Safely say Fianna Fail &amp; Fianna Gael feel like got got a right hook in the nuts from Katie!,,,https://twitter.com/seanpurcellart/status/1226547351302627328
2020-02-09 16:44:03,olearyeric,,3,0,Looking like it's going to be a Fianna Fáil Sinn Fein coalition #GE2020,,#GE2020,https://twitter.com/olearyeric/status/1226547317483986947
2020-02-09 16:43:30,AineWaterford,gavreilly,1,0,"Power Hungry . #Fiannafail.. doing a u-turn already . Can’t be trusted ..,",,#Fiannafail,https://twitter.com/AineWaterford/status/1226547179176759296
2020-02-09 16:43:13,PabloRbNv,,1,0,"🇮🇪 | En las próximas horas, se irá conociendo quiénes ocupan los escaños del #Dáil. De los cuatro primeros, el Sinn Féin se lleva tres y el Fianna Fail, uno. Según las primeras previsiones, el primer ministro #Varadkar podría perder en su circunscripción.",,#D #Varadkar,https://twitter.com/PabloRbNv/status/1226547109102596097
2020-02-09 16:43:07,oconnellhugh,,15,17,Fine Gael Minister: Micheál Martin is clearly planning a Fianna Fáil-Sinn Féin coalition #GE2020,,#GE2020,https://twitter.com/oconnellhugh/status/1226547084725301250
2020-02-09 16:43:01,constanceshortc,,0,0,"@fiannafailparty @sinnfeinireland @rtenews From the Michéal Martin's answer to Mr Mc Collough on RTE 2020 just now , it's not hard to predict that our next Government will be formed by Fianna Fáil and Sinn Féin.",@fiannafailparty @sinnfeinireland @rtenews,,https://twitter.com/constanceshortc/status/1226547057084727296
2020-02-09 16:42:49,SAS_A321,Philip_Ryan,0,0,"He loves to lie doesnt he, part of fabric of the Fianna Fail way tho isnt it🤗 ",,,https://twitter.com/SAS_A321/status/1226547009252941825
2020-02-09 16:42:23,DundalkDemocrat,,1,6,Gerry Adams: 'Our preference is to have a government without Fine Gael or Fianna Fail - they've had their day' #ge2020,,#ge2020,https://twitter.com/DundalkDemocrat/status/1226546900561690624
2020-02-09 16:41:46,FirstSquawk,,1,3,IRISH ELECTION: FIANNA FAIL LEADER SAYS IT LOOKS LIKE FIANNA FAIL WILL BE THE LARGEST PARTY,,,https://twitter.com/FirstSquawk/status/1226546742541373440
2020-02-09 16:41:37,Yomynameis5,,0,0,"@LeoVaradkar out @MichealMartinTD out Hophelly @sinnfeinireland in @MaryLouMcDonald d leader @fiannafailparty possible in #GE20 #SinnFéin #FiannaFail In means tshocke sinn fein ha 12,000 votes fianna has 7,000",@LeoVaradkar @MichealMartinTD @sinnfeinireland @MaryLouMcDonald @fiannafailparty,#GE20 #SinnF #FiannaFail,https://twitter.com/Yomynameis5/status/1226546707044995072
2020-02-09 16:41:09,thefaaside,,0,1,FIanna Fáil in the eyes of the youth. #GE2020,,#GE2020,https://twitter.com/thefaaside/status/1226546587889029120
2020-02-09 16:41:08,HamillOSF,sinnfeinireland,0,3,"Confirmed that @Donnchadhol has topped the poll ahead of Tánaiste Simon Coveney &amp; Fianna Fáil leader Micheál Martin, elected on the first count &amp; becomes the first TD in the Dáil. Comhghairdeas a comrádaí! #GE2020",@Donnchadhol,#GE2020,https://twitter.com/HamillOSF/status/1226546583271038977
2020-02-09 16:40:43,_FPLKings,,0,0,"Micheal Martin refusing to rule out a coalition with Sinn Féin on RTE, Fianna Fáil coalition with Sinn Féin it is... #GE2020",,#GE2020,https://twitter.com/_FPLKings/status/1226546478619004931
2020-02-09 16:40:26,DannyThiar,Iarla_Mac_Aodha,0,1,Ní bheinn chomh cinnte de sin. An mbeadh sé le leas SF Fianna Fáil a chur i gcumhacht arís?,,,https://twitter.com/DannyThiar/status/1226546406464290817
2020-02-09 16:40:23,sobeiskios,lindyloo25,0,0,#GE2020 The Ugly Face Of Fianna Fail - Fine Gael Terror Apparatus #AntiSeismic bias,,#GE2020 #AntiSeismic,https://twitter.com/sobeiskios/status/1226546397492760578
2020-02-09 16:40:11,lisaocarroll,,0,6,#Irishelection Can Sinn Fein form a government? Unlikely. Can Fine Gael or Fianna Fail break their written in blood pledges to go into a coalition with Sinn Fein? Can FG and FF form a grand coalition. Latest analysis from Irish Times pol ed @PatLeahyIT,@PatLeahyIT,#Irishelection,https://twitter.com/lisaocarroll/status/1226546346523537408
2020-02-09 16:39:45,DarranMarshall,,0,5,.@MichealMartinTD’s “fundamental moral issues to be addressed” before Fianna Fáil enter coalition with Sinn Féin has now become “there has to be compatibility”. Door opening of FF / SF coalition? #GE2020,@MichealMartinTD,#GE2020,https://twitter.com/DarranMarshall/status/1226546236792156162
2020-02-09 16:39:40,juliancanny,johngosullivan,0,0,As someone said during the week Fianna Fail are in the business of being in power. Whatever way the wind blows they'll go with that.,,,https://twitter.com/juliancanny/status/1226546217137532929
2020-02-09 16:39:29,almodozo,,1,3,"(The rush of Ireland's mainstream parties to take on more economically left-wing sounding positions between 2011 and 2016 -- after the massive water protests of 2014-15, I presume -- is something to behold.. esp Fianna Fáil's:) ",,,https://twitter.com/almodozo/status/1226546168194314241
2020-02-09 16:39:15,LTobin04,brexit2020,0,0,There is also elements of fascism in Fine Gael today. Almost every political party has something bad in their history. The big 3 here atm. Fianna Fáil has mass corruption. Fine Gael with the blueshirts and Sinn Fein with the IRA. That’s all in the past.,,,https://twitter.com/LTobin04/status/1226546111227322368
2020-02-09 16:39:14,DonieHartney,AlRyan86,0,0,Ya just watching! No wonder paddy power kept Fianna Fáil/Sinn Fein coalition such a short price all week,,,https://twitter.com/DonieHartney/status/1226546104587759616
2020-02-09 16:38:56,DeniseConn24,,0,0,Mary Lou : ‘Ideally we want a government with no Fine Gael or Fianna Fáil in it’ ,,,https://twitter.com/DeniseConn24/status/1226546029375475713
2020-02-09 16:38:30,IJWorldview,,0,0,"Exit poll suggests 'dead heat' between Fianna Fáil, Sinn Féin and Fine Gael in Irish General Election ",,,https://twitter.com/IJWorldview/status/1226545920260661249
2020-02-09 16:38:29,costadelsol931,,0,0,"Irlanda cuenta sus votos después de una reñida elección legislativa Micheal Martin (Fianna Fail), primer ",,,https://twitter.com/costadelsol931/status/1226545918129905664
