date,username,to,replies,retweets,text,mentions,hashtags,permalink
2020-02-06 16:42:48,cronny86,,9,20,"If you haven't realised that the media is just as big an enemy for ordinary people as fine gael and fianna fail are, just pop your ears onto newstalk now.",,,https://twitter.com/cronny86/status/1225459842044825600
2020-02-06 16:42:45,peadarmaolros,,0,0,"I wonder how many people commited suicide because of the crash? Yes, there was a worldwide recession, but Fianna Fáil NATIONALISED THE BANKS. They chose bankers over citizens. Micheál Martin was a cabinet minister. Europe laughed as we took on their debt. #GE2020",,#GE2020,https://twitter.com/peadarmaolros/status/1225459827423490051
2020-02-06 16:42:26,SL_Mahon,,1,0,#GE2020 I don’t know who im voting for. I’m leaning towards #SinnFein at the moment. I just know that I don’t want #FineGael or #FiannaFail. How can I make my vote count towards them not getting back in?,,#GE2020 #SinnFein #FineGael #FiannaFail,https://twitter.com/SL_Mahon/status/1225459747203231744
2020-02-06 16:42:13,MD_IRE_123,,0,8,"In that 10 minute interview, Eoghan Harris has given me enough reason not to vote for Fianna Fail for the rest of my life. Thanks @NewstalkFM",@NewstalkFM,,https://twitter.com/MD_IRE_123/status/1225459692077559814
2020-02-06 16:40:14,EagleEyeEd,,0,0,@IvanYatesNT Get that clown off the air... vote Fianna Fail ... FF built the housing estates ... Ivan your worse for given him the time of day ... these two men were sworn enemies but over time moved forward in the name of peace ,@IvanYatesNT,,https://twitter.com/EagleEyeEd/status/1225459195648102400
2020-02-06 16:39:15,RayMinehane,,0,0,"People won't vote Fianna Fail because of the past, yet are going to vote for Sinn Fein and go ape shit when you mention Sein Fein's past? #GE2020",,#GE2020,https://twitter.com/RayMinehane/status/1225458947248836616
2020-02-06 16:38:54,pbrennan50,Michael_O_Regan,0,0,"Fianna Fail and Fine Gael have managed a country in which virtually no one can rent let alone buy a house. As for blood on hands etc, who presided over 50 years of the rape and murder of children in Industrial Schools? Who sponsored it?",,,https://twitter.com/pbrennan50/status/1225458859587837959
2020-02-06 16:38:13,PFQMUSIC,sammie_init,2,15,I think @PatKennyNT needs to offer his listeners an explanation for his handling of @MaryLouMcDonald in light of the fact that it was #FineGael and previously #FiannaFail who brought Ireland it’s knees. There is no place for such bias on the national airways. Who is his producer? ,@PatKennyNT @MaryLouMcDonald,#FineGael #FiannaFail,https://twitter.com/PFQMUSIC/status/1225458687331962890
2020-02-06 16:34:55,OrlaLeyden,,0,0,In this week's @westmeathindo #GE2020 #AnIrelandForAll #Fiannafail #RoscommonGalway #voteleyden,@westmeathindo,#GE2020 #AnIrelandForAll #Fiannafail #RoscommonGalway #voteleyden,https://twitter.com/OrlaLeyden/status/1225457857904115713
2020-02-06 16:34:47,NewstalkFM,,3,0,The Ivan Interview: Fianna Fáil's Micheál Martin is the last party leader to take to the chair. Watch live here from 5.00pm. https://www.newstalk.com/news/ivan-interview-fianna-fail-leader-micheal-martin-963138?utm_medium=Social&amp;utm_source=Twitter#Echobox=1581006887 #GE2020,,#GE2020,https://twitter.com/NewstalkFM/status/1225457824333025282
2020-02-06 16:34:44,wisethady,IrishTimes,0,0,is that Fianna Fail he's talking about who destroyed our economy and then kept him in power for the last four years or so ,,,https://twitter.com/wisethady/status/1225457811133472770
2020-02-06 16:33:00,KeohaneDan,,7,12,So ⁦@harrymcgee⁩ predicts: Fianna Fáil: 53 Fine Gael: 38 Sinn Féin: 28 Labour Party: 8 Green Party: 14 Social Democrats: 3 Sol-PBP: 2 Others: 14 Combined FF/FG seats would be only 3 less than in 2016 (91 v 94 in ‘16). Turnout &amp; transfers the key ,@harrymcgee,,https://twitter.com/KeohaneDan/status/1225457375760601090
2020-02-06 16:32:43,GaughanDominick,BernardAKavana3,1,0,"Ah Bernard you're back, so who you voting for, Fianna Fail who bankrupt the Country and put us all in a crippling depth for generations, or Sinn Fein who'll prop them up in Government",,,https://twitter.com/GaughanDominick/status/1225457300565110784
2020-02-06 16:28:28,NellydaSilla,,0,0,Come on lads it’s neck and neck. 2 percent each for Fine Gael and Fianna Fáil 😂😂,,,https://twitter.com/NellydaSilla/status/1225456234649866240
2020-02-06 16:25:23,RealPMurphy,,0,3,"Election Flashback: 1932 Cumann na nGaedheal TD Patrick Reynolds is shot dead while canvassing in Leitrim by RIC/IRA pensioner Joseph Leddy. A detective with Reynolds was also killed. Fianna Fail issued this poster to combat the ""propaganda"" linking them to gunmen like Leddy.... ",,,https://twitter.com/RealPMurphy/status/1225455457214570496
2020-02-06 16:24:41,joecraig79,,2,44,When are the media going to ask Fianna Fail and Fine Gael about murders that happened in this state that they are involved in ?? My cousin Mary Boyle &amp; Fr Niall Molloy for starters ??? @MolloyCampaign @rte @rtenews @Independent_ie @IrishTimes @thejournal_ie @BBCNewsNI @guardian,@MolloyCampaign @rte @rtenews @Independent_ie @IrishTimes @thejournal_ie @BBCNewsNI @guardian,,https://twitter.com/joecraig79/status/1225455280080773121
2020-02-06 16:23:08,DecMonaghan01,Kehoe_colin99,1,0,It has been rumbling on since and the Quinns were seeking answers to his allegations. Why would it not be raised at on the eve of an election? Should we not discuss Fianna Fail’s links to the economic crash because it is election season either?,,,https://twitter.com/DecMonaghan01/status/1225454889578397698
2020-02-06 16:20:30,Rushing_Spy,theirishmega,0,7,"Fianna FAIL = mass immigration, OPEN BORDERS and the plantation of Ireland ",,,https://twitter.com/Rushing_Spy/status/1225454227411161090
2020-02-06 16:16:04,saratna29128604,,0,0,Profile: Micheál Martin by Fianna Fáil https://newstalkblog.site/profile-micheal-martin-by-fianna-fail/,,,https://twitter.com/saratna29128604/status/1225453112162504704
2020-02-06 16:15:15,Brianpmohan,LegalEagleStar,1,0,"Your telling me that you have information that RTE are colluding with Fianna Fail, genuinely you have 100% proof of this?",,,https://twitter.com/Brianpmohan/status/1225452906683469824
2020-02-06 16:13:01,paulied1970,HenryMcKean,0,0,he's been around a while don't ya know yes indeed 31 years and a minister in a couple of government's which wrecked the country and got our economic sovereignty taken off us get to be fucked Johnny boy ya 🤡 #GE2020 #fiannafail,,#GE2020 #fiannafail,https://twitter.com/paulied1970/status/1225452343854084098
2020-02-06 16:08:51,mammysdinners,Michael_O_Regan,1,0,Funny that because there doesn't seem to be any media scrutiny on Fine Gael and Fianna Fail re Moriarty or indeed any of the tribunals. Similar silence on why we borrowed billions to save banks and wealthy re Nama. Media selective on who and why they hold to account. All about $$,,,https://twitter.com/mammysdinners/status/1225451298222415872
2020-02-06 16:04:59,Leninist69,,0,1,Liars and gangsters. No votes for Fianna Fail and Fine Gael. ,,,https://twitter.com/Leninist69/status/1225450323306860547
2020-02-06 16:04:32,newsworthy_ie,,0,3,Mary Butler said she wasn't aware of any woman in Ireland criminalised for taking abortion pills. Mary is a member of Fianna Fáil (The Republican Party) and sure lookit Irish citizens in Belfast are far away. #VoteLeft #GE2020 #repealedthe8th,,#VoteLeft #GE2020 #repealedthe8th,https://twitter.com/newsworthy_ie/status/1225450208349360129
2020-02-06 16:00:17,paulied1970,DOVEBRICK,0,0,they don't talk about him anymore or the other fella 😳👇 #GE2020 #fiannafail ,,#GE2020 #fiannafail,https://twitter.com/paulied1970/status/1225449140571791361
2020-02-06 15:58:40,WhispersNewsLTD,,0,7,Fianna Fáil Promise To Stop Into McDonalds On Way Home From Election If Voters Behave Themselves https://waterfordwhispersnews.com/2020/02/06/fianna-fail-promise-to-stop-into-mcdonalds-on-way-home-from-election-if-voters-behave-themselves/ #ge2020,,#ge2020,https://twitter.com/WhispersNewsLTD/status/1225448735011942400
2020-02-06 15:56:11,garvangrant,Casserly_Rock,0,1,I simply cannot and will not vote for Fine Gael or Fianna Fáil. But I always vote. So I need alternatives. We don’t and can’t know that the left-leaning parties will destroy our economy. But why would they? It is in their interest to have a healthy economy too.,,,https://twitter.com/garvangrant/status/1225448107376287744
2020-02-06 15:56:08,BBCWorld,,2,19,Irish general election profile: Fianna Fáil's Micheál Martin ,,,https://twitter.com/BBCWorld/status/1225448095229628417
2020-02-06 15:55:41,adrian_cusack,lukeming,3,5,"I'll be reporting on the Roscommon-Galway count for the @westmeathindo on Sunday, and the destination of the third seat will be fascinating. 'Ming' feels there is ""a massive opportunity"" to have ""no Fianna Fáil or no Fine Gael TD returned"" in the constituency. #GE2020 #RosGal",@westmeathindo,#GE2020 #RosGal,https://twitter.com/adrian_cusack/status/1225447982750978048
2020-02-06 15:55:22,MichealSavage1,justjack652,0,0,"It's not Fianna Fáil, they just spelt SDLP wrong",,,https://twitter.com/MichealSavage1/status/1225447902337781761
2020-02-06 15:53:44,SeamusHealyTipp,,6,12,For the first time in the history of our state an alternative to Fianna Fail and Fine Gael is possible. Voters of Tipperary: Please allow me to continue the work that I have dedicated my life to. Please give me your No. 1 vote on Saturday. ,,,https://twitter.com/SeamusHealyTipp/status/1225447493099454464
2020-02-06 15:52:44,LeftieStats,Orwell_Fan_Fan,2,0,"The Greens in Ireland are not leftwing, they're centrist. They were in coalition with Fianna Fáil from 2007-11, and supported austerity.",,,https://twitter.com/LeftieStats/status/1225447239574839296
2020-02-06 15:48:58,paulied1970,celinegovern,0,0,"Celine you do know you and each of the children in you're care owe the eu €8,484.05 for the destruction of the economy the last time tommys mob where put in charge don't you🤔 #GE2020 #fiannafail",,#GE2020 #fiannafail,https://twitter.com/paulied1970/status/1225446293859962882
2020-02-06 15:48:11,GerryAdamsSF,,6,76,Fianna Fáil and Fine Gael are counting on you not voting on Saturday. They don’t want change. They don’t want you to vote. Vótail for change and for the party of change. Vótail Sinn Féin. Vote Carthy &amp; Tully. ,,,https://twitter.com/GerryAdamsSF/status/1225446095737819136
2020-02-06 15:46:32,OrlaLeyden,RAI_ie,0,0,ensure there would be no rate increase. In their general election manifesto Fianna Fáil have set out specific proposals to increase apprenticeship places and further supports to enhance and develop rural tourism growth and opportunities nationwide. I am passionate about,,,https://twitter.com/OrlaLeyden/status/1225445678773669889
2020-02-06 15:45:34,hughquinn31,fionamitchell56,0,0,Are the other bastards Fianna Fáil,,,https://twitter.com/hughquinn31/status/1225445437081038848
2020-02-06 15:45:20,Kishlight,MichealMartinTD,0,0,"Thank God that shinner #BrendanKeneally cousin #BillKeneally wasn't working there, Oh! thats a #FiannaFail cover up.",,#BrendanKeneally #BillKeneally #FiannaFail,https://twitter.com/Kishlight/status/1225445378935357441
2020-02-06 15:45:19,GerryGormley,,0,1,Here's 'Sinn Féin in the membrane' a satirical tune I put together in the spirit of #GE2020 #FiannaFail #FineGael #SinnFein #cypresshill,,#GE2020 #FiannaFail #FineGael #SinnFein #cypresshill,https://twitter.com/GerryGormley/status/1225445373822611456
2020-02-06 15:44:17,OrlaLeyden,RAI_ie,0,0,"soar for businesses, which are hampering your day to day existence. Fianna Fáil have outlined in their General Election manifesto a suite of measures to tackle insurance costs; get tough on insurance fraud; increase transparency and tackle anti-competitive behaviour. They will",,,https://twitter.com/OrlaLeyden/status/1225445115705122818
2020-02-06 15:40:08,med_indonews,,0,0,"""In the short term, we have a €50 million minor capital grant programme for access to diagnostics for GPs, and we are saying let us get around the table very quickly and start talking about a new contract."" Fianna Fail's Mr Stephen Donnelly on GPs #GE2020",,#GE2020,https://twitter.com/med_indonews/status/1225444068819337216
2020-02-06 15:38:29,JosephH87865689,LeoVaradkar,0,0,You don’t believe that Fianna Fáil crashed the economy. Neither does any international expert. But you think we are GULLIBLE enough to believe it if you say it often enough!,,,https://twitter.com/JosephH87865689/status/1225443654472519686
2020-02-06 15:34:38,1billmurphy,AddressingLife,0,0,Irish times was always known a fianna fail paper and indo a fine gael. Thats why,,,https://twitter.com/1billmurphy/status/1225442684409696256
2020-02-06 15:33:41,unadunphy,,1,3,"Despite pre-election commitments on these issues, the Greens instead backed existing Fianna Fáil policy — and rebuffed campaigners. ",,,https://twitter.com/unadunphy/status/1225442447662161922
2020-02-06 15:31:25,yvonnejudge,ccferrie,1,0,"Repeat; to quote @ellencoyne, Eamon Ryan is 'reluctant to back measures like lifting the 3 day waiting period.' Also, nothing in Green manifesto on safe access zones. (Nothing in Fianna Fail's either.) So, Greens not so progressive for women, after all.",@ellencoyne,,https://twitter.com/yvonnejudge/status/1225441876859334658
2020-02-06 15:25:25,garvangrant,,4,5,"I don’t like or trust Fine Gael or Fianna Fáil. I have doubts about Sinn Féin, Greens, Labour, the smaller parties, Independents, etc I abhor the loony, racist, right-wing nuts. Change to me is not Trump or Brexit. Change to me is Obama, #marriageequality and #repealthe8th. 1/2",,#marriageequality #repealthe8th,https://twitter.com/garvangrant/status/1225440366922551301
2020-02-06 15:21:16,NewstalkFM,,1,0,First-Time Candidates Panel: Ireland’s youngest #GE2020 candidate says there is a “real opportunity” to vote in a Government that doesn't involve either #FiannaFáil or #FineGael.,,#GE2020 #FiannaF #FineGael,https://twitter.com/NewstalkFM/status/1225439320796008448
2020-02-06 15:17:33,YJB57,paddycosgrave,0,5,"Paddy Cosgrave thank you so much. It renews one's Faith in humanity when someone as successful as you takes the time to let us ""little folk"" know that you care about us. Its a shame we don't have more civic minded people like you @FineGael @fiannafail",@FineGael @fiannafail,,https://twitter.com/YJB57/status/1225438385516548099
2020-02-06 15:17:19,Shiney_Buoy,SouthernStarIRL,0,0,Can't trust him. Fianna Fáil man in bed with the Soc Dems.,,,https://twitter.com/Shiney_Buoy/status/1225438326628507648
2020-02-06 15:14:41,JackTindale,adambecket,1,0,"Unsure about the Blueshirts, but there's traditionally been a lot of co-operation by the SDLP and Fianna Fáil. They've come close to endorsing a merger north of the border recently (although it's since been watered down to a 'partnership').",,,https://twitter.com/JackTindale/status/1225437666168246273
2020-02-06 15:12:35,ffrey42,Link73,1,0,Es súper loco. Las familias hasta 2008 eran TODAS de Fianna Fáil o Fine Gael y la única diferencia entre los dos es si apoyaban el Tratado Angloirlandés de 1922,,,https://twitter.com/ffrey42/status/1225437134389174272
2020-02-06 15:11:10,ffrey42,,1,0,"(Fine Gael apoyaba en 1922 el tratado de independencia del Estado Libre de Irlanda, que dejaba al Rey británico como Rey de Irlanda. Fianna Fáil estaba en contra del monarquismo, pero quería participar en democracia; mientras que Sinn Féin es famosamente abstencionista)",,,https://twitter.com/ffrey42/status/1225436780310286337
2020-02-06 15:10:00,ffrey42,,2,0,"Curiosamente, Sinn Féin también es el partido político más viejo de Irlanda - los dos partidos grandes del país, Fine Gael y Fianna Fáil (los dos de centroderecha) son escisiones de Sinn Féin que buscaban colaborar hasta cierto grado con los británicos",,,https://twitter.com/ffrey42/status/1225436488055304192
2020-02-06 15:10:00,peterlitre,,0,1,#ge2022 Bertie Abern of Fianna Fáil made the same slur and was supported not just by party but by voters and was Taoiseach again later that year. ,,#ge2022,https://twitter.com/peterlitre/status/1225436486092369922
2020-02-06 15:08:27,LeftieStats,,2,5,"As recently as 2011, Fine Gael won 36% of the vote, Labour won 19%, Fianna Fáil won 17% and Sinn Féin won just 10%. In just 9 years, Irish politics has been transformed.",,,https://twitter.com/LeftieStats/status/1225436098282872832
2020-02-06 15:06:55,lewis_goodall,,5,6,Nonetheless- This election seems to be accelerating the process of ending the FF/FG hegemony. Think how dominant Fianna Fáil used to be in particular. Martin still the most likely next Taoiseach but on a paltry vote share. They’re only up six or so points on their 2011 wipeout.,,,https://twitter.com/lewis_goodall/status/1225435709491830784
2020-02-06 15:05:15,OrlaLeyden,,1,0,I have a strong proven track record as a Fianna Fáil County Councillor for over 15 years. I live right in the heart of the Roscommon Galway Constituency and I want to effect positive change for individuals and families. ,,,https://twitter.com/OrlaLeyden/status/1225435290141175808
2020-02-06 15:02:43,LeftieStats,,5,44,"Irish voting intention, via @Survation, 27 January-2 February (changes since 2016): Sinn Féin: 25% (+11) Fianna Fáil: 22% (-2) Fine Gael: 17% (-9) Green: 9% (+6) Labour: 6% (-1) Solidarity-PBP: 5% (+1) Social Democrats: 3% (-)",@Survation,,https://twitter.com/LeftieStats/status/1225434655056420864
2020-02-06 15:00:59,FauxMole,PatLeahyIT,1,1,"Take the Paul Quinn murder. It’s very sinister that Fianna Fail collectively, because Bertie Ahern spoke at the time as well, [said] that it was ""not paramilitary but pertained to feuds about criminality that were taking place"" FIFY Please feel free to add this balance to story",,,https://twitter.com/FauxMole/status/1225434219171733505
2020-02-06 14:59:16,ronronzo,,1,0,Fianna Fáil are also running a lot of ads that target key areas with local FF candidates. Fine Gael only have one at the moment. #GE2020,,#GE2020,https://twitter.com/ronronzo/status/1225433783857557505
2020-02-06 14:59:13,ronronzo,,1,0,"Fianna Fáil are involved too but are trying to appeal to all ages, especially with ads around health. #GE2020",,#GE2020,https://twitter.com/ronronzo/status/1225433772599980032
2020-02-06 14:59:11,ronronzo,,1,0,But I'm interested in their attack ads on Fianna Fáil which seem to trying to scare unsure voters over the age of 45. #GE2020,,#GE2020,https://twitter.com/ronronzo/status/1225433762223226881
2020-02-06 14:57:53,machamongruadh,,0,1,all my ads on youtube are fianna fáil and fine gael being like 😳vote for me😎 i love your family😌 come on vote for me😇,,,https://twitter.com/machamongruadh/status/1225433434971148288
2020-02-06 14:57:06,Survation,,13,175,"NEW: Survation Irish General Election voting intention poll, 1st preference votes: Sinn Féin 25% Fianna Fáil 22% Fine Gael 17% Green Party 9% Labour Party 6% Solidarity–People Before Profit 5% Social Democrats 3% Independent Alliance 1% Independent candidate 10% Other 2%",,,https://twitter.com/Survation/status/1225433238199558144
2020-02-06 14:55:50,TimMaherOrchard,,0,2,"Please vote @fiannafailparty on Saturday 1,2,3 in order of your own preference, it’s time for change, we need Fianna Fáil in Government #anirelandforall",@fiannafailparty,#anirelandforall,https://twitter.com/TimMaherOrchard/status/1225432920204115971
2020-02-06 14:54:09,Paddy_Mc_Kee,newschambers,1,0,Too late. Fianna Fáil will return 3 FF TDs in CW/KK. Deering will lose out. Going to be a great day for Jennifer Murnane O’Connor.,,,https://twitter.com/Paddy_Mc_Kee/status/1225432497489616897
2020-02-06 14:53:53,Creirwry,,0,0,#FiannaFail #GE2020 poster directly blocking the line of sight for drivers to see if a car is coming. I guess @CllrCathalCrowe doesn’t care about the lives of people in Shannon to let his campaign be so careless #VoteThemOut,,#FiannaFail #GE2020 #VoteThemOut,https://twitter.com/Creirwry/status/1225432431374864384
2020-02-06 14:53:36,electionlit,,1,0,Leaflet from Pauline Madigan -Fianna Fáil -Laois Offaly #GE2020 http://irishelectionliterature.com/2020/02/06/leaflet-from-pauline-madigan-fianna-fail-laois-offaly-ge2020/,,#GE2020,https://twitter.com/electionlit/status/1225432357383155712
2020-02-06 14:51:52,llihmollof,,0,0,Pearse Doherty lambasts Fianna Fáil/Fine Gael and slams RTE bias https://youtu.be/jYVXem4BtSU via @YouTube,@YouTube,,https://twitter.com/llihmollof/status/1225431924493234176
2020-02-06 14:51:50,Berlinnaeus,nodiggerdee,1,0,"I'm thinking that if Marc MacSharry wrote the Fianna Fail manifesto, they're in big trouble.",,,https://twitter.com/Berlinnaeus/status/1225431912455512066
2020-02-06 14:47:59,lukeming,,63,301,I will be voting number 1 for @ClaireKerrane from @Sinnfeinireland in the general election. The Roscommon/Galway constituency has a significant chance to deny Fianna Fáil and Fine Gael a single seat in this area. We would be well rid of them. #GE2020,@ClaireKerrane @sinnfeinireland,#GE2020,https://twitter.com/lukeming/status/1225430947665006592
2020-02-06 14:47:05,BACiaran,maranello1977,1,0,I dread to think what would be left of the country after a few more cycles of Fine Gael/Fianna Fáil...,,,https://twitter.com/BACiaran/status/1225430720925052929
2020-02-06 14:42:08,GigiEinaudi,LesFederalistes,1,0,I partiti irlandesi solo per il nome li voterei sempre tutti quanti 😍😍😍 Fine Gael (Gente d’Irlanda) Sinn Fein (Noi stessi) Fianna Fail (soldati del destino) Poesia e trifogli ☘️ . @atonitoperdido @LucianoCaveri @lucaquaglia66 @aspide_l,@atonitoperdido @LucianoCaveri @lucaquaglia66 @aspide_l,,https://twitter.com/GigiEinaudi/status/1225429474071719938
2020-02-06 14:41:12,ConorPCullen,,0,0,"You would think Fine Gael and Fianna Fail would take 0.3 seconds of actual self-reflection and realize people aren't stupid, people (age &lt;50!) want to vote for Sinn Fein as they represent the views of the people much more and seem far less scary than more years of FG/FF. https://twitter.com/EmmetKirwan/status/1225400170088685569",,,https://twitter.com/ConorPCullen/status/1225429236921573377
2020-02-06 14:37:10,robdn,,0,1,"Ireland votes on Saturday 8 February in an unpredictable general election which looks set to shake up the political consensus in the country. Fine Gael faces opposition from Fianna Fail, and an unexpected surge in popularity for Sinn Fein. ",,,https://twitter.com/robdn/status/1225428223728783361
2020-02-06 14:34:03,NeilRedFM,,5,0,ELECTION 2020 - Leader of Fianna Fáil Micheál Martin was live in the studio with Neil this morning ahead of the vote on Saturday. ,,,https://twitter.com/NeilRedFM/status/1225427438483668993
2020-02-06 14:33:06,BACiaran,maranello1977,1,0,"They talk about making the economy work for society, not the other way around, as Fine Gael and Fianna Fáil do. They are the only realistic option for bringing about that change of emphasis in Ireland. It would be a step in the right direction for the country.",,,https://twitter.com/BACiaran/status/1225427201975345152
2020-02-06 14:31:16,AfricaWorldNews,,0,0,"(L-R) Fianna Fail leader Micheal Martin, Fine Gael leader Leo Varadkar and Sinn Fein President Mary Lou McDonald participate during the final TV leaders' debate at the RTE studios on Tuesday in Donnybrook, Dublin,… https://www.instagram.com/p/B8Opa10JugG/?igshid=1cwrg61ya4pra",,,https://twitter.com/AfricaWorldNews/status/1225426739070930944
2020-02-06 14:30:54,IrishTimes,,2,5,Fianna Fáil calls on Conor Murphy to resign over Paul Quinn remarks #GE2020,,#GE2020,https://twitter.com/IrishTimes/status/1225426647391916034
2020-02-06 14:30:13,SenatorEMurphy,,1,1,I dropped in to see Rossie Legend Paddy Joe Burke in Roscommon Town the other day. Thanks for your support Paddy! #VoteMurphyNo1 #fiannafail ,,#VoteMurphyNo1 #fiannafail,https://twitter.com/SenatorEMurphy/status/1225426473965817857
2020-02-06 14:26:02,David56465257,Rorymon,0,0,The sad truth is their is no hope for you Rory. You may as well put your head in the oven & turn it on full blast. #FineGael #Sinnfein #FiannaFail,,#FineGael #Sinnfein #FiannaFail,https://twitter.com/David56465257/status/1225425420276977664
2020-02-06 14:24:33,frankghennesse1,,0,0,What about Murphy' record of discrimination MaryLou suggested breaking law over PSNI? What a shower Fianna Fáil calls on Conor Murphy to resign over Paul Quinn remarks https://www.irishtimes.com/news/politics/fianna-f%C3%A1il-calls-on-conor-murphy-to-resign-over-paul-quinn-remarks-1.4163873,,,https://twitter.com/frankghennesse1/status/1225425049206870016
2020-02-06 14:22:04,breakingnewsie,,0,1,"Expert gives verdict on Fine Gael, Fianna Fáil and Sinn Féin health manifestos ",,,https://twitter.com/breakingnewsie/status/1225424423458496513
2020-02-06 14:20:51,liamlovell4,murrirl,0,1,Maureen Potter used to say: “Fianna Fáil approach elections with a Carmelite in one hand and a ballot box in the other.”😀 Things have changed. ,,,https://twitter.com/liamlovell4/status/1225424118771785728
2020-02-06 14:16:50,Ordinaryman13,1MadIrishMan1,2,15,"RTE trying to hide fact Bertie Ahern never apologised but made a statement on Paul Quinn RTE Fine Gael Fianna Fail Government do not care about Quinn family Jim Callaghan Barrister partime TD believes sister Mariam O'callaghan is right to not report Bertie Ahern,RUC,PSNI comments ",,,https://twitter.com/Ordinaryman13/status/1225423106669412354
2020-02-06 14:13:33,irishexaminer,,0,1,"Expert gives verdict on Fine Gael, Fianna Fáil and Sinn Féin health manifestos http://www.irishexaminer.com/breakingnews/ireland/expert-gives-verdict-on-fine-gael-fianna-fail-and-sinn-fein-health-manifestos-980161.html?utm_source=dlvr.it&amp;utm_medium=twitter",,,https://twitter.com/irishexaminer/status/1225422278319411200
