date,username,to,replies,retweets,text,mentions,hashtags,permalink
2020-02-09 20:54:51,drwgalea,,1,0,Fine Gael and Fianna Fail still seemingly adamant they won't form a government with Sinn Fein. What the hell does that mean?,,,https://twitter.com/drwgalea/status/1226610435077611520
2020-02-09 20:54:33,AindriuB,,0,0,"Fine Gael has Coveney to take over as a new leader, but who does Fianna Fáil have to take over from Micheál Martin? #GE2020",,#GE2020,https://twitter.com/AindriuB/status/1226610356736417793
2020-02-09 20:54:19,CianSavage,,2,0,"People who associate Sinn Fein with the Ira need to educate themselves, Charlie haughy, leader of Fianna Fáil, ran guns for the IRA, Fine Gael were set up from an amalgamation of the blueshirts, cumann na nGaedhal and the NCP 1/2",,,https://twitter.com/CianSavage/status/1226610298079121408
2020-02-09 20:54:13,KeithGalvin,philipoconnor,1,0,Cheap is good cos I spent our budget on @PrayForPatrick Fuck Fine Gael and Fuck Fianna Fail stickers,@PrayForPatrick,,https://twitter.com/KeithGalvin/status/1226610275643772929
2020-02-09 20:54:00,irishpoint,,0,0,#GE2020 Fianna Fáil leader Micheál Martin have sent political circles into a spin now .Martin opening the door to Sinn Féin with Any luck @MaryLouMcDonald Can close the door on him @rtenews #twip #cblive #rtept #TonightVMT,@MaryLouMcDonald @rtenews,#GE2020 #twip #cblive #rtept #TonightVMT,https://twitter.com/irishpoint/status/1226610218609631233
2020-02-09 20:53:14,BigFatFenian,,4,10,Is this what Fine Gael and Fianna Fáil voters feel like for EVERY GENERAL ELECTION???? Because this is the first time watching ballot counts where I haven’t felt full of dread and I could get used to it,,,https://twitter.com/BigFatFenian/status/1226610025675792385
2020-02-09 20:52:42,chris89nager,,0,0,"Eugene Murphy in Roscommon not happy at all, very miffed at Fianna Fail strategy and rightly so I think...#ge2020",,#ge2020,https://twitter.com/chris89nager/status/1226609893999882241
2020-02-09 20:52:03,cian2me,peter_mott,1,0,"Top 3 parties all look like they will attain 35-40 seats. 80 seats are needed for a majority, so it is anybody's guess what coalition will emerge. More than likely Varadkar will not be Taoiseach, with Fianna Fáil leader Martin more likely to be nominated",,,https://twitter.com/cian2me/status/1226609730908573698
2020-02-09 20:50:34,theceltsarehere,AineMcMahon,0,0,"Other parties such as Fianna Fáil, Leo? The two cheeks of it! ",,,https://twitter.com/theceltsarehere/status/1226609355958734849
2020-02-09 20:50:29,PeterFarr_,,0,0,"The Green Party now have three TDs. Fine Gael and Fianna Fáil have two, and one of those was automatically re-elected. Wild. #GE2020",,#GE2020,https://twitter.com/PeterFarr_/status/1226609337122119685
2020-02-09 20:50:21,lukerooney16,,0,0,“You have been fooled into voting Sinn Fein they can’t achieve what they’re saying.” No no no you have been fooled into voting Fianna Fáil or Fine Gael for the last 33 general elections😂😂😂,,,https://twitter.com/lukerooney16/status/1226609301206294528
2020-02-09 20:50:19,KieranKearns37,davidrafferty10,0,0,"100%...last change for Martin to become Taoiseach. In fact, he'll be the 1st Fianna Fáil leader never to have be Taoiseach....he needs to start talking to SF or FG or others....he doesn't want that title.",,,https://twitter.com/KieranKearns37/status/1226609294801539073
2020-02-09 20:49:29,RandomCharStr,,0,0,"If that plans out, these are the changes from 2016: Sinn Féin +15 Green +12 Social Democrats +1 Áontu +1 People Before Profit = Labour -1 Independents 4 Change -4 Independents -4 Fianna Fáil -6 Fine Gael -14",,,https://twitter.com/RandomCharStr/status/1226609082460786692
2020-02-09 20:49:22,DonegalLiveNews,,0,0,#donegal constituency: Too early to say about how Fianna Fáil and Fine Gael will reaction going forward - McHugh https://www.donegallive.ie/video/election-2020/516033/donegal-constituency-too-early-to-say-about-how-fianna-fail-and-fine-gael-will-reaction-going-forward-mchugh.html#.XkBwIH2JioI.twitter @GE2020,@Ge2020,#donegal,https://twitter.com/DonegalLiveNews/status/1226609055667564549
2020-02-09 20:48:48,JohnnyFitz1,svencjohn_steve,1,0,"Fianna Fail and Fine Gael have been running the country for 100 years with PR and they are dedinitely not liberal or elite, more like conservative and mediocre.",,,https://twitter.com/JohnnyFitz1/status/1226608913442856961
2020-02-09 20:48:24,JackJackmernag,,0,0,"It's amazing how in the run up to the election all the Fine Gael & Fianna Fail completely downplayed opinion polls and said they pay little attention to them. They are now quoting the figures from them, especially FG, saying how FF &amp; FG are actually neck and neck #GE2020",,#GE2020,https://twitter.com/JackJackmernag/status/1226608813136064514
2020-02-09 20:47:55,mickmuldoon,JamesKanag,0,0,"“Hmm, I’m angry at lack of change from Fianna Fáil and Fine Gael, but I won’t vote Sinn Fein in case some Brexiter tool misinterprets it as a ‘message to the world.’”",,,https://twitter.com/mickmuldoon/status/1226608691111178242
2020-02-09 20:47:43,MagsLand1,,1,7,"Ireland Exit Poll, things that influenced the vote. To put it into context the 2 former main parties (Varadakers Fine Gael & Fianna Fail) have been concentrating on bottom half. Labour Party near obliterated by moving to centre- the price of going for 'power'. #IrelandElection",,#IrelandElection,https://twitter.com/MagsLand1/status/1226608639244369926
2020-02-09 20:47:22,meehallclancy,,1,2,"Why would Sinn Fein go into coalition with Fianna Fáil or Fine Gael? They have huge surpluses that are transferring hard left, it makes much more sense to agitate for another election, run more candidates, secure more seats &amp; head a left wing government #ge2020",,#ge2020,https://twitter.com/meehallclancy/status/1226608549813510145
2020-02-09 20:46:50,zack_breslin,,1,9,"The high levels of Sinn Fein votes transferring to Sol/PBP shows that it'd be absolute madness to go in with Fianna Fáil. Broad left alliance instead please, force another election and win it. #GE2020 #SinnFein",,#GE2020 #SinnFein,https://twitter.com/zack_breslin/status/1226608416052916226
2020-02-09 20:46:48,Edwinafg,,0,0,Irish election: Sinn Fein to exclude Fine Gael and Fianna Fail from new coalition - McDonald ,,,https://twitter.com/Edwinafg/status/1226608408289251328
2020-02-09 20:46:47,EmtLarkin,davidcullinane,0,0,"Bigger than Fianna Fáil, Fine Gael and Labour combined in Louth ",,,https://twitter.com/EmtLarkin/status/1226608403042140161
2020-02-09 20:45:52,sickboydub,,0,0,Michael Martin after being beaten in Cork #MichaelMartin #FiannaFail #MeholeMcCraken #GE2020,,#MichaelMartin #FiannaFail #MeholeMcCraken #GE2020,https://twitter.com/sickboydub/status/1226608174163210245
2020-02-09 20:45:06,AlexisErudite,,1,0,"It's a silly time to adopt hope tbh. When the first Fine Gael candidates makes it over the quota, the second will very quickly sweep up the votes if neither have been eliminated. Same with Fianna Fail, the early surge was always to be expected due to SF only having 42 candidates",,,https://twitter.com/AlexisErudite/status/1226607980113801216
2020-02-09 20:44:52,mattkeatinggg,,1,0,"Fianna Gael and Fianna Fáil saying that people’s votes for Sinn Fèin are nothing more than a “protest vote” is a joke man, get over yourselves, the people want a change it’s not a protest, it’s a statement of the time’s. Tiocfaidh àr là. #GE2020",,#GE2020,https://twitter.com/mattkeatinggg/status/1226607922366550018
2020-02-09 20:44:28,sergiocap71,,0,0,Fianna Fail ha in Micheal Martin un giovane leader che bussa alla porta delle persone per sentire i loro bisogni. Proprio ciò che vogliono gli abitanti dell'isola di Smeraldo : empatia,,,https://twitter.com/sergiocap71/status/1226607819455160331
2020-02-09 20:44:16,lisaocarroll,,3,4,"Michael McGrath, prominent Fianna Fail politician, tells RTE radio he doesn't know if the numbers will even be there for an option of coalition with Fine Gael AKA grand coalition....",,,https://twitter.com/lisaocarroll/status/1226607770335666176
2020-02-09 20:44:11,Trickstersworld,,3,22,So the #ExitPoll was marginally wrong. Sinn Féin are now the biggest party. Disaster for Fianna Fáil and just a total rejection of Fine Gael’s punch down politics. #GE2020,,#ExitPoll #GE2020,https://twitter.com/Trickstersworld/status/1226607751897415680
2020-02-09 20:43:59,plantingforbees,,0,1,Irish election: Sinn Fein to exclude Fine Gael and Fianna Fail from new coalition - McDonald https://news.sky.com/story/irish-election-sinn-fein-to-exclude-fine-gael-and-fianna-fail-from-new-coalition-mcdonald-11930261,,,https://twitter.com/plantingforbees/status/1226607698092941315
2020-02-09 20:42:37,SJAMcBride,,19,34,Shrewd from @PatLeahyIT: It's not just about whether Fianna Fáil or Fine Gael will agree to go into government with Sinn Féin - but about whether Sinn Féin will agree to govern with either of them. Is that in SF's strategic interests at this point? ,@PatLeahyIT,,https://twitter.com/SJAMcBride/status/1226607354461986817
2020-02-09 20:42:03,irishexaminer,,1,0,Sinn Féin election success has Fianna Fáil and Fine Gael considering options ,,,https://twitter.com/irishexaminer/status/1226607211830341632
2020-02-09 20:41:58,sergiocap71,,1,0,"Irlanda : vincono Sinn Fein, nonostante I passati legami con l'IRA, e Fianna Fail. Il primo si rivolge ad un elettorato giovane, disinteressato alla riunificazione ma desideroso di nuovi alloggi-e a buon mercato -, non bastandogli i 20mila costruiti recentemente dal PM uscente",,,https://twitter.com/sergiocap71/status/1226607192704417792
2020-02-09 20:41:53,NeilWarner_,,0,1,"Michael McGrath from Fianna Fail, the ""party of the working classes"", saying that Sinn Fein is primarily unacceptable to Fianna Fail because it wants to tax higher incomes #GE2020",,#GE2020,https://twitter.com/NeilWarner_/status/1226607172525711366
2020-02-09 20:40:27,BarryWhyte85,,0,1,"Fianna Fails Charlie McConalogue, who looks set to retain his seat in #Donegal won’t completely rule out a coalition with Sinn Fein He also says he has confidence in party leaders Michael Martin and he says he should continue to lead Fianna Fail after this election #GE20202",,#Donegal #GE20202,https://twitter.com/BarryWhyte85/status/1226606808896352256
2020-02-09 20:39:38,Kl_Stone,,1,0,"Aufgrund des sehr komplizierten Wahlsystems gibt es noch kein Endergebnis der gestrigen Wahlen in Irland. Nach Hochrechnungen wird die linke Sinn Féin mit 24,1% erstmals stärkste Partei. Die konservativen Fianna Fáil und Fine Gael folgen mit je 22%..... #FridaysForFuture 1/x",,#FridaysForFuture,https://twitter.com/Kl_Stone/status/1226606606592466944
2020-02-09 20:37:49,pp69forever,,1,0,"It's a good day to be Irish, drinks are on me, unless you voted for fianna fail or those other gobshites fine gael #GeneralElection2020 #GE2020 #SinnFéin",,#GeneralElection2020 #GE2020 #SinnF,https://twitter.com/pp69forever/status/1226606149019078658
2020-02-09 20:37:20,HT_Glt,,1,1,"🇮🇪 #Irlande On part sur une 1ère place en sièges du pcpal parti d'opposition jusque là, les Centristes du Fianna Fáil. Le Sinn Féin devrait être 1er en voix 👏 ! Le Fine Gael du Premier Ministre Varadkar serait bien relégué à la 3ème place Difficile encore de voir les décomptes",,#Irlande,https://twitter.com/HT_Glt/status/1226606026537000963
2020-02-09 20:35:33,DundalksNews,,0,0,Fianna Fail's @BreathnachLouth believes he's “still in with a shout” for close final seat in Louth,@BreathnachLouth,,https://twitter.com/DundalksNews/status/1226605577972961280
2020-02-09 20:35:11,amyohconnor,,0,5,Fine Gael and Fianna Fáil attempting to be magnanimous in defeat: ,,,https://twitter.com/amyohconnor/status/1226605483613728768
2020-02-09 20:35:02,breakingnewsie,,0,1,Sinn Féin election success has Fianna Fáil and Fine Gael considering options ,,,https://twitter.com/breakingnewsie/status/1226605448314228736
2020-02-09 20:35:00,JackMasterman4,,0,0,"A bloody nose for the establishment parties? As #SinnFein look set to win a record amount of votes/seats in the #IrishGeneralElection, voters cast a damming verdict on the governing #FineGael and opposing #FiannaFail. ",,#SinnFein #IrishGeneralElection #FineGael #FiannaFail,https://twitter.com/JackMasterman4/status/1226605439422353408
2020-02-09 20:34:57,AnnSea7,,2,0,Irish election: Sinn Fein to exclude Fine Gael and Fianna Fail from new coalition - McDonald ,,,https://twitter.com/AnnSea7/status/1226605426378182656
2020-02-09 20:34:46,dunyanin_secimi,,0,0,#seçim #irlanda İrlanda'da yapılan genel seçimler: 160 milletvekilinin seçileceği parlamentoda 31 koltuğun sahibi belirlendi. Sinn Fein (Merkez Sol): 23 Fianna Fail (Liberal): 1 Fine Gael (Merkez Sağ): 1 Green Party (Yeşiller): 2 Bağımsızlar: 4,,#se #irlanda,https://twitter.com/dunyanin_secimi/status/1226605378231787524
2020-02-09 20:34:23,Tepper_Dylan,,0,0,"A lot of Sinn Féin seats are getting called early, because of their strategy of hedging their bets and only running 42 candidates compared to 82 and 84 for Fine Gael and Fianna Fáil, respectively Big question of where they cap out because of this strategy #GE2020",,#GE2020,https://twitter.com/Tepper_Dylan/status/1226605282178031619
2020-02-09 20:34:18,Whatatado,McCarthyMick,0,0,"Thinking the same, Fianna Fáil with get into bed with any devil to get into power #cringe #GE20202",,#cringe #GE20202,https://twitter.com/Whatatado/status/1226605263551188993
2020-02-09 20:33:20,leonsaviour,rtenews,0,1,"No saying it's inevitable but if Fianna Fáil leader Micheál Martin doesn't jump first Sinn Féin will work for a Left coalition, and that could be seriously problematic, even tipping us into a future recession (something on the near horizon already) #GE2020",,#GE2020,https://twitter.com/leonsaviour/status/1226605018259869697
2020-02-09 20:33:16,Vegansorrel,,0,0,Sinn Fein election success has Fianna Fail and Fine Gael considering options - AOL UK https://www.aol.co.uk/amp/2020/02/09/sinn-fein-election-success-has-fianna-fail-and-fine-gael-conside/#aoh=15812803062144&amp;csi=1&amp;referrer=https%3A%2F%2Fwww.google.com&amp;amp_tf=From%20%251%24s,,,https://twitter.com/Vegansorrel/status/1226605002099187712
2020-02-09 20:33:03,cfcpac,,0,2,Fine Gael reaction: Party is ‘not compatible’ with SF – Varadkar: Simon Harris says Fine Gael would go into coalition with Fianna Fáil as a ‘last resort’ http://dlvr.it/RPjGqd,,,https://twitter.com/cfcpac/status/1226604950085464064
2020-02-09 20:32:38,mediamurray,,1,0,Here’s a thought if Micheal Martin leads Fianna Fáil into coalition with @sinnfeinireland he won’t stand for election again. #GE2020,@sinnfeinireland,#GE2020,https://twitter.com/mediamurray/status/1226604845160960000
2020-02-09 20:32:22,Fricat,,0,0,"Looks like Mary Lou McDonald is sweeping through the election, brushing off old dinosaurs like Fine Gael & Fianna Fáil who had between them 100 years of governance. Great news!",,,https://twitter.com/Fricat/status/1226604777041203200
2020-02-09 20:31:55,MaDeniau,,1,0,A difficult deal is better than another election for Fine Gael and Fianna Fáil https://www.businesspost.ie/election2020/a-difficult-deal-is-better-than-another-election-for-fine-gael-and-fianna-fail-5585f08b?utm_campaign=article&amp;utm_source=twitter&amp;utm_medium=web via @businessposthq,@businessposthq,,https://twitter.com/MaDeniau/status/1226604663748857857
2020-02-09 20:31:25,GWxllxw,Dannycommockx,0,0,Fine Gael and Fianna Fáil ,,,https://twitter.com/GWxllxw/status/1226604535927496704
2020-02-09 20:31:17,JamesMc50748778,MichealLehane,0,0,"Senior Fianna Fáil front bench outgoing T D ‘ s going against their leader Michael Martin , ruling out a coalition with Sinn Fein .",,,https://twitter.com/JamesMc50748778/status/1226604503585230848
2020-02-09 20:30:52,businessposthq,,0,6,.@susanokeeffe weighs up the potential coalition options after Sinn Féin pushed Fine Gael and Fianna Fáil to unfamiliar depths #GE2020 https://www.businesspost.ie/election2020/a-difficult-deal-is-better-than-another-election-for-fine-gael-and-fianna-fail-5585f08b,@susanokeeffe,#GE2020,https://twitter.com/businessposthq/status/1226604398278782977
2020-02-09 20:30:49,manunitedH67,,0,0,Fianna fail will go into power with the shinners coz them chaps have no morals,,,https://twitter.com/manunitedH67/status/1226604386908090368
2020-02-09 20:30:46,DundalkDemocrat,,0,1,Fianna Fail's Declan Breathnach believes he's “still in with a shout” for close final seat in Louth #ge2020,,#ge2020,https://twitter.com/DundalkDemocrat/status/1226604372949454848
2020-02-09 20:29:24,Swift__Girl,TheCGarrison,2,0,"The Taoiseach still hasn’t been re-elected (on count 3) which is almost unprecedented! People (young people) in particular are sick of the right-centrists Fianna Fáil &amp; Fine Gael (who have both caused the financial crisis, and crippled people through austerity trying to fix it)",,,https://twitter.com/Swift__Girl/status/1226604030895501314
2020-02-09 20:29:05,jediknight1985,,3,0,"Fianna Fáil’s Michael McGrath sounds like a man who’s set to back a Fianna Fáil-Fine Gael coalition. Jim O’Callaghan singing the same tune as McGrath &amp; FF leader Micheál Martin. While John McGuinness, certainly Pat ‘The Cope’ Gallagher, unenthusiastic about that prospect.#GE2020",,#GE2020,https://twitter.com/jediknight1985/status/1226603947873439746
2020-02-09 20:29:05,Gombeenisland,Alexryan55,1,0,"Social housing, affordable housing. Also social housing should be accessible to everyone. The defunct housing market that Fianna Fail and FG have propped up is the source of the homeless problem...",,,https://twitter.com/Gombeenisland/status/1226603947793829888
2020-02-09 20:28:35,Terra_corrupt,,3,1,"You used to tweet about video games man. You used to tweet about Cave Story. Now it's all ""Fianna Fail are gomies"" this and ""I want a house"" that. You've changed man",,,https://twitter.com/Terra_corrupt/status/1226603825517252609
2020-02-09 20:28:20,lisaocarroll,,1,2,"Two cabinet ministers already lost their seat in Irish election including Shane Ross, former business journalist and vocal critic of Fianna Fail government during financial crash and EU/ECB/IMF bail out in 2010",,,https://twitter.com/lisaocarroll/status/1226603762325884933
2020-02-09 20:28:14,noone_joseph,mickthehack,0,0,"In 1932, when Fianna Fail took power for the first time, several Fianna Fáil TDs had guns in their pockets because they were afraid Cumann na nGaedheal would not hand over power. The Gardaí and army at the time were probably making the same jokes!",,,https://twitter.com/noone_joseph/status/1226603734496677889
2020-02-09 20:27:57,CianByNature,,2,0,"Declan Breathnach in serious trouble in Louth. Looking like Fianna Fáil will have no elected TD here. That is unbelievable. In the history of the Irish state, I don’t think that’s happened before? Even in 2011 when they bankrupted the country they returned one.#ge2020",,#ge2020,https://twitter.com/CianByNature/status/1226603665550643200
2020-02-09 20:27:46,Pointoveiw,BBCMarkSimpson,0,0,Not really. Labour are non existent. Fianna fail have no mission for people to latch on to. Votes for Sinn Féin is just the anti establishment vote.,,,https://twitter.com/Pointoveiw/status/1226603620541575170
2020-02-09 20:27:43,IrishMirror,,0,0,Who is Fianna Fail leader Micheal Martin? All you need to know about the former teacher from Co Cork ,,,https://twitter.com/IrishMirror/status/1226603603915399168
2020-02-09 20:27:26,NiaMariae,RankynPhyle,0,0,"I accidentally said Fianna Fail the other day :P but fáil (pronounced fall) is like a poetic way of saying ""of Ireland.""",,,https://twitter.com/NiaMariae/status/1226603532658335744
2020-02-09 20:26:44,Shaw_K,janeruffino,0,0,"Fianna Fáil have corruption, lots and lots of corruption.",,,https://twitter.com/Shaw_K/status/1226603356443021318
2020-02-09 20:25:29,sweatyuncle,,1,0,Fianna Fail’s Darragh O’Brien getting ready to speak to @kierancuddihy on @NewstalkFM. He’s hoping to get the second seat here in #DublinFingal #GE2020 @NewstalkFM,@kierancuddihy @NewstalkFM @NewstalkFM,#DublinFingal #GE2020,https://twitter.com/sweatyuncle/status/1226603043669598210
2020-02-09 20:25:29,AineMcMahon,,1,11,Leo Varadkar is 85 votes short of the quota and looks set to be elected after the fourth or fifth count. Fianna Fáil’s Jack Chambers looks set to take the third seat. Full breakdown here #DublinWest #GE2020,,#DublinWest #GE2020,https://twitter.com/AineMcMahon/status/1226603043409551360
2020-02-09 20:25:18,Nadie1991,,0,0,This is Fianna Fáil and Fine Gael after today 😂😂 hon Sinn Fein 💚💚#GeneralElection2020,,#GeneralElection2020,https://twitter.com/Nadie1991/status/1226602997372858376
2020-02-09 20:24:37,MartinMBond,,0,0,@Johnny_Celtic Irish election: Sinn Fein to exclude Fine Gael and Fianna Fail from new coalition - McDonald ,@Johnny_Celtic,,https://twitter.com/MartinMBond/status/1226602825251250183
2020-02-09 20:23:43,connorj67,Inselaffe76,0,0,"The size of the Sinn Fein vote has taken everyone by surprise even SF themselves who would have a lot more seats except they didn't run the candidates! Fianna Fail, Fine Gael and SF will probably end up around the same and I'd guess at a FF/SF coalition..",,,https://twitter.com/connorj67/status/1226602598599405568
2020-02-09 20:23:12,legallyona,,3,0,I want to know what people who voted Sinn Fein would think of them going into coalition with Fianna Fail #GE2020,,#GE2020,https://twitter.com/legallyona/status/1226602469943320577
2020-02-09 20:23:01,jackpowerIT,,1,0,He says the party will he “at least within touching distance” of Fianna Fáil when all counts are finished,,,https://twitter.com/jackpowerIT/status/1226602423252377601
2020-02-09 20:22:29,APRILMARY,RTEgalwayWEST,0,2,Congratulations to one of the few remaining pro-life principled #FiannaFail candidates.,,#FiannaFail,https://twitter.com/APRILMARY/status/1226602290892726272
2020-02-09 20:22:22,croninjohn02,GeneKerrigan,0,0,"The children are eating off foot paths , because of Fianna fail and Fianna gael ,Dublin 4 politics ..",,,https://twitter.com/croninjohn02/status/1226602260366602241
2020-02-09 20:22:19,AKNFContent,,0,0,"Good Christ, let Fianna Fáil go into coalition with Sinn Féin rather than Fine Gael. I like at least one cheek of my arse not to be shit-caked. #GE2020",,#GE2020,https://twitter.com/AKNFContent/status/1226602248416964611
2020-02-09 20:22:18,paulmcguinness6,,3,0,What’s pretty clear now is that some members of Fianna Fáil would sell their grannies for the #whiff of power. Power corrupts #GE20,,#whiff #GE20,https://twitter.com/paulmcguinness6/status/1226602241307676673
2020-02-09 20:22:09,colmr,,1,0,the @Independent_ie appears to be going for maximum confusion with their election charts. oddly shaped pie chart (oval not circle) and off centre 'election 2020' logo make it seem as if Fianna Fáil have ~8 times the first preferences of Labour (in reality &lt; 5) (exit poll data) ,@Independent_ie,,https://twitter.com/colmr/status/1226602205735608320
2020-02-09 20:21:21,RankynPhyle,NiaMariae,1,0,"Somehow there's gotta be a joke about putting the fail in Fianna Fáil, but I don't know enough about Irish politics to make it.",,,https://twitter.com/RankynPhyle/status/1226602004983767040
2020-02-09 20:21:17,Joe_C_London,,0,0,Count four in Cork South-Central. Fianna Fáil leader @MichealMartinTD still short of a quota. #GE2020,@MichealMartinTD,#GE2020,https://twitter.com/Joe_C_London/status/1226601987007033349
2020-02-09 20:21:03,breakingnewsie,,0,1,"Fianna Fail’s policies do not change overnight, says Micheal Martin ",,,https://twitter.com/breakingnewsie/status/1226601930148872192
2020-02-09 20:20:45,janeruffino,,9,1,"It took me like a decade of living in Ireland to grasp this. FG does have a shady past of supporting fascists, however. But FF is just like...I don’t know what to tell you about Fianna Fáil.",,,https://twitter.com/janeruffino/status/1226601853107961857
2020-02-09 20:20:33,WayneJacob6,,0,0,"Following on from my tweet on Cullinanes rise over 18 years. Below documents the demise of the #FiannaFail and #FineGael first preference votes in #Waterford over that same period: #GE2020 2002: 31,579 2007: 36,577 2011: 26,931 2016: 25,453 2020: 18,179",,#FiannaFail #FineGael #Waterford #GE2020,https://twitter.com/WayneJacob6/status/1226601802679963651
2020-02-09 20:20:20,ByeTezanos,jjfdb,1,0,Qué es lo que realmente diferencia al Fine Gael del Fianna Fail? La gente de Irlanda los ve como dos partidos claramente diferentes o también los ven cercanos? Y el tema del nacionalismo tiene mucho peso a la hora de votar?? Gracias de antemano😊,,,https://twitter.com/ByeTezanos/status/1226601749097656321
2020-02-09 20:20:02,dearbongo,,0,0,Fianna Fáil: a banana stand that won't make you fight for fascists in Spain and kill you,,,https://twitter.com/dearbongo/status/1226601673931608064
2020-02-09 20:19:57,jon_macd,,1,0,"Fianna Fáil will need to go into government with Sinn Fein. They may need to hold their nose in doing so - as is the case with Unionists. In the long term, it should work out in their interest #GE2020",,#GE2020,https://twitter.com/jon_macd/status/1226601651533950978
2020-02-09 20:19:30,jdboxtalk,,1,0,Massive day for #Sinnfein just hope it doesn't lead to an emergency coalition of Fianna Fail and Fine Gael.,,#Sinnfein,https://twitter.com/jdboxtalk/status/1226601537851547648
2020-02-09 20:19:16,sheilareilly123,,0,0,Fianna Fail's Joe Flaherty says it will go to the wire for the last two seats in #LDWH #GE2020,,#LDWH #GE2020,https://twitter.com/sheilareilly123/status/1226601480821628928
