date,username,to,replies,retweets,text,mentions,hashtags,permalink
2020-01-28 10:09:34,mrdavidflane,sharontolan,0,0,This should cause a few mixed emotions.... #vinb #GE2020 #FineGael ,,#vinb #GE2020 #FineGael,https://twitter.com/mrdavidflane/status/1222099389189062656
2020-01-28 10:00:06,delyncher_irl,,0,0,"Anyone know if #MeHoleMartin &amp; #Varadkar are alright after the beatdown they took last night, have they been released from hospital yet?... Looked pretty serious from my vantage point. Wonder if #FineGael or #FineFail are gonna press charges? #GeneralElection2020 #GE2020",,#MeHoleMartin #Varadkar #FineGael #FineFail #GeneralElection2020 #GE2020,https://twitter.com/delyncher_irl/status/1222097004651782144
2020-01-28 09:50:58,PFQMUSIC,,0,1,"The women of #FineGael have proven themselves to be particularly ignorant and ill-informed.,#CatherineNoone thinks autism is an ‘illness’. #GE2020",,#FineGael #CatherineNoone #GE2020,https://twitter.com/PFQMUSIC/status/1222094708509462529
2020-01-28 09:43:01,Martins_tweetz,,0,0,Can we have a discussion about vote transfers? I’m considering not voting for main parties at all. #Elections2020 #fiannafail #FineGael ,,#Elections2020 #fiannafail #FineGael,https://twitter.com/Martins_tweetz/status/1222092705498652673
2020-01-28 09:36:54,ComedyLeitrim,,0,0,Ireland under #Finegael if the Gangsters are returned to power. #GE2020 #cblive,,#Finegael #GE2020 #cblive,https://twitter.com/ComedyLeitrim/status/1222091169091530753
2020-01-28 09:35:23,ComedyLeitrim,,0,2,"#MichaelCreed Minister for Veganism here in #Cork.. Put #finegael back in power in #GE2020 We will decimate rural ireland/make country 100% meatless, destroy #farming Corrupt #ReginaDoherty will ensure mile long food bank queues everywhere. ""Keep Our FG Fat Cat Salaries Going""",,#MichaelCreed #Cork #finegael #GE2020 #farming #ReginaDoherty,https://twitter.com/ComedyLeitrim/status/1222090784851267591
2020-01-28 09:29:15,PatrickSharke13,RENUAIreland,1,0,Just remember this party was founded by a former @FineGael TD. #Election2020 #FineGael #vote,@FineGael,#Election2020 #FineGael #vote,https://twitter.com/PatrickSharke13/status/1222089244056915969
2020-01-28 09:27:51,PFQMUSIC,,0,0,"Hang on, just reading the full report. So #CatherineNoone actually describes autism as an ‘illness’. #GE2020 #FineGael",,#CatherineNoone #GE2020 #FineGael,https://twitter.com/PFQMUSIC/status/1222088891026505736
2020-01-28 09:27:22,michaelmahony01,,0,1,What else could possibly go wrong for #FineGael ? #catherinenoone,,#FineGael #catherinenoone,https://twitter.com/michaelmahony01/status/1222088769324691457
2020-01-28 09:17:28,RossWynne16,,0,0,I see Catherine Noone has got herself in a bit of bother...love to see it #GE2020 #FineGael,,#GE2020 #FineGael,https://twitter.com/RossWynne16/status/1222086276511301632
2020-01-28 09:11:52,DiplomatMurph,ellenmcoyne,1,1,"Spectacularly inappropriate comment from #FineGael, if you vote for these, don’t expect empathy or accepting fault. The record is clear and the attempted walk back on the comment is evident. #GE2020",,#FineGael #GE2020,https://twitter.com/DiplomatMurph/status/1222084867795668992
2020-01-28 09:10:48,KeepinItSureal,paulodonoghue93,0,0,"Ladies & Gentlemen, people of Dublin Bay North, I give you Senator Catherine Noone, she’s been “specially” airlifted in as she wants to represent you. Vote wisely. #Ireland #FineGael #VoteThemOut #LeoVaradkar #VoteForChange #GE2020 #Election2020 #Special #SensitivityTraining #Leo",,#Ireland #FineGael #VoteThemOut #LeoVaradkar #VoteForChange #GE2020 #Election2020 #Special #SensitivityTraining #Leo,https://twitter.com/KeepinItSureal/status/1222084601021181953
2020-01-28 08:51:29,modm1230,,0,0,#GE2020 this was rolled up and stuffed in my front gate yesterday. #FineGael need a no.1 vote by promoting littering and a remarkable healthy eating policy. #goodluck,,#GE2020 #FineGael #goodluck,https://twitter.com/modm1230/status/1222079736756740096
2020-01-28 07:35:14,ComedyLeitrim,,0,0,"#cblive #GE2020 #FineGael Minister for Black &amp; Tans here... BlueShirts have taken over every Town in #Kerry #Cavan-#Monaghan #Galway #Mayo this morning. Every single man,woman and child who plays #GAA Gaelic Games is being arrested. There will be NO 32 County #Ireland under us.",,#cblive #GE2020 #FineGael #Kerry #Cavan #Monaghan #Galway #Mayo #GAA #Ireland,https://twitter.com/ComedyLeitrim/status/1222060550785585152
2020-01-28 02:11:00,FighterPodcast,,0,0,We can all agree that the only way to settle the General Election debate is by having a party leaders boxing tournament a bit like @MTKGlobal #GoldenContract tournament The last one standing becomes leader of the country.AND THE NEW 🙌🥊 #SinnFein #FiannaFail #FineGael #GE2020,@MTKGlobal,#GoldenContract #SinnFein #FiannaFail #FineGael #GE2020,https://twitter.com/FighterPodcast/status/1221978952270602240
2020-01-28 01:56:59,ruthactyahooie1,Cllr_Gerry,0,0,BUT. Better services for our tax. So we won’t feel like we are being ripped off. #propertytax #usc #paye #carbontax #waste we get nothing for our taxes from #FineGael,,#propertytax #usc #paye #carbontax #waste #FineGael,https://twitter.com/ruthactyahooie1/status/1221975427448700928
2020-01-28 01:23:07,AineWaterford,ciananbrennan,0,0,Only hit she gave #fineGael. Also .,,#fineGael,https://twitter.com/AineWaterford/status/1221966902878253056
2020-01-28 00:12:15,wildrover4711,PatriciaSahbani,0,0,#FineGael are you watching. Look at the poll ,,#FineGael,https://twitter.com/wildrover4711/status/1221949069381324806
