date,username,to,replies,retweets,text,mentions,hashtags,permalink
2020-01-07 16:51:01,Micheal_Lagain,NiallSF,0,0,"Commemorate a formation who quite literally murdered, raped, pillaged and betrayed the Irish nation. This is a new low even for FF and FG.......and Labour. Kind of makes you question their view of Irish heros.",,,https://twitter.com/Micheal_Lagain/status/1214590273608671233
2020-01-07 16:50:46,artvandelay2015,sinnfeinireland,1,0,Interesting notes on the. Note pad 😮,,,https://twitter.com/artvandelay2015/status/1214590210006237184
2020-01-07 16:46:21,roisinnicloch,glennthefitz,0,0,@MaryLouMcDonald Lmao that’s me sorted,@MaryLouMcDonald,,https://twitter.com/roisinnicloch/status/1214589096309510145
2020-01-07 16:42:33,Marcus_Suridius,BennGunn3,1,0,Please enlighten me how will there be a civil war? Irish people wont fight Irish people so please enlighten me who will be the other side?,,,https://twitter.com/Marcus_Suridius/status/1214588140591169537
2020-01-07 16:41:50,Marcus_Suridius,BennGunn3,0,0,"The laws of the day included murdering Irish people, I don't give a shit if they were Irish it just makes them traitors. We know the RIC is part of our history the same way the Nazis are apart of the French history but they don't commemorate them.",,,https://twitter.com/Marcus_Suridius/status/1214587961406349312
2020-01-07 16:41:46,diffgm,NiallSF,0,0,With you and 100%,,,https://twitter.com/diffgm/status/1214587944104865794
2020-01-07 16:41:28,fromthenorth57,NiallSF,0,0,arse paper,,,https://twitter.com/fromthenorth57/status/1214587869412708354
2020-01-07 16:41:12,Sage_Opinion,MaryLouMcDonald,0,1,"Perhaps you and the PIRA Army Council puppet masters could hold an alternative commemoration for the IRA's WW2 allies, that nice Mr Hitler and his Nazis.",,,https://twitter.com/Sage_Opinion/status/1214587800382779393
2020-01-07 16:40:08,Marcus_Suridius,JimmyJungle4,0,0,"Mate your anti Irish, go away nobody cares what you have to say.",,,https://twitter.com/Marcus_Suridius/status/1214587533264379906
2020-01-07 16:39:12,Marcus_Suridius,JimmyJungle4,2,0,"Yes all those soldiers really wasn't an occupation force, pull the other one because nobodies buying it.",,,https://twitter.com/Marcus_Suridius/status/1214587298421104642
2020-01-07 16:36:57,Marcus_Suridius,boceallachain,0,0,"Murderers and oppressors have no right to be remembered in a positive way, they were traitors end of.",,,https://twitter.com/Marcus_Suridius/status/1214586730009038849
2020-01-07 16:35:13,Marcus_Suridius,JimMorr46622225,0,0,"People who took the Queens money to oppress their fellow Irish men and women do not deserve to be remembered. They were traitors, they watched as so many innocent Irish people were harassed, beaten, tortured and killed.",,,https://twitter.com/Marcus_Suridius/status/1214586295059660800
2020-01-07 16:33:48,BennGunn3,Constcrepe,1,0,"Here here, shows how naive and reckless the shinners are with their iminent border poll madness. Imagine it happened and a majority voted for it. Civil war, collapsed economy and mass emigration to reach stalemate.",,,https://twitter.com/BennGunn3/status/1214585941043634176
2020-01-07 16:32:47,Marcus_Suridius,sonofshwing,0,0,History is history though.,,,https://twitter.com/Marcus_Suridius/status/1214585682590650368
2020-01-07 16:31:40,Marcus_Suridius,sonofshwing,0,0,"The Irish language never murdered or oppressed people, the RIC did.",,,https://twitter.com/Marcus_Suridius/status/1214585403681976321
2020-01-07 16:31:03,Marcus_Suridius,joannatuffy,0,0,"Here Tuffy, James Connolly asked us to tell you that if he was around you and all the so called Labour party would be up against a wall for your betrayal of the Irish people.",,,https://twitter.com/Marcus_Suridius/status/1214585246089433089
2020-01-07 16:29:16,odonger,MaryLouMcDonald,0,0,"It's a disgrace.....Leo you are insulting the Irish people who were murdered by the Black and Tans, it's time for you to go, we need a taoiseach who knows a out Irish history, Leo do your research",,,https://twitter.com/odonger/status/1214584798053830656
2020-01-07 16:26:45,CJS20727129,sinnfeinireland,0,0,Absolutely no interest whatsoever in starting back at Stormont have you,,,https://twitter.com/CJS20727129/status/1214584165766696960
2020-01-07 16:18:30,Rosemar34374965,fairclough_john,0,0,Last line especially true!,,,https://twitter.com/Rosemar34374965/status/1214582090764865537
2020-01-07 16:15:25,Rosemar34374965,MaryLouMcDonald,0,0,English TRAITOR also trying to bring AIDS to Ireland.,,,https://twitter.com/Rosemar34374965/status/1214581311882616833
2020-01-07 16:12:57,Booze_Fags_Mags,Mary2363,0,0,Leo is a Brit lover on Irish Twitter and a Brit hater on UK Twitter Gotta love that balanced Twitter opinion 🥱,,,https://twitter.com/Booze_Fags_Mags/status/1214580693587636231
2020-01-07 16:10:48,PaddyShanks,perth_marc,3,0,"And the other millions of duties they carried out peacefully and within the law at the behest of their fellow citizens? You really are brainwashed. Time you stopped thumping that old victims' drum, its membrane is wearing a bit thin.",,,https://twitter.com/PaddyShanks/status/1214580151100555271
2020-01-07 15:59:56,Prof_Kennedy,,1,1,"I had occasion to reread my 2012 account of the EU's contradictions, solidarities & reflexivities yesterday https://www.academia.edu/1248187/_2012_Cultural_Formations_of_the_European_Union_Integration_Enlargement_Nation_and_Crisis_ The framework remains useful, but so much revision given historical transformations over recent years, evident in this thread, needs be done...",,,https://twitter.com/Prof_Kennedy/status/1214577416225673223
2020-01-07 15:59:50,perth_marc,PaddyShanks,1,0,"You forgot to mention that his “ duties” would’ve included arresting children for stealing bread , beating paupers into early graves for the “ crime “ of poverty ! , burning his neighbors and fellow countrymen out of their miserable homes at the behest of British landlords ??",,,https://twitter.com/perth_marc/status/1214577390405521410
2020-01-07 15:53:56,Prof_Kennedy,,1,1,"Congratulations to @sanchezcastejon &amp; others forming Spain's new govt https://www.nytimes.com/2020/01/07/world/europe/spain-pedro-sanchez-government.html. The alternative you promise is not only critical for your country, &amp; for Europe, but also for the world. Gratitude to other Europeans like @Ania_Skrzypek for flickers of hope elsewhere.",@sanchezcastejon @Ania_Skrzypek,,https://twitter.com/Prof_Kennedy/status/1214575906750160896
2020-01-07 15:51:52,ClionaQ,prinzessinpixie,0,0,So thats both @GerryAdamsSF and @MaryLouMcDonald who like the old prawns we will be accused of notions... For a Shinners dinner prawns are a winner,@GerryAdamsSF @MaryLouMcDonald,,https://twitter.com/ClionaQ/status/1214575387679903746
2020-01-07 15:43:07,odonger,standavid10,0,0,"Too right he did, if this goes ahead FG are finished",,,https://twitter.com/odonger/status/1214573183476654080
2020-01-07 15:33:56,MalachyMcKeever,PeteThompson175,0,0,Mind ye don't spill any of that soup there Pete!!,,,https://twitter.com/MalachyMcKeever/status/1214570871693688833
2020-01-07 15:32:20,seanohargain,Michael_O_Regan,0,0,On the button Michael. I suspect the hysteria around this issue has a lot more to do with the competition between @fiannafailparty and @sinnfeinireland for votes and the silence of @MichealMartinTD and @MaryLouMcDonald is very disappointing. Much excellent work being undone. ,@fiannafailparty @sinnfeinireland @MichealMartinTD @MaryLouMcDonald,,https://twitter.com/seanohargain/status/1214570470093283328
2020-01-07 15:19:44,Mary2363,thejournal_ie,1,0,So whose idea was it ? Was it Brit loving Leo ? Easy for him when his family did not live in fear . He spits in the face of those who gave lives for this country @MaryLouMcDonald,@MaryLouMcDonald,,https://twitter.com/Mary2363/status/1214567299337687040
2020-01-07 15:04:58,MartyTroare,SteveDon78,0,0,He said as he pretends not to know what the 12th is,,,https://twitter.com/MartyTroare/status/1214563583134027776
2020-01-07 15:04:10,adevlinbailey,potstyx,1,0,Do you know joe?,,,https://twitter.com/adevlinbailey/status/1214563380679176195
2020-01-07 14:58:13,o7716235184,MaryLouMcDonald,0,0,Your voters are leaving in hundreds let's drum up the old hate card again give peace a chance,,,https://twitter.com/o7716235184/status/1214561883455250432
2020-01-07 14:52:42,Mary2363,sinnfeinireland,0,0,How about Leo buy a history book and see the devastation that the RIC brought to the people of this county . But then his relatives never lived in fear from them 😡,,,https://twitter.com/Mary2363/status/1214560495199383552
2020-01-07 14:51:10,Mary2363,sinnfeinireland,0,0,What’ll it is stirring up old hatred and an insult to those whose ancestors suffered under British Regime,,,https://twitter.com/Mary2363/status/1214560112611708929
2020-01-07 14:49:21,Mary2363,sinnfeinireland,0,0,Surely you are not going to allow this ceremony to go ahead . They were thieves and murderers !,,,https://twitter.com/Mary2363/status/1214559655331946497
2020-01-07 14:45:59,DipperMc,0xB0D,0,0,The truth is the truth! You should try opening you're eyes sometime? @FineGael have made (hardly for the first time) a bollocks of this celebration of the #RIC a highly divisive subject.,@FineGael,#RIC,https://twitter.com/DipperMc/status/1214558804567822337
2020-01-07 14:45:46,Mary2363,sinnfeinireland,0,0,He will be greatly missed . A great representative of our lively city,,,https://twitter.com/Mary2363/status/1214558752138919937
2020-01-07 14:39:10,Dave84961160,sinnfeinireland,0,0,I see members of the IRA Army Council there.... At least you don't have to run to them to get permission.... Scum!,,,https://twitter.com/Dave84961160/status/1214557089646800898
2020-01-07 14:37:37,0xB0D,DipperMc,1,0,Nice avatar BTW - balanced and appropriate 😉,,,https://twitter.com/0xB0D/status/1214556702546116610
2020-01-07 14:35:03,DipperMc,0xB0D,1,0,"No you are not, that is clear!",,,https://twitter.com/DipperMc/status/1214556055184822272
2020-01-07 14:33:15,0xB0D,DipperMc,1,0,What about my experience of living in the 6 counties ? Not too bright are we ?,,,https://twitter.com/0xB0D/status/1214555603412176896
2020-01-07 14:31:12,DipperMc,0xB0D,1,0,"Classic whataboutery, shouting WHATABOUTTHERA! (And please feel free to tell us all about your extensive experience living in the 6cs during the height of the violence?) Does not coverup the @FineGael Stockholm syndrome of celebrating the #RIC",@FineGael,#RIC,https://twitter.com/DipperMc/status/1214555085637849088
2020-01-07 14:30:42,JohnathanSRoss1,sweenboy45,1,0,You're talking the IRA were the goodies. Also literally the vast majority of RIC left alive went on to join the guards.,,,https://twitter.com/JohnathanSRoss1/status/1214554960370618373
2020-01-07 14:28:01,mjinko_ie,rabgee101,0,0,I do t see any criticism of loyalist paramilitaries on your posts.,,,https://twitter.com/mjinko_ie/status/1214554286589456385
2020-01-07 14:25:43,rabgee101,mjinko_ie,2,0,"against terrorism ,Sinn Fein are still directed by the army council and i will highlight islamic extremism . usually when you highlight these things those who support them play the racist and bigot card so you just follow a well tread path.",,,https://twitter.com/rabgee101/status/1214553704038387712
2020-01-07 14:22:24,sweenboy45,sweenboy45,0,0,It's a bit like of France held a commemoration for the Vichy,,,https://twitter.com/sweenboy45/status/1214552870370119680
2020-01-07 14:21:40,sweenboy45,JohnathanSRoss1,2,0,The RIC were nothing more than collaborators. Grassing up their own people to the British. Yes some left to join the IRA and others were agents for the IRA but in the main they were collaborators,,,https://twitter.com/sweenboy45/status/1214552688316149761
2020-01-07 14:19:03,ColmDore,ColmDore,0,0,"Given how FF politicians throw C20th events at SF politicians who were children in post-1969 conflict, hearing a leading FF politician tell a panel discussion of his unqualified hero worship of F. Aiken, it was interesting to reflect on q.s of moral superiority, hypocrisy, etc.",,,https://twitter.com/ColmDore/status/1214552028250288129
2020-01-07 14:12:25,tommy030355,MaryLouMcDonald,0,0,Did the army council order you to say that Mary Lou ?,,,https://twitter.com/tommy030355/status/1214550357742964736
2020-01-07 14:07:19,JohnathanSRoss1,sweenboy45,1,0,"If you think police beating people was unusual, you should go and count the amount of incidents in the world. Also do you have any other way that they could have kept law and order..?",,,https://twitter.com/JohnathanSRoss1/status/1214549075959439361
2020-01-07 14:06:02,0xB0D,ColmDore,0,0,"I'm aware of many distortions in the British political domain. ""Vexatious"" prosecutions for example. I just don't feel compelled to jump into the gutter with them. Perhaps the Shinners are captive of their ""armalite & ballotbox"" rhetoric of old as you say",,,https://twitter.com/0xB0D/status/1214548753606160384
2020-01-07 14:03:23,ColmDore,0xB0D,2,1,"It is daft and, perhaps, counterproductive, to expect any party to unilaterally recant its pre-peace narrative. By the way, SF talk about Kingsmill and Bloody Sunday in the same terms (""murder"", etc). Are you aware of any Unionist politicians or British politicians doing that?",,,https://twitter.com/ColmDore/status/1214548084501417984
2020-01-07 14:03:10,0xB0D,0xB0D,0,0,"If there's ever a UI - it will be in spite of Sinn Fein, not because of it. /3",,,https://twitter.com/0xB0D/status/1214548029866463233
2020-01-07 14:02:50,0xB0D,0xB0D,1,0,How will they ever 'on-board' small u unionists ? They won't is the answer. All of their border poll stuff is prole-feed for their electoral base. /2,,,https://twitter.com/0xB0D/status/1214547946664087554
2020-01-07 14:01:49,0xB0D,0xB0D,2,0,Shinners are perfectly entitled to express opinions. But actual distortion of truth ? And political point scoring .. Not so much. Plus is SF's cultural pitch supposed to bring about a UI ? Shinners can't even communicate with non-partisan Southern Irish. /1,,,https://twitter.com/0xB0D/status/1214547690802970625
2020-01-07 13:59:17,0xB0D,ColmDore,1,0,"I love how you manage to glide on past the other four points. SF has been all over the place on the border poll, at war with it's own ""leader"" on when and if it should happen. Not a good look for the self-appointed guardians of all that is properly Irish.",,,https://twitter.com/0xB0D/status/1214547054451679233
2020-01-07 13:58:06,ColmDore,ColmDore,1,0,"In any case, your reference to 5yrs time makes my point. Incidentally, which Dáil parties are entitled to moral superiority, re: C20th political violence? If the Shinners are not entitled to express a view, because of C20th history which parties are entitled to do so?",,,https://twitter.com/ColmDore/status/1214546755376812032
2020-01-07 13:57:41,0xB0D,ColmDore,1,0,Well you explain the response to me then. This is a party that has mealy-mouthed non-apologies about acts of terrorist barbarism - recently too - waxing on about RIC and DMP 100 years ago. Skewed and self-serving - not rabid then. Happy ?,,,https://twitter.com/0xB0D/status/1214546652540874752
2020-01-07 13:54:17,ColmDore,0xB0D,3,0,"Ancestral D1 connections are of little relevance compared to the fact that one of the active factors in the absence of equal partnership in the north-east today is a politics which refers to of the historically subordinated community requiring ""house-training"", ""crocodiles"", etc.",,,https://twitter.com/ColmDore/status/1214545796055654400
2020-01-07 13:50:01,0xB0D,0xB0D,3,0,Sinn Fein to my knowledge has never condemned the forced suicide bombing of British Army checkpoints. I mean - WTAF - who are these people to take the moral high ground on the feckin RIC ? Unbelievable ! /5,,,https://twitter.com/0xB0D/status/1214544723353964546
2020-01-07 13:48:05,0xB0D,0xB0D,1,0,"And indeed the entire rising, war of independence and civil war are littered with people of good conscience on all sides. Is more than a little rich - wouldn't you say. /4",,,https://twitter.com/0xB0D/status/1214544235195781120
2020-01-07 13:47:59,adriancooke2,PaddyShanks,0,0,Try again,,,https://twitter.com/adriancooke2/status/1214544211585974273
2020-01-07 13:47:50,refsupreme,JoeCassidyIRE,0,1,I think Joe with the greatest of respect RTE have 2 big stories to feature today ..that other abomination will get its due coverage in fact @MaryLouMcDonald gave it plenty of stick on @NewstalkFM this morning and @morningireland covered it ..,@MaryLouMcDonald @NewstalkFM @morningireland,,https://twitter.com/refsupreme/status/1214544173187182593
2020-01-07 13:47:50,HughGillanders,,0,0,I am not looking at the wrongs/rights of them but how we deal with some extremely sensitive and painful commemorations - that is no celebration - how for example am a relative of a grand-uncle killed in 1922 to learn from that - Mandella noted 'forgiveness liberates the soul'.,,,https://twitter.com/HughGillanders/status/1214544170569936901
2020-01-07 13:47:21,0xB0D,0xB0D,1,0,"And SF's bleating about the past doesn't seem to extend to the families of the people the IRA murdered or maimed. Some pathetically weak stuff about how there was suffering on ""all sides"" - while castigating @FineGael for having the temerity to suggest the RIC /3",@FineGael,,https://twitter.com/0xB0D/status/1214544049878786050
2020-01-07 13:46:05,0xB0D,0xB0D,3,0,"And umm, as someone who's family was resident in Dublin 1 in the Gardiners street area for at least five generations - including during the rising - I literally am one of the historically ""subordinated"" but - frankly 100 years is a long time /2",,,https://twitter.com/0xB0D/status/1214543733162741760
2020-01-07 13:44:26,0xB0D,ColmDore,1,0,Literally SF - Called for a border poll after the 2016 result - Then @MaryLouMcDonald said 'not now' - Then the old guard shouted her down - Subsequently she called for a poll - Then it became border poll on #NoDeal - Now its one in five years /1,@MaryLouMcDonald,#NoDeal,https://twitter.com/0xB0D/status/1214543317591085057
2020-01-07 13:41:44,PaddyShanks,adriancooke2,1,0,"An ancestor perhaps: Const George Cooke Died 1 July 1872, aged 40 Shot dead while in the execution of his duty in Co. Donegal.",,,https://twitter.com/PaddyShanks/status/1214542635341418498
2020-01-07 13:40:31,sweenboy45,JohnathanSRoss1,0,0,"Yeah like that was going to happen. This ""was just following orders"" is the greatest load of shite ever. They've done nothing to be commemorated for",,,https://twitter.com/sweenboy45/status/1214542331745128448
2020-01-07 13:40:12,neiley2,sinnfeinireland,0,0,How many more people have to kill themselves before you put mental health over the ILA. Fucking joke.,,,https://twitter.com/neiley2/status/1214542251055079426
2020-01-07 13:38:39,sweenboy45,JohnathanSRoss1,1,0,Wouldn't say now the RIC were as holy as u make them out to be. They had no problem turfing hungry people out of their homes and stood by while the tans did what they did and even backed them up. The DMP beat strikers in the lockout. Their idea of keeping law and order was loose,,,https://twitter.com/sweenboy45/status/1214541861144141825
2020-01-07 13:25:32,QMorrissey,sonofshwing,0,0,"Jack, If one of your relatives were a member of the SS during WWII would you want Ireland to commemorate the institution to which your honorable relative joined?",,,https://twitter.com/QMorrissey/status/1214538560981864449
2020-01-07 13:22:30,PaddyShanks,adriancooke2,2,0,"Coming from you that's indeed a compliment, thanks.",,,https://twitter.com/PaddyShanks/status/1214537795773091840
2020-01-07 13:21:03,Troymcclure869,mike04342281,0,0,"Lloyd George might have some wiley tricks , on how our volunteers to fix, but all his Black n Tans were sick when they think of Barry;s Column, Oh but isn't great to see The Tommies and the R.I.C The Black And Tans and the Staters flee Away from Barry's Column",,,https://twitter.com/Troymcclure869/status/1214537433959845888
2020-01-07 13:20:51,bbreathnach,sinnfeinireland,0,0,"Curious: Where does @MaryLouMcDonald and @sinnfeinireland stand on commemorating Irishmen like Bram Stoker who worked in Dublin Castle to administer British Rule as a petty clerk, enforced dog licenses with RIC on poor tenants?",@MaryLouMcDonald @sinnfeinireland,,https://twitter.com/bbreathnach/status/1214537382852268038
2020-01-07 13:20:10,AMontyspurs,paddytmurray,0,0,They allready do the terrorist loving bastards,,,https://twitter.com/AMontyspurs/status/1214537208268492800
2020-01-07 13:17:12,potstyx,adevlinbailey,1,0,"""I'm not sexist but....."" The mantra of every self delusional misogynist 💤",,,https://twitter.com/potstyx/status/1214536463683137537
2020-01-07 13:15:25,PaddyShanks,duffykevin11,0,0,"Correct, well done!",,,https://twitter.com/PaddyShanks/status/1214536015442042880
2020-01-07 13:13:19,adriancooke2,PaddyShanks,1,0,Paddy I’m not sure what planet your from but you haven’t a clue about Irish history !,,,https://twitter.com/adriancooke2/status/1214535485458128897
2020-01-07 13:12:52,BasiaWolf,BalorTheIrish,0,0,"It affects us all, including you @moneillsf",@moneillsf,,https://twitter.com/BasiaWolf/status/1214535371406675968
2020-01-07 13:08:49,Troymcclure869,boceallachain,0,0,A bit like the French commemorating the collaborationist Vichy Milice or the Algerians commemorating the Pied Noirs. You can be inclusive and welcoming without revising factual events.,,,https://twitter.com/Troymcclure869/status/1214534354266923009
2020-01-07 13:07:36,GeorgeS13186341,BalorTheIrish,0,0,@moneillsf wouldn't help Mairia Cahill after @sinnfeinireland member raped her. What makes you think they'll help @EmmandJDeSouza?,@moneillsf @sinnfeinireland @EmmandJDeSouza,,https://twitter.com/GeorgeS13186341/status/1214534045297713152
2020-01-07 13:04:57,GovEngland,MaryLouMcDonald,0,1,"Madam you've missed the point of commemoration! It's not about what one's done wrong but about the lives that existed for law & order at the time, let's face it, not all were law abiding, nowhere is perfect after all. Irish people served the British empire & should be remembered.",,,https://twitter.com/GovEngland/status/1214533379326119936
2020-01-07 12:46:40,lundo1888,AnNbsym,0,0,Oh ye of little faith. Watch and learn,,,https://twitter.com/lundo1888/status/1214528778757644290
2020-01-07 12:40:56,jay89898989,sonofshwing,0,0,The Irish language never killed anyone you cabbage,,,https://twitter.com/jay89898989/status/1214527337380958208
2020-01-07 12:37:19,Constcrepe,BennGunn3,1,0,"But remember SF don't want to really recognise unionism or hold it as an equal tradition on this island. Until unionism is accepted as being a legitimate tradition and aspiration which people have every right to hold, they will never be peace here.",,,https://twitter.com/Constcrepe/status/1214526428227756032
2020-01-07 12:24:23,RabbyjohnRh,MaryLouMcDonald,0,0,"Dont sweat it,Globalism says there are no nations,only European masses. Love the EU sweeteners while you can,its all downhill from here...",,,https://twitter.com/RabbyjohnRh/status/1214523173380743168
2020-01-07 12:12:18,Dublin45078537,joannatuffy,0,0,"Increasing pension age is that not a crime for thousands of men and women who have worked all their lives ,so you can keep your head in the troff ,been forced to go on the dole",,,https://twitter.com/Dublin45078537/status/1214520131923173376
2020-01-07 12:11:11,McPeelerFace,MeFein83,0,0,The PIRA never disbanded. This is a publicly available fact. No one in the PSNI would seriously suggest that they ever disbanded.,,,https://twitter.com/McPeelerFace/status/1214519850946760706
2020-01-07 12:09:34,BorderSolution_,MeFein83,0,0,They did not say the IRA had disbanded otherwise it would not still exist.,,,https://twitter.com/BorderSolution_/status/1214519444468318208
2020-01-07 12:08:53,MeFein83,BorderSolution_,1,0,The fact the PSNI (of which you stated earlier said otherwise) said the P.I.R.A are disbanded and committed to peace means they are not operating. You're still clinging to the council to deem them as 'operating'. You know more than the P.S.N.I? Are you Jamie Bryson? Lol,,,https://twitter.com/MeFein83/status/1214519272577359872
2020-01-07 12:04:28,Redeyes1878,moneillsf,0,0,"I can’t read it, have you got an Irish version?",,,https://twitter.com/Redeyes1878/status/1214518158549245952
2020-01-07 12:00:07,adevlinbailey,grant_maura,0,0,I'd hope so,,,https://twitter.com/adevlinbailey/status/1214517064494399488
2020-01-07 11:55:35,BorderSolution_,MeFein83,1,0,No it is use trying to twist the words. Do keep up. The IRA exists. Therefore it is operating. It is very straight forward. What exactly do you not understand?,,,https://twitter.com/BorderSolution_/status/1214515925749239810
2020-01-07 11:54:11,cloneywill,PatKennyNT,0,0,True words marylou,,,https://twitter.com/cloneywill/status/1214515570340708352
2020-01-07 11:50:06,MeFein83,BorderSolution_,2,0,"LMAO. Still trying to twist words and change context. The PSNI's own view bis that the P.I.R.A has disbanded. Therefore, it is not 'operating'. You still have not explained how it is still operating. And don't waste time trying to use excuse of the Army Council...",,,https://twitter.com/MeFein83/status/1214514545491873792
2020-01-07 11:49:45,jenny87797866,MaryLouMcDonald,0,0,Please you and your party are the same snake that has sold this country out!!,,,https://twitter.com/jenny87797866/status/1214514457218605056
2020-01-07 11:47:28,JimBob06694610,sinnfeinireland,0,0,"Fine Gael ""maturing"" into a fascist party?",,,https://twitter.com/JimBob06694610/status/1214513882703646726
2020-01-07 11:45:28,grant_maura,adevlinbailey,1,0,How nice. I’m sure your family must be very proud...,,,https://twitter.com/grant_maura/status/1214513376602267648
2020-01-07 11:44:04,grant_maura,sinnfeinireland,0,0,How nice. I’m sure your family must be very proud,,,https://twitter.com/grant_maura/status/1214513025379635202
