date,username,to,replies,retweets,text,mentions,hashtags,permalink
2020-01-06 17:33:28,AtownColm,MaryLouMcDonald,0,0,"🎶Now the RIC were hunting for, Sir Roger High and low. They found him at mckennas Fort...... 🎶 Cancel this event @LeoVaradkar",@LeoVaradkar,,https://twitter.com/AtownColm/status/1214238567742001156
2020-01-06 17:32:43,GreySealHugger,MaryLouMcDonald,0,0,DISGUSTING!! 🤬🤬🤬🤬,,,https://twitter.com/GreySealHugger/status/1214238376766906371
2020-01-06 17:30:38,kevygalbraith,sonofshwing,0,0,stick to being a Virgin and playing sonic you absolute tube,,,https://twitter.com/kevygalbraith/status/1214237855779901441
2020-01-06 17:29:21,Earthwormal,Tsm38020929,1,0,...it's a disgrace that brave Irishmen upholding law and order cannot be remembered for their duty and loyalty ....our blood is all the same colour,,,https://twitter.com/Earthwormal/status/1214237533128839170
2020-01-06 17:26:17,GlasgowBhoy,boceallachain,1,0,"Inclusivity to unionists has nothing to with lauding ""the local police force"" which administered British rule in Ireland, aided the landlords, Black and Tans and auxiliaries. Why not ask FG why their former minister for Justice, Seán MacEoin, killed a dozen of them?",,,https://twitter.com/GlasgowBhoy/status/1214236759908921355
2020-01-06 17:25:03,Tsm38020929,sinnfeinireland,4,0,"Well said Mary , it’s beyond a disgrace",,,https://twitter.com/Tsm38020929/status/1214236449916293122
2020-01-06 17:23:47,ComiskeyAnthony,PaddyShanks,0,0,Ooh ahh,,,https://twitter.com/ComiskeyAnthony/status/1214236128208924672
2020-01-06 17:21:34,KearneyConal,MaryLouMcDonald,0,0,"I totally agree, of course it must be cancelled. It is as offensive as commerating Hitler's S.S..",,,https://twitter.com/KearneyConal/status/1214235571066953728
2020-01-06 17:21:29,ComiskeyAnthony,Michael__Daly,0,0,Support don't criticise. Don't be an Idiot!,,,https://twitter.com/ComiskeyAnthony/status/1214235550552674307
2020-01-06 17:21:08,TerryLingwood,MaryLouMcDonald,0,2,Patrick Goggin murdered by the black & tans in 1921 at the age of 7 is enough of a reason NOT to commemorate them in any way!,,,https://twitter.com/TerryLingwood/status/1214235464800100362
2020-01-06 17:21:08,sarmcdonnell,timoconnorbl,0,0,"The RIC commemoration is a complicated one to deal with, especially when there were many family members who spent time in prison because of the war of independence and the RIC. However absolute shame on 2020 Sinn Fein’s narrative, which is far from the reality of the day.",,,https://twitter.com/sarmcdonnell/status/1214235464644907008
2020-01-06 17:20:02,boceallachain,GlasgowBhoy,3,0,How can you promise inclusivity to unionists when you can’t give it to families whose ancestors were poor Irish catholics who joined the local police force... those sort of barriers lad.,,,https://twitter.com/boceallachain/status/1214235188110254081
2020-01-06 17:16:35,SPENCE_JOHN,sinnfeinireland,0,1,Stop commemorations of Provo sectarian mass murderers,,,https://twitter.com/SPENCE_JOHN/status/1214234317771153410
2020-01-06 17:12:36,irrpfad,MaryLouMcDonald,0,0,This is perverse.,,,https://twitter.com/irrpfad/status/1214233316708290560
2020-01-06 17:11:35,MarkFegan17,MaryLouMcDonald,0,0,"Its same old 26 counties, Sucking up to the very people who murder us in there thousand, Why dosen't Leo and his blue shirts merry men FOOK OF TO ENGLAND IF THEY SO WANT TO BE BRITS",,,https://twitter.com/MarkFegan17/status/1214233059857502208
2020-01-06 17:11:13,cncpinky,,0,0,Ah now it’s @MaryLouMcDonald fault but Charlie’s not going to advise her #drivetime @drivetimerte #BlackandTans,@MaryLouMcDonald @drivetimerte,#drivetime #BlackandTans,https://twitter.com/cncpinky/status/1214232968874643456
2020-01-06 17:07:53,JamieJohnston4,MaryLouMcDonald,0,0,"Glad to see your inclusiveness agenda working so well, Mary Lou.",,,https://twitter.com/JamieJohnston4/status/1214232130743676934
2020-01-06 17:07:13,ComiskeyAnthony,joannatuffy,1,0,Are U still around? Liebour! Ooh ahh,,,https://twitter.com/ComiskeyAnthony/status/1214231961574748165
2020-01-06 17:05:17,IrishBardamu,boceallachain,1,0,"If you were French, youd be commemorating the Milice.",,,https://twitter.com/IrishBardamu/status/1214231473030672386
2020-01-06 17:04:38,DipperMc,sonofshwing,0,0,People who supported a foreign #Empire in their occupation of Ireland are by the very definition #Traitors #Warcrimes #RIC (no one is forcing you to speak the Irish language with which you have an illogical hatred off),,#Empire #Traitors #Warcrimes #RIC,https://twitter.com/DipperMc/status/1214231310815911945
2020-01-06 17:04:38,PaddyShanks,ComiskeyAnthony,1,0,"What is it you wish to say? Peace between ""orange"" and ""green"" perhaps, I'll assume that!",,,https://twitter.com/PaddyShanks/status/1214231309217869825
2020-01-06 17:04:16,ToddLaw,sonofshwing,1,0,Put both to Referendums and you'd soon see what the majority view would be.,,,https://twitter.com/ToddLaw/status/1214231218339876865
2020-01-06 17:02:29,timoconnorbl,DarranMarshall,1,0,"She unveiled a statue to a man who subverted the Irish State and sought help from Nazi Germany, dying on a U-Boat. She might want to sit out any discussions of commemorations.",,,https://twitter.com/timoconnorbl/status/1214230770241429506
2020-01-06 17:01:41,Buddhasthong,MaryLouMcDonald,0,0,Look forward to the British Legion commemorating the brave Luftwaffe this year.,,,https://twitter.com/Buddhasthong/status/1214230567081918466
2020-01-06 17:00:51,PaddyShanks,MaryLouMcDonald,3,3,"1836 to 1916 (80 years) just 64 RIC killed through ill deed or accident, less than one per annum, didn't seem that unpopular. Republicans made them into ogres after 1916 513 were killed by the IRA between 1919-21 while 682 were wounded. Vast majority Irish and Catholic. Brave men",,,https://twitter.com/PaddyShanks/status/1214230358494994432
2020-01-06 17:00:37,ComiskeyAnthony,boceallachain,0,0,Go wear your poppy!,,,https://twitter.com/ComiskeyAnthony/status/1214230298529058822
2020-01-06 17:00:36,RyanBudgie,sonofshwing,1,0,The Irish language didn't murder anyone's loved ones so maybe you should choose a different angle of criticism of SF?,,,https://twitter.com/RyanBudgie/status/1214230295635013633
2020-01-06 17:00:26,sinnfeinireland,,63,210,State commemoration of the RIC must be cancelled - @MaryLouMcDonald 📰 Full statement here: https://www.sinnfein.ie/contents/55668,@MaryLouMcDonald,,https://twitter.com/sinnfeinireland/status/1214230255457775616
2020-01-06 16:58:57,ComiskeyAnthony,PeteThompson175,0,0,U should be still in prison.,,,https://twitter.com/ComiskeyAnthony/status/1214229881594269696
2020-01-06 16:58:49,PaddyShanks,MaryLouMcDonald,11,3,"My four grandparents were part of ""your"" history, I have never heard a story about them brutally suppressed. The RIC were recognised as the best police force in the world. Poorly paid but well trained and all very brave men, drawn from both religions. Read about them !",,,https://twitter.com/PaddyShanks/status/1214229847477805058
2020-01-06 16:58:42,DipperMc,boceallachain,1,0,"Completely untrue off course, the #RIC worked closely with the Black&amp;Tans providing intelligence manpower all to support the #British occupation of Ireland, including evicting people during the so called #Famine and protecting the docks as vast amounts of food was exported.",,#RIC #British #Famine,https://twitter.com/DipperMc/status/1214229817119379456
2020-01-06 16:58:02,GlasgowBhoy,boceallachain,1,0,What barriers? What's inclusive about lauding the RIC? Will we just cede all sovereignty back to Westminster next?,,,https://twitter.com/GlasgowBhoy/status/1214229651536650240
2020-01-06 16:57:41,ComiskeyAnthony,iAMmrDebbie,0,0,Go to Commemoration then!,,,https://twitter.com/ComiskeyAnthony/status/1214229560285417472
2020-01-06 16:55:25,DipperMc,joannatuffy,0,0,Interesting comments from a onetime friend of #Israel? #Warcrimes,,#Israel #Warcrimes,https://twitter.com/DipperMc/status/1214228991038631936
2020-01-06 16:55:21,PaddyShanks,HighkingThe,1,0,"Const Patrick McGoldrick, 59 Died 25 April 1920 along with ""Cornie"" Crean, Tom Crean's brother. Shot dead when ambushed by IRA gunmen. ""The news came as a terrible shock in Cork, where ‘Cornie’ Crean was a popular police officer, and a familiar figure on the rugby pitch.""",,,https://twitter.com/PaddyShanks/status/1214228972801839105
2020-01-06 16:55:13,chrishiking,boceallachain,1,2,"The long-serving RIC members who planned and carried out the murder of Tomas MacCurtain, Lord Mayor of Cork were included a District Inspector. Do you want to commemorate those thugs as well?",,,https://twitter.com/chrishiking/status/1214228939415134208
2020-01-06 16:54:49,NI_Citizen_69,MaryLouMcDonald,0,0,Belfast council is giving you a Million pounds for an IRA terror museum ffs!,,,https://twitter.com/NI_Citizen_69/status/1214228840169574400
2020-01-06 16:53:24,GlasgowBhoy,joannatuffy,0,0,Josnna you support Israel which has broken more UN resolutions and committed more war crimes than any other. What a brass neck statement to make.,,,https://twitter.com/GlasgowBhoy/status/1214228484786184192
2020-01-06 16:53:15,RichardJGrant,PeteThompson175,1,2,Do germans commemorate the SS? The french the Vichy regime? That's the reason we shouldn't be commemorating the RIC and its associated groups,,,https://twitter.com/RichardJGrant/status/1214228447679127555
2020-01-06 16:52:23,ComiskeyAnthony,joanie_mc,0,0,"But U always praise FG Scum including Neale ""Mutton Head"" Richmond!",,,https://twitter.com/ComiskeyAnthony/status/1214228227515961344
2020-01-06 16:51:29,ComiskeyAnthony,MaryLouMcDonald,1,0,Charlo Flanagan Scumbag on RTÉ Radio One 5pm+ with Evil Mad Mary Wilson! There's a meeting in the Teachers Club on 10th 8pm re Protest against it on 17th. Many Facebook pages are talking about it! Could be a nice big protest.,,,https://twitter.com/ComiskeyAnthony/status/1214228003624046592
2020-01-06 16:51:09,mike04342281,MaryLouMcDonald,1,1,Cancel this event; it's a slur on those that fought for Irish Freedom; Black & Tans RIC.,,,https://twitter.com/mike04342281/status/1214227918148308992
2020-01-06 16:49:24,sonofshwing,MaryLouMcDonald,17,3,"You're very selective on what history you support Mary Lou. You want to force an Irish Language Act on the people of Northern Ireland as it's part of our history and heritage, apparently, yet you don't want to commemorate the RIC even though they are part of Ireland's history??",,,https://twitter.com/sonofshwing/status/1214227477473701888
2020-01-06 16:48:19,covber1,MaryLouMcDonald,0,2,"Our ""Tory"" party will commemorate anything and anyone who has kept the Irish working class in their ""place"" as they see it. Leo is a narrow minded, nasty, D4 snob, he has made sure he continued on with the disgusting treatment of the working class, whilst the rich got richer.",,,https://twitter.com/covber1/status/1214227206001627138
2020-01-06 16:47:14,DarranMarshall,,1,3,"Royal Irish Constabulary. Sinn Féin president @MaryLouMcDonald has called on the Irish Government to cancel the proposed state commemoration. ""In no other State would those who facilitated the suppression of national freedom be commemorated by the State."" ",@MaryLouMcDonald,,https://twitter.com/DarranMarshall/status/1214226933849952258
2020-01-06 16:47:14,Aodhan44,MaryLouMcDonald,0,0,"makes no sense to me how anyone could commemorate them? not saying they were “evil” but they were the people who didn’t want irish freedom, literally has royal in the name",,,https://twitter.com/Aodhan44/status/1214226930083516416
2020-01-06 16:46:47,joannatuffy,MaryLouMcDonald,14,2,"The issue is that war crimes should not be whitewashed, no matter who committed same. You have yet to condemn war crimes of the IRA",,,https://twitter.com/joannatuffy/status/1214226819643252737
2020-01-06 16:46:24,PeteKearney,MaryLouMcDonald,1,0,I thought this was waterford whispers ?,,,https://twitter.com/PeteKearney/status/1214226724071841793
2020-01-06 16:44:01,neil90825478,MaryLouMcDonald,0,0,Disgusting behaviour,,,https://twitter.com/neil90825478/status/1214226121820180480
2020-01-06 16:42:54,boceallachain,MaryLouMcDonald,11,3,It’s ironic that those that call for an inclusive United Ireland are the first to come out and place barriers in the way of an inclusive United Ireland. The long serving RIC/DMP can easily be distinguished from the very short reign of the B&Ts.,,,https://twitter.com/boceallachain/status/1214225839719669761
2020-01-06 16:40:39,Michael__Daly,MaryLouMcDonald,1,0,"So what's Sinn Féin gonna do about this, fighting the english for 800yrs only to let LEO deliberately commemorate these scumbags",,,https://twitter.com/Michael__Daly/status/1214225275485114368
2020-01-06 16:40:36,Gl3nnC77,MaryLouMcDonald,0,2,"The detachment between government & citizen has never been greater,its Us & Them,we don’t count,different species,a divide created by FG to keep us in our place,they see the people as insignificant,as shown in healthcare & housing,I’d love to see the view from their ivory towers.",,,https://twitter.com/Gl3nnC77/status/1214225262180786176
2020-01-06 16:39:47,RichardJGrant,iAMmrDebbie,0,0,"No, as a new unified state will not be commemorating them either? Why would it?",,,https://twitter.com/RichardJGrant/status/1214225056190156801
2020-01-06 16:35:50,sammyboy_197,moneillsf,0,0,Absolutely correct so please no red lines or stupid demands!!,,,https://twitter.com/sammyboy_197/status/1214224062488203265
2020-01-06 16:34:43,Civis_Major,MaryLouMcDonald,0,0,As in a Garden in Dublin @RoyalFamily an English Head is bowed.,@RoyalFamily,,https://twitter.com/Civis_Major/status/1214223780094054402
2020-01-06 16:33:32,lundo1888,MaryLouMcDonald,1,0,Disgusting,,,https://twitter.com/lundo1888/status/1214223482369781760
2020-01-06 16:32:52,miklebobsixty6,MaryLouMcDonald,0,0,Disgrace to the memory of all those murdered and maimed by these thugs and gangsters,,,https://twitter.com/miklebobsixty6/status/1214223317948870657
2020-01-06 16:30:05,gavinoconnor,MaryLouMcDonald,0,0,"Or use the money to tackle our current national shame, homelessness and our hospitals.",,,https://twitter.com/gavinoconnor/status/1214222617349152773
2020-01-06 16:28:40,MaryLouMcDonald,,188,731,"Govt commemoration of RIC, Black&Tans, DMP a calculated insult to all who stood for Irish freedom. Nowhere else would those who brutally suppressed national freedom be afforded a state commemoration. Crass Fine Gael revisionism gone too far. Cancel this event @LeoVaradkar",@LeoVaradkar,,https://twitter.com/MaryLouMcDonald/status/1214222257775685632
2020-01-06 16:25:18,paullogue22,moneillsf,0,0,You should tell this to Maria Anderson. She is the queen of soundbites.,,,https://twitter.com/paullogue22/status/1214221411977498624
2020-01-06 16:23:45,pauldelaney2012,moneillsf,0,0,Ohh God help us all.,,,https://twitter.com/pauldelaney2012/status/1214221022611804161
2020-01-06 15:52:45,Corrib_West,Mappermick,0,0,"I’m sure Sinn Fein and @MaryLouMcDonald will happily tell us all with their usual indignant tone that it’s none of our business. Transparency only when it suits, voters come first, when it suits, and don’t dare question the Sinn Fein two faced arguments ",@MaryLouMcDonald,,https://twitter.com/Corrib_West/status/1214213219306364928
2020-01-06 15:38:14,ktorney4,moneillsf,0,0,"Well said Michelle, the GFA is the only way forward.",,,https://twitter.com/ktorney4/status/1214209566067572737
2020-01-06 15:32:58,PatsyPat27,moneillsf,0,0,Get he finger out then,,,https://twitter.com/PatsyPat27/status/1214208241321811971
2020-01-06 15:27:39,MeFein83,rtg1968,1,0,"DUP put blocking an already agreed act, over NHS...",,,https://twitter.com/MeFein83/status/1214206905192796160
2020-01-06 13:35:08,arconadaarmstr1,moneillsf,0,0,Its 44 years since the Kingsmill massacre by SFIRA. Respect whenever your people own up and hand themselves in.,,,https://twitter.com/arconadaarmstr1/status/1214178586871181313
2020-01-06 13:20:10,Lothario664,,0,0,@FineGael @fiannafailparty @MaryLouMcDonald celebrating the black&amp;tans or RIC is akin to Jews celebrating Nazi #Traitors,@FineGael @fiannafailparty @MaryLouMcDonald,#Traitors,https://twitter.com/Lothario664/status/1214174823162753025
2020-01-06 13:16:43,Danko1975,BTxabal,0,0,"In Spain we have a democratic state, we don’t have political prisioner.",,,https://twitter.com/Danko1975/status/1214173955705192448
2020-01-06 12:49:05,BTxabal,caoimhinmgm,1,0,"Sorry? Political prisoner? He was a terrorist and a murderer, who has never regretted his crimes",,,https://twitter.com/BTxabal/status/1214166999183560704
2020-01-06 12:44:27,ceowmd65,,0,0,@BorisJohnson Any expansion of the reach and influence of the @commonwealthsec is in the best interests of Britain and the Commonwealth of Nations. @Lagarde @MichelBarnier @sajidjavid @JulianSmithUK @MaryLouMcDonald @BillClinton @GerryAdamsSF @antonioguterres @RoyalFamily @VP,@BorisJohnson @commonwealthsec @Lagarde @MichelBarnier @sajidjavid @JulianSmithUK @MaryLouMcDonald @BillClinton @GerryAdamsSF @antonioguterres @RoyalFamily @VP,,https://twitter.com/ceowmd65/status/1214165834320486401
2020-01-06 12:16:25,derg_girl2020,moneillsf,0,0,You know nothing about respect or integrity!!!!,,,https://twitter.com/derg_girl2020/status/1214158780688191493
2020-01-06 12:14:34,Therumpokid2,moneillsf,0,0,"No thanks, moll",,,https://twitter.com/Therumpokid2/status/1214158312431898625
2020-01-06 12:11:46,rtg1968,moneillsf,1,0,Yes we need an assembly but not on your terms you have put an Irish language act in front of the NHS you should be ashamed but then SFIRA never done any wrong,,,https://twitter.com/rtg1968/status/1214157609214861312
2020-01-06 11:28:38,TheSpinDoctor3,moneillsf,1,0,More tripe from someone looking for a state pension,,,https://twitter.com/TheSpinDoctor3/status/1214146753840197643
2020-01-06 10:03:34,Corksouthnews,,0,0,@INMO_IRL @SimonHarrisTD @FineGael @Michael_O_Regan @cooper_m @pmessy @JP_Cork @C103Cork @deshocks @HangBlaa @RealPMurphy @sinnfeinireland @MaryLouMcDonald @MichealMartinTD @LeoVaradkar Enough said,@INMO_IRL @SimonHarrisTD @FineGael @Michael_O_Regan @cooper_m @pmessy @JP_Cork @C103Cork @deshocks @HangBlaa @RealPMurphy @sinnfeinireland @MaryLouMcDonald @MichealMartinTD @LeoVaradkar,,https://twitter.com/Corksouthnews/status/1214125346725023744
2020-01-06 09:50:40,goldenhart1234,,0,0,@MaryLouMcDonald do not go back to Stormont without a stand-alone Irish language act if you go back without one you will lost the hardline republican vote that has stood beside years and protested on the streets with yous from the start if you have to go to the elections go,@MaryLouMcDonald,,https://twitter.com/goldenhart1234/status/1214122097825472512
2020-01-06 07:51:11,derg_girl2020,MaryLouMcDonald,0,1,"#OnThisDay in 1980 the IRA murdered James Cochrane, 21. 8th Catholic UDR murdered. Mother “He died for his country. We feel deeply for the other families who are going through the same as we are are”. She successfully campaigned to have his name added to Downpatrick cenotaph #OTD",,#OnThisDay #OTD,https://twitter.com/derg_girl2020/status/1214092032584638464
2020-01-06 03:12:28,BelongsIrish,Rosecomment,0,0,Sounds like @MaryLouMcDonald a.d @sinnfeinireland,@MaryLouMcDonald @sinnfeinireland,,https://twitter.com/BelongsIrish/status/1214021887824728064
2020-01-05 23:49:29,canisgallicus,EFFanning,0,0,r/mend http://watchers.ie @GerryCarrollPBP @GerryMoriartyIT @GerryKellyMLA @gerryconway @GerryAdamsSF @MaryLouMcDonald @luberachi @IrishMirror @ancienteastIRL @EamoD @columeastwood @ThomasByrneTD @colettebrowne @bbcradioulster @EamonMelia,@GerryCarrollPBP @GerryMoriartyIT @GerryKellyMLA @gerryconway @GerryAdamsSF @MaryLouMcDonald @luberachi @IrishMirror @ancienteastIRL @EamoD @columeastwood @ThomasByrneTD @colettebrowne @bbcradioulster @EamonMelia,,https://twitter.com/canisgallicus/status/1213970804888788992
2020-01-05 23:41:05,canisgallicus,echolivecork,0,0,Beautifully written interview of a man w a heart; thankfully he is studying law & I wish Jonathan every success and believe him when he says he will remain involved in social issues at a grassroots level. @MaryLouMcDonald r/mend Watchers see Ian Bailey piece @MichealMartinTD,@MaryLouMcDonald @MichealMartinTD,,https://twitter.com/canisgallicus/status/1213968694994522112
2020-01-05 23:38:45,lulinspector,NoelMcgree,0,0,The Appg is a sham set up only after the Government outed .@shahmiruk they ignore #Whistleblowers evidence if it incriminates them or those close to them. Some #Whistleblowers flourish others are ruined.,@shahmiruk,#Whistleblowers #Whistleblowers,https://twitter.com/lulinspector/status/1213968104222535680
2020-01-05 23:33:47,NoelMcgree,lulinspector,1,3,It is an opportunity for any political leaders to prove that they really campaign on an anti corruption manifesto to bravely step up and represent #whistleblowers @LeoVaradkar @MichealMartinTD @MaryLouMcDonald @BrendanHowlin,@LeoVaradkar @MichealMartinTD @MaryLouMcDonald @BrendanHowlin,#whistleblowers,https://twitter.com/NoelMcgree/status/1213966857595686913
2020-01-05 22:53:20,tommycn19,,0,1,"There are still, unbelievably So, 2 Gobshites who think @SimonHarrisTD should remain as Minister for HEALTH.. Harris himself and that other Idiot who actually gave 'The Boy' the Gig...@LeoVaradkar roll on the no confidence vote ..🙋‍♀️..@MaryLouMcDonald @labour @JMcGuinnessTD",@SimonHarrisTD @LeoVaradkar @MaryLouMcDonald @labour @JMcGuinnessTD,,https://twitter.com/tommycn19/status/1213956676816162824
2020-01-05 22:49:18,sinnfeinireland,,3,19,Sinn Féin President @MaryLouMcDonald thanks Jonathan O'Brien TD for his 'massive contribution' http://sinnfein.ie/contents/55659,@MaryLouMcDonald,,https://twitter.com/sinnfeinireland/status/1213955662583140353
2020-01-05 21:36:08,forces_forum,,0,0,...Ireland’s best. Ireland’s bravest. We salute you. @leovaradkar @MichealMartinTD @brendanhowlin @MaryLouMcDonald @EamonRyan @simoncoveney @campaign4kehoe @fiachkelly @JohnDowning2 @obraonain @donlav @ConorGallaghe_r,@LeoVaradkar @MichealMartinTD @BrendanHowlin @MaryLouMcDonald @EamonRyan @simoncoveney @campaign4kehoe @fiachkelly @JohnDowning2 @obraonain @donlav @ConorGallaghe_r,,https://twitter.com/forces_forum/status/1213937249022365698
2020-01-05 21:33:29,tommycn19,donlav,0,0,Blue shirt revisionism...@fiannafailparty @MaryLouMcDonald ..please stop this ,@fiannafailparty @MaryLouMcDonald,,https://twitter.com/tommycn19/status/1213936582094475265
2020-01-05 19:57:48,canisgallicus,RuthCoppingerSP,0,0,r/mend http://watchers.ie Black &amp; Tans commemoration @MaryLouMcDonald @M_AndersonSF @J_Donaldson_MP @DUPleader @CWeston_Indo @ggreenwald @Snowden @RuthDE @EamonnHolmes @HackneyAbbott @kevinpbreslin @caulmick @BelTel @CorkNews @OfficialCorkGAA @PresidentIRL @ft @EamonMelia,@MaryLouMcDonald @M_AndersonSF @J_Donaldson_MP @DUPleader @CWeston_Indo @ggreenwald @Snowden @RuthDE @EamonnHolmes @HackneyAbbott @kevinpbreslin @caulmick @BelTel @CorkNews @OfficialCorkGAA @PresidentIRL @FT @EamonMelia,,https://twitter.com/canisgallicus/status/1213912502997794816
2020-01-05 18:35:41,DudeDilligaf,RepublicanSF,0,0,@M_AndersonSF @CaralNiChuilin @GerryKellyMLA @GerryAdamsSF @ChrisHazzardSF @sinnfeinireland @MaryLouMcDonald @moneillsf @newbelfast @mccannj67 @seanlynch122 @FramccannMLA @AlexMaskeySF @PatDohertySF @PatSheehanMLA @GearoidOhEara @Ianmilnesf OMFG Shame Fein-IRA Terrorist Scumbags,@M_AndersonSF @CaralNiChuilin @GerryKellyMLA @GerryAdamsSF @ChrisHazzardSF @sinnfeinireland @MaryLouMcDonald @moneillsf @newbelfast @mccannj67 @seanlynch122 @FramccannMLA @AlexMaskeySF @PatDohertySF @PatSheehanMLA @GearoidOhEara @Ianmilnesf,,https://twitter.com/DudeDilligaf/status/1213891838467280898
2020-01-05 17:48:55,ciaradebp,NorahCasey,0,0,Amazing idea ! @campaignforkate @MaryLouMcDonald #NollaignamBan,@campaignforkate @MaryLouMcDonald,#NollaignamBan,https://twitter.com/ciaradebp/status/1213880068566638592
2020-01-05 17:14:03,Jketfield,Nathan_FTG,0,0,Jesus wept,,,https://twitter.com/Jketfield/status/1213871292673339392
2020-01-05 16:58:59,weepep,Irish_Ulster,0,0,"No giving into anti Irish bigotry or nationalism will not be kind to SF/SDLP next election.we,d rather have no stormont than anything resembling the last one",,,https://twitter.com/weepep/status/1213867502750617600
2020-01-05 16:46:48,jpal2001Paul,,1,0,"@EOBroin @MaryLouMcDonald @moneillsf Can the Irish government be possibly allowed to proceed with the event for the RIC,Black and Tans? Our area as many suffered their brutality.",@EOBroin @MaryLouMcDonald @moneillsf,,https://twitter.com/jpal2001Paul/status/1213864436177494016
2020-01-05 15:19:01,ojcole985,canisgallicus,0,0,"George w Bush vengeance for 911 good, Iran revenge bad.",,,https://twitter.com/ojcole985/status/1213842343046123520
2020-01-05 15:07:04,RajGaneshHDL,72TommyBrick,1,0,@MaryLouMcDonald Sinn Fein terrorists are even more depraved than the terrorist clerical regime of Iran. #SinnFein @GerryAdamsSF,@MaryLouMcDonald @GerryAdamsSF,#SinnFein,https://twitter.com/RajGaneshHDL/status/1213839335763664896
2020-01-05 15:01:18,RajGaneshHDL,TobiasHuch,0,1,#SinnFein Sinn Fein's depravitity has no limits. @MaryLouMcDonald ,@MaryLouMcDonald,#SinnFein,https://twitter.com/RajGaneshHDL/status/1213837883133616129
2020-01-05 15:00:10,irishzionist,RedKalai,0,0,"I am Irish, how dare you @sinnfeinireland @MaryLouMcDonald do you even know who he was or the atrocities he was responsible for, the human lives he extinguished without thought. @LeoVaradkar are you going to challenge this or HIDE.",@sinnfeinireland @MaryLouMcDonald @LeoVaradkar,,https://twitter.com/irishzionist/status/1213837599795793926
2020-01-05 14:17:48,o7716235184,DoireOSF,0,0,What about the European referendum that's right didn't get what you wanted so it doesn't count,,,https://twitter.com/o7716235184/status/1213826938894241792
