date,username,to,replies,retweets,text,mentions,hashtags,permalink
2020-01-25 11:33:12,LilFeekyB,Colliniho,1,0,It's pretty obvious that FF and FG have drawn these borders to maximise the benefit to themselves and weaken PBP and Sinn Féin's base,,,https://twitter.com/LilFeekyB/status/1221033273599590400
2020-01-25 11:33:03,pauldelaney2012,BrianElliman,0,0,"No he still has one of his properties in west Belfast sure Sinn Fein and their top brass own most of Belfast houses, clubs, hotels, bars, restaurants etc etc everyone with a brain knows that.",,,https://twitter.com/pauldelaney2012/status/1221033233359560704
2020-01-25 11:30:00,sinnfeinireland,,1,10,"📻 Sinn Féin TD for Waterford @davidcullinane will be on @SaturdayRTE today at 1pm to discuss reducing the pension age to 65, tackling sky-high rents and giving families &amp; workers a break #GE2020",@davidcullinane @SaturdayRTE,#GE2020,https://twitter.com/sinnfeinireland/status/1221032465931874307
2020-01-25 11:29:55,MallowNews,,1,9,People thinking Arlene Foster’s appearance on the late late show might swing undecideds away from Sinn Fein are massively underestimating the malign bounty that is her personality,,,https://twitter.com/MallowNews/status/1221032445237178368
2020-01-25 11:29:45,robertdsweeney,stillcormactho,2,0,You realise Sinn Fein as a governing party would be run themselves by an unelected executive council?,,,https://twitter.com/robertdsweeney/status/1221032405311598594
2020-01-25 11:24:58,adriang86518036,HamillOSF,0,0,More and more people struggle each day due to the economic model we are faced with. We need to build an economy that is in favour of workers. Sinn Féin will create a living wage as well as creating an environment for worker owned cooperatives. ,,,https://twitter.com/adriang86518036/status/1221031199872888835
2020-01-25 11:24:05,laurencec123,c0nallmccallig,1,0,Why are Sinn Féin only running 41 seats for?,,,https://twitter.com/laurencec123/status/1221030977092378624
2020-01-25 11:20:58,KevLar6B,sarahcareyIRL,2,2,Daughter of man who spent 47 years as a FG councillor hates Sinn Féin! Shock! Horror!,,,https://twitter.com/KevLar6B/status/1221030191843201025
2020-01-25 11:20:45,fintancox,Philip_Ryan,0,0,Again fine gael focused solely on negative attacks on FF and stupidly completely ignoring sinn fein who are surging past them in polls ,,,https://twitter.com/fintancox/status/1221030139506647040
2020-01-25 11:20:33,DiscePuer,RyanLewisPugh,0,0,"Scottish Tories aren't ""true Scots"", so we're told by many ""Scottish"" nationalists, chiefly, and bizarrely, by those who advertise that they have a greater affinity for Sinn Fein and its hatred of all things British than with the SNP and Scotland.",,,https://twitter.com/DiscePuer/status/1221030089871306753
2020-01-25 11:19:25,fintancox,BarryWhyte85,2,1,If both FF and FG both end up in the 40s for seats again I think it becomes near impossible to form a government unless Martin does a massive Uturn and goes in with sinn fein ,,,https://twitter.com/fintancox/status/1221029805778444289
2020-01-25 11:16:41,MidwivesIreland,MidwivesIreland,0,1,"> The association is appealing to political representatives to engage with us, not talk at us, read our manifesto, midwives know the issues and are happy to engage. #GE2020",,#GE2020,https://twitter.com/MidwivesIreland/status/1221029116033544192
2020-01-25 11:15:03,j_gettigan,,0,0,What is Sinn Féin’s policy on the legitimacy of the Special Criminal Court?,,,https://twitter.com/j_gettigan/status/1221028706161917952
2020-01-25 11:14:58,FionaDoris,Berlinnaeus,0,1,Let's agree to differ. I'm tired of Sinn Féin being dissed. They are a legitimate all Ireland party. I look forward to the day when partition is over and our Country is whole. If you voted for Good Friday Agreement then you should also allow that everyone can speak.,,,https://twitter.com/FionaDoris/status/1221028682929754114
2020-01-25 11:14:47,Colliniho,,0,0,@Donnchadhol good morning Donnchadh. There are thousands of accidental landlords in Ireland who are stuck with properties they don’t want due to negative equity. Do Sinn Fein have any proposals to allow them to dispose of their properties to individuals/families who need them?,@Donnchadhol,,https://twitter.com/Colliniho/status/1221028639548084224
2020-01-25 11:13:12,MidwivesIreland,MidwivesIreland,1,1,"> development of midwives into primary care, for example GPs don't get HSE allowances for practice midwives in contrast to the allowance for practice nurses. These is just one of issues that effect Midwifery expanding into primary care. Insurance another >",,,https://twitter.com/MidwivesIreland/status/1221028238224510977
2020-01-25 11:12:17,GlRLSFOODGEAR,darren_conway,0,0,“heard Sinn Fein are brining back Mars Delight bars” Fucking gas fella😂😂😂 ,,,https://twitter.com/GlRLSFOODGEAR/status/1221028009764933640
2020-01-25 11:09:24,freddyforrestal,Michael_O_Regan,0,0,I know that should be only for sinn fein,,,https://twitter.com/freddyforrestal/status/1221027283303116801
2020-01-25 11:07:17,williamwallbook,,0,0,Just to say that I would support any left candidate running in my constituency. That includes Sinn Féin. I'm wary of the Greens because of their history but individual candidates are fantastic and the case for green policies is unanswerable.,,,https://twitter.com/williamwallbook/status/1221026750077030400
2020-01-25 11:04:50,SaveUsY2Jake,,2,0,"Yano Sinn Fein have a lot of good policies and shit, but where will they get all the funding they need and shit",,,https://twitter.com/SaveUsY2Jake/status/1221026134277660672
2020-01-25 11:04:44,MidwivesIreland,SocDems,1,1,"We are onboard with philosophy of Slaintecare however their has been no consultation with midwives, sadly the term 'midwife' does not feature in the document and 'maternity' only 5 times in the broad context of Maternity Strategy. We have concerns we KNOW will effect the >",,,https://twitter.com/MidwivesIreland/status/1221026107081789440
2020-01-25 11:03:09,MartinaMCCABE1,quietlygrateful,0,0,Do you knw the word Nazi are National socialist more your crowd than Irish Nationalist even Sinn Féin were Nationalist and Republicans at one time wonder who got to them.,,,https://twitter.com/MartinaMCCABE1/status/1221025708396482560
2020-01-25 11:00:29,spillaney89,dorgan_gavin,1,0,"I've given Sinn Féin my top votes since I was 18 bud then certain FF members as they arranged to fix the flooding down by my gaff and never FG. Sinn Fein are only running 49 candidates in 38 constituencies. Do the math, best you can hope for is SF and someone else in government",,,https://twitter.com/spillaney89/status/1221025038968795136
2020-01-25 11:00:01,pauldelaney2012,JohnMor65459780,0,0,"No elections are free and fair these days, as a matter of interest is any Sinn Fein posters down because they are renound for sabotaging election posters and intimidating canvassers of other parties.",,,https://twitter.com/pauldelaney2012/status/1221024923440893955
2020-01-25 10:59:05,BurtonSinead,Wardy1916,0,0,They’re afraid that Sinn Fein will wipe the floor with them in any debate. And they would.,,,https://twitter.com/BurtonSinead/status/1221024687314042880
2020-01-25 10:58:04,fintancox,Seadhnalogan,0,0,"Sinn fein could be 25% or even higher, they always overstate SF a little and understate FF, I can understand why SF didn't add more candidates at the last minute, it might have worked in March lous Dublin central but probably wouldn't have gained any seats anywhere else",,,https://twitter.com/fintancox/status/1221024429209088000
2020-01-25 10:57:59,Jo96655094,jimmy_weasel,2,0,Yep. And interestingly something the British media never seem to remember. Imagine if it was the Tories and Sinn Fein?,,,https://twitter.com/Jo96655094/status/1221024411165372416
2020-01-25 10:56:15,thesuir,PatLeahyIT,0,2,Hi Pat sorry to say but this article was very poorly written.Sinn Féin do have the numbers to make a difference and going on resent polls will have after the election.A bit of balance please .,,,https://twitter.com/thesuir/status/1221023972453765121
2020-01-25 10:54:45,richardwaghorne,,0,1,"'It was a huge disappointment to Mallon that neither the DUP nor Sinn Fein properly engaged with the reconciling philosophy of the Good Friday Agreement, and he felt that too much effort was made to appease them.' ",,,https://twitter.com/richardwaghorne/status/1221023595582951425
2020-01-25 10:53:21,deirbhilesdaddy,,33,82,So Arrogant Arlene has been invited into the Late Late Show one week before a GE.Will she be asked about her party taking policy direction from the Loyalist Drug Gangs and Orange Order or is she just there to say a few snide things about Sinn Fein.?,,,https://twitter.com/deirbhilesdaddy/status/1221023244528115712
2020-01-25 10:49:16,PatLeahyIT,,19,0,"(You could equally make the argument they should do it with Sinn Féin too, but Mary Lou won’t have the numbers. And it is a numbers game.)",,,https://twitter.com/PatLeahyIT/status/1221022218207080448
2020-01-25 10:49:11,Maker66Treble,,0,0,Not One Politician from any party have arrived at my http://door.Im in Dublin Bay North.Iv received one leaflet stuck in letterbox from Sinn Féin. Is it just me?,,,https://twitter.com/Maker66Treble/status/1221022197302644737
2020-01-25 10:46:47,MyBaldyHead,hgeogheg,0,0,"Sure, they will put a bomb under the establishment! ‘Sinn Fein murdering the Irish for a Century’",,,https://twitter.com/MyBaldyHead/status/1221021589430513664
2020-01-25 10:44:34,david_flood,gerry_shannon,1,0,Only one founder of the Sinn Féin/National Council - and I'd strongly argue that the father of 'Sinn Féinerism' was actually William Rooney,,,https://twitter.com/david_flood/status/1221021031810445312
2020-01-25 10:40:56,samfrob5,JuliaHB1,0,0,"Sorry but the BBC has gone too far. Reporting from the USA is a disgrace, unprofessional, anti Trump propaganda with no positive stories at all; anti Brexit and pro Sinn Fein in its reporting on Ireland. Little balanced honest reporting.",,,https://twitter.com/samfrob5/status/1221020119259918336
2020-01-25 10:40:07,RuaAodh,Sal_feeko,1,0,And this is the police force that sinn fein calls on nationalist and republican to support,,,https://twitter.com/RuaAodh/status/1221019912166105090
2020-01-25 10:40:00,IrishMirror,,0,2,Sinn Fein's Eoin O'Broin is taking nothing for granted on campaign trail in Dublin ,,,https://twitter.com/IrishMirror/status/1221019883212693510
2020-01-25 10:39:48,jaseomcn,,2,74,"If Arlene Foster is on the Late Late next week as the perceived arch-nemesis of Sinn Féin, in the interests of balance I presume Tubridy will also be interviewing, as FF/FG’s bête noire, a homeless child with chronic illness.",,,https://twitter.com/jaseomcn/status/1221019833401335808
2020-01-25 10:38:18,ronan_mcginley,,14,10,I am standing down as a Councillor and look forward to my new role in Sinn Féin It has been an honour to serve on the Mid Ulster Council Massive thanks to the residents of Mid Ulster who put their trust in me to represent them and make their voices heard Full statement below ,,,https://twitter.com/ronan_mcginley/status/1221019457486716928
2020-01-25 10:34:03,S_A_Dunleavy,,0,1,"""Taoiseach Leo Vardakar will attend the rally and those taking part will gather at the Bridge of Peace at 1.30pm...Fianna Fáil leader Micheál Martin, Sinn Féin President Mary Lou McDonald and Labour leader Brendan Howlin will also attend the rally."" ",,,https://twitter.com/S_A_Dunleavy/status/1221018388320989187
2020-01-25 10:31:57,jimpayne10,SuzyJourno,0,0,Depending what she says about sinn fein this could affect the result of the election.,,,https://twitter.com/jimpayne10/status/1221017860119695361
2020-01-25 10:25:04,samfrob5,OnThisDayPIRA,0,0,"Another vile act by Sinn Fein ""heroes"". ",,,https://twitter.com/samfrob5/status/1221016125628174336
2020-01-25 10:23:04,dj_breathnach,dj_breathnach,0,0,Or is it Sinn Féin? You can't seem to make your mind up 😂😂😂,,,https://twitter.com/dj_breathnach/status/1221015622651449344
2020-01-25 10:21:34,HeachainO,,1,0,"When you believe in 'The Great Replacement', chemtrails as a sterilization programme, Soros destroying western civilisation and the Jews being responsible for the Irish Famine, then Aontú being a Sinn Féin conspiracy isn't much of a stretch. Irish proto-Fascist ""patriots"" #GE2020",,#GE2020,https://twitter.com/HeachainO/status/1221015246346903553
2020-01-25 10:21:28,WatchPopulistIr,listentolizzy,1,0,Nobody dies on a 66 retirement age or on a pension arrangement keeping them off the dole between 65 and 66. The Sinn Fein strategy of beating every one on Anger describing problems Promise unrealistic solutions Reteat to opposition immediately SF solves naothing #GE2020,,#GE2020,https://twitter.com/WatchPopulistIr/status/1221015218387587073
2020-01-25 10:19:38,ChiefMM82,EamonRyan,1,0,Would you include Sinn Fein in the consensus?,,,https://twitter.com/ChiefMM82/status/1221014757429403648
2020-01-25 10:14:20,eisteacht,cripplecreek77,2,0,It's a pre election Sinn Féin demolition interview with no right of reply. RTÉ think we're stupid.,,,https://twitter.com/eisteacht/status/1221013424882225152
2020-01-25 10:11:11,paul_gavan,LeftLost_Pltcs,0,0,Pat is right about one thing - the potential does exist for a broad Left led coalition but the bedrock of any such alliance has to be Sinn Féin.,,,https://twitter.com/paul_gavan/status/1221012632011972609
2020-01-25 10:07:55,WatchPopulistIr,PaulDonnellySF,2,3,The only cynical politics here is Sinn Fein who in 2011 promises full abolition of the USC costing €3bn when the country was running €18bn deficits promising that pension age should stay the same throwing another €750m a year of magic money tree bank notes at it. #ge2020,,#ge2020,https://twitter.com/WatchPopulistIr/status/1221011811476156416
2020-01-25 10:01:47,IamCormac,,0,1,"Most people watch Netflix when they can't sleep, me on the other hand, I sign up to join Sinn Féin #sinnfeinandchill",,#sinnfeinandchill,https://twitter.com/IamCormac/status/1221010268643307520
2020-01-25 10:01:00,DublinGazette,,1,2,The Dublin Mid-West TD’s comments came as he blasted the state broadcaster’s decision to exclude Sinn Féin from the leaders debate in the final week of the general election. ,,,https://twitter.com/DublinGazette/status/1221010068642070528
2020-01-25 09:59:39,Sofiane_M,donalhassett1,0,0,Amazing! I believe it is more than leaders getting inspired by the combination of Sinn Fein plus IRA. It is a much deeper similarity between the suffering that both people have been through and how it has toughen and build their character to face the biggest empires of the time.,,,https://twitter.com/Sofiane_M/status/1221009730149191681
2020-01-25 09:58:30,SocDems,mgtmurphy123,2,3,We agree...our proposals to properly resource and fund #Slaintecare (development led by @RoisinShortall ) which include implementation of that strategy are essential to our #GE2020 manfiesto and approach to govt. @patriciamodwyer,@RoisinShortall @patriciamodwyer,#Slaintecare #GE2020,https://twitter.com/SocDems/status/1221009440217890816
2020-01-25 09:56:16,shanecurragh,EamonRyan,0,0,Grand but where does she stand re Saoirse and her views on business and Sinn Fein and guillotines.,,,https://twitter.com/shanecurragh/status/1221008879313657859
2020-01-25 09:52:43,OghamTheBold,BBCNewsPR,0,0,WMD (War Mayhem & Death) : Theresa May voted for Iraq - she lied - first woman MP were Sinn Féin - who refused to swear foul BLOOD oath 2 UN €lected #indyref2020 by George,,#indyref2020,https://twitter.com/OghamTheBold/status/1221007983519420421
2020-01-25 09:50:58,mr_stephen_moss,,0,2,"As we near #GE20 with FG, FF &amp; SF neck &amp; neck, @SinnFéinIreland is excluded from @RTEpolitics debate. The 2 conservative parties FG &amp; FF are given free rein to unfairly criticise #sinnfein. This is undemocratic. https://www.irishpost.com/news/sinn-fein-issues-legal-letter-rte-following-debate-exclusion-177798?utm_source=twitter&amp;utm_campaign=article&amp;utm_medium=web via @theirishpost",@rtepolitics @theirishpost,#GE20 #sinnfein,https://twitter.com/mr_stephen_moss/status/1221007544707100672
2020-01-25 09:48:48,MidwivesIreland,mgtmurphy123,0,1,"Thanks Margaret, let's get the message out there. #GE2020",,#GE2020,https://twitter.com/MidwivesIreland/status/1221006998642352128
2020-01-25 09:47:28,coillte55,sinnfeinireland,0,0,Please tell me why we are hearing so much about FF and FG on the airwaves and so far nothing about Sinn Fein or other parties it looks as if the don’t exist,,,https://twitter.com/coillte55/status/1221006662242357249
2020-01-25 09:45:59,bouldirishmammy,revisionistcork,0,1,He wasn't killed for nothing @MiriamOCal she is very confused likes to hammer Sinn Fein and yet her family are Fianna Fáil .,@MiriamOCal,,https://twitter.com/bouldirishmammy/status/1221006288437628931
2020-01-25 09:45:17,EFFanning,,19,59,"Pages 1, 2 & 3 of @IrishTimes today shown below. It's all about FG &amp; FF and the two lads. Then if you look closely you'll see a small piece at the bottom of page 6 (below) about Sinn Féin, below two larger pieces on Lab &amp; the Greens at the top of the page. #MouldingTheElection",@IrishTimes,#MouldingTheElection,https://twitter.com/EFFanning/status/1221006113132421126
2020-01-25 09:44:37,SWso155,CllrBSilvester,0,1,"GB Brexit, not UK Brexit? Stormont decides? Now Stormont is pro Republican will that ever happen? What did Boris offer Sinn Fein to reconvene the assembly? Could Boris use 'the break up of union' to stop Brexit entirely? He said no UKPM could countenance it ? Questions, Brian !",,,https://twitter.com/SWso155/status/1221005945498755078
2020-01-25 09:43:40,mgtmurphy123,MidwivesIreland,2,4,The party that wants my vote in Cork South Central will have to address what they will do to ring fence funding to implement the national maternity strategy & Midwifery led care for the women of Ireland @NWCI @FineGael @FiannaFiail @SinnFein @SocDems,@NWCI @FineGael @sinnfein @SocDems,,https://twitter.com/mgtmurphy123/status/1221005707446771715
2020-01-25 09:38:28,Nialler67,,1,0,Met quite a few people on the doors in their 50s and 60s who are voting Sinn Féin this time because of the pensions issue. Obviously FF canvassers were hearing this as well; hence their U-Turn. And Michael Martin has the nerve to call us populist?,,,https://twitter.com/Nialler67/status/1221004399352471552
2020-01-25 09:37:38,LeilaNedjati_,georgieIockhart,1,1,I was gna vote Sinn Fein #1 until I read her reply solidarity is looking up 🤨🤨🤨🤨 ,,,https://twitter.com/LeilaNedjati_/status/1221004190253768705
2020-01-25 09:37:09,Diogenes_cat,PFQMUSIC,1,1,Sinn Fein's economic policy is not viable. Their structure and transparency is comparable with Hamas. Not to forget the fact that they 'were' the political wing of a quasi criminal terrorist organisation.,,,https://twitter.com/Diogenes_cat/status/1221004066773446657
2020-01-25 09:36:11,Robbo19867448,caulmick,0,0,"And that's another reason why Regina's struggling in the polls, sinn fein to be equal or greater the fine gael come Feb 9th, the ordinary fg cumman member never wanted Leo anyway, so under him they are not a party pulling altogether,.D4 fg dragged them back to fg under Noonan🤣👍",,,https://twitter.com/Robbo19867448/status/1221003824678260736
2020-01-25 09:35:05,RabbieDevine,laurenslane2306,0,0,Yupppp Sinn Fein.. get it retweeted for him hahahah,,,https://twitter.com/RabbieDevine/status/1221003546604138501
2020-01-25 09:31:00,CllrGMcAteer,,1,9,A moving & fun event last night as south Belfast Sinn Féin commended the incomparable @newbelfast for his yrs of service as elected rep. Great speeches &amp; raconteur from @AlexMaskeySF &amp; @GerryAdamsSF . As Mairtín reminded us - he's not going away you know @NiallSF @DeirdreHargey,@newbelfast @AlexMaskeySF @GerryAdamsSF @NiallSF @DeirdreHargey,,https://twitter.com/CllrGMcAteer/status/1221002518752374784
2020-01-25 09:28:00,EamonReilly_com,FrancisMcKeown6,1,0,No. Sinn Fein are pro aborts.,,,https://twitter.com/EamonReilly_com/status/1221001766109679616
2020-01-25 09:27:57,JakeBarnes61,SuzyJourno,0,0,"How hard was it for Devlin to stop herself from reminding us that during the white heat time of the Civil Rights Marches, Seamus and his family were subjected to death threats from Sinn Fein/IRA, whose murderous campaign for a United Ireland horrified Seamus Mallon?",,,https://twitter.com/JakeBarnes61/status/1221001753304453120
2020-01-25 09:27:34,michelle_curley,,0,0,@louisemcsharry where is sinn fein in your election coverage slot,@louisemcsharry,,https://twitter.com/michelle_curley/status/1221001654633488384
2020-01-25 09:26:36,JohnnyGuirke,,0,4,Johnny Guirke is Working Hard for Families Restore the pension age to 65 Put a Worker in the Dail Vote Johnny Guirke no 1 VOTE Sinn Féin Ireland ,,,https://twitter.com/JohnnyGuirke/status/1221001411678429184
2020-01-25 09:26:07,jameshurley22,Tristin_1916,0,0,Get out and vote Sinn Féin people!! #GE2020,,#GE2020,https://twitter.com/jameshurley22/status/1221001290278473733
2020-01-25 09:23:26,whylejohn,jediknight1985,1,0,Gosh rte give dup primetime slot I wonder why. I bet she's gonna tell the free state voters how lovely Sinn Fein are eh?,,,https://twitter.com/whylejohn/status/1221000617512050689
2020-01-25 09:23:11,Berlinnaeus,FionaDoris,4,0,"I dishonour no one. Seamus Mallon was indeed a brave and principled man, though I would have disagreed with him on certain issues. Sinn Fein were part of the agreement because Sinn Fein, and its cohort, were part of the problem.",,,https://twitter.com/Berlinnaeus/status/1221000551422484481
2020-01-25 09:15:05,paulmurphy_TD,,4,16,There is a huge desire for radical change in this election. Sinn Fein should rule out getting into bed with Fine Gael and Fianna Fail. We have seen where that leads. We need a left government with socialist policies to build people power. ,,,https://twitter.com/paulmurphy_TD/status/1220998512805994496
2020-01-25 09:14:28,murray241989,darren_conway,0,0,Sinn Fein are bring back Mars Delight bars ,,,https://twitter.com/murray241989/status/1220998360808722432
2020-01-25 09:12:14,Peter_Baker57,Sam93172366,2,0,Sam it's about time you realised Sinn Fein is the only party strong enough to get all the votes from Catholics.... Look at SF Now There is only 1-2 people in positions that have direct involvement with PIRA.... The party has moved on from its PIRA history Jesus 2x women leaders,,,https://twitter.com/Peter_Baker57/status/1220997796037373952
2020-01-25 09:08:54,barraoneill,WhitmoreJen,0,0,"I don't understand people though. The rise in Sinn Fein even with there Cllr victim blaming, homophobic and racist comments and they didnt turf him out of the party. Anyone mentioning that to you Jennifer",,,https://twitter.com/barraoneill/status/1220996957440704512
2020-01-25 09:01:48,chnewsuk,,0,0,No support from archbishop for priest who cancelled Sinn Féin event ,,,https://twitter.com/chnewsuk/status/1220995171644559360
2020-01-25 08:58:23,DrRetunsae,,0,0,"Jesus is trending. #Varadkar is sliding. Sinn Féin’s Democratic Socialism surging. Leo disses Gerry for Jesus, next Pilates class. Jesus wears Lycra better. https://youtu.be/7jOZdUX68Pg #Election2020 #DoorStepping #SpudChoices 🤗🥴 🗳",,#Varadkar #Election2020 #DoorStepping #SpudChoices,https://twitter.com/DrRetunsae/status/1220994312160366592
2020-01-25 08:56:15,DanielSextonIRL,,0,0,What I think will happen now: Fianna Fáil/Sinn Féin coalition. What I'd like to happen: Labour/Green/Sinn Féin/SocDem coalition (no independents or purity testers),,,https://twitter.com/DanielSextonIRL/status/1220993773519458306
2020-01-25 08:52:04,yung_4head,darren_conway,0,0,Sinn Féin are bringing back 12.5g boxes ,,,https://twitter.com/yung_4head/status/1220992720870744065
2020-01-25 08:45:35,OghamTheBold,chunkymark,0,0,"Owe The GOD (Grand Old Duke) of Pork my bad York had 1O,OOO LORDS [by size bar BILLS] : Plague of London rats EVE (Ermine Vermin Exodus) : First woman MP were Sinn Féin &amp; refused 2 swear foulest BLOOD oath 2 UN €lected mass murderer #indyref2 by George save £4OO,OOO,OOO,OOO WMD",,#indyref2,https://twitter.com/OghamTheBold/status/1220991090918088704
2020-01-25 08:45:03,paulmurphy_TD,,1,9,"It is scandalous that public land, perfect for building public housing, is being sold off by the state in the middle of a housing crisis. Even more disgraceful is that parties like the Greens, Social Democrats and Sinn Fein have gone along with it on the councils. End this now. ",,,https://twitter.com/paulmurphy_TD/status/1220990957002403846
2020-01-25 08:43:00,KenMSweeney,SuzyJourno,0,0,"Yea, that's bullshit - she's just looking to get on over Sinn Féin. ",,,https://twitter.com/KenMSweeney/status/1220990438141722624
2020-01-25 08:40:53,Diogenes_cat,windstormman,1,0,If Sinn Fein are brought into government by Fianna Fail this state will have abandoned both sense and morality.,,,https://twitter.com/Diogenes_cat/status/1220989908589928455
2020-01-25 08:36:42,FionaDoris,Berlinnaeus,1,0,You dishonour the memory of a brave and principled man by suggesting this. He held Catholic views with regards to women's health and agency. This does not detract from the work he did with John Hume and others to bring about the G. Friday agreement. Sinn Féin are part of this.,,,https://twitter.com/FionaDoris/status/1220988853508562944
2020-01-25 08:36:03,Gareth1958,OnThisDayPIRA,0,0,A timely reminder as Sinn Féin rise in the polls.,,,https://twitter.com/Gareth1958/status/1220988689771159552
2020-01-25 08:30:19,WWinters_,,1,5,"#SeamusMallonRIP A man with integrity and values and the courage to call it as it was: ""the IRA were the biggest failures of the past 40 years and in the process, demeaned the term republican and all that it stood for"" #SinnFein ",,#SeamusMallonRIP #SinnFein,https://twitter.com/WWinters_/status/1220987249938006016
