date,username,to,replies,retweets,text,mentions,hashtags,permalink
2020-01-17 01:37:10,BennGunn3,PaddyHolohanMMA,1,0,Dont know why anyone is surprised. To me he/this typifies the type that vote sinn fein. #gurriers,,#gurriers,https://twitter.com/BennGunn3/status/1217984172402323456
2020-01-17 01:34:08,MTaylorClare,AvaWithAFada,1,0,"Unpopular is right.. Holohan knew well what he was saying. He made a statement that is totally unacceptable in a modern, pluralist, progressive society. If it were the other way around Sinn Féin would be baying for blood...",,,https://twitter.com/MTaylorClare/status/1217983409290645509
2020-01-17 01:27:08,jimconnor64,AUOBALBA,0,0,"Not sure on this. Abstentionism has had mixed results for Sinn Fein, considering they previously abstained from the Irish government. They seem to be a better party for participating and evolving politically. I think Scottish MPs may have the potential to add value from within.",,,https://twitter.com/jimconnor64/status/1217981647842414592
2020-01-17 01:25:14,SocialistVoice,,1,3,PETITION: RTÉ to revise its decision to exclude Sinn Féin from televised debates during Ireland’s general election RTÉ is giving biased coverage in favour of the Fine Gael - Fianna Fáil coalition by nakedly trying to rig the general election #GE2020 🇮🇪,,#GE2020,https://twitter.com/SocialistVoice/status/1217981170652192768
2020-01-17 01:15:36,FrancisMcKeown6,Ogra_SF,0,0,National Party should be allowed on RTE. Sinn Fein have had plenty of opportunity to make their voice heard. ANTIFA/Soros people need deplatformed!,,,https://twitter.com/FrancisMcKeown6/status/1217978745555845120
2020-01-17 01:10:00,lawess97,,1,0,"Yes I am a Sinn Fein supporter but I amnt even saying vote for them, vote for your independent, vote for green but just make sure FF and FG dont get back into power, they have ruined my country and have made a generation that cant afford a house, will die on a trolley and dont",,,https://twitter.com/lawess97/status/1217977334843789312
2020-01-17 01:09:19,loststacey24,Ciara87C,0,0,I got asked to stop wearing a Celtic bag to school and a sinn Fein badge at 14 😂,,,https://twitter.com/loststacey24/status/1217977166052364289
2020-01-17 01:08:30,vanillatary,,0,0,It’s really remarkable how little visibility there is of Sinn Féin’s leader Mary Lou McDonald in the last couple of months and in the election campaign so far. Meanwhile Eoin and Pearse are everywhere. #GE2020,,#GE2020,https://twitter.com/vanillatary/status/1217976959084482560
2020-01-17 00:56:24,tvcritics,StevenOMcCarthy,1,0,"It's slightly better, but their dislike of Sinn Féin is obvious on both shows, good or bad. Also, not having any Social Democrats on is more than disappointing in the run up to a general election.",,,https://twitter.com/tvcritics/status/1217973914720227331
2020-01-17 00:46:50,JoeBergin,Michael_O_Regan,1,0,Me Holohan’s thinking is a Sinn Féin maybe the Sinn Féin way of thinking.,,,https://twitter.com/JoeBergin/status/1217971504362807297
2020-01-17 00:35:52,TVAddictStill,Falcon_Malteser,1,0,"Helpfully explaining: ""I think that his understanding is he met with them in their capacity as activists in Sinn Fein"" (Corbyn's jesuitical evasions deserve greater notice.)",,,https://twitter.com/TVAddictStill/status/1217968747409039360
2020-01-17 00:30:03,LangtryDavidSQ,MaoTseTim,0,0,"Hopefully, Sinn Fein will make it absolutely clear, so that even Sinn Fein can understand, that racism, sectarianism and bigotry in any form must be opposed. ",,,https://twitter.com/LangtryDavidSQ/status/1217967282766471168
2020-01-17 00:28:33,walshrac,LSSlattery,0,0,"That's the problem with revolutionary nationalism, it's not far away from regular old ugly nationalism...",,,https://twitter.com/walshrac/status/1217966903936921602
2020-01-17 00:28:05,GitanoRubio,PaddyHolohanMMA,0,0,"There are some very earnest and commendable people in Sinn Féin, but, in my experience some of their supporters' views on foreign nationals, and sexuality would be more at home in one of those ultra nationalist groups in Europe",,,https://twitter.com/GitanoRubio/status/1217966787381297153
2020-01-17 00:27:28,LangtryDavidSQ,deanvannguyen,0,0,"Hopefully, Sinn Fein will make it absolutely clear, so that even Sinn Fein can understand, that racism, sectarianism and bigotry in any form must be opposed. ",,,https://twitter.com/LangtryDavidSQ/status/1217966634201243649
2020-01-17 00:18:54,MarkCork50,Donal_OKeeffe,1,0,"Surely not the same SinnFein who as far back as 2004 had ""An Ireland of Equals"" as their election slogan. #misinterpretatiomehole",,#misinterpretatiomehole,https://twitter.com/MarkCork50/status/1217964478177955842
2020-01-17 00:16:08,AntoneRiordan,EFFanning,0,0,Well done sinnfein 👋 👋 the great Irish people are wakeingup up to finnafall and finngall and the farmers are to about time,,,https://twitter.com/AntoneRiordan/status/1217963781336322051
2020-01-17 00:14:51,NornEye,StockMarket5577,0,0,"I am no supporter of the OO, but I think you have no clue what you are talking about. If you think you do could you cite some examples (from reliable sources). If your source is from Sinn Fein History Re-Writing project, don’t bother.",,,https://twitter.com/NornEye/status/1217963456479092736
2020-01-17 00:14:04,Cohailpin,,0,0,Just commented on @thejournal_ie: Sinn Féin councillor apologises after remarks about Taoiseach's 'Indian blood' - ,@thejournal_ie,,https://twitter.com/Cohailpin/status/1217963258101030913
2020-01-17 00:13:36,Mick_Rob_OD,IrishTimes,0,0,"Okay. Let's be honest here. There's an element of Sinn Fein, especially in ""Traditional IRA areas""' (Border counties &amp; Kerry) that's ""Socially Conservative"" &amp; borderline Xenophobic. These comments are typical of that constituency.",,,https://twitter.com/Mick_Rob_OD/status/1217963141881004033
2020-01-17 00:12:04,LiamoOSHEA,,0,0,Sinn Féin councillor apologises after remarks about Taoiseach's 'Indian blood' criticised (via @thejournal_ie) https://jrnl.ie/4967937,@thejournal_ie,,https://twitter.com/LiamoOSHEA/status/1217962755078135808
2020-01-17 00:07:45,amdowdican,MsAvaArmstrong,5,6,"This👇How has communism / Marxism suddenly become cool. Do People not know how many have died under that red flag? How is it even a thing in Ireland? Are we so uneducated &amp; ignorant now that we welcome our own demise? Sinn Fein, the Greens &amp; pBp 🤨#GeneralElection2020",,#GeneralElection2020,https://twitter.com/amdowdican/status/1217961670871523329
2020-01-17 00:04:40,Naknamara,artimusfoul,0,0,"98 years of FF/FGnot enough for you Aidan? SF have never been in power yet they’re power hungry?The 🦧in a zoo would have done a better job of running the country than FG/FF,FF literally lost our http://sovereignty.You were never going to vote for SF at least admit that",,,https://twitter.com/Naknamara/status/1217960892660359169
2020-01-17 00:03:07,NornEye,AlexKane221b,0,0,Sinn Fein will say “mistakes have been made but now is not the time for recriminations” I bet it is not published before the ROI elections (SF breathe a sigh of relief),,,https://twitter.com/NornEye/status/1217960502447550464
2020-01-17 00:02:05,FrancisMcKeown6,sinnfeinireland,0,0,Mass influx of foreigners puts massive strain on services. Sinn Fein the baby and public service killers! Catriona Ruane lost money for education because she refused to spend it. Too busy trying to destroy grammar schools. Fuck baby murderers and ANTIFA terrorists!,,,https://twitter.com/FrancisMcKeown6/status/1217960244703162369
2020-01-17 00:01:49,McDonaghDJ,artimusfoul,0,0,"Does Holohan realise Varadkar also has a mother, who happens to be Irish. Are racists now saying you have to have *two* Irish parents to be truly Irish? Or is he just being sexist and ignoring the mother?",,,https://twitter.com/McDonaghDJ/status/1217960178701799424
2020-01-17 00:00:31,Aaron_R_Rankin,Nirn70544558,0,0,That was the initial excuse on the Sinn Fein side but it then kept changing after it lost its potency.,,,https://twitter.com/Aaron_R_Rankin/status/1217959851839672327
2020-01-17 00:00:31,tvcritics,,4,9,Sinn Féin &amp; People before profit still getting a much harder time than Fine Gael &amp; Fianna Fáil on all national TV &amp; radio shows despite Fianna Fáil &amp; Fine Gael looking after their own since day 1. #GE2020 #TonightVMTV #retpt,,#GE2020 #TonightVMTV #retpt,https://twitter.com/tvcritics/status/1217959850430357511
2020-01-16 23:59:59,VinnyNolan2,caulmick,0,0,"Rte only says what is favourable to ff/fg ,but if it gets opportunity to cut sinn fein an parties of the left it shows different side, disband an start again with realistic wages.",,,https://twitter.com/VinnyNolan2/status/1217959714757234689
2020-01-16 23:58:20,LaughlinPadge,,1,3,Pearse Doherty fantastic tonight again. Can’t help but think that the man is wasted with Sinn Fein. A man of that quality should be making decisions.,,,https://twitter.com/LaughlinPadge/status/1217959300947152896
2020-01-16 23:57:12,johnom318,johnom318,1,0,He also used the horrible murder as an opportunity to snipe at Sinn Fein.,,,https://twitter.com/johnom318/status/1217959016338534407
2020-01-16 23:53:33,Manchain8,DanielJHannan,0,0,This c*nt is just unhappy she'll be out of a job in two weeks and Sinn Fein coffers will take a hit. ,,,https://twitter.com/Manchain8/status/1217958097693528064
2020-01-16 23:50:17,joesmithd9,DonnachaMaguire,0,0,Are Sinn féin even running enough candidates to have a majority?,,,https://twitter.com/joesmithd9/status/1217957274053824513
2020-01-16 23:49:19,commie_spice,unakavanagh,4,22,"I’m begging Sinn Fein to just deal with this firmly and make an example, as opposed to dancing around the issue by discussing the exact semantics used, and exactly how he phrased things. Deal with it and move on, simple. Please. ",,,https://twitter.com/commie_spice/status/1217957029765091329
2020-01-16 23:49:10,ChrisFaulkner97,PatrickGaffney8,0,0,"What's misleading? They stated they're the only Dail Party not funded by the State. That is accurate. They never claimed otherwise. Unlike Sinn Fein who claim they're Republicans, yet their track record kinda proves otherwise.",,,https://twitter.com/ChrisFaulkner97/status/1217956993648005120
2020-01-16 23:47:24,alanindyfed,,0,0,Sinn Féin pledges to pay State pension at age 65 ,,,https://twitter.com/alanindyfed/status/1217956548670054400
2020-01-16 23:44:14,JohnnyKeegan,,0,0,"And if you don't kick him out for being a homophobic racist, then kick him out for being stupid. As well as being hurtful to people, his comments push thousands of Sinn Fein voters away, and strengthens Varadkar's position.",,,https://twitter.com/JohnnyKeegan/status/1217955751601328128
2020-01-16 23:41:24,theNSMonaghan,,0,8,Sinn Féin leader @MaryLouMcDonald confident the party can take 2 seats out of 5 in Cavan Monaghan (&amp; a bit of North Meath at Drumconrath) in #GE2020 with @mattcarthy &amp; Pauline Tully (Cavan) both were confirmed as candidates at a packed convention in Cootehill tonight.,@MaryLouMcDonald @mattcarthy,#GE2020,https://twitter.com/theNSMonaghan/status/1217955040117301248
2020-01-16 23:40:47,Richard_Ardvark,,6,6,"If, as Sinn Fein claim, Holohan's comments were 'misinterpreted' in what context would attacking a politician because of their Indian heritage and sexuality not be racist or homophobic? ",,,https://twitter.com/Richard_Ardvark/status/1217954884776939520
2020-01-16 23:40:13,goldenhart1234,,0,0,He was only telling the truth the fact that Leo gets a big salary and the fact he has no children and doesn't know how expensive it is to feed and clothe a child that's all paddy was saying and he said that in his own way Leo varadkar has said worse about sinn Fein,,,https://twitter.com/goldenhart1234/status/1217954740740534275
2020-01-16 23:40:00,the_animalnerd,FineGael,0,0,I would always have voted Fine Gael but after the sheer ignorance re RIC and refusal to admit error of judgement recently along with other incompetence I will vote Sinn Fein and the Greens because the other 2 are jokes of parties that are all talk no action #GeneralElection2020,,#GeneralElection2020,https://twitter.com/the_animalnerd/status/1217954685199552512
2020-01-16 23:39:44,NornEye,RuthDE,0,0,@SuzyJourno Any pride Gerry Adams has in developing Sinn Fein and whatever he did in the “Peace Process” has zero value when you consider his past and his support for murders by the IRA. ,@SuzyJourno,,https://twitter.com/NornEye/status/1217954619479023616
2020-01-16 23:37:28,goldenhart1234,,0,0,McDonald says Sinn Fein councillor will not be removed for Taoiseach comments ,,,https://twitter.com/goldenhart1234/status/1217954048671997965
2020-01-16 23:36:33,doyler031,RMcGreevy1301,0,0,I'm no fan of varadkar bit this just shows you the level of ignorance and lack of intelligence sinn Fein will accept into their party for a vote. Horrible horrible party,,,https://twitter.com/doyler031/status/1217953817460908034
2020-01-16 23:36:01,EclecticPolls,AlexKane221b,0,2,Do you like Julian Smith's approach to Sinn Fein &amp; DUP? #NorthernIreland #juliansmith #poll #eclecticpolls #eclecticpollsThursday,,#NorthernIreland #juliansmith #poll #eclecticpolls #eclecticpollsThursday,https://twitter.com/EclecticPolls/status/1217953683087986688
2020-01-16 23:35:28,adunlea,,0,0,Sinn Féin councillor apologises after remarks about Taoiseach's 'Indian blood' criticised (via @thejournal_ie),@thejournal_ie,,https://twitter.com/adunlea/status/1217953544004874241
2020-01-16 23:35:16,DerekMcCabe9,Mr__XYZ,2,0,"Is there any Green, SNP, Sinn Fein, Plaid Cymru peeps in that fotee or is it all londonshire politcos?",,,https://twitter.com/DerekMcCabe9/status/1217953497439789056
2020-01-16 23:34:51,JCorncrake,ashstronge,0,0,"That's the worst take I've ever heard, Sinn Fein will probably grow as a defined left wing party",,,https://twitter.com/JCorncrake/status/1217953389004242944
2020-01-16 23:33:48,JamieBrysonCPNI,,19,11,Ref commentators corner on the View- is Andree Murphy a member of Sinn Fein? It would be wholly inappropriate to present a SF activist as a neutral commentator. This issue should be clarified.,,,https://twitter.com/JamieBrysonCPNI/status/1217953125002248192
2020-01-16 23:32:32,BrianMc37318957,PatrickGaffney8,0,0,As a former sinn fein voter im sure sinn fein never misled their voters,,,https://twitter.com/BrianMc37318957/status/1217952807657058305
2020-01-16 23:30:37,Call_Me_Ciaran,PierceCallaghan,1,0,Roy Hodgson is me watching Sinn Féin dealing with Paddy Holohan incident.,,,https://twitter.com/Call_Me_Ciaran/status/1217952326717231105
2020-01-16 23:30:19,HNow33,,0,0,#TonightVMTV Damien English said: Shi Fay Faw dim ti polgise. The teeshaw ha septed ahh moo aw Translates To Sinn Fein Forced them to apologise. The taoiseach has accepted and moved on,,#TonightVMTV,https://twitter.com/HNow33/status/1217952250053701638
2020-01-16 23:28:41,BusmanFagan,sinnfeinireland,0,0,"The same two party’s who introduced political censorship in Ireland In 1960 With section 31 of the broadcasting act Since then RTÉ has been pivotal in demonizing Sinn Fein, Real journalists, professionally trained, would revolt That’s why RTÉ hire microphone holders instead",,,https://twitter.com/BusmanFagan/status/1217951839569793024
2020-01-16 23:28:24,JamesO1904,paul_gavan,1,0,"By what means though, will pension contribution tax relief limits be tampered with. From a Sinn Fein voter",,,https://twitter.com/JamesO1904/status/1217951768824504321
2020-01-16 23:25:28,HonestOrdinary,DanielJHannan,0,0,You don’t have Irish citizenship @M_AndersonSF I think you should read the GFA because you do. All citizens born in Northern Ireland (a term which your too scared to even say) are the only citizens in the world to have dual citizenship from birth!! #brexit #ireland #sinnfein ,@M_AndersonSF,#brexit #ireland #sinnfein,https://twitter.com/HonestOrdinary/status/1217951028827643905
2020-01-16 23:22:41,jediknight1985,PatLeahyIT,1,1,"You got the distinct impression that Fine Gael’s priority is to lift high earners out from slipping into the higher tax bands. That Fianna Fáil’s policy is in the post. Believe me folks, watch Primetime, that’s basically FF’s position. Sinn Féin’s focuses on rent &amp; housing. ",,,https://twitter.com/jediknight1985/status/1217950329041555456
2020-01-16 23:22:34,Call_Me_Ciaran,,2,1,If there is one politician in the country right now who could possibly unite the working class and drive out Fine Gael and Fianna Fáil it is Pearse Doherty. That will never happen whilst he represents Sinn Féin in my humble opinion.,,,https://twitter.com/Call_Me_Ciaran/status/1217950299010338819
2020-01-16 23:22:27,NornEye,BenLowry2,0,0,"@JulianSmithUK @BeattieDoug comes across as very open &amp;honest in all public matters. Is he inaccurately recounting several conversations with you about “Legacy”? If we are to have “Legacy” will it only fit Sinn Fein definition of Legacy, which is a 1way street. What is SF Legacy?",@JulianSmithUK @BeattieDoug,,https://twitter.com/NornEye/status/1217950271797710852
2020-01-16 23:18:10,EmmO94634214,Redeyes1878,0,0,Shoehorned into government? And there was the rest of the world thinking Sinn Fein Ministers were democratically elected.,,,https://twitter.com/EmmO94634214/status/1217949190703271936
2020-01-16 23:16:11,PartyMarty50,sinnfeinireland,0,0,"Shame on RTE. How can they decide what the licence payer want to see. We all know what FG,FF will say, after holding hands for last 4 years. Who ever gets most votes, the other side will back em. They are terrified Sinn Fein will oust them. ",,,https://twitter.com/PartyMarty50/status/1217948693556596738
2020-01-16 23:15:06,adamthomaskelly,,0,0,Realistically if yous cared about your future and the future of further generations you'd be voting for Sinn Fein and not a party that only cares about the upper class and feels its right to host a commemoration for a group that brutally slaughtered innocent irish civilians.,,,https://twitter.com/adamthomaskelly/status/1217948421413330946
2020-01-16 23:13:48,LawlorCaitriona,,3,20,Sinn Féin pledges to pay State pension at age 65 https://www.irishtimes.com/news/politics/sinn-f%C3%A9in-pledges-to-pay-state-pension-at-age-65-1.4142246#.XiDuJ5-Wnwc.twitter via @IrishTimes,@IrishTimes,,https://twitter.com/LawlorCaitriona/status/1217948092508594176
2020-01-16 23:12:19,DylanOReilly8,,0,0,Surely Sinn Fein have to be added to the final election debate only fair? 3 way debate no hiding get your ideas out no time wasting ..,,,https://twitter.com/DylanOReilly8/status/1217947719135830016
2020-01-16 23:12:08,DanielGm2008,,0,0,Fair play to him vote SINN FEIN number 1 girls and boys ,,,https://twitter.com/DanielGm2008/status/1217947674999230469
2020-01-16 23:10:55,WillisUna,WillisUna,0,0,"Exactly, we need to work smarter in NI, save money through integration in housing & education and deterrents for those who oppose these ie: dup/sinn fein and their ilk. Shared future is the only option",,,https://twitter.com/WillisUna/status/1217947369838387200
2020-01-16 23:09:26,blackcoffeecup,gordonLunar,1,0,I’d put money on all of these Parties biting the hand off Sinn Fein to form a Government if Sinn Fein did well in the election!,,,https://twitter.com/blackcoffeecup/status/1217946995651948545
2020-01-16 23:08:38,ceesa_ma,,1,1,"Did you hear the one about the way Sinn Fein or the SocDems are really, really different? Right up to the point they become junior partner in govt with one of the usual suspects. But sure they'd never do that. Would they?",,,https://twitter.com/ceesa_ma/status/1217946793339760640
2020-01-16 23:06:34,AWoosterNI,BelTel,0,0,This may come as a surprise - but I actually expected better from Sinn Fein on this specific issue. This is disappointing. ,,,https://twitter.com/AWoosterNI/status/1217946270997917697
2020-01-16 23:06:23,folkmooney,terrymcmahon69,1,0,The sinn fein Paddy joined does not exist anymore,,,https://twitter.com/folkmooney/status/1217946225628139521
2020-01-16 23:03:47,An_Phoblacht,,0,12,Sinn Féin wins big in first PR contest Remembering the Past - Centenary of the 1920 local government elections #LE1920 #GE202 Read more: https://anphoblacht.com/contents/27729,,#LE1920 #GE202,https://twitter.com/An_Phoblacht/status/1217945571337654272
2020-01-16 23:03:28,Bartholomew53,goldenhart1234,0,0,Cant afford not to implement the language act if it falls again election's will be called and at the moment dup and sinn fein are hemorrhaging votes and both will get the blame if it fails and the electorate will punish them,,,https://twitter.com/Bartholomew53/status/1217945494602899456
2020-01-16 23:03:18,VonPilsner,fahey_tom,0,0,"surprised to hear that from a member of anti-White, anti-Irish sinn fein",,,https://twitter.com/VonPilsner/status/1217945450063503361
2020-01-16 23:03:00,MarkMurphy23,,0,0,Just commented on @thejournal_ie: Sinn Féin councillor apologises after remarks about Taoiseach's 'Indian blood' - ,@thejournal_ie,,https://twitter.com/MarkMurphy23/status/1217945376973631488
2020-01-16 23:02:41,KazzzzTweets,unakavanagh,0,0,ah here sinn fein. this is pure patriarchal racist bullshite. ,,,https://twitter.com/KazzzzTweets/status/1217945297470545921
2020-01-16 23:01:51,sinead_molloy_,Kevmacd,1,0,We can say with very high likelihood to be fair. Next biggest party is Sinn Féin they are running 6 less than in 2016. Any coalition will have to include either Fianna Fáil or FG who will most likely be the main party in government- whichever it will be.,,,https://twitter.com/sinead_molloy_/status/1217945084798361605
2020-01-16 23:01:38,deanvannguyen,,4,10,"I dislike going in two-footed on Sinn Féin and having to cape for Leo of all people but can't let that rhetoric fly, especially not in a party that has admirable pro-immigration and anti-racism policies. Hopefully a resolution is reached and we move on with the election",,,https://twitter.com/deanvannguyen/status/1217945032864468992
2020-01-16 23:00:28,chrisadonnelly,ni_siobhan,19,111,Doherty really is a class act. Sinn Fein would do well to use him- and Eoin O’Broin- as often as possible during this campaign. ,,,https://twitter.com/chrisadonnelly/status/1217944736469856256
2020-01-16 23:00:00,browneindo,,0,0,"Fair play to Pearse Doherty for saying people should be allowed retire at 65.. FF & FG want to give pensioners an extra 5 euro a week every year, but then take 45 a week off them for 3 years by making them sign on, thieves #SinnFein",,#SinnFein,https://twitter.com/browneindo/status/1217944621340405765
2020-01-16 22:59:37,Unitedpeople_ie,,0,0,Ireland National Media Network: We object to ongoing 2020 Election media bias. - Sign the Petition! http://chng.it/bCP5nnzC @Sinnfein @RTEnews #UnitedPeople,@sinnfein @rtenews,#UnitedPeople,https://twitter.com/Unitedpeople_ie/status/1217944523164278787
2020-01-16 22:59:30,OisinH1,,0,0,RTÉ responds to it’s decision to exclude Sinn Féin and the entire left-wing of Irish politics from #GE2020 debate:,,#GE2020,https://twitter.com/OisinH1/status/1217944493770575873
2020-01-16 22:58:56,jenties87,,1,0,"As a Sinn Féin member I will say this: @MaryLouMcDonald must condemn xenophobia, homophobia, racism, and bigotry of all kinds in the strongest terms or @sinnfeinireland will suffer. Faux apologies, excuses, and lip service is not enough. Prove you are fit to govern.",@MaryLouMcDonald @sinnfeinireland,,https://twitter.com/jenties87/status/1217944353961848833
2020-01-16 22:58:25,PaulAnthonyWard,TheKavOfficial,1,0,"Just seems like there’s always a certain amount of bending over backwards to save the blushes of Sinn Féin TDs who can’t speak Irish, is my point. Which is totally fine. Definitely not líofa myself, though getting there hopefully.",,,https://twitter.com/PaulAnthonyWard/status/1217944221174452225
2020-01-16 22:55:32,Bighilti1968,Glenn2487,0,0,"He means Duckster Lynch is the leader in Northern Ireland, as PIRA Chief of Staff. Michelle is just the Sinn Fein UK Branch Leader. 👍👍👍👍",,,https://twitter.com/Bighilti1968/status/1217943494829969409
2020-01-16 22:51:58,tvcritics,aoifemasters16,1,0,Not the biggest fan of Sinn Féin &amp; todays antics don't help but we badly need change.,,,https://twitter.com/tvcritics/status/1217942600797360134
2020-01-16 22:51:16,Sage_Opinion,,0,3,"PIRA Sinn Fein caretakers back in Stormont, helping look after Northern Ireland on behalf of the British Government. BBC News - Stormont finance packages keeps NI in 'austerity trap', says Murphy ",,,https://twitter.com/Sage_Opinion/status/1217942423269249033
2020-01-16 22:49:14,RayCasserly,Donnan_S,0,0,Not sure Sinn Fein would either,,,https://twitter.com/RayCasserly/status/1217941910897209350
2020-01-16 22:48:48,bbctheview,,3,11,"Sinn Féin remains opposed to revenue raising measures like water rates, says @JohnODowdSF",@JohnODowdSF,,https://twitter.com/bbctheview/status/1217941800171773952
2020-01-16 22:48:18,goldenhart1234,,1,2,The view has started on BBC one let's hear Mark carruthers he is getting as bad as Nolan were sinnfein concerned alliance is calling for water charge to be brought in to the North on believable,,,https://twitter.com/goldenhart1234/status/1217941675638738944
2020-01-16 22:48:14,BoatsnHoessss,Michael_O_Regan,0,0,Didn't know Daniel Bryan was in Sinn Fein.,,,https://twitter.com/BoatsnHoessss/status/1217941657234169859
2020-01-16 22:47:53,CullyRads,,0,2,"Hail, rain or snow we strive to serve our community. Great ground covered again tonight by our Cork South Central Team in the Republican heartland of #Togher #VoteOLaoghaire1 #VoteGould1 #SinnFéin #GE2020 ✊💚🇮🇪",,#Togher #VoteOLaoghaire1 #VoteGould1 #SinnF #GE2020,https://twitter.com/CullyRads/status/1217941572463087619
