date,username,to,replies,retweets,text,mentions,hashtags,permalink
2020-01-23 16:46:17,BrendanFerronSF,ChrisPenderKE,0,1,"I have always voted Sinn Fein and stopped there, this election I will be voting for @SocDems Carly Bailey No. 2 and a then other left wing candidates down the ballot. If you want change it's important to give no transfers to FF/FG as these can count at the later stages.",@SocDems,,https://twitter.com/BrendanFerronSF/status/1220387287239942144
2020-01-23 16:45:37,IrishTimesOpEd,,0,0,Newton Emerson: Sidelining Sinn Féin when it comes to power in Dublin infantilises Stormont via @IrishTimesOpEd,@IrishTimesOpEd,,https://twitter.com/IrishTimesOpEd/status/1220387117840457728
2020-01-23 16:42:54,voter_irish,a_callumb,2,0,"Incorrect. Sinn Fein are running a total of 42 candidates. You need 80 TD's to have a majority in government, even if every candidate won they would have no where near enough to be the largest party for the dail to elect her Taoiseach. So, no. She's not a candidate.",,,https://twitter.com/voter_irish/status/1220386436043747328
2020-01-23 16:40:05,SpunOut,,0,0,Labour vs Sinn Féin: what's the difference? https://spunout.info/30vLGEm #WhyImVoting #GE20 #GE2020,,#WhyImVoting #GE20 #GE2020,https://twitter.com/SpunOut/status/1220385726853976069
2020-01-23 16:39:00,jonathanrut,,0,0,@IvanYatesNT I think sinn Fein were the big winner's for not being invited. They will get my vote for the first time ever. Voting for finna geal or fail hoping for change has got us nowhere. They will do anything to stay in power,@IvanYatesNT,,https://twitter.com/jonathanrut/status/1220385453754540032
2020-01-23 16:39:00,ddcummings2,,0,0,"Go on @Ianblackford_MP, be a man and pull your MPs out of parliament then - be the new Sinn Fein if you want to ",@Ianblackford_MP,,https://twitter.com/ddcummings2/status/1220385453284655105
2020-01-23 16:37:29,sinnfeinireland,,10,154,#ThrowbackThursday to when FF/FG and Labour hiked up the pension age to 68. Sinn Féin in Government will reverse this disgraceful decision and set the pension age back to 65! @MaryLouMcDonald @PearseDoherty @SIPTU #GE2020,@MaryLouMcDonald @PearseDoherty @SIPTU,#ThrowbackThursday #GE2020,https://twitter.com/sinnfeinireland/status/1220385070483234816
2020-01-23 16:37:03,1standlasttweet,,0,2,SNP SINN FEIN 2 cheeks of the same terrorist supporting arse.,,,https://twitter.com/1standlasttweet/status/1220384961200578563
2020-01-23 16:34:20,1standlasttweet,,0,1,Well done to the lads who challenged @NicolaSturgeon today. Her party are Scotland’s SINN FEIN. Terrorist apologists.,@NicolaSturgeon,,https://twitter.com/1standlasttweet/status/1220384278191779840
2020-01-23 16:30:53,AdrianKavanagh,,1,5,"The Green Party, Fine Gael and Fianna Fáil will contest every constituency at #GE2020 Sinn Féin will contest every constituency, apart from Cork North-West Four other parties are running 20+ candidates (as shown in the chart below) More details here: https://adriankavanaghelections.org/2017/04/19/candidates-for-the-next-2017-2021-general-election-by-constituency/",,#GE2020,https://twitter.com/AdrianKavanagh/status/1220383412487364613
2020-01-23 16:29:54,MTaylorClare,glennthefitz,1,0,Rewriting history? You must be joking. There are folks on my mentions who are convinced that their Sinn Féin is the same one that Collins &amp; Dev were in 😂😂😂,,,https://twitter.com/MTaylorClare/status/1220383164004208642
2020-01-23 16:28:42,TheFlyingColum1,,1,0,As if Martin McGuinness and Gerry Adams didn't do terrible things in the past? Sinn Fein are dwelling on the moons of Jupiter if they think they can dissociate Republicanism from a long history of physical force. Was the 1916 Rising 'encouraging terrorists'?,,,https://twitter.com/TheFlyingColum1/status/1220382859837542400
2020-01-23 16:23:24,Ogra_SF,melaniietweets,1,1,♥️ YAAAASSS Melanie! ♥️ All aboard the Sinn Féin train 🚂🚃🇮🇪🚃🇮🇪🚃🇮🇪🚃🇮🇪🚃🇮🇪🚃,,,https://twitter.com/Ogra_SF/status/1220381526698885122
2020-01-23 16:22:35,JeanMonnetRHUL,,1,0,".@M_AndesonSF, European United Left and Sinn Fein, speaks now. Nobody has stopped the Brexit juggernaut. Choice is to vote for orderly withdrawal or a crash out. MEPs have mostly understood the Good Friday Agreement.",,,https://twitter.com/JeanMonnetRHUL/status/1220381320800546817
2020-01-23 16:19:56,Colm_Moloney,NiamhMcAdam,0,0,Exactly Sinn Fein are experts at hurling from ditch and can do and say what they want as they know there is very little chance of actually having follow to through. If you want to effect change you have to aim to be in power or at least off credible opposition,,,https://twitter.com/Colm_Moloney/status/1220380655290343424
2020-01-23 16:15:31,SazCurran,,0,0,People before Profit or Sinn Fein👍🏽👍🏽👍🏽,,,https://twitter.com/SazCurran/status/1220379542205890560
2020-01-23 16:15:10,KOBrien1977,FintanYTWalsh,0,0,could she forsee a time in the near future that the soc dems and labour get back together and make a concerted effort to reclaim 3rd biggest party position from sinn fein,,,https://twitter.com/KOBrien1977/status/1220379454540783617
2020-01-23 16:11:19,pawlie001,DevinJohnDoyle,1,0,"Agreed and I’d like to give Sinn Fein a go but imo they didn’t enter enough candidates to become main party as they would prefer main opposition for next term,",,,https://twitter.com/pawlie001/status/1220378487145537537
2020-01-23 16:10:10,MTaylorClare,FidelCastroTD,5,0,Maybe if it was you'd find out that Fine Gael is actually called Fine Gael - The United Ireland Party and was referred to in parts of the country as UIP until the present Sinn Féin appeared in the mid-1970s.,,,https://twitter.com/MTaylorClare/status/1220378198254477313
2020-01-23 16:09:46,WatchPopulistIr,HamillOSF,0,0,I distinctly remember exactly the same offer from Sinn Fein in 2016 they hashtagged everything bar #BetterForOpposition but at 1030pm the night of the count the great ideas were gone and the comfort of opposition was the only game in town. #GE2020,,#BetterForOpposition #GE2020,https://twitter.com/WatchPopulistIr/status/1220378095628230656
2020-01-23 16:09:20,a_callumb,voter_irish,1,0,"Well considering Sinn Féin’s poll rise, she should have a spot among the potential winners.",,,https://twitter.com/a_callumb/status/1220377986643496965
2020-01-23 16:08:59,DomaineValescia,DanielJHannan,0,0,Sinn Fein is the third largest party in RoI and second in NI. It’s now just a question of time - sadly.,,,https://twitter.com/DomaineValescia/status/1220377898818908161
2020-01-23 16:08:14,mrderekmccabe,johnbradysf,0,0,Why didn't you protest outside the building/studio. All talk no action. Th founders of the real sinn fein would kick the lot of ye up the arse.,,,https://twitter.com/mrderekmccabe/status/1220377710414876672
2020-01-23 16:05:38,TVsCarlKinsella,TVsCarlKinsella,3,0,I'm only missing a Sinn Féin participant now. ,,,https://twitter.com/TVsCarlKinsella/status/1220377056036446208
2020-01-23 16:01:51,Lfc20001,SJAMcBride,0,0,"#SinnFein ""special advisor"" ",,#SinnFein,https://twitter.com/Lfc20001/status/1220376105040912386
2020-01-23 16:01:49,kburnskburns,climaticchange4,0,0,"They are pro life, they ain't in anyway conservative, the are sinn Fein minus the virtue signalling...",,,https://twitter.com/kburnskburns/status/1220376095318593536
2020-01-23 15:59:05,SinnFeinNUIG,,0,5,Are you in Galway? Are you voting Sinn Féin in #GE20? Contact @Farrell_Mairead for a window poster!,@Farrell_Mairead,#GE20,https://twitter.com/SinnFeinNUIG/status/1220375409411358722
2020-01-23 15:58:31,CaoimhinOSF,Ogra_SF,0,0,Sinn Féin will fix this mess. We’ve been failed for far too long! #VótáilSinnFéin #ForThePeople,,#V #ForThePeople,https://twitter.com/CaoimhinOSF/status/1220375265274224641
2020-01-23 15:58:20,c122_h122,,0,0,@IwriteOK would you say Sinn Fein are Irish extremists they are a political party?,@IwriteOK,,https://twitter.com/c122_h122/status/1220375220369985536
2020-01-23 15:57:24,W1tchin,leonhawkins_,0,0,"Ye that’s the T! Like Sinn Fein isn’t the worst but they’re not the best, it’s a step in the right direction! I think the main thing is getting FF/FG out!!",,,https://twitter.com/W1tchin/status/1220374984037732352
2020-01-23 15:52:16,AbuMaridAlDraku,,0,1,It's sinn fein,,,https://twitter.com/AbuMaridAlDraku/status/1220373694725476352
2020-01-23 15:50:53,JamesFoley15,Ciaraioch,0,0,I think we need to look at the bigger picture. Sinn Fein need to be given the chance..,,,https://twitter.com/JamesFoley15/status/1220373343255384064
2020-01-23 15:50:27,or_jnr,,1,0,"Young people for very obvious reason, ie housing and taxation. The answer to this, as ive seen on here, is to vote for Sinn Fein, a party that I personally think have tremendous ideas and strategies. However please know that they will more than likely have to make a coalition",,,https://twitter.com/or_jnr/status/1220373235386265601
2020-01-23 15:50:24,clodaghherlihy,,0,0,Being part of the only constituency in Ireland to not have a Sinn Féin option in the #GE2020 is so disappointing ☹☹,,#GE2020,https://twitter.com/clodaghherlihy/status/1220373222316744705
2020-01-23 15:49:26,IrelandHomeless,,0,0,"WE WANT CHANGE, NOW!!!! Tomorrow, we march! Tomorrow, we shout! Tomorrow we will be heard! #ProtestAgainstHomelessness #LessTalkMoreAction #TimeForChange #GE2020 #Homelessness #FineGael #FiannaFail #SinnFéin #PBP #Labour #Greens #Independents #HomesNotHotels #Ireland",,#ProtestAgainstHomelessness #LessTalkMoreAction #TimeForChange #GE2020 #Homelessness #FineGael #FiannaFail #SinnF #PBP #Labour #Greens #Independents #HomesNotHotels #Ireland,https://twitter.com/IrelandHomeless/status/1220372978363502593
2020-01-23 15:49:20,ukcatholicpress,,0,1,#Priest backed for #SinnFein #ban over #abortion @sinnfeinireland,@sinnfeinireland,#Priest #SinnFein #ban #abortion,https://twitter.com/ukcatholicpress/status/1220372952878931970
2020-01-23 15:48:27,RobCussen2,Mrirish_,0,0,What does Sinn Fein bring to the table what will they do differently,,,https://twitter.com/RobCussen2/status/1220372731759296513
2020-01-23 15:48:16,WhyUps,80_mcswan,0,0,SNP = Sinn Fein in kilts,,,https://twitter.com/WhyUps/status/1220372686406332417
2020-01-23 15:47:16,Dublin45078537,rettiwt5463,0,0,"Mary lou should tell RTE and dennis o bribe tv ,their are other platforms to put the sinn fein message across ,and their monopoly is finished",,,https://twitter.com/Dublin45078537/status/1220372436702711808
2020-01-23 15:45:17,fitzyfloop,,0,0,"really a Sinn Féin lead rainbow government is very very much a long shot, but its the ideal outcome",,,https://twitter.com/fitzyfloop/status/1220371936259268609
2020-01-23 15:43:52,sir_knox,CybernatAlan,2,0,"Scotland's shame,Scotland's Sinn Fein ",,,https://twitter.com/sir_knox/status/1220371578296336386
2020-01-23 15:43:23,IndyWorld,,0,1,Sinn Fein surge in polls ahead of Ireland election as Leo Varadkar’s party suffers ,,,https://twitter.com/IndyWorld/status/1220371456699387905
2020-01-23 15:43:02,rour_ke,,1,0,Hence why most people in this age group are more likely to be on the left of the spectrum and want political reform (Sinn Féin and UK Labour supporters tend to be in this age group).,,,https://twitter.com/rour_ke/status/1220371368769916929
2020-01-23 15:39:38,fitzyfloop,,1,0,"as unlikely as it is, considering the ground that would need to be covered by every opposition party, as well as the necessity to get them all to work with Sinn Féin (the biggest obstacle I think, but I feel like the worse of the opposition are opportunistic enough to do it)",,,https://twitter.com/fitzyfloop/status/1220370512498581507
2020-01-23 15:39:37,fitzyfloop,,2,0,unironically think that FF/FG could seriously go into official coalition to block a Sinn Féin-lead coalition like if it came down to Sinn Féin getting close to having the numbers I think they might,,,https://twitter.com/fitzyfloop/status/1220370510921502720
2020-01-23 15:38:34,W1tchin,hoochiemermaid,2,0,"Ye like they’ll be one of the ones I vote for but they ain’t gonna be the main one, I’m fully for Green Party! I was looking into Sinn Fein and it’s very hit and miss, they ain’t the ones but they are defo gonna get voted in",,,https://twitter.com/W1tchin/status/1220370246198091776
2020-01-23 15:38:17,markdal32810300,lacdaly,0,0,here here! leo and this govt are apathetic when it comes to social care. utter silence from the other parties. sinn Fein are not interested... nala member wrote to all parties about to sign our pledge re basic literacy. not a word from Sinn fein,,,https://twitter.com/markdal32810300/status/1220370174601236481
2020-01-23 15:38:09,Ogra_SF,,3,52,"It's a straight choice between four men who have already failed you and one woman who has fought in your corner against them every step of the way. Easy decision, really. Vótáil @MaryLouMcDonald agus vótáil Sinn Féin ",@MaryLouMcDonald,,https://twitter.com/Ogra_SF/status/1220370138677104640
2020-01-23 15:37:08,WildWillieWall1,,0,0,@gavreilly Sitting through that 3 hour hatchet job on Sinn Fein last night must have tainted your view of both your employers and Ireland’s Democracy. You seem the only one involved who has some bit of a conscience #GE2020,@gavreilly,#GE2020,https://twitter.com/WildWillieWall1/status/1220369884086927362
2020-01-23 15:37:00,jamiepjhealy,,0,0,"Yup mary Lou, vote Sinn Fein",,,https://twitter.com/jamiepjhealy/status/1220369851740491776
2020-01-23 15:36:23,keithmagra,,0,0,"Illegally parked on the path, outside a school on a roundabout, working hard for who ? It'll be gone by 4.00, must be taxpayers paying the driver. Sinn Fein Traitors ! ",,,https://twitter.com/keithmagra/status/1220369694324068352
2020-01-23 15:35:54,o_moneill42,WilliamsJon,0,1,Sinn Fein bias. Their minders in FFFG will be happy to exclude SF. Censorship is alive and well.,,,https://twitter.com/o_moneill42/status/1220369574849392642
2020-01-23 15:35:20,banbloodsports,,2,19,"66,000 sign petition urging Sinn Fein to back a ban on cruel hare coursing https://www.change.org/p/sinn-fein-support-a-ban-on-cruel-hare-coursing #Ireland #BanHareCoursing",,#Ireland #BanHareCoursing,https://twitter.com/banbloodsports/status/1220369432394063872
2020-01-23 15:34:52,Paul38031645,IrishTimes,0,1,Sinn Fein or were all fucked! ,,,https://twitter.com/Paul38031645/status/1220369312872947715
2020-01-23 15:33:00,steelepicture,,1,12,"""When we starved together on hunger strike it was not to move the process forward, it was not for seats in a British government. It was to rid this land of any British interference. I would not have missed a good breakfast for what Sinn Fein achieved."" - Dolours Price ",,,https://twitter.com/steelepicture/status/1220368842851045377
2020-01-23 15:30:28,Niall_Breen98,,1,0,Will we all stick a tenner on Sinn Fein at 66’s and all go vote for them for the sweat,,,https://twitter.com/Niall_Breen98/status/1220368205874716672
2020-01-23 15:28:21,W1tchin,,1,0,Why y’all voting Sinn Fein? It don’t make no sense mama,,,https://twitter.com/W1tchin/status/1220367672245936129
2020-01-23 15:23:27,AintSnp,DollyG2007,0,1,i've answered this many times before. IRA/SINN FEIN SUPPORTERS mainly in scotland.....there is another sponsored IRA march on saturday in glasgow by SNP. STURGEON tweeted last year that any scottish protestors is unacceptable. BLOCK vote by MUZZIES too via imams in MOSQUES,,,https://twitter.com/AintSnp/status/1220366440655728640
2020-01-23 15:23:01,ImmaRainebow,sinnfeinireland,0,0,This is what I've been waiting to see! 👏🏼 #GE2020 #SinnFéin ,,#GE2020 #SinnF,https://twitter.com/ImmaRainebow/status/1220366330987253763
2020-01-23 15:21:27,PaddyPurt,cimicc,0,0,"yeah i did that, mine skewed towards Sinn Fein because I said burning the flag should be illegal. Its not like Fine Gael having tricolour burning parties.",,,https://twitter.com/PaddyPurt/status/1220365937620201472
2020-01-23 15:18:43,VanguardBears,,10,51,IRA out of Holyrood! Sinn Fein/SNP told a few home truths. ,,,https://twitter.com/VanguardBears/status/1220365251704696833
2020-01-23 15:18:33,fintancox,KevinPMeagher,0,0,If FF cabt form a government with the greens labour and the indos they will form a government with sinn fein and do a labour on them ,,,https://twitter.com/fintancox/status/1220365209791029249
2020-01-23 15:18:16,moreflowers4,irish_news,0,0,joe doesn't speak for the nationalists I know as they have never voted for Sinn Fein because of their association with known killers and bombers if joe is hoping for the voters in the south to okay a UI he is living in dreamland.,,,https://twitter.com/moreflowers4/status/1220365138114547713
2020-01-23 15:13:37,UlyssesReader,,0,0,"nomen!), Socratididion's Epipsychidion, no man, not a woman, will ever know. But neither the midwife's lore nor the caudlelectures saved him from the archons of Sinn Fein and their naggin of hemlock.",,,https://twitter.com/UlyssesReader/status/1220363967803154433
2020-01-23 15:11:56,fintancox,SJAMcBride,0,2,So the question now @MaryLouMcDonald will have to answer is this will she have to run key government decisions past Ted Howell and what position does this man actually have in sinn Fein and who appointed him to such a position of influence ,@MaryLouMcDonald,,https://twitter.com/fintancox/status/1220363541703733250
2020-01-23 15:10:21,FionnRodgers,MrVirtueSignal,0,0,"I'd say a wee bit, among the wrap the green flag round me constituency- certainly after Leo's botched RIC commemorartion- but not in any significant way. Sinn Féin will take off Labour and the Left.",,,https://twitter.com/FionnRodgers/status/1220363143412625408
2020-01-23 15:05:11,lordcarsonwest,JournoStephen,0,0,Well done those men....clearly pointing out the SNP backing for Sinn Fein/IRA politics and following their Republican ways......Scotland is a powder keg ready to blow with wee Nicola holding the fuse,,,https://twitter.com/lordcarsonwest/status/1220361844629655552
2020-01-23 15:04:47,UlsterVanguard,FixThisNowPls,0,0,"Mandatory coalition manufactures the illusion of a binary choice, in that if your a unionist you vote DUP and if nationalist then Sinn Fein. Its a perverse system",,,https://twitter.com/UlsterVanguard/status/1220361744838807553
2020-01-23 15:01:44,brendandrummey1,denisoconnell63,0,0,Aah hello how do u explain labour so They were included last time around and lied lied lied Everyone blames or takes swipes at sinn fein yet theve never caused any melt down to this country like the so called big 2 have joan burton destroyed families as for Eamon Gilmore ffs,,,https://twitter.com/brendandrummey1/status/1220360976031256576
2020-01-23 14:55:48,MrVirtueSignal,FionnRodgers,1,0,Only other likely coalition partner would be Sinn Fein.,,,https://twitter.com/MrVirtueSignal/status/1220359481604956162
2020-01-23 14:53:37,IanChopperLowry,,1,0,The next time someone from RTÉ or the media at large starts their usual nonsense line of questioning to discredit Sinn Féin whilst interviewing a member of the party! 😂 @fionamitchell56 @DMitchellTD @DublinSinnFein @sinnfeinireland @think__32 #VótáilSinnFéin #GeneralElection2020,@fionamitchell56 @DMitchellTD @DublinSinnFein @sinnfeinireland @think__32,#V #GeneralElection2020,https://twitter.com/IanChopperLowry/status/1220358932499034113
2020-01-23 14:47:34,ulstertimes,BallywalterPark,0,0,Jennifer has never condemned the Provisional Sinn Fein IRA gang. Now is her chance to prove me wrong ..,,,https://twitter.com/ulstertimes/status/1220357412584030208
2020-01-23 14:42:57,jediknight1985,oconnellhugh,0,2,"Martin is being horrendously disingenuous. The imperative that drove him to partner with Fine Gael, which he admitted again last night, was to keep Sinn Féin out, &amp; any alternative government, that isn’t FF or FG, firmly off the table. Leo Varadkar drew the logical conclusion. ",,,https://twitter.com/jediknight1985/status/1220356248387887104
2020-01-23 14:42:03,cullenkeith,,0,0,"Parties should give a committment not to go into govt with FG/FF. They are the same. Its a trap, they are the bad guys. @labour @sinnfein @greenparty_ie @SocDems @pb4p Micheál Martin rules out Fianna Fáil-Fine Gael ‘grand coalition’",@labour @sinnfein @greenparty_ie @SocDems @pb4p,,https://twitter.com/cullenkeith/status/1220356024156217344
2020-01-23 14:31:22,TarynDeVere,,1,0,"“Fine Gael just scraped over the quota at (30.5%). Fianna Fáil (31%), Labour (32%) and Sinn Féin (33%) didn’t do much better."" #Women4Election",,#Women4Election,https://twitter.com/TarynDeVere/status/1220353335607332867
2020-01-23 14:25:52,Evercurious123,Al_toMyFriends,0,0,Whenever I think of Sinn Fein ... ,,,https://twitter.com/Evercurious123/status/1220351947863220224
2020-01-23 14:15:41,IrishTimesOpEd,,0,2,Opinion: Ruling Sinn Féin out of power in Dublin infantilises Stormont ,,,https://twitter.com/IrishTimesOpEd/status/1220349388670849024
2020-01-23 14:15:38,sir_knox,hihat21,3,1,"Scotland's shame, Scotland's Sinn fein ",,,https://twitter.com/sir_knox/status/1220349374573764608
2020-01-23 14:14:56,moscannail,,0,0,"A petition for Sinn Féin to be added to RTE's Leaders debate has reached its original target of 25,000 signatures. I wasn't sure if it was better for SF to wait in the shadows, but thought it was unfair in last night's debate that MM and LV could criticise SF without rebuttal. ",,,https://twitter.com/moscannail/status/1220349196521263104
2020-01-23 14:12:08,cahill_marley,JamesReynoldsNP,0,1,The fact this fascist prick is actually ALLOWED to mount an election board like this is sick. Immigrants should not be used to spin narratives during election time they are literally PEOPLE. Vote Sinn Fein #GE20,,#GE20,https://twitter.com/cahill_marley/status/1220348491752464387
2020-01-23 14:11:48,sir_knox,amroger1,2,0,"Scotland's shame, Scotland's Sinn Fein ",,,https://twitter.com/sir_knox/status/1220348410022092801
2020-01-23 14:10:28,Ciara56803547,,0,0,@NoelRock a group of 30 parents met with @PaulMcauliffe @keithconnollyff Fianna Fáil and @cllrdessieellis Sinn Fein in relation to ASD education for Finglas and for children with learning disabilities. When can you meet with us ?,@NoelRock @PaulMcauliffe @keithconnollyff @cllrdessieellis,,https://twitter.com/Ciara56803547/status/1220348076084400129
2020-01-23 14:10:11,sir_knox,John_Arab,0,0,The Scottish Sinn Fein Party ,,,https://twitter.com/sir_knox/status/1220348001761341442
2020-01-23 14:08:59,corkyhere,News_Letter,1,0,"1/ That is BS “the desire to maintain the union was driven by ‘material well-being’.” Really is this an approp incitement letter to post in what terms itself a respectable newspaper? It would not be found acceptable now to be posted in An Phoblacht, the Sinn Fein newspaper. The",,,https://twitter.com/corkyhere/status/1220347699532386312
2020-01-23 14:07:38,Seighin_OC,,1,0,"Fine Gael want to raise the pension age to 67 and then to 68 in a few years time. If this isn't stopped now then many people wont even live to pension age. Sinn Féin will bring pension age back to 65, anyone who has worked all of their lives deserve to be able to retire at 65 ",,,https://twitter.com/Seighin_OC/status/1220347362679435266
2020-01-23 14:07:09,StephenBleming1,LeoVaradkar,0,0,No one can afford your 21000 gafs you smell bag how can a homosexual man with no family have a say in housing and family crisis? the rich just getting richer reducing taxes for the rich like him and using there change to look after the people. Vote Sinn Fèin ,,,https://twitter.com/StephenBleming1/status/1220347240813879297
2020-01-23 14:06:14,WeAreBrightBlue,,0,1,"Read 'Northern Ireland: A New Hope' by Robert Mirante, today on the Centre Write blog. @robmirante #stormonttalks #NorthernIreland #SinnFein #DUP",@robmirante,#stormonttalks #NorthernIreland #SinnFein #DUP,https://twitter.com/WeAreBrightBlue/status/1220347009573498880
2020-01-23 14:03:23,thebloodiesword,SamanthaLibreri,0,1,"Not one POC. I can't believe how racist Sinn Fein are-if they truly supported diversity, the majority of SF candidates would be minorities. #WhiterThanWhite #SinnFeinRacism #LetThemAllIn #RefugeesWelcome #RacistIreland #DiversityandInclusion #DiversityInIreland #Pride2020 #GE2020",,#WhiterThanWhite #SinnFeinRacism #LetThemAllIn #RefugeesWelcome #RacistIreland #DiversityandInclusion #DiversityInIreland #Pride2020 #GE2020,https://twitter.com/thebloodiesword/status/1220346293521997824
2020-01-23 13:58:40,thebloodiesword,SamanthaLibreri,0,0,"Ugh, #SoWhite. If Sinn Fein truly supported diversity, the majority of SF candidates would be minorities #WhiterThanWhite #SinnFeinRacism #LetThemAllIn #RefugeesWelcome #RacistIreland #DiversityandInclusion #DiversityInIreland #Pride2020",,#SoWhite #WhiterThanWhite #SinnFeinRacism #LetThemAllIn #RefugeesWelcome #RacistIreland #DiversityandInclusion #DiversityInIreland #Pride2020,https://twitter.com/thebloodiesword/status/1220345104147329024
2020-01-23 13:57:15,Keithc786,,0,0,Sinn Fein it is,,,https://twitter.com/Keithc786/status/1220344747287547904
2020-01-23 13:55:01,cammysinghcl,PALillie,0,0,"It was 12, & really more like 20 when Sinn Fein &amp; Bercow were factored out.",,,https://twitter.com/cammysinghcl/status/1220344186123300865
2020-01-23 13:54:50,Primosono,BigFatFenian,0,0,"SINN FEIN, get Number 1, and Shane Rose get 2, Maria Bailey is not running ",,,https://twitter.com/Primosono/status/1220344141256720384
2020-01-23 13:54:10,smackovsky,,1,1,to be a fly on the wall with a Sinn Fein min .for justice and Drew Harris.,,,https://twitter.com/smackovsky/status/1220343972222160896
2020-01-23 13:53:20,Cleggan1,,0,0,Mary Lou McDonald asks uncertain voters to give Sinn Féin ‘a chance’ ,,,https://twitter.com/Cleggan1/status/1220343762209189889
