date,username,to,replies,retweets,text,mentions,hashtags,permalink
2020-01-16 16:43:19,Guitarista4,AUOBALBA,1,1,No! A lot of money was spent and hard work done campaigning. This is Scotland. Not Ireland. Not Sinn Fein. Even some English people say the SNP is the best opposition to the Tories.,,,https://twitter.com/Guitarista4/status/1217849825997271043
2020-01-16 16:42:57,dyl_a81,HamillOSF,0,0,"Genuine question, why should someone who clearly doesn’t share the views of Sinn Féin continue to be party representative? If his views are that contrary to the party then he should surely be independent or representing a party that share those views?",,,https://twitter.com/dyl_a81/status/1217849733483548674
2020-01-16 16:42:54,HulbertMathew,,1,0,"Coded homophobia? At the very least, totally unnecessary comments. The real face of Sinn Fein?! #GE2020 #Ireland ‘I want a family man running the country’ — Sinn Fein councillor slated for ‘bizarre’ comments about Leo Varadkar ",,#GE2020 #Ireland,https://twitter.com/HulbertMathew/status/1217849719256383488
2020-01-16 16:41:53,Heritage_IRL,ElOsoGrizzly5,2,0,"She is ya. By destroying Sinn Féin. Fair play to her. As far as I can see Croft is doing plenty to renounce his past deeds. What do you think about Sean South, Tom Clarke, Eóin O Duffy, Dan Breen? They were all patriots. People like you try to paint them as demons.",,,https://twitter.com/Heritage_IRL/status/1217849462627930125
2020-01-16 16:41:05,conallGmolloy,,0,0,"I come out and say I'm voting Sinn Féin and then the NEXT DAY an SF councillor hits us with some classic ancient mythic winds of Ireland racism, homophobia AND sexism in one go. Democracy is pain in the hole, let us just be enslaved and we can move on",,,https://twitter.com/conallGmolloy/status/1217849261746008065
2020-01-16 16:40:55,munster4ever,PaulQuinnNews,1,0,I cannot wait for sinnfein to call to my door during the run up to the election campaign.. not only will i keep them talking but when they are finished i will them to feck off.. #SorryNotSorry,,#SorryNotSorry,https://twitter.com/munster4ever/status/1217849220780253184
2020-01-16 16:38:06,calumofstewart,robolger,1,0,This is all so interesting. Are Sinn Fein likely to get in this time or is it too much of an ask?,,,https://twitter.com/calumofstewart/status/1217848512878129153
2020-01-16 16:37:53,ExeKaye,,0,0,"Varadkar remarks were 'misinterpreted' - Holohan https://www.rte.ie/news/election-2020/2020/0116/1107829-sinn-fein-holohan/ via @rte Gross, he shouldn't need to resign from the party: he should be kicked out. Do Sinn Fein really want those ideas as",@rte,,https://twitter.com/ExeKaye/status/1217848457945157632
2020-01-16 16:37:47,missehughes79,,0,0,Sinn Féin To Begin Spouting Racism In Bid To Get On RTÉ Debate ,,,https://twitter.com/missehughes79/status/1217848434239197186
2020-01-16 16:36:59,darrenjokeeffe,,4,30,"Petition · Leo Varadkar, Micheál Martin and RTÉ want to freeze Mary Lou McDonald and Sinn Féin out of this election. Let them know they don’t own the debate on Ireland’s future. Sign this petition and share with your friends. #GE2020",,#GE2020,https://twitter.com/darrenjokeeffe/status/1217848232547581952
2020-01-16 16:36:45,AndyMOBrien,,1,1,"Not that I don’t put my foot in it (and when I do, it usually goes hard to the ground), I really see the stupidity/total ignorance of Paddy Holohan’s remarks, and the total non apology becoming swing gate 2.0, unless Sinn Féin get a hold on it now.",,,https://twitter.com/AndyMOBrien/status/1217848173231771651
2020-01-16 16:36:25,NewstalkFM,,1,0,"#SinnFéin councillor @PaddyHolohanMMA claims comments he made about Taoiseach Leo Varadkar were ""misrepresented.""",@PaddyHolohanMMA,#SinnF,https://twitter.com/NewstalkFM/status/1217848089148641280
2020-01-16 16:36:24,babyjanecoyle,JohnMadden86,0,0,I mean it's not just Sinn fein though is it? Plenty of Fine Gael got caught out on racism. Fianna Fail largely created Direct Provision. If anything SF are the best of the big 3.,,,https://twitter.com/babyjanecoyle/status/1217848084694208513
2020-01-16 16:34:16,ManUtdIrishReds,shanekennedy7,0,0,"In my previous tweet I did mention Sinn Fein candidate, to be honest me or my family wont vote for any of them and we did in previous elections.",,,https://twitter.com/ManUtdIrishReds/status/1217847545776484357
2020-01-16 16:33:46,OdranReid,,0,0,Sinn Féin councillor says his Varadkar comments ‘misinterpreted’ and apologises https://www.irishtimes.com/news/politics/sinn-f%C3%A9in-councillor-says-his-varadkar-comments-misinterpreted-and-apologises-1.4141879#.XiCQItAWCLI.twitter via @IrishTimes Misinterpited? That would be difficult to do as the comments are so clear.,@IrishTimes,,https://twitter.com/OdranReid/status/1217847422476587008
2020-01-16 16:32:26,EuroCelt,,1,0,Dog-whistle racism & homophobia by Sinn Féin politician as he questions Taoiseach’s sexuality &amp; Indian heritage https://www.irishtimes.com/news/politics/sinn-f%C3%A9in-councillor-says-his-varadkar-comments-misinterpreted-and-apologises-1.4141879?mode=amp,,,https://twitter.com/EuroCelt/status/1217847085158014977
2020-01-16 16:29:35,ConorPCullen,PaddyHolohanMMA,0,0,"If you are being badly misrepresented to the extent that it looks like you did a big bunch of racism and homophobia, you have to do a much stronger actual apology, then provide the context you imply wasn't given. Can't believe Sinn Fein would allow a statement like that.",,,https://twitter.com/ConorPCullen/status/1217846367269335040
2020-01-16 16:28:22,CentenaryNI,JamieBrysonCPNI,2,0,"Serious question for fellow Unionists and Loyalists: Do we just continue to vote for @duponline regardless of their incompetence in order to keep Sinn Fein out, or do we demand a change in @DUPleader?",@duponline @DUPleader,,https://twitter.com/CentenaryNI/status/1217846062322503685
2020-01-16 16:25:58,IvanYatesNT,,2,0,"""They were wrong, they don't reflect the views of Sinn Fein!"" @PearseDoherty on the comments made by Paddy Holohan #GE2020",@PearseDoherty,#GE2020,https://twitter.com/IvanYatesNT/status/1217845458527277061
2020-01-16 16:25:54,FionntanOS,,0,0,"Political defferences aside - regardless of whether you normally vote for a Fine Gael, Fianna Fáil or Sinn Féin candidate wouldn't it surely make for more interesting TV viewing to have a robust debate ? ",,,https://twitter.com/FionntanOS/status/1217845442890928130
2020-01-16 16:25:37,MTaylorClare,,5,2,"Paddy Holohan can backtrack all he likes, but his comments were utterly vile. Many accuse us of gutter politics, but this racist, homophobic diatribe from Sinn Féin's Holohan was a new low. Attacking people not ideas is typical from someone who has nothing valuable to say #GE2020",,#GE2020,https://twitter.com/MTaylorClare/status/1217845370665029634
2020-01-16 16:24:46,SamanthaLibreri,,13,9,"The Sinn Fein President Mary Lou Donald has said shes satisfied that Councillor Paddy Holohan has apologized for the comments he made about the Taoiseach. She said the party had insisted he apologized, that he had done that and that it was the right thing to do @rtenews",@rtenews,,https://twitter.com/SamanthaLibreri/status/1217845156419973120
2020-01-16 16:24:16,pauloftarsis1,goldenhart1234,2,0,Sinn Fein have got no right to say anything about what goes on in the British HoC pertaining to Ireland. Don't have a go at Colum Eastwood for his inability to say anything about that egregious prick Campbell when they refuse to be there to back him up.,,,https://twitter.com/pauloftarsis1/status/1217845030087319552
2020-01-16 16:24:15,Donal_OKeeffe,PaddyHolohanMMA,40,115,"This is the shittest non-apology apology you'll ever read. There is absolutely no misinterpreting Paddy Holohan's racist, homophobic and misogynistic comments, and he did make them, on his own podcast. Even by Sinn Féin's brazen standards, this is some shocking stuff. #GE2020",,#GE2020,https://twitter.com/Donal_OKeeffe/status/1217845024915935234
2020-01-16 16:23:18,ronronzo,,1,0,"Nothing as of yet from Sinn Féin, the Social Democrats, The Green Party, PBP, Solidarity. Can't even find the Labour Party for some reason. Be interesting to keep an eye on it.",,,https://twitter.com/ronronzo/status/1217844789254803458
2020-01-16 16:23:12,MaoTseTim,,1,0,"The silence from Sinn Féin supporters about one of their number, who resorted to racism and homophobia, is quite deafening. If the LGBT members of that party are staying quiet, what does that say about them? What kind of allies do they have?",,,https://twitter.com/MaoTseTim/status/1217844761580752898
2020-01-16 16:22:46,Ballymagash_T,PaddyHolohanMMA,0,2,Sinn Fein councillor makes homophobic and racist comments and then claims he was misinterpreted. There's nothing to misinterpret you're a racist and a homophobe. ,,,https://twitter.com/Ballymagash_T/status/1217844655464886276
2020-01-16 16:20:44,shanekennedy7,ManUtdIrishReds,2,0,I know I live there and pass it every day. In fairness you should have mentioned the Sinn Fein and Labour posters that went up last night too.,,,https://twitter.com/shanekennedy7/status/1217844143478779904
2020-01-16 16:20:42,reksighs,,0,0,1 homeless man assaulted in his tent by a JCB and 1 homeless woman dead? But we focus on the sinn fein gobshite that said some ignorant nonsense to him. What was said was bad but it's glad to see that the Irish people have their priorities in order,,,https://twitter.com/reksighs/status/1217844133563457536
2020-01-16 16:20:18,billymce,roakleyIRL,0,0,The most Sinn Fein apology ever. The tragedy is they don’t realise that people might have a smidgen more respect for them if they weren’t so cowardly and owned their shit.,,,https://twitter.com/billymce/status/1217844030719037440
2020-01-16 16:20:13,malcolmdeegan,,0,0,"https://extra.ie/2020/01/15/news/irish-news/sinn-fein-paddy-holohan-leo-varadkar/amp?__twitter_impression=true ""Leo does not know what it’s like to be on the dole.’ Speaking on his podcast, Mr Holohan said that he believes Sinn Fein politicians such as Pearse Doherty and Eoin O’Broin should be in charge of the government."" #Politics #Government #Extraie",,#Politics #Government #Extraie,https://twitter.com/malcolmdeegan/status/1217844012322820096
2020-01-16 16:18:39,joxer23,happy2k9,1,0,Certainly would not like to have him representing me--Sinn Fein should suspend him from membership,,,https://twitter.com/joxer23/status/1217843615793369093
2020-01-16 16:18:12,Reniour,,28,18,"This #politicalAgitator won't be happy until blood runs on Scotland streets, we saw @theSNP March they have now amalgamated with #Sinnfein this is a dangerous game @NicolaSturgeon #politicalAgitator",@theSNP @NicolaSturgeon,#politicalAgitator #Sinnfein #politicalAgitator,https://twitter.com/Reniour/status/1217843504061276160
2020-01-16 16:17:41,Joopface,cillian32,1,0,"Well, the point is that the SF politician said things that were directly and unambiguously racist and homophobic. Then, he claimed they were misinterpreted somehow, despite being verbatim quotes. Then, Gerry Adams, Sinn Féin party grandee retweeted (and implictly endorsed) that.",,,https://twitter.com/Joopface/status/1217843373673000960
2020-01-16 16:14:26,cr8856,MarkdavidLawlor,1,0,Who represented Sinn Fein? Oops see what I did there,,,https://twitter.com/cr8856/status/1217842555154501633
2020-01-16 16:13:27,Reniour,SooksThe,2,1,Who will fund it? Is @theSNP amalgamation with #Sinnfein a sign @NicolaSturgeon is threatening to revert to terrorism if they don't get their own way?,@theSNP @NicolaSturgeon,#Sinnfein,https://twitter.com/Reniour/status/1217842309443850241
2020-01-16 16:12:48,Manton4Belfast,uuponline,0,0,". @uuponline @RobinSwannUUP fixing the mess Sinn Fein and the DUP left behind. Working for you, your family and our services. 💪👍 Our NHS cannot be trusted in their hands again. #payparity #NHS #nurses",@uuponline,#payparity #NHS #nurses,https://twitter.com/Manton4Belfast/status/1217842143525511173
2020-01-16 16:11:23,Hmmm43640828,PaddyHolohanMMA,0,1,You are a Grade A toolbox that has done damage to Sinn Féin in a very concise way.,,,https://twitter.com/Hmmm43640828/status/1217841789534687232
2020-01-16 16:11:15,Rocketgal,clairecrystal,1,0,"Not a fucking clue.... they're all landlords, like. Sinn Fein? lol",,,https://twitter.com/Rocketgal/status/1217841756806549505
2020-01-16 16:10:30,AntoinONiadh,,1,0,If Sinn Fein are consistent after the whole controversy surrounding Verona Murphy and Lorraine Clifford Lee giving out that they should have been removed as candidates then they would remove that idiot Paddy Holohan.,,,https://twitter.com/AntoinONiadh/status/1217841566615789569
2020-01-16 16:10:28,AnarchoMugwump,,0,0,Oh another group that'll be targeted is Irish Republicans. If you're a member of Sinn Fein you're probably on a watchlist already.,,,https://twitter.com/AnarchoMugwump/status/1217841559103819776
2020-01-16 16:10:08,5olasyia,,0,0,@sinnfeinireland are you kidding me? 😑😡 Sinn Féin tells councillor to withdraw Varadkar remarks ,@sinnfeinireland,,https://twitter.com/5olasyia/status/1217841473967869953
2020-01-16 16:09:49,FlannOBreacain,_Ruaidhri_,0,0,Sinn Féin Never Surrender 4 day week 3 day bender,,,https://twitter.com/FlannOBreacain/status/1217841394682867715
2020-01-16 16:06:10,DermoKennedy,IrishTimes,0,0,@sinnfeinireland Not good enough. This is not an apology. All he says here is that he is sorry he got found out as a homophobe and a racist. Still representing Sinn Fein though. And yiz are still not getting my vote until you sort this out ,@sinnfeinireland,,https://twitter.com/DermoKennedy/status/1217840477761888261
2020-01-16 16:05:50,AntoinONiadh,oceanclub,1,0,No he isn't less Irish? Where have you seen in any of my tweets that I would think that? I was merely pointing out the hypocrisy of people attacking Sinn Fein over an idiot councillor while remaining silent on comments from the Taoiseach. I don't know what's so hard to understand,,,https://twitter.com/AntoinONiadh/status/1217840390981791752
2020-01-16 16:05:08,KINGRONANTHE1ST,,0,0,Sinn Féin pledges ‘largest’ programme of public housing building in State’s history ,,,https://twitter.com/KINGRONANTHE1ST/status/1217840217677320192
2020-01-16 16:05:00,Ronanequinlan,Michael_O_Regan,0,0,He's so far from what Sinn Fein say is their policy they should expel him. Apologies are meaningless.,,,https://twitter.com/Ronanequinlan/status/1217840181438533632
2020-01-16 16:03:05,obrien_jonathan,,1,0,"This guy has to be toast as far as Sinn Féin are concerned, surely. Dreadful comments. https://www.irishtimes.com/news/politics/sinn-f%C3%A9in-councillor-says-his-varadkar-comments-misinterpreted-and-apologises-1.4141879",,,https://twitter.com/obrien_jonathan/status/1217839701010284544
2020-01-16 16:02:20,shaneheneghan,PaddyHolohanMMA,0,0,Sinn Fein's one man dumpster fire. #ge2020 #GE20,,#ge2020 #GE20,https://twitter.com/shaneheneghan/status/1217839510400249860
2020-01-16 15:59:57,sinnfeinireland,,3,31,"With 189 drug-related deaths in 2018, @orlaithiflynnsf calls for urgent, community-based action to reduce harm and tackle drug misuse. For more information, see Sinn Féin's submission to 'New Strategic Direction for Drugs and Alcohol' in link below: https://www.sinnfein.ie/contents/55753",@orlaithiflynnsf,,https://twitter.com/sinnfeinireland/status/1217838912955211776
2020-01-16 15:58:28,Conor_McCrave,,2,2,McDonald says that a Sinn Féin government would ensure everyone over the age of 65 would be able to access the State pension at a cost of €368 million euro. ,,,https://twitter.com/Conor_McCrave/status/1217838539674701824
2020-01-16 15:58:14,odonger,PaddyHolohanMMA,0,0,"No your comments were not misinterpreted......do the right thing and resign, you are costing Sinn Fein a lot of votes, or maybe this was your intention!!! From a SF member",,,https://twitter.com/odonger/status/1217838478886567942
2020-01-16 15:58:13,robolger,robolger,1,0,"However both FF and FG have those exact roots in the same history but people seem to forget that. Sinn Féin I think have the best chance of bringing in leftist policies, they are very progressive these days and they have a decent leader. Still there are some controversies with SF",,,https://twitter.com/robolger/status/1217838476609101830
2020-01-16 15:57:43,Sandyshark,FXKennedy,0,0,"The dogs on the street know that @SinnFein party is Ireland's main opposition party, so it's a major faux pas by @rte to leave them out of #2020Election leaders' debates",@sinnfein @rte,#2020Election,https://twitter.com/Sandyshark/status/1217838349018390528
2020-01-16 15:56:40,robolger,GaathGazmatum,1,0,"FF are right wing along with FG, they've been in power since I was born, pretty much two sides of the same coin. Both awful. Greens made some good gains in the last by-election, Sinn Féin have come a long way but people are weary of them due to history (IRA members etc) (1/2)",,,https://twitter.com/robolger/status/1217838085611950080
2020-01-16 15:54:33,ThirdMan__,greenmiranda,1,0,Heard speaking less during the last three years than Gerry Adams during the Sinn Fein media blackout.,,,https://twitter.com/ThirdMan__/status/1217837550896844801
2020-01-16 15:51:39,Caolanmcaree,,7,5,"Failed Conor McGregor wannabe Paddy Holohan spouting racist, homophobic tripe on his 'podcast'.Hate on Leo all you want but dont stoop to that level. Sinn Fein need all the help they can get in this election and having dopes like this around is only improve Leo's chances #GE2020",,#GE2020,https://twitter.com/Caolanmcaree/status/1217836823394779136
2020-01-16 15:51:28,Jacklllllllllll,PaddyHolohanMMA,1,0,Sinn Fein not really supporting you Paddy. I tweeted you last week to get away from them. You will just be a puppet for them unable to have an independent opinion. You're better than that.,,,https://twitter.com/Jacklllllllllll/status/1217836775500058632
2020-01-16 15:51:24,Pidge,,9,3,"Disappointed to read the Paddy Holohan comments about the Taoiseach. Sinn Féin obviously aren't my party, but they are dead right to call for a withdrawl and (proper) apology. The really progressive, decent voices who make up the bulk of SF are let down by such nonsense.",,,https://twitter.com/Pidge/status/1217836759414902785
2020-01-16 15:48:55,SeamusjKearney,,1,0,Sure it wouldn't be Irish Simpsons Fans without comments switched off on posts criticising Sinn Féin or the left... ,,,https://twitter.com/SeamusjKearney/status/1217836136795602947
2020-01-16 15:48:34,thehotash,,0,0,SINN FEIN OUT.,,,https://twitter.com/thehotash/status/1217836045892509697
2020-01-16 15:47:47,TheSun_NI,,0,0,Sinn Fein call on Paddy Holohan to apologise for remarks about Leo Varadkar ,,,https://twitter.com/TheSun_NI/status/1217835848277938176
2020-01-16 15:47:20,Reniour,Proud_Mama1,0,0,"@NicolaSturgeon is nothing more than a rabble rouser, @theSNP have emerged with #Sinnfein now, are they planning to take up sell Scotland to #EUempire",@NicolaSturgeon @theSNP,#Sinnfein #EUempire,https://twitter.com/Reniour/status/1217835737019752448
2020-01-16 15:46:08,AlanLeo_7,sinnfeinireland,0,0,It really is at a stage where we have to vote with strategy rather than political alignment... sinn fein or not we need to give ourselves the best chance at stopping a FG/FF majority.. think about it ,,,https://twitter.com/AlanLeo_7/status/1217835432873996288
2020-01-16 15:45:45,ivers_j,sinnfeinireland,0,0,How can RTE refuse to allow sinn fein on ? How is that even possible,,,https://twitter.com/ivers_j/status/1217835336681869313
2020-01-16 15:42:57,DipperMc,ronportnoir,0,0,Disgusting and called out by Sinn Féin,,,https://twitter.com/DipperMc/status/1217834635247472640
2020-01-16 15:41:58,eamonn_98,,0,0,The Sinn Féin election campaign coordinator after listening to Paddy Holohan's latest podcast... #GE2020 #GE20,,#GE2020 #GE20,https://twitter.com/eamonn_98/status/1217834384860110848
2020-01-16 15:40:19,ExeKaye,christianmorris,0,0,"Paddy H should be barred from Sinn Fein. Surely ignorance and prejudice has no place in 2020 politics, in ANY party.",,,https://twitter.com/ExeKaye/status/1217833969808564230
2020-01-16 15:38:50,thecoldgun,,2,0,Hits keep coming for McGregor. SBG alumnus turned Sinn Fein councillor says a bad thing. #IrelandsShame | Sinn Féin call on Councillor Paddy Holohan to apologise for Varadkar comments https://www.joe.ie/politics/sinn-fein-call-councillor-paddy-holohan-apologise-varadkar-comments-691053?utm_source=twitter&amp;utm_medium=web&amp;utm_campaign=onsite_share via @joedotie,@JOEdotie,#IrelandsShame,https://twitter.com/thecoldgun/status/1217833596402249729
2020-01-16 15:36:15,Conor_McCrave,,1,0,"Sinn Féin leader @MaryLouMcDonald, out on the campaign trail, speaks with members of the Cabra Senior Bowls Club who field questions on housing and what can be done to fix the housing crisis",@MaryLouMcDonald,,https://twitter.com/Conor_McCrave/status/1217832947413331972
2020-01-16 15:35:58,tweet_db,,1,0,"I hope @PaddyHolohanMMA has lots of free drink with him the next time he speaks cos he’s going to need it to dig himself out of that hole 😂😂😂 the man has let himself down, big time #paddyholohan #sinnfein ",@PaddyHolohanMMA,#paddyholohan #sinnfein,https://twitter.com/tweet_db/status/1217832875938209792
2020-01-16 15:35:04,buzzdotie,,2,0,Sinn Féin councillor Paddy Holohan has issued an apology over remarks he made about Taoiseach Leo Varadkar. ,,,https://twitter.com/buzzdotie/status/1217832648737009668
2020-01-16 15:34:55,DarrenG43544166,PaddyHolohanMMA,1,1,"Your words weren't misinterpreted, your thoughts were verbalised. If you are Sinn Fein now remember your podcast maybe your own and not of Sinn Feins but Sinn Feins thoughts should be yours. The 1916 proclamation was built on equality for ALL (men women and all backgrounds).",,,https://twitter.com/DarrenG43544166/status/1217832611726360584
2020-01-16 15:32:30,lenybhoy,gracemarylaura,1,0,"They could of spoke to Sinn Fein..either of them.They will after this election,mark my words.Why should they not talk to them ? Who do they think they are ?",,,https://twitter.com/lenybhoy/status/1217832002684100611
2020-01-16 15:31:52,SamanthaLibreri,,0,2,The @sinnfeinireland President @MaryLouMcDonald is canvassing in Cabra in North Dublin telling her constituents that Sinn Fein want to return the state pension age to 65 @rtenews,@sinnfeinireland @MaryLouMcDonald @rtenews,,https://twitter.com/SamanthaLibreri/status/1217831842319163392
2020-01-16 15:31:15,Mappermick,o_poil,1,0,"Were you ever, really going to vote for Sinn Féin?",,,https://twitter.com/Mappermick/status/1217831686936895489
2020-01-16 15:30:33,rayrosebray,artimusfoul,0,0,They need to move swiftly and expel him. It ahould have been done this morning.,,,https://twitter.com/rayrosebray/status/1217831510629322760
2020-01-16 15:30:26,AdrianKavanagh,,1,0,"As far as I can see; * Green Party now have candidates in all constituencies apart from Cork South-West * Sinn Féin selections still pending in Cork North-Central (almost defo Cllr. Thomas Gould, maybe one more), Galway East (prob Louis O'Hara), Clare (prob Noeleen Moran) #GE2020",,#GE2020,https://twitter.com/AdrianKavanagh/status/1217831484234649600
2020-01-16 15:25:21,2day_tonight,,0,0,Varadkar is no more Indian than De Valera was Spanish. Sinn Féin racism needs to be called what it is.,,,https://twitter.com/2day_tonight/status/1217830204305027072
2020-01-16 15:25:10,IrishTimes,,27,4,Sinn Féin councillor Paddy Holohan says Varadkar comments ‘misinterpreted’ and apologises for offence ,,,https://twitter.com/IrishTimes/status/1217830159551803395
2020-01-16 15:20:41,stevenevetsd,TVsCarlKinsella,0,0,I think we can all agree that yahoos like #PaddyHolohan are going to deplete an awful lot of the goodwill being shown towards Sinn Féin 😬 ,,#PaddyHolohan,https://twitter.com/stevenevetsd/status/1217829031216910336
2020-01-16 15:19:50,happy2k9,PaddyHolohanMMA,4,1,"But you made the remarks. How are they being mis-interpreted? So many people attacking varadkar for sitting in to a forklift yesterday, which was ill advised, no doubt. But these comments are homophobic and racist, no matter what way you look at them! Sinn Fein have to act. Now",,,https://twitter.com/happy2k9/status/1217828814958612488
2020-01-16 15:19:11,christineomg5,LiberalLarry5,0,0,Why just why did they choose him to represent Sinn Fein ugh,,,https://twitter.com/christineomg5/status/1217828651217182721
2020-01-16 15:18:32,StevenM95164330,britain_scott,0,0,Very much doubt if a DUP or Sinn Fein representative ever made such a comment,,,https://twitter.com/StevenM95164330/status/1217828487496716288
2020-01-16 15:15:54,peterwfry,adriancummins,0,0,Time to get behind Sinn Féin,,,https://twitter.com/peterwfry/status/1217827825237053441
2020-01-16 15:14:07,JonTron84607264,fintanwarfield,0,5,"What I find interesting is that RTE refused to have Sinn Féin on their platform for years, censoring them, so to speak, yet they had their thugs at the free speech rally, whose main objective was to censor others, and now, they are crying about not being part of the live debate ",,,https://twitter.com/JonTron84607264/status/1217827379080519681
2020-01-16 15:12:34,damianstack,John_P_Browne,0,0,Sinn Féin ate their lunch in Tralee basically and I think Sinn Féin are unlikely to hold their seat so dunno what that says,,,https://twitter.com/damianstack/status/1217826986988658688
2020-01-16 15:11:27,goldenhart1234,,0,0,@columeastwood you have condemned others for not giving a voice to the north of Ireland where was your voice today for the Irish speakers when Gregory Campbell was telling lies was it because they're telling lies on sinn Fein you're willing to stay silent,@columeastwood,,https://twitter.com/goldenhart1234/status/1217826705739591680
2020-01-16 15:10:20,flowherb,fergalrte,0,0,"Any chance sinn fein can get on debates, no paymaster said no",,,https://twitter.com/flowherb/status/1217826424234676227
