date,username,to,replies,retweets,text,mentions,hashtags,permalink
2020-01-24 12:43:00,jcm247,,0,6,The DUP + Sinn Fein are both against #LiarJohnson's WA. Northern Ireland parties tell Boris Johnson that his Brexit plan is unacceptable,,#LiarJohnson,https://twitter.com/jcm247/status/1220688450258718721
2020-01-24 12:42:44,daithigor,SeanDefoe,1,2,Notably the legal advice they got was a rent freeze that had no end limit. Sinn Fein's proposal was a three year freeze. This does make a difference. ,,,https://twitter.com/daithigor/status/1220688382914895878
2020-01-24 12:42:43,RoberticusM,sinnfeinireland,0,0,"@sinnfeinireland is the only party with the best interests of the Irish people from all 32 counties as their priority, its time for change and to vote for Sinn Féin",@sinnfeinireland,,https://twitter.com/RoberticusM/status/1220688380457037825
2020-01-24 12:40:59,sousedbergin,dunta90,0,0,"Sinn Fein rally is people whipping their sides with a rolled up pamphlet yelling at candiates to, ""get on your fecking bike.""",,,https://twitter.com/sousedbergin/status/1220687942378819586
2020-01-24 12:40:12,hollymatthews70,,2,0,Kinda wanna vote Sinn Fein Kinda can’t forget Gerry Adams was in the RA at once and led the party for 35 years ,,,https://twitter.com/hollymatthews70/status/1220687747389837313
2020-01-24 12:40:07,Spartan6669,,0,0,Thats what sinn fein says beleive that there again the hand went out maybe they know them maybe they dont maybe you just dont know your selfs.,,,https://twitter.com/Spartan6669/status/1220687725839470592
2020-01-24 12:34:31,diminiedeas,,0,0,"Good morning, don’t forget to drink water and vote Sinn Fein 😁",,,https://twitter.com/diminiedeas/status/1220686317463515139
2020-01-24 12:30:36,Scullybones032,,6,0,"The only reason I think I'll be voting for Sinn Fein is because of the border poll, there's nothing else. I wonder if that's the height of stupidity for me to do so.",,,https://twitter.com/Scullybones032/status/1220685330266890240
2020-01-24 12:26:54,CentenaryNI,sinnfeinireland,2,0,Sinn Fein still can't say where the money is coming from to pay for it.,,,https://twitter.com/CentenaryNI/status/1220684396711350273
2020-01-24 12:26:42,SenLeahy1,IrishVoice1,0,0,"Well you conveniently didn't answer my questions. Why do you think a handful of hard-right candidates would do any better than Sinn Féin, the Social Democrats or Aontú? What policies that they're proposing are better? Your graphic made it seem obvious and yet you have no answers",,,https://twitter.com/SenLeahy1/status/1220684348204167170
2020-01-24 12:26:42,IrelandHomeless,,0,1,This is WRONG! We must stand up for what’s RIGHT! #ProtestAgainstHomelessness #LessTalkMoreAction #TimeForChange #GE2020 #Homelessness #FineGael #FiannaFail #SinnFéin #PBP #Labour #Greens #Independents #HomesNotHotels #Ireland,,#ProtestAgainstHomelessness #LessTalkMoreAction #TimeForChange #GE2020 #Homelessness #FineGael #FiannaFail #SinnF #PBP #Labour #Greens #Independents #HomesNotHotels #Ireland,https://twitter.com/IrelandHomeless/status/1220684346782355458
2020-01-24 12:23:27,paul_gavan,,0,8,Sinn Fein are four square behind #stop67,,#stop67,https://twitter.com/paul_gavan/status/1220683528360185857
2020-01-24 12:22:38,CentenaryNI,MaryLouMcDonald,2,0,"Sinn Fein have the solutions, only thing is they don't know where the money is coming from to pay for them.",,,https://twitter.com/CentenaryNI/status/1220683325905539074
2020-01-24 12:22:30,KAdvertiser,,0,0,"Sinn Féin’s Mary Lou McDonald visits Killarney - https://www.killarneyadvertiser.ie/sinn-feins-mary-lou-mcdonald-visits-killarney/ Sinn Féin President Mary Lou McDonald, who paid a visit to Killarney this morning (Friday), has said that Sinn Féin will bring CervicalCheck screening services back to Ireland. Mary-Lou was in K... ",,,https://twitter.com/KAdvertiser/status/1220683291377983488
2020-01-24 12:22:18,sinnfeinireland,,6,109,"The only reason the pension age hike is now an issue is because we in Sinn Féin have vehemently opposed it. In Government Sinn Féin will ensure you can retire at 65 with a full State Pension. FF/FG, Labour &amp; Greens all supported the hike to 68. #GE2020 #Stop67 @davidcullinane",@davidcullinane,#GE2020 #Stop67,https://twitter.com/sinnfeinireland/status/1220683242061418499
2020-01-24 12:21:54,Spartan6669,,0,0,By giving sinn fein money its the same stupid shit,,,https://twitter.com/Spartan6669/status/1220683141188288512
2020-01-24 12:21:30,wannabeart_hoe,josephkb96,1,0,Well in that case I would urge u to tactically vote socalist first then Sinn Feín,,,https://twitter.com/wannabeart_hoe/status/1220683041560985602
2020-01-24 12:20:08,JohnnyGuirke,,0,6,"Sinn Féin Ireland in Government * No USC on First €30,000 * A living wage of €12.30 * Keep pension age at 65 * Biggest Public Housing Building Programme * More Nurses &amp; Hospital Beds * Tax the Banks * A rent Freeze Vote Johnny Guirke No 1 ",,,https://twitter.com/JohnnyGuirke/status/1220682697762316288
2020-01-24 12:19:38,pubinq,LNBDublin,1,0,"And when Colette Browne mentioned the unmentionable farce of Sinn Fein exclusion from leaders debate, she was immediately attacked by the other pro establishment ""journalists"".",,,https://twitter.com/pubinq/status/1220682571597656064
2020-01-24 12:17:27,SaturdayRTE,aharring,1,0,"As things stand, we have reps from FIne Gael, Fianna Fail, Sinn Fein, Solidarity-PBP and Aontu. As with all live radio, that’s subject to change!",,,https://twitter.com/SaturdayRTE/status/1220682019501412352
2020-01-24 12:16:42,OSFBAC,,2,4,Last night Paul Donnelly launched his campaign to be elected as a Sinn Féin TD for #DubW. Dublin Ógra were proud to be there and we will be doing our best to help Paul and all our SF candidates in Dublin be elected to the Dáil on February 8th. If you want to help us get in touch.,,#DubW,https://twitter.com/OSFBAC/status/1220681831974084608
2020-01-24 12:16:00,AintSnp,NickSturgeon4,0,0,i heard chris law snp mp in HoC for 1st time the other day....he said ABSOLUTELY when bunter sinnfein ira supporter was speaking. you do realise bunter &amp; martin docherty SNP had photo with SINN FEIN at start of Parliament again INSIDE HoC in a cosy room. DISGUSTING!!,,,https://twitter.com/AintSnp/status/1220681655989538817
2020-01-24 12:11:03,EireTalk,rtenews,0,0,Dirty animals don’t deserve anything for what they’re doing to the people of Ireland. They won’t let Sinn Fein in the debate either because they are going to popular. Shame on RTÉ,,,https://twitter.com/EireTalk/status/1220680410528722946
2020-01-24 12:08:53,spooftaig,,1,0,love how gerry adams has been retiring from politics for ages but is always hanging around he's like a watermark on sinn féin content,,,https://twitter.com/spooftaig/status/1220679866477088768
2020-01-24 12:08:04,MaryLouMcDonald,,11,34,"Great morning in the beautiful Kingdom of Kerry with our candidate Pa Daly and the mighty Martin Ferris. Big discussions about issues facing ordinary people throughout the county. Sinn Féin have the solutions, we need your support! #GE2020",,#GE2020,https://twitter.com/MaryLouMcDonald/status/1220679659098120198
2020-01-24 12:06:19,cathal_murrayy,JohnCon75779360,1,0,I have no brain because I’ll vote Sinn Fein,,,https://twitter.com/cathal_murrayy/status/1220679219719626752
2020-01-24 12:03:15,Bytox_Ireland,,0,0,Sinn Féin pledges to cut salaries of TDs and Ministers if elected ,,,https://twitter.com/Bytox_Ireland/status/1220678447518900224
2020-01-24 12:00:34,ahernmike132,,3,4,In Tralee today I spoke with Sinn Féin President Mary Lou McDonald and GE candidate Pa Daly. She told Kerry’s Eye that suggestions to privatise the HSE are ‘insane’ and that ‘private medicine leaves people to suffer and die’. #GE2020 #GeneralElection2020 #kerry #kerryseye #hse,,#GE2020 #GeneralElection2020 #kerry #kerryseye #hse,https://twitter.com/ahernmike132/status/1220677772311482370
2020-01-24 11:59:58,FrederickHerma7,1872Rck,0,0,They've been using sinn fein's mantra when being called out for being hypocrites for years 🙈🙉🙊 ,,,https://twitter.com/FrederickHerma7/status/1220677620238639104
2020-01-24 11:59:42,WatchPopulistIr,JakeFarrell_9,0,0,"Should vote a left of party that turns up, every promise Sinn Fein makes this time they also made in 2016, it all sounded best of pack but sadly when it was time to stand up and deliver they ran off to comfort of opposition, they'll do it again #ge2020",,#ge2020,https://twitter.com/WatchPopulistIr/status/1220677553570091008
2020-01-24 11:58:35,GaelNorse,SamanthaLibreri,0,0,"First question: ""Can you pinpoint for our listeners exactly when it was that you turned your back on the Irish Nationalist & Republican values of the Sinn Fein of old to instead embrace the Anti-Irish Globalist, Marxist ideology which you now represent?""",,,https://twitter.com/GaelNorse/status/1220677272056881154
2020-01-24 11:58:25,bbreathnach,adequatemrfox,1,0,"Yes, FF, FG, Labour, current Sinn Fein all can claim a direct link to original Sinn Fein.",,,https://twitter.com/bbreathnach/status/1220677230143180802
2020-01-24 11:57:09,JakeFarrell_9,,0,0,Told her there’s a reason every young person is voting Sinn Féin because we actually don’t want to live with our parents forever and to be able to afford our own place instead of having to emigrate. Was like talking to a wall.,,,https://twitter.com/JakeFarrell_9/status/1220676911791247360
2020-01-24 11:54:42,clarkejps,GerryAdamsSF,2,0,If that's the case why did Sinn Fein do so badly in the recent elections,,,https://twitter.com/clarkejps/status/1220676295450923010
2020-01-24 11:53:53,JakeFarrell_9,sinnfeinireland,3,0,"Last night I asked my mam if she was voting for Fianna Fáil or Fine Gael, she said yes. I asked why them and not Sinn Féin? ‘Well I don’t know the facts completely but all I know is that Sinn Féin won’t deliver on their promises but one of them two will’. This is the problem ",,,https://twitter.com/JakeFarrell_9/status/1220676090739548160
2020-01-24 11:52:55,adequatemrfox,bbreathnach,0,0,I’m not arguing that the current iteration of Sinn Fein was formed in 1970. This is such fucked logic sorry,,,https://twitter.com/adequatemrfox/status/1220675845766905856
2020-01-24 11:51:59,Klavigavi,,2,0,Family: whatever you do dont vote Sinn Féin Me: ,,,https://twitter.com/Klavigavi/status/1220675611020136448
2020-01-24 11:50:55,adequatemrfox,bbreathnach,1,0,That would be a really good point if they weren’t avowedly anti-democratic in 1912 or 1918. You’re right that it was a catch all party though but would that mean that Sinn Féin gets to claim literally every nationalist politician since Griffith?,,,https://twitter.com/adequatemrfox/status/1220675343478149121
2020-01-24 11:50:54,TaraCatriona,,0,0,FG just knocked at my door and I said very nicely we’re all SF in this house sorry. So he started telling how he was SF born and bred and has more republican blood in him then I do as if it’s an accomplishment. Hahahahaha then vote for Sinn Féin you numpty,,,https://twitter.com/TaraCatriona/status/1220675340579803137
2020-01-24 11:50:31,mollofla,,3,0,Aw yeah sound I owe revenue €120. Vote sinn fein so the fuckin tax we pay actually get routed back to us in some way instead of just lining pockets,,,https://twitter.com/mollofla/status/1220675243657891840
2020-01-24 11:48:57,molloy1916,andreemurphy,0,0,"""Except for the couple of hundred thousand people who vote for Sinn Fein""",,,https://twitter.com/molloy1916/status/1220674846205542401
2020-01-24 11:45:47,bbreathnach,adequatemrfox,1,0,"But the facists were originally Sinn Feiners, so by that logic has facism its roots in Sinn Fein?",,,https://twitter.com/bbreathnach/status/1220674050365775872
2020-01-24 11:44:12,bbreathnach,adequatemrfox,1,0,"Goes back to my original client - if Sinn Fein claim to be the same party as old Sinn Fein, then they too need to own people like O’Duffy and Blythe, who was a Sinn Fein TD - names you brought up as Facists. I’m saying affiliations are a bit more complicated than that.",,,https://twitter.com/bbreathnach/status/1220673652804419584
2020-01-24 11:41:43,TheAaronWalsh,RichieCorkery,0,0,"Yes Richie, it’s a shame I didn’t pass away. One less vote for your Sinn Fein if I died",,,https://twitter.com/TheAaronWalsh/status/1220673028637495296
2020-01-24 11:41:41,Smur_AOK,ChrisHazzardSF,0,0,"I often think about Jean McConville's nine motherless children and how they must think about how their mum was tortured, executed and buried on a beach on the orders of an ex Sinn Fein president who was ""never in the IRA"". How does Gerry sleep at night Chris?",,,https://twitter.com/Smur_AOK/status/1220673017942024192
2020-01-24 11:31:03,bbreathnach,adequatemrfox,1,0,"People like Blythe was also a Sinn Fein TD, member of IRB, Orange Order, FG, Ulster Protestant who went to Kerry to become better at Irish. Our history is more complicated than labeling them with one affiliation.",,,https://twitter.com/bbreathnach/status/1220670342089396225
2020-01-24 11:27:10,jediknight1985,7815PWK,2,3,"It’s the anti-Sinn Féin depository for almost every shade of opinion, no matter where on the political spectrum, from across these islands. That’s a level of fakery &amp; bogus political conviction only rivalled in the mind of Donald J. Trump. ",,,https://twitter.com/jediknight1985/status/1220669365814747136
2020-01-24 11:22:01,MrsDKlopp,SocDems,0,0,"Hi Soc Dems, convince me why I should give my no. 1 vote to you and not Sinn Féin? Climate change, homelessness, property bubble and rents, taxing the rich and the corps, serious public transport improvements are some of my main concerns. Locally Leixlip needs a swimming pool.",,,https://twitter.com/MrsDKlopp/status/1220668070064201728
2020-01-24 11:20:32,Jack_Leahy,SeamusGoldsmith,0,0,Ah there is definitely someone in Sinn Féin who knows how to make posters petrol-bomb-proof,,,https://twitter.com/Jack_Leahy/status/1220667695940734976
2020-01-24 11:14:29,mattcarthy,,2,19,"Sinn Féin commits to €60,000 CAP payment limit in order to ensure that the majority of family farms receive increased supports https://www.farmersjournal.ie/sinn-fein-commits-to-60-000-cap-payment-limit-522371 #GE2020",,#GE2020,https://twitter.com/mattcarthy/status/1220666173039099905
2020-01-24 11:14:24,jediknight1985,jasonomahony,0,0,So Sinn Féin are the real opposition then,,,https://twitter.com/jediknight1985/status/1220666152541663232
2020-01-24 11:11:58,lmaoilir,,1,0,A glimpse of Ireland under #SinnFein! #GE2020 #GE20 #TonightVMTV Legal chaos in #Poland amid warning that country is no longer 'governed by rule of law',,#SinnFein #GE2020 #GE20 #TonightVMTV #Poland,https://twitter.com/lmaoilir/status/1220665539091226624
2020-01-24 11:06:15,jeremydepots,,0,0,"Say what you like about Sinn Fein...and you can ‘cause they are not allowed a platform to defend themselves. Thank you FF, FG, RTE, Virgin TV etc for giving me a party to give my protest to.",,,https://twitter.com/jeremydepots/status/1220664103263461379
2020-01-24 11:05:02,nikki_gavan,INMO_IRL,0,2,"We deserve better than this FG, Labour, Greens&FF have ALL sat in govt over the last 9 years - don’t give them another 5 years Vote Sinn Féin ,end the crisis,support our frontline staff &amp; build a health service fit for purpose 🗳#GE2020 #VotáilSinnFéin",,#GE2020 #Vot,https://twitter.com/nikki_gavan/status/1220663795074437120
2020-01-24 11:04:54,donnchaoh,JOEdotie,1,1,Martin nails this issue in this clip. Not clear if Sinn Fein decision-making process would accord with Irish constitution if they were in government. ,,,https://twitter.com/donnchaoh/status/1220663762388180992
2020-01-24 11:02:59,donnchaoh,heffop,0,0,Sinn Fein don't look for opinions from their Ard Chomhairle before making decisions. They look for permission. Big difference.,,,https://twitter.com/donnchaoh/status/1220663279367917568
2020-01-24 11:00:04,careyjonny2,jenny87797866,0,0,It's a bit like the take over by official Sinn Fein of news and current affairs in the 70s.....,,,https://twitter.com/careyjonny2/status/1220662546484662272
2020-01-24 10:57:15,donnchaoh,IrishTimesOpEd,0,0,This article somewhat infantilises the NI electorate. If Sinn Fein are ineffective in government then its up to the voters to kick them out.,,,https://twitter.com/donnchaoh/status/1220661836468641792
2020-01-24 10:53:36,hughwhogan,SJAMcBride,0,0,@Matthias_Winsor Check out this thread for the low down on modern day Sinn Féin and how it interacts with the IRA,@Matthias_Winsor,,https://twitter.com/hughwhogan/status/1220660919048593408
2020-01-24 10:53:34,SeamusGoldsmith,Jack_Leahy,1,0,Funny how the Sinn Féin poster managed to survive an arson attack? 😂😂😂😂😂😂😂,,,https://twitter.com/SeamusGoldsmith/status/1220660911205224448
2020-01-24 10:49:46,Fi_Barrett,,0,0,Would love to see @MaryLouMcDonald in Tralee today! Wonder if she will pop into us in @Castle_Offy near the Sinn fein office!? 😊,@MaryLouMcDonald @Castle_Offy,,https://twitter.com/Fi_Barrett/status/1220659952148254720
2020-01-24 10:46:56,WatchPopulistIr,rplobrien,0,0,"Sinn Fein heads all calling for a tribunal on this, there is no corruption at NCH it was simply rushed tender analysis to get it done yesterday, that never happened with DPER writing the cheques, resources were respected.",,,https://twitter.com/WatchPopulistIr/status/1220659240622329856
2020-01-24 10:45:35,jessicaDixon99,,0,0,A man just came up to me and told me why he’s voting for Fianna Fail and I asked him why not Sinn Fein and he goes “ because they supported Same sex marriage and abortion” I am LIVID. #GE2020,,#GE2020,https://twitter.com/jessicaDixon99/status/1220658900732645377
2020-01-24 10:45:20,pauldelaney2012,Heritage_IRL,0,0,Sinn Fein nor any group or party in Ireland could never do what yellow vests movement in France has achieved Sinn Fein protest is 20 down to the international wall with Andytown news camera man on board few snaps and then back to their lap of luxury.,,,https://twitter.com/pauldelaney2012/status/1220658839126773761
2020-01-24 10:44:57,WatchPopulistIr,DeclanPReynolds,0,0,Debt is currently 3.33 times current spend Dept of Finance see the space as €11bn Sinn Fein want a €15 bn package That would see spend at only 2.8 times national debt that is about 100% debt to GNI* of realistic GDP #ge2020,,#ge2020,https://twitter.com/WatchPopulistIr/status/1220658741491720192
2020-01-24 10:40:43,darrenjokeeffe,,3,16,"Sinn Féin President @MaryLouMcDonald addressing the media in Tralee this morning with General Election candidate Pa Daly and former TD, the great Martin Ferris. #GE2020",@MaryLouMcDonald,#GE2020,https://twitter.com/darrenjokeeffe/status/1220657678147563521
2020-01-24 10:39:27,gareth_herron,ChrisHazzardSF,0,0,"Lessons in Christian morality from Provisional Sinn Fein IRA's Chris Hazzard. That's like a course in how not to fornicate given by Prince Andrew. The most useless MP S Down has ever had, an abortion cheer leader pretending to care about children. No end to SF's Trojan horses.",,,https://twitter.com/gareth_herron/status/1220657358432612352
2020-01-24 10:39:04,JOEdotie,,17,3,'Figures who are not elected dictate Sinn Féin policy.' Micheál Martin explains why Fianna Fáil won't go into coalition with Sinn Féin and dismisses Mary Lou McDonald's claim that his party is too close to bankers. ,,,https://twitter.com/JOEdotie/status/1220657262349443072
2020-01-24 10:38:49,ConorCj,,1,1,What if Sinn Fein were going to tax your Home Lashes and Shellac business?,,,https://twitter.com/ConorCj/status/1220657200219279360
2020-01-24 10:38:04,KarlBrophy,paulmurphy_TD,3,0,Are Sinn Féin using flame resistant posters? ,,,https://twitter.com/KarlBrophy/status/1220657011312013312
2020-01-24 10:37:04,JohnCon75779360,sinnfeinireland,0,0,Use your brain! Vote Sinn Fein! 🌈🇮🇪,,,https://twitter.com/JohnCon75779360/status/1220656759364358144
2020-01-24 10:35:55,JohnCon75779360,MaryLouMcDonald,1,0,Use your brain! Vote Sinn Fein 🌈🇮🇪,,,https://twitter.com/JohnCon75779360/status/1220656470259355649
2020-01-24 10:33:53,Rachelagain,YuleGoat,1,0,"although Sinn Féin were weak on repeal (disguising it well with spin that made their policy seem more pro choice than it actually was), Mary Lou putting her face on their Yes posters was a risk she didn’t have to take and I appreciated it",,,https://twitter.com/Rachelagain/status/1220655959078588417
2020-01-24 10:31:51,Crossauldwan,,0,0,"@TodaySOR Another RTE election debate, this time on climate change, with no #SinnFein spokesperson.",@TodaySOR,#SinnFein,https://twitter.com/Crossauldwan/status/1220655444504596481
2020-01-24 10:30:54,var_dee,harrymcgee,0,1,"Can y'all ask the real reason why their manifestos were delayed? Yanno, cos being rewritten to catch up with Sinn Féin.",,,https://twitter.com/var_dee/status/1220655204992983041
2020-01-24 10:26:34,PatLawlor11,,0,13,Determined public sector workers on strike today for a decent standard of living. The new Sinn Fein Finance Minister has the power to make this happen! Let's make sure we give them full support! @nipsa @115Nipsa @127Nipsa @117Nipsa @Nipsa1131 @NipsaBranch130 @NIPSA128,@nipsa @115Nipsa @127Nipsa @117Nipsa @Nipsa1131 @NipsaBranch130 @NIPSA128,,https://twitter.com/PatLawlor11/status/1220654114025197568
2020-01-24 10:25:09,Shelsfan,Shelsfan,1,0,Them as evil people. The same was done by British government and media to members of Sinn Féin and the IRA. It’s too simplistic a narrative. The people vote for and support those they feel will protect them from a major aggressor with a lot of political and millions power.,,,https://twitter.com/Shelsfan/status/1220653759006748672
2020-01-24 10:20:56,rishh96,,1,0,They don’t do maccies bagels down south! Fuck the republic and Fuck Sinn Fein 😤,,,https://twitter.com/rishh96/status/1220652698531500033
2020-01-24 10:20:33,Dian1506,KimMayRice,0,0,Social Democrats and People Before Profit have some very good candidates. I’m wary of Sinn Fein they are another crowd that seem to make a lot of promises that they can’t back up. Changing their tune whichever way the wind blows,,,https://twitter.com/Dian1506/status/1220652603106832385
2020-01-24 10:19:10,FillerPolly,FineGael,1,0,"I’m hearing from loads of people they’re voting #SinnFein Never have I heard it from so many. You guys have lost the plot.. pension age, HSE, homelessness, over spend hospital, no Garda, Crime, corruption, no mortgages, Black and Tans, public transport, in bed with #fiannafail",,#SinnFein #fiannafail,https://twitter.com/FillerPolly/status/1220652253897465856
2020-01-24 10:15:40,NCPH1973,sinnfeinireland,0,0,"Or in other words, Sinn Fein are determined to bankrupt the state and impoverish pensioners in the years to come.",,,https://twitter.com/NCPH1973/status/1220651373198528514
2020-01-24 10:13:45,Ill_Neglect,,0,0,Sinn Féin gets my no.1 vote and I hope they get yours too. 🇮🇪 #GE2020 #SinnFein,,#GE2020 #SinnFein,https://twitter.com/Ill_Neglect/status/1220650888634732544
2020-01-24 10:13:03,jediknight1985,SelfOppressedId,2,0,"Sinn Féin have proposed revenue raising measures. “Sinn Féin publishes its full manifesto expected to call for a 4.5% PRSI increase for those on incomes above €100,000.” ",,,https://twitter.com/jediknight1985/status/1220650714017329153
2020-01-24 10:12:51,GaelachAgusSaor,repnews,1,0,Sinn Féin are not a normal political party. They are run by the remnants of the Provo Army Council. You know this.,,,https://twitter.com/GaelachAgusSaor/status/1220650663778103296
2020-01-24 10:12:45,560937N_39388W,moridura,0,0,Look how its working out for sinn fein.,,,https://twitter.com/560937N_39388W/status/1220650638180257794
2020-01-24 10:11:50,ska_train,AgentP22,0,1,Because they are trying to be just like sinn Fein,,,https://twitter.com/ska_train/status/1220650407397076994
2020-01-24 10:11:48,MaudSpruce,BAffronted,1,0,I know its great isn't it? And best of all unionist politicians made it all happen. Sinn Fein will make them honorary members.,,,https://twitter.com/MaudSpruce/status/1220650398786248704
2020-01-24 10:10:00,democracyupdate,,0,1,Sinn Féin call for a United #Ireland referendum by 2025 ahead of general election,,#Ireland,https://twitter.com/democracyupdate/status/1220649945340006400
2020-01-24 10:09:49,Ill_Neglect,,1,0,"Since being legal to vote, I have always voted for Sinn Féin no.1. I left school being told there was nothing there for me in terms of jobs and not to get my hopes up. I watched my dad be made redundant and stress over if we could have enough food and to pay our house off.",,,https://twitter.com/Ill_Neglect/status/1220649902088298496
2020-01-24 10:01:03,JohnKea44682949,ciara_irl,1,0,That's not how it works. Vote Sinn fein number 1 Pb4P 2 Get your act together and do the right thing,,,https://twitter.com/JohnKea44682949/status/1220647692176625664
2020-01-24 09:59:00,cmag508,carlalockhart,0,0,"Once again the DUP & Sinn Fein are at their tit for tat petty comments in full view of the electorate. Worse than children the pair of you. A snide remark still doesn't explain your vote against helping innocent children Carla, and Chris you can't talk when your party abstained!",,,https://twitter.com/cmag508/status/1220647177149648896
2020-01-24 09:53:51,sparklyparticle,Donagh,1,0,They literally split from Sinn Féin over maintaining Catholic conservativism. Cormac is definitely not someone I'd describe as left of center either.,,,https://twitter.com/sparklyparticle/status/1220645881474625536
2020-01-24 09:53:08,fintancox,,0,0,"Tbe modus operandi usually in elections is for @fiannafailparty to say they wont go in with sinn Fein, I think that urgently has to change in this election and FF have to categorically rule out going in with FG or giving them another C&amp;S and form a government some other way",@fiannafailparty,,https://twitter.com/fintancox/status/1220645701903953920
