date,username,to,replies,retweets,text,mentions,hashtags,permalink
2020-02-07 11:40:59,younggreens,TarynDeVere,0,0,Thanks Taryn 💚,,,https://twitter.com/younggreens/status/1225746274584080388
2020-02-07 11:34:56,BernadetteDurki,walls2,0,0,"Well done John, u definitely are a trojan worker..",,,https://twitter.com/BernadetteDurki/status/1225744749845413893
2020-02-07 11:28:43,nkeegan,greenparty_ie,1,0,"Yes eamon but how? We need more than words to give our vote to you. It’s all sound bites with no clear vision. When we are broke we don’t care about carbon tax, not everyone is rich and most of us are struggling with everything. Give details eamo!",,,https://twitter.com/nkeegan/status/1225743187857289217
2020-02-07 11:26:11,Aiden_Corkery,think_or_swim,0,0,This is brilliant! The @greenparty_ie should have these young rappers on tour! (Great tune too!) #GE2020,@greenparty_ie,#GE2020,https://twitter.com/Aiden_Corkery/status/1225742550566346752
2020-02-07 11:26:10,Ravens_W,Ravens_W,0,1,"@OneFutureIre Three of my local #GE2020 #Cork #SouthWest candidates @BConnollyGP of @greenparty_ie , @HollyLeahCairns of @SocDems and #KevinOConnor of @PBPCork have replied to my email to say they’ve signed the #OneFutureIreland pledge. #ClimateAction #JustTransition #LoveNature",@OneFutureIre @BConnollyGP @greenparty_ie @HollyLeahCairns @SocDems @PBPCork,#GE2020 #Cork #SouthWest #KevinOConnor #OneFutureIreland #ClimateAction #JustTransition #LoveNature,https://twitter.com/Ravens_W/status/1225742546745352193
2020-02-07 11:25:38,MayoCorncrake77,ChellaDug,1,0,I'd like to see you as a TD in the Dáil. You'd shake thing up!,,,https://twitter.com/MayoCorncrake77/status/1225742410401173504
2020-02-07 11:20:51,Cyclistie,JillianBolger,2,2,"Secure bike parking, especially at transport hubs, is promised in manifestos by @fiannafailparty @FineGael @greenparty_ie @labour @SocDems Looking forward to the next government making it easier &amp; safer for us to park our bikes #AllocateForCycling",@fiannafailparty @FineGael @greenparty_ie @labour @SocDems,#AllocateForCycling,https://twitter.com/Cyclistie/status/1225741207587971074
2020-02-07 11:19:13,vmartinspaul,ScroogeMcMaster,0,2,Agreed. @greenparty_ie stood right there alongside @fiannafailparty when our country was mortgaged and @labour were happy to punish us with their policies of austerity. They all had their chance. #VoteThemAllOut2020 #GE2020,@greenparty_ie @fiannafailparty @labour,#VoteThemAllOut2020 #GE2020,https://twitter.com/vmartinspaul/status/1225740797536063493
2020-02-07 11:17:22,ChellaDug,,1,6,Things I'm looking forward to after #GE2020 1 Reading something other than Twitter 📚 2 Going for walks that are not around housing estates 🏠🚶‍♀️ #canvassing 3 Lots of new @greenparty_ie TDs in Dáil Éireann fighting for real climate action! #FridaysForFuture #votegreen,@greenparty_ie,#GE2020 #canvassing #FridaysForFuture #votegreen,https://twitter.com/ChellaDug/status/1225740328566763520
2020-02-07 11:16:59,marywych,Campaign4Arts,0,1,"2.8 million adults attended arts events in 2019. Art & Culture matters to 76% of Irish adult population, make it matter to you @greenparty_ie @SocDems @FineGael @sinnfeinireland @pb4p @labour @fiannafailparty #Ireland @Campaign4Arts #DoubleArtsFunding #GE2020 #Arts",@greenparty_ie @SocDems @FineGael @sinnfeinireland @pb4p @labour @fiannafailparty @Campaign4Arts,#Ireland #DoubleArtsFunding #GE2020 #Arts,https://twitter.com/marywych/status/1225740232445829120
2020-02-07 11:16:15,Salty_H20,cathmartingreen,0,0,Best of luck Catherine!,,,https://twitter.com/Salty_H20/status/1225740047720251392
2020-02-07 11:14:31,TheGreenMcCabe,,0,21,"If you are still wondering who to vote for in #MeathEast, I'd ask you to watch my TEDx talk. It will give you some idea of who I am and what I stand for. We need the next government to tackle inequality and climate change together. https://www.ted.com/talks/sean_mccabe_inequality_and_climate_breakdown_the_survival_paradox @greenparty_ie #GE2020",@greenparty_ie,#MeathEast #GE2020,https://twitter.com/TheGreenMcCabe/status/1225739613572128768
2020-02-07 10:59:51,Jamietyoung,MarcKC_Green,0,0,"It's great to see this level of engagement so young. Hope for the future.🗺️ If you feel the same, vote for @greenparty_ie tomorrow wherever you are and continue your preferences for candidates of change. If you think the monopoly of 2 parties has served us well, look around you. ",@greenparty_ie,,https://twitter.com/Jamietyoung/status/1225735921980583938
2020-02-07 10:57:45,markrwillis,s_finnan,0,0,"Good read. Like most people who are interested in the environment and desperately want change in politics, a vote for @greenparty_ie in #GE2020 should be an obvious choice. But they're making it difficult.",@greenparty_ie,#GE2020,https://twitter.com/markrwillis/status/1225735394878160896
2020-02-07 10:56:50,CorkGreens,,0,3,"CORK LUAS: @greenparty_ie candidate for Cork North Central @oliver_moran is quoted in @echolivecork today on how Green TDs in Cork will prioritise light rail projects in the city, on the north &amp; south sides of the Lee Read online: https://www.echolive.ie/corknews/Oliver-Moran-Voting-Green-is-the-best-way-to-get-a-Luas-for-Cork-79ec59e0-7d29-4741-b07f-63882ebb1b41-ds",@greenparty_ie @oliver_moran @echolivecork,,https://twitter.com/CorkGreens/status/1225735162748719105
2020-02-07 10:53:54,Conor1960,CByrneGreen,0,0,Where was 2quota .@hazechu? .@EamonRyan too cowardly to run with a partner? Obviously .@greenparty_ie is run for the benefit of the former minister from 2007/11. ,@hazechu @EamonRyan @greenparty_ie,,https://twitter.com/Conor1960/status/1225734423229976577
2020-02-07 10:52:12,nalaireland,,1,6,"NALA hopes that all TDs and political parties will prioritise adults with literacy, numeracy and digital skills needs in the #33rdDail #LiteracyChangesLives @fiannafailparty @FineGael @greenparty_ie @labour @pb4p @sinnfeinireland @SocDems #LiteracyMatters in #GE2020",@fiannafailparty @FineGael @greenparty_ie @labour @pb4p @sinnfeinireland @SocDems,#33rdDail #LiteracyChangesLives #LiteracyMatters #GE2020,https://twitter.com/nalaireland/status/1225733995192778752
2020-02-07 10:51:16,BlackWtrCastle,,0,0,With @fiannafailparty likely to lead next Gov post #GE2020 who on earth would be a minister? Where is the talent? Can't see it apart from Jim O'Callaghan and Michael McGrath... Disclosure: I'm voting @labour and @greenparty_ie (anyone but SF and FF).,@fiannafailparty @labour @greenparty_ie,#GE2020,https://twitter.com/BlackWtrCastle/status/1225733762132082688
2020-02-07 10:47:27,michaelfinlan,frankmcdonald60,0,0,He's the most genuine person in politics I ever met. I met a few over the years.,,,https://twitter.com/michaelfinlan/status/1225732801191911424
2020-02-07 10:46:36,dwain_schouten,,0,0,"Y are both @fiannafailparty &amp; @FineGael looking at this as a battle just between each other? Have we not got other parties here like, @greenparty_ie @antiprofiteer @sinnfeinireland who all have ideas 2 improve our lives in Ireland? Who all actually have plans to better our lives?",@fiannafailparty @FineGael @greenparty_ie @antiprofiteer @sinnfeinireland,,https://twitter.com/dwain_schouten/status/1225732585722085378
2020-02-07 10:45:22,daltoki_,,0,0,https://lnkd.in/dmSRG6G Railway most efficient energy mode of transport including for freight @greenparty_ie @Shane_RossTD @SeanCanney,@greenparty_ie @SeanCanney,,https://twitter.com/daltoki_/status/1225732276362846208
2020-02-07 10:45:02,frankmcdonald60,michaelfinlan,1,0,"I coouldn't agree with you more, even though for much of his time in office he was reeling from the dramatic downturn.",,,https://twitter.com/frankmcdonald60/status/1225732191315013635
2020-02-07 10:44:24,DarkhairGael,CoraSherlock,0,0,Tax the sh*te of it all,,,https://twitter.com/DarkhairGael/status/1225732034179543040
2020-02-07 10:42:49,gougle_lads,pbyrne82,0,0,"They do ideology, not evidence.",,,https://twitter.com/gougle_lads/status/1225731636962242560
2020-02-07 10:41:23,SliabhLuachraW1,HenryFingleton,0,1,Absolutely spot on Henry. 100%. What's being done all over rural Ireland is absolutely appalling.,,,https://twitter.com/SliabhLuachraW1/status/1225731273940963328
2020-02-07 10:41:02,michaelfinlan,frankmcdonald60,1,0,John Gormley on the other hand. A thoroughly decent person.,,,https://twitter.com/michaelfinlan/status/1225731186733002752
2020-02-07 10:40:04,MigrantRightsIr,INARIreland,0,1,and see more in this graphic by @INARIreland #ge2020,@INARIreland,#ge2020,https://twitter.com/MigrantRightsIr/status/1225730944801353728
2020-02-07 10:39:32,MigrantRightsIr,,1,1,You can read more about what the manifestos say about migration and integration in this excellent piece by @TBuczkowska https://ec.europa.eu/migrant-integration/news/irish-general-election-2020---what-do-parties-say-about-immigration-and-integration #GE2020,@TBuczkowska,#GE2020,https://twitter.com/MigrantRightsIr/status/1225730809618935808
2020-02-07 10:39:14,michaelfinlan,frankmcdonald60,0,0,Years and years ago I canvassed night after night for Patricia Mc Kenna. She got elected. Went to the celebration do. She never bothered to thank us.,,,https://twitter.com/michaelfinlan/status/1225730733743968256
2020-02-07 10:38:24,HenryFingleton,cathmartingreen,1,2,Any talk of community by @greenparty_ie is v hollow when you look at the way they have enabled and supported big #wind developers to roll over communities. We need a new #green movement.,@greenparty_ie,#wind #green,https://twitter.com/HenryFingleton/status/1225730523710054400
2020-02-07 10:37:44,DeirdreWard18,walls2,0,0,Well done John,,,https://twitter.com/DeirdreWard18/status/1225730356646686720
2020-02-07 10:37:43,LorDempsey,,0,0,"With 1 day to go, have a read of @fiannafailparty @FineGael @sinnfeinireland @labour @greenparty_ie @pb4p @SocDems manifesto review @InclusionIre http://www.inclusionireland.ie/content/news-items/1803/analysis-political-party-manifestos-theme-ahead-general-election-2020 #GE2020",@fiannafailparty @FineGael @sinnfeinireland @labour @greenparty_ie @pb4p @SocDems @InclusionIre,#GE2020,https://twitter.com/LorDempsey/status/1225730350132944896
2020-02-07 10:37:05,MigrantRightsIr,,1,0,"Across Ireland and across the political spectrum, we're in agreement: it's time to give workers and families a pathway to papers in Ireland. It's time for justice for the undocumented. #undocIRL #GE2020",,#undocIRL #GE2020,https://twitter.com/MigrantRightsIr/status/1225730190963363845
2020-02-07 10:33:50,MigrantRightsIr,,5,0,"For years, schools, communities and businesses across Ireland have supported a pathway to papers for our undocumented neighbours and friends. Our political parties are standing with them now. #undocIRL #ge2020",,#undocIRL #ge2020,https://twitter.com/MigrantRightsIr/status/1225729376496603137
2020-02-07 10:32:17,MigrantRightsIr,,1,0,Many smaller parties and independents have also spoken out in support of undocumented families and workers. #undocIRL #ge2020,,#undocIRL #ge2020,https://twitter.com/MigrantRightsIr/status/1225728985646206978
2020-02-07 10:31:44,MigrantRightsIr,,1,0,@FineGael's manifesto contains a commitment to regularisation for children &amp; young people. @fiannafailparty and @sinnfeinireland have each given us written assurance that they support a pathway to papers for undocumented people in Ireland. #ge2020 #undocIRL,@FineGael @fiannafailparty @sinnfeinireland,#ge2020 #undocIRL,https://twitter.com/MigrantRightsIr/status/1225728845141204992
2020-02-07 10:30:48,MigrantRightsIr,,1,0,"Three party manifestos (@greenparty_ie, @labour, @SocDems) include a strong commitment to a pathway to papers for children, workers &amp; families. #ge2020 #undocIRL",@greenparty_ie @labour @SocDems,#ge2020 #undocIRL,https://twitter.com/MigrantRightsIr/status/1225728609714831360
2020-02-07 10:27:49,EoinBuckleyLmk,,1,0,"Remaining transfers in no particular order between @janosullivantd @senatormbyrne and surprising even myself @jamesjcollins. Jan for her history on women's rights, Maria because I like her and James because we tend to agree on what the city needs.",@JanOSullivanTD @senatormbyrne @jamesjcollins,,https://twitter.com/EoinBuckleyLmk/status/1225727858498207745
2020-02-07 10:27:11,EoinBuckleyLmk,,2,2,I am voting No.2 for @jennyblakelk based entirely on the efforts of her party colleague @ElisaODonovan. If that’s the Soc Dem work ethic then I’m in.,@JennyBlakeLK @elisaodonovan,,https://twitter.com/EoinBuckleyLmk/status/1225727702759505921
2020-02-07 10:26:37,EoinBuckleyLmk,,1,1,I tell my kids all the time it’s ok to make mistakes as long as you learn from them – I trust the @greenparty_ie to have learned from their experience and I urge them to actively seek a role in any coalition government,@greenparty_ie,,https://twitter.com/EoinBuckleyLmk/status/1225727560157450240
2020-02-07 10:24:43,frankmcdonald60,gavinjdaly,0,0,"Ah yes, of course. I hadn't scrolled back. Duh;-)",,,https://twitter.com/frankmcdonald60/status/1225727079871864833
2020-02-07 10:23:33,GYM_Einhorn,,0,0,Undecided vote. Who wants it? @fiannafailparty @FineGael @sinnfeinireland @labour @greenparty_ie,@fiannafailparty @FineGael @sinnfeinireland @labour @greenparty_ie,,https://twitter.com/GYM_Einhorn/status/1225726786933264385
2020-02-07 10:21:37,TomasTyner,,0,0,Could all candidates please send one piece of election literature per house? All this waste paper is a mockery to the guff you all spout about climate change etc @FineGael @fiannafailparty @sinnfeinireland @SocDems @greenparty_ie @fiannafailparty #GE2020,@FineGael @fiannafailparty @sinnfeinireland @SocDems @greenparty_ie @fiannafailparty,#GE2020,https://twitter.com/TomasTyner/status/1225726302147301376
2020-02-07 10:18:30,An_Fear_Liath,TheGreenMcCabe,0,0,Well done Gardai. These kids should be at school.,,,https://twitter.com/An_Fear_Liath/status/1225725514444419073
2020-02-07 10:18:13,clareCEnetwork,josephfinn100,0,2,#nopensionnovote #GE2020 @Paschald @ReginaDo @LeoVaradkar @simoncoveney @MichealMartinTD @FineGael @sinnfeinireland @ClareSinnFein @fiannafailparty @greenparty_ie Respect the Labour Court ,@Paschald @ReginaDo @LeoVaradkar @simoncoveney @MichealMartinTD @FineGael @sinnfeinireland @ClareSinnFein @fiannafailparty @greenparty_ie,#nopensionnovote #GE2020,https://twitter.com/clareCEnetwork/status/1225725444277833728
2020-02-07 10:17:18,gavinjdaly,frankmcdonald60,1,0,in the article,,,https://twitter.com/gavinjdaly/status/1225725214325190656
2020-02-07 10:16:10,MaryinKenmare,cleomurphy64,0,0,#Kerry @greenparty_ie candidate @cleomurphy64 #freshvoiceforthekingdom #GE2020,@greenparty_ie @cleomurphy64,#Kerry #freshvoiceforthekingdom #GE2020,https://twitter.com/MaryinKenmare/status/1225724928873418752
2020-02-07 10:16:00,frankmcdonald60,gavinjdaly,1,0,Where did that appear?,,,https://twitter.com/frankmcdonald60/status/1225724886011740161
2020-02-07 10:14:53,eoincarrollis,,0,2,"Final day on the #GE2020 Campaign with @extern1978's Asks, check them out http://extern.org/general-election-2020-asks be informed. @FineGael @fiannafailparty @sinnfeinireland @greenparty_ie @labour @SocDems @AontuIE",@extern1978 @FineGael @fiannafailparty @sinnfeinireland @greenparty_ie @labour @SocDems @AontuIE,#GE2020,https://twitter.com/eoincarrollis/status/1225724607040233472
2020-02-07 10:11:57,D9Herbs,D9Herbs,0,0,@greenparty_ie I am voting on the track record in the Dail and will give my transfers according to the chart attached. I believe new TD's like @neasa_neasa @saoirse_mchugh @caroline1conroy Manifesto means nothing voting records mean everything. (Love your work on #statins),@greenparty_ie @neasa_neasa @saoirse_mchugh @caroline1conroy,#statins,https://twitter.com/D9Herbs/status/1225723865671831552
2020-02-07 10:09:58,clareCEnetwork,CommunityMot,0,4,#nopensionnovote #GE2020 Last day for commitments @FineGael @fiannafailparty @sinnfeinireland @greenparty_ie . Respect the Labour Court #JusticeForCESupervisors,@FineGael @fiannafailparty @sinnfeinireland @greenparty_ie,#nopensionnovote #GE2020 #JusticeForCESupervisors,https://twitter.com/clareCEnetwork/status/1225723366285463552
2020-02-07 10:09:50,michealsheridan,,1,0,#undecidedvoter question for #GE2020 to the main parties. What will you 100% deliver on in your first 12 months should you form part of the next Government @labour @fiannafailparty @greenparty_ie @sinnfeinireland @FineGael or any other party / candidate who cares to comment.,@labour @fiannafailparty @greenparty_ie @sinnfeinireland @FineGael,#undecidedvoter #GE2020,https://twitter.com/michealsheridan/status/1225723335729917952
2020-02-07 10:08:57,Muir_maid,dprossiter,0,0,"I dont believe the GP are trying to achieve the same level of change. Holding parties whove a bad track record in government and less radical policies to account isn't sniping. Calling PBP ""the purist left jumping on the bandwagon"" probably is though. I'll still give a preference",,,https://twitter.com/Muir_maid/status/1225723112316116992
2020-02-07 10:07:21,djlonergan,,0,2,They were lying 😳feisty one :) First time I was made @neasa_neasa @greenparty_ie didn’t use more paper 😛😛😛😛 #GE2020,@neasa_neasa @greenparty_ie,#GE2020,https://twitter.com/djlonergan/status/1225722708685660160
2020-02-07 10:03:18,dprossiter,Muir_maid,1,0,"My guess is you were going to vote that way anyway which is fine, but I might suggest PBP et al. stop sniping at other parties trying to achieve the same level of change...",,,https://twitter.com/dprossiter/status/1225721688794583040
2020-02-07 10:02:52,D9Herbs,pbyrne82,1,0,"I was a disillusioned @greenparty_ie supporter. I'm a climate change activist, my interests are foraging, herbalism, mycology, botany. I don't fly, cycle everywhere, Im #vegan, some years I'm 80% self sufficient. I spent the last few weeks campaigning for the Greens. 1/2",@greenparty_ie,#vegan,https://twitter.com/D9Herbs/status/1225721582158589954
2020-02-07 10:01:28,nodiggerdee,cathmartingreen,0,0,"HI @cathmartingreen I am a green party member and am becoming concerned about the Greens stance on the 3 day waiting period, can you clarify it please as there is a lot of confusion. @BlaithinLeitrim",@cathmartingreen @BlaithinLeitrim,,https://twitter.com/nodiggerdee/status/1225721227484049408
2020-02-07 09:59:59,Muir_maid,Muir_maid,1,0,"""The Planet Before Profit document is remarkable for its transparency, coatings and radicalism."" Radical changes with a set out path is needed to prevent climate catastrophe, anything less is certain failure. What the GP proposes is not as radical or as transparent as PBP",,,https://twitter.com/Muir_maid/status/1225720857227669504
2020-02-07 09:56:48,Muir_maid,dprossiter,1,0,Reading the analysis I'm unimpressed. Here's two examples: PBP have repeatedly justified why a carbon tax is unacceptable on ordinary working people. When just 100 companies are responsible for 77% of all emissions. They also say that the Green party manifesto is costed,,,https://twitter.com/Muir_maid/status/1225720056262385665
2020-02-07 09:56:04,cathmartingreen,,2,0,(with thanks to https://www.purple-planet.com for the beautiful music),,,https://twitter.com/cathmartingreen/status/1225719871356506113
2020-02-07 09:55:11,cfar_dcu,lawlessj,0,1,It would be good to see what commitments on research funding other parties have too @sinnfeinireland @FineGael @labour @greenparty_ie You gotta pay to play if you want a high tech economy: solely subsidising private sector product dev using cheap PhD student labour won't work ,@sinnfeinireland @FineGael @labour @greenparty_ie,,https://twitter.com/cfar_dcu/status/1225719648928358400
2020-02-07 09:54:51,Mariacarey10,CoraSherlock,0,0,Who cares they want to take our cars and have us cycle everywhere.... They are insane.,,,https://twitter.com/Mariacarey10/status/1225719562555006977
2020-02-07 09:49:06,pbyrne82,,3,6,"As a disillusioned ex- @greenparty_ie supporter, this piece by @dlandy100 articulates much of my frustration We need a new effective green movement in Ireland that acts on evidence",@greenparty_ie @dlandy100,,https://twitter.com/pbyrne82/status/1225718115671117825
2020-02-07 09:48:52,macktwelve12,TheGreenMcCabe,0,0,Headline a bit misleading. It says in the article they’re not refusing to police it. Just not sanctioning it because it isn’t safe.,,,https://twitter.com/macktwelve12/status/1225718060402827270
2020-02-07 09:47:03,kevjsomers,wakeywakies,0,0,"Culchies don't need airbags, seat belts, wheelchair access or any other fripperies. It might work if some pedal powered electricity could be harvested for the national grid ?",,,https://twitter.com/kevjsomers/status/1225717599683710977
2020-02-07 09:46:35,KieranJFarrell,KieranJFarrell,0,0,Hey @greenparty_ie I wonder could we ask FG to consider their paper policy as a starting point #WantGreenVoteGreen #GE2020,@greenparty_ie,#WantGreenVoteGreen #GE2020,https://twitter.com/KieranJFarrell/status/1225717483685937152
2020-02-07 09:44:15,ColetteFinnCork,EoinBearla,0,0,"Fantastic news, this has made my day. Well done to all who have battled for the people in Bessborough over the years. @LornaBogue @greenparty_ie @EoinBearla",@LornaBogue @greenparty_ie @EoinBearla,,https://twitter.com/ColetteFinnCork/status/1225716894981926912
2020-02-07 09:43:10,dprossiter,Muir_maid,1,0,Its independent analysis by @OneFutureIre a consortium of NGOs who campaign on climate,@OneFutureIre,,https://twitter.com/dprossiter/status/1225716623719436289
2020-02-07 09:41:48,LeftLost_Pltcs,leehamill12,0,0,"Have dedicated 2/3 hours tonight to really think about it, try and ignore the noise and then predict it",,,https://twitter.com/LeftLost_Pltcs/status/1225716278226235392
2020-02-07 09:41:19,Muir_maid,Muir_maid,1,0,Seriously skeptical of a box which rates greens an A for rural livelihoods when only recently Eamon Ryan was talking about people in rural communities running a carpooling scheme instead of free frequent public transport.,,,https://twitter.com/Muir_maid/status/1225716158382432256
2020-02-07 09:41:13,FlourishOrganic,GraceOSllvn,0,0,Fantastic candidate,,,https://twitter.com/FlourishOrganic/status/1225716132235169792
2020-02-07 09:40:42,leehamill12,LeftLost_Pltcs,1,0,Reckon about 27/28 for Sinn Féin? That's what I have too,,,https://twitter.com/leehamill12/status/1225716003830718464
2020-02-07 09:39:55,SliabhLuachraW1,,0,0,@EamonRyan @greenparty_ie @Dept_CCAE @LeoVaradkar @FineGael @MichealMartinTD @fiannafailparty @BrendanHowlin @labour @MaryLouMcDonald @sinnfeinireland @MHealyRae what are your plans for this in Ireland? Would love to know.,@EamonRyan @greenparty_ie @Dept_CCAE @LeoVaradkar @FineGael @MichealMartinTD @fiannafailparty @BrendanHowlin @labour @MaryLouMcDonald @sinnfeinireland @MHealyRae,,https://twitter.com/SliabhLuachraW1/status/1225715807507943426
2020-02-07 09:38:55,Muir_maid,dprossiter,1,0,"That box has no breakdown of how those ratings were reached or any analysis at all. When you break down what's there it's wholly inadequately funded. They have a track record of going back on promises, betraying local environmental activists like shell to sea.",,,https://twitter.com/Muir_maid/status/1225715555820351493
2020-02-07 09:37:40,franmcnulty,,2,2,Speaking to @ClareFM @MichealMartinTD says @greenparty_ie @SocDems &amp; @labour “will be key” to forming a new Government with his party #GE2020,@ClareFM @MichealMartinTD @greenparty_ie @SocDems @labour,#GE2020,https://twitter.com/franmcnulty/status/1225715240152784896
2020-02-07 09:36:12,theseant,AoifeTDoyle,1,0,I'm not sure political solutions to health are impossible but I agree we are not been offered any in this election other than lipservice to @slaintecare (a partial solution at best). Let's hope the @greenparty_ie don't get crucified by @fiannafailparty like the last time! 😁,@slaintecare @greenparty_ie @fiannafailparty,,https://twitter.com/theseant/status/1225714869170843649
2020-02-07 09:34:10,LeftLost_Pltcs,,1,1,Chart of @pppolitics +/- seat estimates since GE called 1. @FineGael set for devastating losses 2. @fiannafailparty small increase on lower polls? 3. @sinnfeinireland gains now look certain 4. @greenparty_ie slight setback 5. @labour further decline #GE2020,@pppolitics @FineGael @fiannafailparty @sinnfeinireland @greenparty_ie @labour,#GE2020,https://twitter.com/LeftLost_Pltcs/status/1225714359692820481
2020-02-07 09:34:05,JackZZDuffy,,0,0,"Leaflets received: @fiannafailparty: 16 @FineGael: 9 @labour: 11 @greenparty_ie: 2 Speaks volumes about the future of our country and our climate. Wasteful use of paper containing harmful inks. Checked suppliers, and only Greens and Fine Gael using sustainable options #GE2020",@fiannafailparty @FineGael @labour @greenparty_ie,#GE2020,https://twitter.com/JackZZDuffy/status/1225714338545197056
2020-02-07 09:33:16,dprossiter,mikerea4,0,0,How did Greens crash the economy?,,,https://twitter.com/dprossiter/status/1225714132781019137
2020-02-07 09:32:23,dprossiter,Muir_maid,1,0,Dont agree,,,https://twitter.com/dprossiter/status/1225713909648236546
2020-02-07 09:31:00,greenparty_ie,breakaway_ian,0,0,Thanks for coming Ian!,,,https://twitter.com/greenparty_ie/status/1225713561755947010
2020-02-07 09:27:53,cathmartingreen,,3,30,Change is possible. A #GreenDecadeofChange that we can all be part of. Anchored in Community. Your #1 for me on February 8th in #GE2020 can be the beginning of that change. Míle Buíochas #FridaysForFuture #WantGreenVoteGreen @greenparty_ie @younggreens,@greenparty_ie @younggreens,#GreenDecadeofChange #GE2020 #FridaysForFuture #WantGreenVoteGreen,https://twitter.com/cathmartingreen/status/1225712778897494016
