date,username,to,replies,retweets,text,mentions,hashtags,permalink
2020-02-06 21:48:14,HenryFingleton,,0,0,"Pointing out glaring deficiencies in @greenparty_ie -“ the Greens still appear to have no real plan to reduce carbon emissions to sustainable levels. No such strategy appears in any of their campaign literature, beyond a very short policy statement” ",@greenparty_ie,,https://twitter.com/HenryFingleton/status/1225536706599956481
2020-02-06 21:47:31,SlaneyTurlough,,0,0,"#IFADonegal County Chairman &amp; Forestry Officer Charlie Doherty meeting the @greenparty_ie candidate for Donegal, Michael White ahead of #GE2020. Farmers need to be well supported by the future government to install renewable energy systems and adopt further environmental measures",@greenparty_ie,#IFADonegal #GE2020,https://twitter.com/SlaneyTurlough/status/1225536523996729345
2020-02-06 21:46:42,greenparty_ie,,4,21,"The urgent need to take climate action is an opportunity to change everything, says @EamonRyan on #rteleadersdebate. This can be good for our people, create a fairer society, with better services &amp; a sustainable solution to our housing crisis. #WantGreenVoteGreen #RETPT #GE2020",@EamonRyan,#rteleadersdebate #WantGreenVoteGreen #RETPT #GE2020,https://twitter.com/greenparty_ie/status/1225536320115806208
2020-02-06 21:46:15,HenryFingleton,,1,0,More on @greenparty_ie - “Through 2008–10 the Fianna Fáil–Green government however imposed austerity budgets on the population and signed Ireland up to a crippling three-year EU/ECB/IMF bailout program”. https://jacobinmag.com/2020/02/irelands-greens-climate-change-environment-election,@greenparty_ie,,https://twitter.com/HenryFingleton/status/1225536204453666819
2020-02-06 21:45:00,PoldyBloom1922,williamhboney1,1,0,One half of a solution. Even @MaryLouMcDonald said on Virgin she does not want the SCC abolished.,@MaryLouMcDonald,,https://twitter.com/PoldyBloom1922/status/1225535889943810049
2020-02-06 21:43:33,HenryFingleton,,0,0,"V interesting article on @greenparty_ie - “The Greens were happy to sign Ireland up for ambitious carbon reduction targets, but one would look in vain for any detailed policies of theirs which could actually deliver on those targets.” https://jacobinmag.com/2020/02/irelands-greens-climate-change-environment-election",@greenparty_ie,,https://twitter.com/HenryFingleton/status/1225535526851223561
2020-02-06 21:43:17,FaddenSean,uncreativePleb,1,0,"Can't see @sinnfeinireland being as naive a junior partner as @labour &amp; @greenparty_ie were.EO'B,PD,DC,MLMD,DO'L won't allow themselves to get screwed over and would imo make good Ministers.Throw in SC,HMcE,Phelan,O'Donovan, Naughton &amp; u have the makings of a balanced Cabinet.",@sinnfeinireland @labour @greenparty_ie,,https://twitter.com/FaddenSean/status/1225535459167744000
2020-02-06 21:42:18,shanetwomey78,,0,0,@greenparty_ie did Eamon travel by bike or electric car to the debate tonight #savetheworld,@greenparty_ie,#savetheworld,https://twitter.com/shanetwomey78/status/1225535212555325441
2020-02-06 21:40:53,williamhboney1,PoldyBloom1922,1,0,policing.,,,https://twitter.com/williamhboney1/status/1225534855183814656
2020-02-06 21:40:47,LRNA11,PeterR3001,0,0,"TY. Yes a dense AQ monitoring network is needed. However there is enough evidence already on all solid fuels emissions and their impact, even though a rel small number of properties use them in resid areas. Air purifiers and respiratory probs for the foreseeable future then...",,,https://twitter.com/LRNA11/status/1225534828117942274
2020-02-06 21:40:40,The__Boyler,,2,1,I haven't seen one mention of Paul Quinn Murder from @labour @AontuIE @SocDems @greenparty_ie @pb4p #rtept #GE2020,@labour @AontuIE @SocDems @greenparty_ie @pb4p,#rtept #GE2020,https://twitter.com/The__Boyler/status/1225534798770458624
2020-02-06 21:39:24,PoldyBloom1922,williamhboney1,2,0,The suggestion is there's an alternative to prevent jury intimidation in organised-crime trials. What is it?,,,https://twitter.com/PoldyBloom1922/status/1225534481240657922
2020-02-06 21:38:36,BrendaBonner82,walls2,1,0,Keep going John. We are right behind you,,,https://twitter.com/BrendaBonner82/status/1225534280417382400
2020-02-06 21:37:51,joefingalgreen,,1,4,"Another canvass, another new canvasser! Welcome Lara! #Rush #Balrothery 24hrs to go! #WantGreenVoteGreen #GE2020 @greenparty_ie ",@greenparty_ie,#Rush #Balrothery #WantGreenVoteGreen #GE2020,https://twitter.com/joefingalgreen/status/1225534093951197190
2020-02-06 21:37:47,williamhboney1,PoldyBloom1922,1,0,"Why, ICCL, the UN and Amnesty all agree?",,,https://twitter.com/williamhboney1/status/1225534077211729921
2020-02-06 21:37:01,PoldyBloom1922,saoirse_mchugh,1,0,Please ask @EamonRyan about the @greenparty_ie position on this. @RTE_PrimeTime #rtept,@EamonRyan @greenparty_ie @RTE_PrimeTime,#rtept,https://twitter.com/PoldyBloom1922/status/1225533884001026050
2020-02-06 21:33:28,NiamhNiRian,walls2,1,0,Fairplay john,,,https://twitter.com/NiamhNiRian/status/1225532987225321472
2020-02-06 21:31:58,frcnf,,1,6,So who’s pledging their support to FRCs; see how the parties line up as of this evening. There’s still one more day to sign! @FineGael @FineFail @sinnfeinireland @labour @SocDems @pb4p @greenparty_ie @AontuIE @NationalPartyIE @WSMIreland #supportingFRCs #GE2020,@FineGael @FineFail @sinnfeinireland @labour @SocDems @pb4p @greenparty_ie @AontuIE @NationalPartyIE @WSMIreland,#supportingFRCs #GE2020,https://twitter.com/frcnf/status/1225532609733812231
2020-02-06 21:31:19,doris_streisand,philipoconnor,0,0,All parties had some anti choicers. Why are you picking on the Greens?,,,https://twitter.com/doris_streisand/status/1225532447460294666
2020-02-06 21:28:51,hiheal,LeitrimARC,0,0,I was wondering how the Green Party could have chosen an anti choice candidate in 2020 (@davidhealyv in DBN)! It seems that I was naive to think they were progressive at all! We can't depend on them to vote for our rights at all! They need a change in leadership! @greenparty_ie,@davidhealyv @greenparty_ie,,https://twitter.com/hiheal/status/1225531826166489088
2020-02-06 21:28:18,altkrelb,hsilgnede,0,0,"Dude, srsly? I'm voting Green, I've been out canvassing for our local Green candidate, but this is pure nonsense. Who will the greens implement these progressive policies with if you think Sinn Féin is a dirty word?",,,https://twitter.com/altkrelb/status/1225531687343448066
2020-02-06 21:20:25,ryano,gavinjdaly,1,0,I'm trying to imagine the Dept of Environment civil servant who is a trusted source of Jacobin.,,,https://twitter.com/ryano/status/1225529705132109831
2020-02-06 21:19:22,LouiseGlynn11,frcnf,0,0,"Lus Na Greine, an amazing Family Resource Centre in Granard, great to see local candidates signing the pledge #SupportingFRCs and #ProtectingFRCs #GE2020 @FineGael @sinnfeinireland @fiannafailparty @SocDems @AontuIE @greenparty_ie @pb4p",@FineGael @sinnfeinireland @fiannafailparty @SocDems @AontuIE @greenparty_ie @pb4p,#SupportingFRCs #ProtectingFRCs #GE2020,https://twitter.com/LouiseGlynn11/status/1225529441599795203
2020-02-06 21:15:47,beibhinnbyrne,,0,5,"#WantGreenVoteGreen Great rally tonight incl @divinecomedyhq for @greenparty_ie We need #systemchange we need solutions! We need them now, we’ve a decade to turn things around. This election is critical. Do the right thing! #thinkgreen #votegreen &amp; #voteleft",@divinecomedyhq @greenparty_ie,#WantGreenVoteGreen #systemchange #thinkgreen #votegreen #voteleft,https://twitter.com/beibhinnbyrne/status/1225528540722016269
2020-02-06 21:13:43,whiteecotrails,pippa_hackett,0,1,Very best of luck on Saturday! Green fingers crossed for you.💚🌻,,,https://twitter.com/whiteecotrails/status/1225528019525292032
2020-02-06 21:12:02,davidmrsn,AliceODonnell10,0,0,Indeed. He said on his Twitter that he fully supported his party's policy.,,,https://twitter.com/davidmrsn/status/1225527594122129415
2020-02-06 21:07:41,dbarlon,saoirse_mchugh,0,0,Ok. No vote for @greenparty_ie from me. The daliance was fun but fleeting. ,@greenparty_ie,,https://twitter.com/dbarlon/status/1225526499996061696
2020-02-06 21:05:45,Kelly1Christy,,0,1,Did I just see @EamonRyan exiting from a taxi. I thought it would be a rickshaw @greenparty_ie @garvangrant,@EamonRyan @greenparty_ie @garvangrant,,https://twitter.com/Kelly1Christy/status/1225526015696523265
2020-02-06 21:04:13,Rose_Anne_White,Cooplafocal,0,0,Also GROUP HUG OMG,,,https://twitter.com/Rose_Anne_White/status/1225525627564052480
2020-02-06 21:03:47,KellieSocialist,niamhnicharra,1,0,"You need to look at 2016 elections look who topped the poll etc... PBP candidates got in on the last seats, if they are to retain the seat this time they need more number ones. 2's and 3's won't keep them in the race",,,https://twitter.com/KellieSocialist/status/1225525518390452227
2020-02-06 21:03:23,Rose_Anne_White,Cooplafocal,0,0,Aw what a lovely collage,,,https://twitter.com/Rose_Anne_White/status/1225525417681006601
2020-02-06 21:01:59,allie_orourke,meabhc,0,0,So why the variety between the parties?,,,https://twitter.com/allie_orourke/status/1225525066336755717
2020-02-06 21:00:58,meabhc,allie_orourke,1,0,"yes, the addresses are taken from the electoral register by An Post. They are not sent by the party. An Post controls the sending /delivery. Yes it should be one per household. It seems to vary per constituency. The Party or candidate hasn't control over it.",,,https://twitter.com/meabhc/status/1225524809444085760
2020-02-06 20:59:25,Christsatheists,ComiskeyAnthony,0,0,So are you voting SF because they have anti choice candidates?,,,https://twitter.com/Christsatheists/status/1225524420581699594
2020-02-06 20:58:39,ColetteFinnCork,,0,3,Back home with a cuppa. Great day meeting people with a disability in the Glen. Then onto Ballincollig with Cormac and Eithne. Thanks to everyone for sharing their stories. #WantGreenVoteGreen #ge2020 @greenparty_ie ,@greenparty_ie,#WantGreenVoteGreen #ge2020,https://twitter.com/ColetteFinnCork/status/1225524228402884629
2020-02-06 20:56:54,allie_orourke,meabhc,1,0,They're addressed so were sent to the house by the party. It's different from where I'm living in Dublin where there's just one to the household. Other party's only sent one so I don't think blaming an post is a good enough excuse. One is too many tbh,,,https://twitter.com/allie_orourke/status/1225523786419712006
2020-02-06 20:56:05,kv_ofarrell,,0,0,Thank you @davidhealyv and @greenparty_ie for signing upto the @OneFutureIre pledge for Faster and Fairer #ClimateAction. Email your #GE2020 candidates here https://www.onefuture.ie/act/emailcandidates #ClimateVote2020,@davidhealyv @greenparty_ie @OneFutureIre,#ClimateAction #GE2020 #ClimateVote2020,https://twitter.com/kv_ofarrell/status/1225523581410594816
2020-02-06 20:54:50,meabhc,allie_orourke,1,0,"An Post control the delivery of those Allie, not the parties.",,,https://twitter.com/meabhc/status/1225523265273200640
2020-02-06 20:53:13,1billmurphy,ClareOC_,0,0,The green party are chameleon like . They will blend into which ever party they coalesce with. They are not to be trusted and there are obviously many divisions within the party. Green in name only and all about taxes.,,,https://twitter.com/1billmurphy/status/1225522859054944256
2020-02-06 20:51:13,ColetteFinnCork,cleomurphy64,0,2,Great to hear you’re doing so well in Kerry Cleo. Fingers🤞for Feb 8th. #WantGreenVoteGreen #GE2020 @greenparty_ie ,@greenparty_ie,#WantGreenVoteGreen #GE2020,https://twitter.com/ColetteFinnCork/status/1225522356522803206
2020-02-06 20:49:17,treegreenwood,,0,2,"So #Google just bought about 80-100 units owned by I-RES apartment complex in Elm Park sth country Dublin, an ex NAMA property. Tennants (families etc) have 6 months to leave and get somewhere else @greenparty_ie @@christinafinn8 #VoteLeft #GE2020 #GeneralElection",@greenparty_ie @christinafinn8,#Google #VoteLeft #GE2020 #GeneralElection,https://twitter.com/treegreenwood/status/1225521871170482176
2020-02-06 20:47:13,amcreaven,amcreaven,0,0,So I did indeed change my vote to #tippge2020! No @SocDems candidates in Tipp so @greenparty_ie gets my #1 this time #GE2020,@SocDems @greenparty_ie,#tippge2020 #GE2020,https://twitter.com/amcreaven/status/1225521350460297217
2020-02-06 20:46:38,LiamCahill2013,dlandy100,0,1,This is a 'must read' forensic dissection of the sham that is @greenparty_ie #GE2020,@greenparty_ie,#GE2020,https://twitter.com/LiamCahill2013/status/1225521203420581890
2020-02-06 20:45:05,isme_ie,CWeston_Indo,0,1,Do we need any further justification for commencing the Consumer Insurance Contracts Act 2019 immediately? @FineGael @fiannafailparty @sinnfeinireland @labour @greenparty_ie @SocDems @pb4p @AontuIE @RENUAIreland @Paschald,@FineGael @fiannafailparty @sinnfeinireland @labour @greenparty_ie @SocDems @pb4p @AontuIE @RENUAIreland @Paschald,,https://twitter.com/isme_ie/status/1225520811135655937
2020-02-06 20:45:04,allie_orourke,,1,0,"Ah lads 6 of these each from ff, Boxer Moran and the Greens. I'd expect it of ff and it's offshoots but 6 flyers from the @greenparty_ie. You would want to cop on. There isn't even 6 voters living here ",@greenparty_ie,,https://twitter.com/allie_orourke/status/1225520807721435140
2020-02-06 20:45:02,sinead_donohue,banbloodsports,0,0,Ah hah! A candidate to vote for @greenparty_ie #GE2020,@greenparty_ie,#GE2020,https://twitter.com/sinead_donohue/status/1225520799320289280
2020-02-06 20:39:36,foodborn,TheGreenApron_,0,0,One day I'll vote for someone who gets elected. Been at it now for years.,,,https://twitter.com/foodborn/status/1225519432702840834
2020-02-06 20:34:20,ColetteFinnCork,ILMIreland,0,2,Very interesting to hear from people with a disability talk about how they want to live a life with purpose. Market economics doesn’t have a place for them. We need to change that. #WantGreenVoteGreen #GE2020 @greenparty_ie ,@greenparty_ie,#WantGreenVoteGreen #GE2020,https://twitter.com/ColetteFinnCork/status/1225518108938514435
2020-02-06 20:34:18,JaneMahony,saoirse_mchugh,0,0,I really want vote for @greenparty_ie but then there's this.... And the anti-choice issue ,@greenparty_ie,,https://twitter.com/JaneMahony/status/1225518099954372610
2020-02-06 20:34:10,TheGreenApron_,foodborn,1,0,That’s what we like to hear,,,https://twitter.com/TheGreenApron_/status/1225518064906711044
2020-02-06 20:33:15,Rionaahearn,jacobzur,0,0,"The Irish Human Rights and Equality commission are looking for it to be investigated, it's not just politicians. It's concerned that special criminal court is violating human rights.",,,https://twitter.com/Rionaahearn/status/1225517835755106309
2020-02-06 20:32:52,tonyflood98,Maker66Treble,0,1,"@MichealMartinTD is going to take money from your wages and give it to rte if elected to government,, household charge 😐",@MichealMartinTD,,https://twitter.com/tonyflood98/status/1225517739760144386
2020-02-06 20:32:48,PatsData,neasa_neasa,0,0,And small business owners can easily afford to pay staff who aren’t there for 2 years of maternity/paternity leave 🙄,,,https://twitter.com/PatsData/status/1225517721275768835
2020-02-06 20:31:17,foodborn,TheGreenApron_,1,0,And green will be my no. 1 👍,,,https://twitter.com/foodborn/status/1225517341406089218
2020-02-06 20:31:07,ColetteFinnCork,,0,1,GE2020 - Green Party closing press conference https://youtu.be/ZnUlDCn3gNg via @YouTube #WantGreenVoteGreen #CorkNW #TimeToChange @greenparty_ie,@YouTube @greenparty_ie,#WantGreenVoteGreen #CorkNW #TimeToChange,https://twitter.com/ColetteFinnCork/status/1225517299853090817
2020-02-06 20:29:57,TheGreenApron_,foodborn,1,0,We’ve had none out to us but we’ve been out a lot canvassing for @greenparty_ie,@greenparty_ie,,https://twitter.com/TheGreenApron_/status/1225517004767059969
2020-02-06 20:26:54,mariahickey1976,RCPilkington,0,0,"Yeah there's really no need for posters or leaflets at all these days, where we can get all the info we need online.",,,https://twitter.com/mariahickey1976/status/1225516235422601217
2020-02-06 20:18:56,marywm7,TheGreenMcCabe,0,0,Better town planning please,,,https://twitter.com/marywm7/status/1225514232478871553
2020-02-06 20:18:39,brownenutrition,Julie_ODonoghue,0,0,Well done Julie!,,,https://twitter.com/brownenutrition/status/1225514159430914048
2020-02-06 20:17:40,Mickl567,KirstyHilliard,0,0,Cleo is looking very strong in the polls as of late too so here's hoping! She'd make a great TD. I'm loving the gender balance too!,,,https://twitter.com/Mickl567/status/1225513911266500614
2020-02-06 20:17:36,KkCarlow,,0,3,Don't forget to vote #wantgreenvotegreen #kilkenny #carlow #climatechange #votemalcolm @greenparty_ie #ge2020,@greenparty_ie,#wantgreenvotegreen #kilkenny #carlow #climatechange #votemalcolm #ge2020,https://twitter.com/KkCarlow/status/1225513894808039437
2020-02-06 20:16:55,TheGreenMcCabe,,0,5,"The Green Army in front of the Green Screen in Dunboyne! 💚✊ (we also had crews in Ratoath, Batterstown, Balrath and Dunshaughlin today!) #ge2020 #WantGreenVoteGreen @greenparty_ie – at Dunboyne / Dún Búinne",@greenparty_ie,#ge2020 #WantGreenVoteGreen,https://twitter.com/TheGreenMcCabe/status/1225513725425262602
2020-02-06 20:16:41,walls2,,19,54,I promised an update prior to #GE2020 &amp; here it is. Medical Card reform for the terminally ill is deeply personal &amp; I will not rest until I see it implemented. This clip explains where we're at ⬇️ @FineGael @fiannafailparty @labour @sinnfeinireland @SocDems @greenparty_ie #GE20,@FineGael @fiannafailparty @labour @sinnfeinireland @SocDems @greenparty_ie,#GE2020 #GE20,https://twitter.com/walls2/status/1225513665010577409
2020-02-06 20:13:52,cwwmnaas,davidmrsn,0,0,My political views and actions are a private matter for me. So whether I’ve read itor not is a matter for me. But what I did read I was unimpressed and e mailed Vincent and told him so.,,,https://twitter.com/cwwmnaas/status/1225512957800525825
2020-02-06 20:13:45,pippa_hackett,whiteecotrails,1,0,"I bought some bread, pastries and coffee there on Saturday! Delish 😋",,,https://twitter.com/pippa_hackett/status/1225512926276136964
2020-02-06 20:12:44,KirstyHilliard,Mickl567,1,0,I want to see @cleomurphy64 unseat Danny Healy-rae. That would be even more delicious than Eoghan Murphy getting dumped in the bin.,@cleomurphy64,,https://twitter.com/KirstyHilliard/status/1225512670717206530
2020-02-06 20:12:17,laura_oface,aMAYzedConfused,0,0,He won't answer me,,,https://twitter.com/laura_oface/status/1225512557156413440
2020-02-06 20:08:21,IrwinGill,FreeIrishman,2,5,"Not a normal political party. If you want an alternative to FF/FG, consider a vote for @labour, @SocDems or @greenparty_ie. Sinn Fein are curreny lefties by convenience, but nationalists first. #GE2020",@labour @SocDems @greenparty_ie,#GE2020,https://twitter.com/IrwinGill/status/1225511570601586693
2020-02-06 20:07:20,davidmrsn,gavinjdaly,0,0,"Feck off with your facts Gavin, they get in the way of an aul fashion left on left pile in.",,,https://twitter.com/davidmrsn/status/1225511310739288065
2020-02-06 20:04:56,conorcassidy1,RuthCoppingerSP,0,0,"Some of your constituents don't watch biased RTE, dont purchase biased newspapers, but do desire a monumental change on Saturday. Everyone needs to step up to the plate and ensure no possible votes for @FineGael @fiannafailparty @labour @greenparty_ie . 4 number 1's for you",@FineGael @fiannafailparty @labour @greenparty_ie,,https://twitter.com/conorcassidy1/status/1225510709590724608
2020-02-06 20:04:13,rgmcdermott,,0,0,BOYLING POINT Any new government must prioritise reform of the fast track SHD planning process @sendboyle #GE2020 @greenparty_ie ,@sendboyle @greenparty_ie,#GE2020,https://twitter.com/rgmcdermott/status/1225510530116399104
2020-02-06 20:03:57,alexjarmitage,VirginMediaNews,0,2,.@EamonRyan is a seriously impressive politician. Go @greenparty_ie! #GE2020,@EamonRyan @greenparty_ie,#GE2020,https://twitter.com/alexjarmitage/status/1225510459979239425
2020-02-06 20:03:53,davidmrsn,cwwmnaas,1,0,Their manifesto is full of actions that would help older people. Have you read it?,,,https://twitter.com/davidmrsn/status/1225510443395026953
2020-02-06 20:03:16,gavinjdaly,frankmcdonald60,1,0,"Have to say, from a personal perspective of having been there, I utterly reject this>",,,https://twitter.com/gavinjdaly/status/1225510289275269122
2020-02-06 20:01:31,OConnorOisin,conndonovan9,0,0,"He'd make a great TD in fairness. Fingers crossed for O'Reilly, Ó Tuathail and Connolly in GalwayWesht.",,,https://twitter.com/OConnorOisin/status/1225509849552883712
2020-02-06 19:59:25,conndonovan9,OConnorOisin,1,1,If @niallotuathail gets elected I would fully support a law which makes it compulsory to pronounce 'trí' like he does..,@niallotuathail,,https://twitter.com/conndonovan9/status/1225509321615736839
2020-02-06 19:58:17,afrix1,,1,0,"@LimerickGreens @greenparty_ie why does no one talk about 'Park and Ride' for cities. Look at @OxTweets Oxford. Same size as Limerick. 3 P&amp;R facilities. Great use of public transport. 1 in Dooradoyle / Mungret, 1 in Castletroy and 1 out Ennis Road. Limeruck City Traffic sorted.",@LimerickGreens @greenparty_ie @OxTweets,,https://twitter.com/afrix1/status/1225509036088578048
2020-02-06 19:56:13,MootIreland,Irishwildlife,0,0,"Are ye joking? Fianna Fáil get an endorsement and The Greens get 3 ticks while PBP get one? The Greens let the Corrib gas pipeline happen. Eamon Ryan is responsible for the Dublin Metro cancellation. They’re a joke of a party, greenwashing capitalism",,,https://twitter.com/MootIreland/status/1225508516556951555
2020-02-06 19:55:57,JenniHolian,TheGreenMcCabe,0,0,Awesome 😍💚💚💚,,,https://twitter.com/JenniHolian/status/1225508447766052869
2020-02-06 19:54:11,aMAYzedConfused,laura_oface,1,0,Appears to be unfounded,,,https://twitter.com/aMAYzedConfused/status/1225508005153779712
2020-02-06 19:54:06,SeanOLoughlin0,davidmcw,1,0,"No. 1 to @sinnfeinireland then transferring left to @SocDems, Solidarity-PBP, @greenparty_ie , @labour and left Independents. #GE2020 #VoteLeft",@sinnfeinireland @SocDems @greenparty_ie @labour,#GE2020 #VoteLeft,https://twitter.com/SeanOLoughlin0/status/1225507980881342467
2020-02-06 19:53:15,Cooplafocal,,2,6,A candidate’s efforts are pointless without a dedicated campaign team #WantGreenVoteGreen. @BrianLeddin @Rose_Anne_White @thomasbibby @bamacgabhann @LimerickGreens @greenparty_ie #Limerick #GE2020,@BrianLeddin @Rose_Anne_White @thomasbibby @bamacgabhann @LimerickGreens @greenparty_ie,#WantGreenVoteGreen #Limerick #GE2020,https://twitter.com/Cooplafocal/status/1225507768213348354
2020-02-06 19:50:43,FloodAideen,TheGreenMcCabe,1,0,Discussing this with TYs in class in St Peter’s College Dunboyne tomorrow if you still in Dunboyne,,,https://twitter.com/FloodAideen/status/1225507131291504640
2020-02-06 19:48:31,NoelKinahan,SamToland,0,0,Sounds like somebody has a major chip on each shoulder ..,,,https://twitter.com/NoelKinahan/status/1225506578759065601
2020-02-06 19:46:03,frankmcdonald60,dlandy100,3,0,"This is a serious analysis of what @greenparty_ie actually stands for, and it’s very critical indeed. I’m not surprised, having heard one of them on the radio this morning endorsing the proposed M20 between Cork and Limerick. Well worth reading in full ... ",@greenparty_ie,,https://twitter.com/frankmcdonald60/status/1225505955716177927
2020-02-06 19:45:39,cwwmnaas,onein7bn,0,0,"When you are in a hole, stop digging. Vincent should know what I’m talking about.",,,https://twitter.com/cwwmnaas/status/1225505854679638017
2020-02-06 19:44:04,Liam_J_Murphy,,0,4,Walking the city streets tonight asking the people of Dublin Central to give their #1 vote to the powerful @neasa_neasa &amp; the rest of Ireland to throw their support behind their local @greenparty_ie candidates #GE2020 #WantGreenVoteGreen,@neasa_neasa @greenparty_ie,#GE2020 #WantGreenVoteGreen,https://twitter.com/Liam_J_Murphy/status/1225505455700664320
2020-02-06 19:43:33,onein7bn,cwwmnaas,1,0,We have no idea what you are asking about from the information here?,,,https://twitter.com/onein7bn/status/1225505326683840512
2020-02-06 19:42:02,onein7bn,cwwmnaas,0,0,"Honestly we have no idea who we reply to is, what their status is. Everyone is equal",,,https://twitter.com/onein7bn/status/1225504945883013120
2020-02-06 19:40:03,MarcasSuibhne,chewborg,0,0,"Resident of three years - it’s arguably one of the ugliest roads in Dublin. It could be improved so much with widened paths, high quality planting, and parking reduced or removed.",,,https://twitter.com/MarcasSuibhne/status/1225504447629008896
2020-02-06 19:39:51,davitter,SamToland,0,0,"It would take a week to correct the errors and selective citation in that. One for after the election. It’s an atrocious hatchet job with little to no insight. Mistakes were made, but these authors know nothing about them",,,https://twitter.com/davitter/status/1225504394646622208
2020-02-06 19:39:49,VirginMediaNews,,1,0,🗳️ #GE2020 The Green Party - Eamon Ryan @EamonRyan|@greenparty_ie | #VMNews,@EamonRyan @greenparty_ie,#GE2020 #VMNews,https://twitter.com/VirginMediaNews/status/1225504386513809408
2020-02-06 19:36:57,janehmul,irishexaminer,0,0,"@LeoVaradkar @MichealMartinTD @MaryLouMcDonald @BrendanHowlin @SocDems @greenparty_ie @FineGael @fiannafailparty @sinnfeinireland please commit to this funding for survivors of #childsexualabuse. It's a drop in the ocean. If neglected, the #trauma toll on people can be immense.",@LeoVaradkar @MichealMartinTD @MaryLouMcDonald @BrendanHowlin @SocDems @greenparty_ie @FineGael @fiannafailparty @sinnfeinireland,#childsexualabuse #trauma,https://twitter.com/janehmul/status/1225503668079931393
2020-02-06 19:36:54,of_playlist,TheGreenMcCabe,0,0,I’d love to have climate change as my biggest issue. Life must be sweet.,,,https://twitter.com/of_playlist/status/1225503652456148994
