date,username,to,replies,retweets,text,mentions,hashtags,permalink
2020-02-06 14:22:57,rayofoghlu,harrymcgee,0,0,and he's not wrong either. @RoisinGarvey,@RoisinGarvey,,https://twitter.com/rayofoghlu/status/1225424646155186176
2020-02-06 14:21:05,liamprinter,,1,6,"There are so many phenomenal @greenparty_ie candidates who would relish the chance to represent you &amp; fight for real #ClimateAction. Give these amazing people a follow &amp; a No.! The planet, our wildlife, our civilisation needs #Greens making policy right now [thread]..",@greenparty_ie,#ClimateAction #Greens,https://twitter.com/liamprinter/status/1225424174920933377
2020-02-06 14:19:16,neasa_neasa,,7,52,"Here's 60 secs on @greenparty_ie universal, child-led, childcare. Families in Ireland spend about a fifth of our incomes on childcare, that's 4 times what they spend in Sweden. No state support but huge pressure to get out and work. #OneUnitedVoice #childcare #WantGreenVoteGreen",@greenparty_ie,#OneUnitedVoice #childcare #WantGreenVoteGreen,https://twitter.com/neasa_neasa/status/1225423718085808129
2020-02-06 14:18:46,PatsData,XbossTony,0,0,Unlike the way FFG jailed all the bankers etc,,,https://twitter.com/PatsData/status/1225423591510040576
2020-02-06 14:15:00,DownSyndromeIRL,,0,0,"@FineGael @fiannafailparty @sinnfeinireland @labour @pb4p @independents4_C @greenparty_ie @SocDems @AontuIE - Many students with Ds face barriers to education - education is a right, not a privilege Read our manifesto here: http://bit.ly/2RWWHul #DisabilityVotesCount #GE2020",@FineGael @fiannafailparty @sinnfeinireland @labour @pb4p @independents4_C @greenparty_ie @SocDems @AontuIE,#DisabilityVotesCount #GE2020,https://twitter.com/DownSyndromeIRL/status/1225422644310228992
2020-02-06 14:13:47,ClareOC_,jimmooneylad,1,0,It's madness. He wouldn't allow a climate denier in the party,,,https://twitter.com/ClareOC_/status/1225422340730826753
2020-02-06 14:11:08,jimmooneylad,ClareOC_,1,0,"Pretty bad form Eamon, He won't do himself many favours in DBN with this attitude",,,https://twitter.com/jimmooneylad/status/1225421673727483904
2020-02-06 14:10:30,gang_of_one,greenparty_ie,0,0,"Wicklow train service is a disaster. Slow, infrequent and expensive. A decent service would help to take the pressure off housing in Dublin and the commuting hell that is the N11",,,https://twitter.com/gang_of_one/status/1225421514318675968
2020-02-06 14:10:12,Gruaig_Rua,ellenmcoyne,0,0,@greenparty_ie Please clarify your party's policy or you're in danger of losing a lot of votes. #GE2020,@greenparty_ie,#GE2020,https://twitter.com/Gruaig_Rua/status/1225421437151973377
2020-02-06 14:05:52,ClareOC_,aoifegracemoore,5,14,Is @EamonRyan for real here? Would he allow a climate denier to run for his party? Or is differing opinions only ok when it's women's &amp; reproductive rights being denied. The @greenparty_ie are no more progressive than fianna fail or fine Gael #GE2020,@EamonRyan @greenparty_ie,#GE2020,https://twitter.com/ClareOC_/status/1225420347379519488
2020-02-06 14:05:48,UrsusRob,,0,0,"The @greenparty_ie haven’t bothered replying to my tweet. I won’t be petty and not vote for them because of that, but like them, I’ll take my sweet old time. I’ll vote on Monday maybe.",@greenparty_ie,,https://twitter.com/UrsusRob/status/1225420331730509824
2020-02-06 14:04:41,dermeng,saoirse_mchugh,1,0,"@EamonRyan @greenparty_ie Naivety at best, but has narrowed my options on Saturday for sure.",@EamonRyan @greenparty_ie,,https://twitter.com/dermeng/status/1225420047335804929
2020-02-06 14:04:02,felixd0r,ClareOC_,0,0,"Did Greens say they are ""100% progressive""? What ever that might mean... Did Greens back abortion referendum? Yes.",,,https://twitter.com/felixd0r/status/1225419883598491648
2020-02-06 14:03:59,MarcasSuibhne,jjh7774,1,0,I live in the area. How is the “demand” stupid exactly?,,,https://twitter.com/MarcasSuibhne/status/1225419871477026817
2020-02-06 14:03:50,AliceODonnell10,syddels,1,0,I think that @greenparty_ie candidate has said he will respect the outcome of democracy re Repeal? on a personal level I campaigned and canvassed for Repeal with TFY in Wicklow and also with our FG members,@greenparty_ie,,https://twitter.com/AliceODonnell10/status/1225419835917598720
2020-02-06 14:02:59,_Johnson_YT_,edbrophy,0,0,Not really considering @rodericogorman is the justice spokesperson for @greenparty_ie and is equally if not more likely to get a seat in the next government. By all accounts of my short conversation with him he’d make a brilliant Minister for Justice.,@rodericogorman @greenparty_ie,,https://twitter.com/_Johnson_YT_/status/1225419619810324481
2020-02-06 14:00:12,Aily_NC,ellenmcoyne,0,1,"The 72 hour period is absolutely ridiculous. Why should we have to accept this compromise of care? Free, safe, legal, immediate access to care. No compromise on our healthcare choices. I'm disgusted with this @greenparty_ie attitude. Repeal is an ongoing campaign for our rights. ",@greenparty_ie,,https://twitter.com/Aily_NC/status/1225418919806144517
2020-02-06 14:00:01,DownSyndromeIRL,,0,0,@FineGael @fiannafailparty @sinnfeinireland @labour @pb4p @independents4_C @greenparty_ie @SocDems @AontuIE - The current crisis in our health system is impacting people with Ds the most. Read our manifesto here: http://bit.ly/2RWWHul #DisabilityVotesCount #GE2020,@FineGael @fiannafailparty @sinnfeinireland @labour @pb4p @independents4_C @greenparty_ie @SocDems @AontuIE,#DisabilityVotesCount #GE2020,https://twitter.com/DownSyndromeIRL/status/1225418872397787136
2020-02-06 13:59:03,bexeyy,LiamQuaide,0,0,Thanks for making people more aware of mental health issues Liam 💪,,,https://twitter.com/bexeyy/status/1225418630508269568
2020-02-06 13:57:32,MickGaskin10,ellenmcoyne,0,1,So disappointing that the @greenparty_ie have such a conflicted policy on women's rights especially when there is still so much left to do around exclusion zones and the 3 year review. Running pro-life candidates in strongly #Repeal areas is just not on! #GE2020,@greenparty_ie,#Repeal #GE2020,https://twitter.com/MickGaskin10/status/1225418250063925249
2020-02-06 13:56:11,MayoCorncrake77,Irishwildlife,1,1,Very disappointed with Labour. I though they would have been a lot more environmentally aware!!,,,https://twitter.com/MayoCorncrake77/status/1225417908525948929
2020-02-06 13:55:44,ClareOC_,ellenmcoyne,4,16,"Hopefully this puts the idea that the @greenparty_ie are 100% a progressive ,pro choice party to bed Personal opinions are fine. But when there are human rights involved, it's not ok to misrepresent yourself to the public We need politicians who will push for progress #GE2020",@greenparty_ie,#GE2020,https://twitter.com/ClareOC_/status/1225417797712433152
2020-02-06 13:55:11,RichardOClear1,PraxisInPlaid,0,0,They sold out your future by keeping FF in power.,,,https://twitter.com/RichardOClear1/status/1225417656175595521
2020-02-06 13:52:37,EvaDowling,Triona_C,1,0,Proud to say that @smytho campaigned and voted YES in the abortion referendum. Here we are together at the count centre #repealedthe8th,@smytho,#repealedthe8th,https://twitter.com/EvaDowling/status/1225417010915561472
2020-02-06 13:50:00,DownSyndromeIRL,,0,0,@FineGael @fiannafailparty @sinnfeinireland @labour @pb4p @independents4_C @greenparty_ie @SocDems @AontuIE - Ireland is currently the worst country in western Europe to have a disability. Read our manifesto here: http://bit.ly/2RWWHul #DisabilityVotesCount #GE2020,@FineGael @fiannafailparty @sinnfeinireland @labour @pb4p @independents4_C @greenparty_ie @SocDems @AontuIE,#DisabilityVotesCount #GE2020,https://twitter.com/DownSyndromeIRL/status/1225416352673996806
2020-02-06 13:47:43,XbossTony,harrymcgee,3,0,"GREEN PARTY, lord help us we'll be taxed for breathing and criminal courts closed down as criminals will promise to be good boy's and girls. 🙄🙄",,,https://twitter.com/XbossTony/status/1225415780424130567
2020-02-06 13:44:25,HugoThompsonEco,Irishwildlife,0,0,"Good to know, suggest whatever parties get in, that they go too crazy acting like they've won the #Lotto.. as emissions &amp; global warming keep increasing, the heat will be turned up on them too to deliver faster fairer #climateaction too. #GE2020",,#Lotto #climateaction #GE2020,https://twitter.com/HugoThompsonEco/status/1225414946961399810
2020-02-06 13:40:15,HelenGuinane,CllrKRedmond,0,0,Plenty of other parties care about green issues and have them in their manifesto. It's not 'yesterday's war' reproductive healthcare is an ongoing matter of concern. Obviously not to you though,,,https://twitter.com/HelenGuinane/status/1225413898947436545
2020-02-06 13:40:00,DownSyndromeIRL,,0,0,@FineGael @fiannafailparty @sinnfeinireland @labour @pb4p @independents4_C @greenparty_ie @SocDems @AontuIE - Children with Ds face delays in areas of development. Early intervention is essential. Read our manifesto here: http://bit.ly/2RWWHul #DisabilityVotesCount #GE2020,@FineGael @fiannafailparty @sinnfeinireland @labour @pb4p @independents4_C @greenparty_ie @SocDems @AontuIE,#DisabilityVotesCount #GE2020,https://twitter.com/DownSyndromeIRL/status/1225413836347445248
2020-02-06 13:39:25,jjh7774,MarcasSuibhne,1,0,Please remember that there is a lot of residents and businesses in that area that need access before you make stupid demands like that . In regards to the lights at the railway bridge the majority of cyclists don’t stop at the red lights there anyway.,,,https://twitter.com/jjh7774/status/1225413691786645504
2020-02-06 13:39:03,MarkHayden1960,IrishInterests,0,0,Don't think the polls are showing any pickup in the FF vote share in Dublin?,,,https://twitter.com/MarkHayden1960/status/1225413597603467264
2020-02-06 13:38:59,catangosul,mickeydell1,0,0,"@fiannafailparty @sinnfeinireland @greenparty_ie @MHealyRae @BrassilJohnTD @normamoriarty #NormaFoleyFF #PaDalySF #we're putting our trust in you, don't turn out to be dishonest like @LeoVaradkar @FineGael #JusticeForCESupervisors #GE2020",@fiannafailparty @sinnfeinireland @greenparty_ie @MHealyRae @BrassilJohnTD @normamoriarty @LeoVaradkar @FineGael,#NormaFoleyFF #PaDalySF #JusticeForCESupervisors #GE2020,https://twitter.com/catangosul/status/1225413579358253056
2020-02-06 13:38:36,emmzcee,SeanOMarachain,0,0,"Quite simply,, anti choicers are shit humans. They actively support harmful practice and denying women autonomy over their own bodies. Its a deal breaker for me in any situation",,,https://twitter.com/emmzcee/status/1225413483333931013
2020-02-06 13:36:12,nouthsider,,0,0,My preferences for #GE2020 1. @greenparty_ie 2. @SocDems 3. @sinnfeinireland 4. @labour 5. @fiannafailparty 6. @FineGael I will never vote for racists (ACI or IFB) or mindlessly contrarian communist masochists (PBP),@greenparty_ie @SocDems @sinnfeinireland @labour @fiannafailparty @FineGael,#GE2020,https://twitter.com/nouthsider/status/1225412881744875524
2020-02-06 13:35:41,SeanOMarachain,emmzcee,1,0,"That's a good point. Not sure what Green's policy is for selecting candidates, if they screen them? I bet the shinners do.. I'm going to vote for the greens in Fingal, the candidate worked a lot with refugees so he's not out to enrich himself. I've no idea if he's lib., or consrv",,,https://twitter.com/SeanOMarachain/status/1225412750878367744
2020-02-06 13:32:31,Nc1908Neil,wester_sou,0,0,At least some Australian #politicians have the guts to challenge the #ClimateHoax and its purveyors. @RichardbrutonTD @1Hildegarde @wallacemick @paulmurphy_TD @MaryLouMcDonald @PearseDoherty @SocDems @greenparty_ie @CathMurphyTD @davidcullinane @MichaelHealyRae @timmydooley,@RichardbrutonTD @1Hildegarde @wallacemick @paulmurphy_TD @MaryLouMcDonald @PearseDoherty @SocDems @greenparty_ie @CathMurphyTD @davidcullinane @MichaelHealyRae @timmydooley,#politicians #ClimateHoax,https://twitter.com/Nc1908Neil/status/1225411953641885704
2020-02-06 13:32:10,laoisman80,yascaoimhin,0,0,Correct,,,https://twitter.com/laoisman80/status/1225411864416411649
2020-02-06 13:30:50,Bren_Kelly30,,1,0,@sinnfeinireland @FineGael @fiannafailparty @thelabourparty @greenparty_ie @peopleb4profit Take note ⁦the mood of the entire country 🤨 https://facebook.com/100000206534547/posts/3214842205199299/?d=n,@sinnfeinireland @FineGael @fiannafailparty @Thelabourparty @greenparty_ie @Peopleb4profit,,https://twitter.com/Bren_Kelly30/status/1225411529362857985
2020-02-06 13:29:01,RositaSweetman,Irishwildlife,0,0,SocDems are the best!,,,https://twitter.com/RositaSweetman/status/1225411071055474688
2020-02-06 13:28:42,PraxisInPlaid,RichardOClear1,1,0,This just makes me want to vote Green more,,,https://twitter.com/PraxisInPlaid/status/1225410991921487873
2020-02-06 13:26:45,Triona_C,orchidsbudget,1,0,Oh she was never getting any preference from me so no an issue. @smytho on the other hand.....,@smytho,,https://twitter.com/Triona_C/status/1225410501020147713
2020-02-06 13:26:34,LouiseActon7,Triona_C,1,0,Especially as over 77% of voters in Dunlaoghaire voted to repeal!,,,https://twitter.com/LouiseActon7/status/1225410457541980160
2020-02-06 13:23:20,Sandyshark,TodaySOR,0,0,#GE2020 I will be voting for @sinnfeinireland and @greenparty_ie because they are the only two political parties in Ireland that have taken the important issue of the mandatory #fluoridation of water here seriously You need to stop allowing this #childabuse,@sinnfeinireland @greenparty_ie,#GE2020 #fluoridation #childabuse,https://twitter.com/Sandyshark/status/1225409643494748161
2020-02-06 13:23:07,tangentfairy,FreePublicTrans,0,0,Muted,,,https://twitter.com/tangentfairy/status/1225409586934448130
2020-02-06 13:22:28,IrishRefugeeCo,,1,0,@greenparty_ie -Work towards ending Direct Provision and replace it with a not for profit system using new or existing approved housing bodies for delivery of accommodation -Increase access to early legal advice -Better support for women and children ,@greenparty_ie,,https://twitter.com/IrishRefugeeCo/status/1225409424715583488
2020-02-06 13:22:19,Triona_C,orchidsbudget,2,0,Thanks for that. She was clearly never going to reply to me anyway 🙄 I really hope the voters of dlrcc are aware of this if repeal was something they voted for. #ge2020,,#ge2020,https://twitter.com/Triona_C/status/1225409388543959040
2020-02-06 13:21:57,fann_man,,0,1,A must listen for #GE2020 candidates who think electric vehicles are the only way to have sustainable transport. @greenparty_ie @99piorg [99% Invisible] 388- Missing the Bus #99Invisible https://podplayer.net/?id=94962193 via @PodcastAddict,@greenparty_ie @99piorg @PodcastAddict,#GE2020 #99Invisible,https://twitter.com/fann_man/status/1225409293266059264
2020-02-06 13:21:43,hiheal,CllrKRedmond,0,0,"I was a definite Green voter but I'm not now. I believe we have to have progressive candidates in the Dáil. Legislation will be up for review, we need to ensure we have people who will support women's rights as well as climate issues.",,,https://twitter.com/hiheal/status/1225409236194209793
2020-02-06 13:20:00,LkennyCathQtr,,1,0,We welcome the @greenparty_ie candidate @mwhitedonegal plan to promote cultural and #historicaltourism in Donegal but that has to include #realsupport for the groups involved in promoting such #attractions.,@greenparty_ie @mwhitedonegal,#historicaltourism #realsupport #attractions,https://twitter.com/LkennyCathQtr/status/1225408802876354560
2020-02-06 13:19:44,FreePublicTrans,tangentfairy,1,0,"When you are helping the oil auto and sprawl industry, it's safe to be yourself.",,,https://twitter.com/FreePublicTrans/status/1225408734739845121
2020-02-06 13:18:40,tangentfairy,OConnorOisin,0,0,"Their goal is to divide, let them off to their dark corner of Twitter and ignore them",,,https://twitter.com/tangentfairy/status/1225408467357315072
2020-02-06 13:17:52,roisiningle,bamacgabhann,0,1,Wild Atlantic Women of @greenparty_ie 💚💚💚💚 #Ge2020,@greenparty_ie,#Ge2020,https://twitter.com/roisiningle/status/1225408266055954432
2020-02-06 13:17:02,tangentfairy,FreePublicTrans,1,0,He's not a troll he's a real person. At least he has the courage to come out and speak his views and put a name and face to his opinions.,,,https://twitter.com/tangentfairy/status/1225408056735027200
2020-02-06 13:15:00,DownSyndromeIRL,,0,0,@FineGael @fiannafailparty @sinnfeinireland @labour @pb4p @independents4_C @greenparty_ie @SocDems @AontuIE - The current crisis in our health system is detrimental to people with Down syndrome. Read our manifesto here: http://bit.ly/2RWWHul #DisabilityVotesCount #GE2020,@FineGael @fiannafailparty @sinnfeinireland @labour @pb4p @independents4_C @greenparty_ie @SocDems @AontuIE,#DisabilityVotesCount #GE2020,https://twitter.com/DownSyndromeIRL/status/1225407544421535744
2020-02-06 13:13:59,AustinMcgrath14,philipoconnor,0,0,"Not a problem...simplistic perhaps,but best strategy is to ""paint them all with the same brush"" & discount themakl as a choice until it's categorically clear ..........",,,https://twitter.com/AustinMcgrath14/status/1225407287721897984
2020-02-06 13:11:59,VirginMediaNews,,0,0,"🗳️ #GE2020 Others It’s been a busy morning on the campaign trail with many of the smaller parties making their final pitches @DebsNaylor has the latest from @pb4p, @labour &amp; @greenparty_ie for #VMNews⤵️",@DebsNaylor @pb4p @labour @greenparty_ie,#GE2020 #VMNews,https://twitter.com/VirginMediaNews/status/1225406787941281793
2020-02-06 13:11:47,emmzcee,SeanOMarachain,1,0,"The party has an overall pro choice stance though, so they should have been transparent about running an anti choice candidate. The fewer of these gobshites that get seats the safer women will be as they will get to vote on legislations.",,,https://twitter.com/emmzcee/status/1225406736208736256
2020-02-06 13:11:25,CorkGreens,,0,4,"DEFENCE FORCES: @greenparty_ie candidate for Cork East @LiamQuaide is quoted in @EastCorkJournal today calling for fair pay for members of our defence forces, as well as properly funded state-provided supports for veterans https://www.eastcorkjournal.ie/our-government-needs-to-value-our-defence-forces-says-green-party-cllr-liam-quaide/",@greenparty_ie @LiamQuaide @EastCorkJournal,,https://twitter.com/CorkGreens/status/1225406644567318528
2020-02-06 13:08:19,VincentPMartin1,,0,0,@greenparty_ie will direct 20% of #Transport budget (rather than existing 1.5%) to safe #cycling &amp; #walking. But we need Green TD's in the next Dail to make this transport revolution happen. Please vote #1 Vincent P. Martin in #KildareNorth this Saturday #WantGreenVoteGreen,@greenparty_ie,#Transport #cycling #walking #KildareNorth #WantGreenVoteGreen,https://twitter.com/VincentPMartin1/status/1225405862254141440
2020-02-06 13:07:58,OkeeffeLynn,freesafelegal,0,0,@eoinmadden in Galway @greenparty_ie candidate for East Galway ,@eoinmadden @greenparty_ie,,https://twitter.com/OkeeffeLynn/status/1225405777080442883
2020-02-06 13:07:10,iainburnsy1979,peter_lydon,0,0,"Campaign in poetry, govern in prose.",,,https://twitter.com/iainburnsy1979/status/1225405576060002305
2020-02-06 13:05:54,colmrfeighery,McConnellDaniel,0,0,"And Amnesty, the UN as well as the ICCL",,,https://twitter.com/colmrfeighery/status/1225405255770345472
2020-02-06 13:04:28,kyleeesi,,0,0,@greenparty_ie can you clarify why you are running anti choice candidates?,@greenparty_ie,,https://twitter.com/kyleeesi/status/1225404894724739072
2020-02-06 13:00:04,darcy_sargument,Kilfalwol,0,0,"Ccllr @TheKavOfficial should be ashamed. Argue the point, if it's so good then you have no need to attack the person. In this case - the young.",@TheKavOfficial,,https://twitter.com/darcy_sargument/status/1225403787428474883
2020-02-06 12:59:03,SeanOMarachain,emmzcee,1,0,"Some do believe that women shouldn't have the best health care, do believe that marriage should only be between a man and woman, they even believe fanciful stuff like life after death, and crazy conspiracy theories But IMO they should not be excluded from voting or seeking a vote",,,https://twitter.com/SeanOMarachain/status/1225403530179235841
2020-02-06 12:58:22,CllrKRedmond,HelenGuinane,1,0,Maybe they care about green issues and don’t judge everybody through the lens of yesterday’s war?,,,https://twitter.com/CllrKRedmond/status/1225403358191767553
2020-02-06 12:56:55,HelenGuinane,CllrKRedmond,1,0,I'm not a supporter of any party and I'm still very disappointed in the Greens.,,,https://twitter.com/HelenGuinane/status/1225402993010454529
2020-02-06 12:56:53,Sobrienegritepe,irishexaminer,0,0,Here I believe her exact words were ‘I am for the courts ‘ .. I accept that we need mechanisms and special Powers ⬇️... we’ve got 21st century criminals . We need 21st century processes ⬇️,,,https://twitter.com/Sobrienegritepe/status/1225402987327172608
2020-02-06 12:56:46,CllrKRedmond,denise_m_ryan,1,0,All of which he will support as GP policy. As he’s said.,,,https://twitter.com/CllrKRedmond/status/1225402956259975170
2020-02-06 12:56:01,CllrKRedmond,hiheal,2,0,I know. I see you’re a socdem supporter. I think that has more to do with this. David has already said he’d vote in accordance with party policy on this. You’re looking for reasons to be offended.,,,https://twitter.com/CllrKRedmond/status/1225402766945812480
2020-02-06 12:55:48,denise_m_ryan,CllrKRedmond,1,0,"It's far from settled. Review of legislation, introducing exclusion zones, ensuring access & removal of barriers are all key issues for elected TDs of the next Dail.",,,https://twitter.com/denise_m_ryan/status/1225402712227012614
2020-02-06 12:53:56,Christsatheists,Christsatheists,1,0,"""No bandwagons"", it says on the profile. But Sinn Fein, sure...",,,https://twitter.com/Christsatheists/status/1225402244268515333
2020-02-06 12:53:21,Triona_C,LouiseActon7,1,0,Can @smytho confirm his stance on @repealeight vote? While we're at it @MaryHanafin1 and @CormacDevlin feel free to confirm your stances also.... #GE2020,@smytho @repealeight @MaryHanafin1 @CormacDevlin,#GE2020,https://twitter.com/Triona_C/status/1225402096343814144
2020-02-06 12:52:50,Christsatheists,ComiskeyAnthony,1,0,"Sinn Fein are running anti choice candidates. But sure, give 'em a vote anyway",,,https://twitter.com/Christsatheists/status/1225401968098783233
2020-02-06 12:50:41,immdaly,KeithMillsD7,0,0,It's a bit ironic for the @greenparty_ie to want us to be more environmentally aware because once we are aware we don't need the greens as nerdy school monitors telling us 'we must do better'. A busted flush politically.,@greenparty_ie,,https://twitter.com/immdaly/status/1225401425594867717
2020-02-06 12:50:13,hiheal,emmzcee,0,0,Hear! Hear!,,,https://twitter.com/hiheal/status/1225401310461222912
2020-02-06 12:50:06,redlemonader,Costellop,0,0,"Great to know, thanks Patrick! 👍🏻",,,https://twitter.com/redlemonader/status/1225401279276634112
2020-02-06 12:50:00,DownSyndromeIRL,,0,0,@FineGael @fiannafailparty @sinnfeinireland @labour @pb4p @independents4_C @greenparty_ie @SocDems @AontuIE - Ireland is currently the worst country in western Europe to have a disability. Read our full manifesto here: http://bit.ly/2RWWHul #DisabilityVotesCount #GE2020,@FineGael @fiannafailparty @sinnfeinireland @labour @pb4p @independents4_C @greenparty_ie @SocDems @AontuIE,#DisabilityVotesCount #GE2020,https://twitter.com/DownSyndromeIRL/status/1225401252994940929
2020-02-06 12:49:36,GaryJk64,,0,0,"@elisaodonovan @neasa_neasa @unapower @greenparty_ie @SocDems A Dutch perspective on shared space, which is what the liffey cycle lane is and all the other cycle designs that endanger pedestrians too.The name may change nothing else @Seaofchangefilm",@elisaodonovan @neasa_neasa @unapower @greenparty_ie @SocDems @Seaofchangefilm,,https://twitter.com/GaryJk64/status/1225401151421657088
2020-02-06 12:48:39,hiheal,CllrKRedmond,1,0,I'm a voter who supports choice who refuses to vote for a TD who doesn't support my right to bodily self-determination! There will be a Legislative review during this Dáil session and several other votes where will need pro-choice TDs. Very disappointed in the Green Party.,,,https://twitter.com/hiheal/status/1225400914267267072
2020-02-06 12:48:10,yascaoimhin,ClareOC_,0,0,Who’s the other ones?,,,https://twitter.com/yascaoimhin/status/1225400794289254401
2020-02-06 12:48:09,craftbeerswhisk,T4rbh,0,0,You don't have to vote Green to be Green.,,,https://twitter.com/craftbeerswhisk/status/1225400788886925313
2020-02-06 12:45:03,jesusofthebog,irishexaminer,0,0,"Lads she’s an eco anarchist, this is hardly surprising and she’s right",,,https://twitter.com/jesusofthebog/status/1225400008838647808
2020-02-06 12:43:52,pslattery2019,Kilfalwol,0,0,He realises some of there candidates came from young greens,,,https://twitter.com/pslattery2019/status/1225399711839985664
2020-02-06 12:42:08,Christsatheists,orchidsbudget,0,0,That comes as no surprise,,,https://twitter.com/Christsatheists/status/1225399275359817731
2020-02-06 12:41:19,mikeobrien92lh,FNDuffy,0,0,"Why dont you start with the USC tax that was suppost to be temporary give it back to the workers , fight for low mortgage interest rates",,,https://twitter.com/mikeobrien92lh/status/1225399068475764738
2020-02-06 12:41:13,lucyoshea,Kilfalwol,0,0,His comments have been beyond disgusting. Beyond me why the party stick by him.,,,https://twitter.com/lucyoshea/status/1225399044249411584
2020-02-06 12:40:40,paulmorrinIE,,1,1,"Parties that you should vote for in #GE2020: @workersparty, @pb4p, @solidarityie, @RISEsocialists, @sinnfeinireland, @SocDems, @greenparty_ie, @labour, a few great independents like @JoanCollinsTD. Who you should not vote for: Anyone else. #VoteLeft #Transferleft #VoteThemOut",@workersparty @pb4p @solidarityie @RISEsocialists @sinnfeinireland @SocDems @greenparty_ie @labour @JoanCollinsTD,#GE2020 #VoteLeft #Transferleft #VoteThemOut,https://twitter.com/paulmorrinIE/status/1225398904885334016
