date,username,to,replies,retweets,text,mentions,hashtags,permalink
2020-01-03 11:39:33,realjohnmurphy,maz_max_80,2,0,"But that simply doesn’t happen in jurisdictions where abortion is seen as an option, because abortion is much cheaper than supporting a woman through pregnancy. GPs down here are being incentivised to push abortion (and still, only a fraction of them are willing to). Wonder why.",,,https://twitter.com/realjohnmurphy/status/1213062335750922240
2020-01-03 11:37:39,realjohnmurphy,maz_max_80,1,0,That was my answer. I told you.,,,https://twitter.com/realjohnmurphy/status/1213061859789754368
2020-01-03 11:34:53,Rasputinish,,0,3,To @LeoVaradkar &amp; @simoncoveney this morning: Call in #US Ambassador to #Ireland (there isn't one 'cos #sTrumpet never bothered to appoint) &amp; politely advise #US Chargé d'affaires that NOT 1 SINGLE US Military Flight will be allowed transit thru #Shannon en route to War -v- #Iran,@LeoVaradkar @simoncoveney,#US #Ireland #sTrumpet #US #Shannon #Iran,https://twitter.com/Rasputinish/status/1213061162931240961
2020-01-03 11:33:50,ArjitDewan,DVATW,0,0,And I thought Irish people are more smarter than Britishers They won't do anything stupid 2040 Irish Doomsday clock,,,https://twitter.com/ArjitDewan/status/1213060898392174592
2020-01-03 11:32:43,ianbell89,DVATW,0,1,Ireland on the road to ruin. The multicultural dream marches on.,,,https://twitter.com/ianbell89/status/1213060617562492930
2020-01-03 11:29:46,WagonWanderly,CA_Gerrard71,0,0,Isn't that what the Church does anyway? And then rapes children and enslaves / tortures / shames women and gets away with it because of people like you support them to.,,,https://twitter.com/WagonWanderly/status/1213059876630474752
2020-01-03 11:28:45,maz_max_80,realjohnmurphy,2,0,I'll certainly answer that. After you John.,,,https://twitter.com/maz_max_80/status/1213059618722762752
2020-01-03 11:26:55,maz_max_80,maz_max_80,0,0,However I don't feel it is my right to enforce my views on anyone.,,,https://twitter.com/maz_max_80/status/1213059159060623361
2020-01-03 11:25:37,maz_max_80,realjohnmurphy,2,0,"Thing is John, the pro life side has always had a voice and for a long time, that drowned everything out. I remember signing petitions after mass a long long time ago. I do hope that abortion doesn't happen and that women have the support to continue pregnancy if they wish.",,,https://twitter.com/maz_max_80/status/1213058832970190848
2020-01-03 11:25:25,realjohnmurphy,realjohnmurphy,1,0,Still waiting on this one. Is targeted harassment sometimes okay?,,,https://twitter.com/realjohnmurphy/status/1213058779417382912
2020-01-03 11:24:32,realjohnmurphy,maz_max_80,0,0,"I’ll also remind you, abortion is not the choosing between two people who are going to die without your help. It’s choosing whether or not to kill a human being who will live without your intervention, so your scenario is not only nonsense, but irrelevant nonsense.",,,https://twitter.com/realjohnmurphy/status/1213058556666269696
2020-01-03 11:24:04,junewilliams515,DVATW,0,0,Border controls needed.,,,https://twitter.com/junewilliams515/status/1213058440588861441
2020-01-03 11:23:55,hinduinquisitor,SheheryarFm,0,0,"If Kashmir is really bleeding, how come there are no refugees? There were thousands of Jews who were fleeing persecution in the Third Reich, to France, Russia, UK and the US. Where are the Kashmiris fleeing so called Indian persecution to PoK and Pakistan? There are none.",,,https://twitter.com/hinduinquisitor/status/1213058404408651777
2020-01-03 11:23:03,realjohnmurphy,maz_max_80,1,0,"I’ll answer that (ridiculous) scenario with another. Same scenario, but you can either save a black man, a gay man, or a woman. Who do you save? Bear in mind, you think the two you leave behind are worth less as people than the one you don’t, by your own logic.",,,https://twitter.com/realjohnmurphy/status/1213058185218658304
2020-01-03 11:22:16,SheheryarFm,,1,0,Seems like your Conscience has Slept Well now for over 150 Days - #Kashmir Anschluss. #KashmirBleeds at the Hands of Aryan Supermacist 4th Reich in India @erna_solberg @BloxFCOG @Xavier_Bettel @LeoVaradkar @katrinjak @antoniocostapm @sanchezcastejon,@erna_solberg @BloxFCOG @Xavier_Bettel @LeoVaradkar @katrinjak @antoniocostapm @sanchezcastejon,#Kashmir #KashmirBleeds,https://twitter.com/SheheryarFm/status/1213057987922841601
2020-01-03 11:21:24,billy_blyberg,merrionstreet,0,0,"Do something to alleviate flood risks in Cork or else in 100 years time it'll be ""2020 - the year that #Cork became #Atlantis""! #ClimateChangeIsReal #TakeActionNow @Corkcoco @corkcitycouncil @foeireland",@Corkcoco @corkcitycouncil @foeireland,#Cork #Atlantis #ClimateChangeIsReal #TakeActionNow,https://twitter.com/billy_blyberg/status/1213057768061636610
2020-01-03 11:21:10,realjohnmurphy,maz_max_80,1,0,Could you please answer my question about targeted harassment at cinemas before you leave?,,,https://twitter.com/realjohnmurphy/status/1213057712847802369
2020-01-03 11:20:41,DerekAskme,merrionstreet,0,0,"Well Leo , I'm heading out for a night on the town Dublin is such a lovely lovely place 🙃👇",,,https://twitter.com/DerekAskme/status/1213057588293709831
2020-01-03 11:20:25,sourface14,DVATW,1,0,Good job fighting off white brits only to invite the third world .,,,https://twitter.com/sourface14/status/1213057524011851777
2020-01-03 11:19:49,realjohnmurphy,realjohnmurphy,1,0,"Refusing to allow the pro-life side a real voice, as happened down here during the 8th amendment referendum, will only bring out the most forceful on the pro-life side, because the people who want a respectful discussion will he bullied into silence.",,,https://twitter.com/realjohnmurphy/status/1213057371104256000
2020-01-03 11:19:21,AnnSea7,ConstuctD,0,0,It's not 100 years since all the hungers trikes died for ireland,,,https://twitter.com/AnnSea7/status/1213057255387648000
2020-01-03 11:19:03,maz_max_80,maz_max_80,2,0,Frozen embryos. You can either save the little girl or the embryos but not both. Which would you choose?,,,https://twitter.com/maz_max_80/status/1213057176832491521
2020-01-03 11:18:33,MikeFreedom10,DVATW,0,1,"There are moves to chuck out Varadkar, or so I heard. 🤓",,,https://twitter.com/MikeFreedom10/status/1213057050831413249
2020-01-03 11:18:19,realjohnmurphy,maz_max_80,1,0,"And I’ll add to that, that we’re supposed to take that woman at her word that things happened as they did, even though I’m not aware of any actual evidence (in this age where everyone has a camera phone) of that ever happening in the north or south.",,,https://twitter.com/realjohnmurphy/status/1213056994485178368
2020-01-03 11:18:16,maz_max_80,maz_max_80,2,0,Care about or love them. I wish the same regard was given this children as those who are yet to develop /be born. Am going to leave you with this thought. You are in a room in a large building and a fire breaks out. In one corner is a 2 year old girl and in the other is 50,,,https://twitter.com/maz_max_80/status/1213056982384549888
2020-01-03 11:17:52,AnnSea7,ConstuctD,0,0,And you dare to call me a terrorist while you look down your guns,,,https://twitter.com/AnnSea7/status/1213056879150149632
2020-01-03 11:17:02,realjohnmurphy,maz_max_80,1,0,"You just told me that you called me a cunt in frustration. Don’t you think those trying to offer these women support and being ignored might also be frustrated, and might come across as screaming when their intention is simply to make themselves heard?",,,https://twitter.com/realjohnmurphy/status/1213056671376957441
2020-01-03 11:16:34,maz_max_80,maz_max_80,1,0,"Judge other people and recognise that abortions will happen regardless, just elsewhere. I have my own religious views also but I feels strongly that church and state should be separated. As a separate note, I know the numbers of children living in care, many with no one to",,,https://twitter.com/maz_max_80/status/1213056555429613569
2020-01-03 11:16:23,ConstuctD,AnnSea7,1,0,Lovely Ballina :),,,https://twitter.com/ConstuctD/status/1213056508365283335
2020-01-03 11:14:52,maz_max_80,realjohnmurphy,1,0,"Personally I would never have an abortion. However I recognise that I'm lucky to live the life I lead. I have the means to support my kids and give them a good life. I've never been raped or suffered abuse. No matter how we try as a society, such things continue. I try not to",,,https://twitter.com/maz_max_80/status/1213056124259315713
2020-01-03 11:13:49,AnnSea7,ConstuctD,1,0,Take me home to Mayo,,,https://twitter.com/AnnSea7/status/1213055860357976064
2020-01-03 11:12:58,edgecoachinguk,,0,0,@LeoVaradkar I hear you are leaving soon. Good riddance you little creep. 👋,@LeoVaradkar,,https://twitter.com/edgecoachinguk/status/1213055646578479104
2020-01-03 11:12:37,tazgallin,DVATW,0,0,"in this country the racist country, lol , they batter each other over lands that will never be theirs, areas etc, and for us to call out their behaviour is racist, the amount of black power on display here at the moment , is unreal. we are told to shut up its their country now,",,,https://twitter.com/tazgallin/status/1213055561161494528
2020-01-03 11:12:27,theoleary,forza_fergie,0,0,"Back of a long queue? UK can't do trade deals with Ireland, any deal is with the entire EU 27. And a trade boycott (ironic!)? Ireland buys 4 times as much from the UK as we sell it - so guess who loses in a tit-for-tat? This jingoistic nonsense doesn't help anybody.",,,https://twitter.com/theoleary/status/1213055516366266368
2020-01-03 11:11:55,HaineSharan,DVATW,2,0,Ireland need out of EU,,,https://twitter.com/HaineSharan/status/1213055382018568193
2020-01-03 11:11:34,thecrusades5,DVATW,0,2,Get them out send them back to the jungle from whence they came Ireland’s shame,,,https://twitter.com/thecrusades5/status/1213055296261828608
2020-01-03 11:11:06,MickMoggster,,0,0,So @LeoVaradkar wants to be friends now? @BorisJohnson should send him to the back of the que. #brexit,@LeoVaradkar @BorisJohnson,#brexit,https://twitter.com/MickMoggster/status/1213055175721652224
2020-01-03 11:10:37,realjohnmurphy,maz_max_80,0,0,"I don’t believe that, I’m afraid. You didn’t make me feel intimidated, by the way. You just tried to. Dead babies are the reality of abortion, by the way.",,,https://twitter.com/realjohnmurphy/status/1213055054502146053
2020-01-03 11:10:26,ianbell89,DVATW,2,5,The Irish ''leaders'' have lost all respect for their culture and history. Plunging the Irish people into this social nightmare is a new level of extreme selfishness.,,,https://twitter.com/ianbell89/status/1213055009744506880
2020-01-03 11:09:36,chrissieA2,DVATW,0,0,"Have brother out there. He descrbes it as ""Hell"". Inefficient Hell. The Irish are useless.",,,https://twitter.com/chrissieA2/status/1213054799157059584
2020-01-03 11:09:31,realjohnmurphy,maz_max_80,1,0,"It’s not a fact anywhere abortion is seen as a choice. Why counsel when what they’re doing isn’t a big deal? It’ll be true in the north too, once the change in the law (enacted in Downing Street, which Sinn Féin was fine with) comes into full effect.",,,https://twitter.com/realjohnmurphy/status/1213054778403631108
2020-01-03 11:09:07,ConstuctD,AnnSea7,2,0,Not quite 100 years since the foundation of the Republic - is is the country that the founding fathers and mothers envisaged?,,,https://twitter.com/ConstuctD/status/1213054676767256577
2020-01-03 11:07:43,3301Dr,DVATW,0,0,Finished,,,https://twitter.com/3301Dr/status/1213054325775310853
2020-01-03 11:01:52,maz_max_80,maz_max_80,2,0,I work in primary care in the North of Ireland so what I told you in relation to counselling is fact. Have you seen Bernie Smith standing quietly anywhere? She's a personal friend of my family but I fundamentally disagree with her. I'm also entitled to disagree with you.,,,https://twitter.com/maz_max_80/status/1213052854048563200
2020-01-03 11:01:38,Janiwink,DVATW,0,0,How much is a wall?,,,https://twitter.com/Janiwink/status/1213052796179800064
2020-01-03 11:01:04,leehamill12,,0,1,"Also, will our government continue to facilitate this allow Shannon to be used by war mongers? @LeoVaradkar @simoncoveney",@LeoVaradkar @simoncoveney,,https://twitter.com/leehamill12/status/1213052653300834305
2020-01-03 10:59:19,Yourmannugget,,0,0,@LeoVaradkar here Leo. Wait until this WWIII thing plays out a bit before picking a side and pick whoever China and Russia are with yeah?,@LeoVaradkar,,https://twitter.com/Yourmannugget/status/1213052211489648640
2020-01-03 10:56:25,maz_max_80,maz_max_80,2,0,Utter frustration and not an attack on your personally.,,,https://twitter.com/maz_max_80/status/1213051480640557057
2020-01-03 10:55:31,maz_max_80,realjohnmurphy,1,0,I apologise if I made you feel intimidated by suggesting that those who protest using pictures of dead babies or holding tiny coffins outside maternity clinics where many women will be experiencing still births or spontaneous abortion are cunts. That word was meant to express my,,,https://twitter.com/maz_max_80/status/1213051255368630281
2020-01-03 10:55:18,SantoshKumarDw5,,0,0,"Recently, #LeoVaradkar visited India. He is the current PM of which country? - #Ireland #ISRO to launch which satellite to study #Sun? - #Aditya Which state police to observe 2020 as year of women safety? - #AndhraPradesh Who sworn in as #Maharashtra’s deputy CM? - #AjitPawar",,#LeoVaradkar #Ireland #ISRO #Sun #Aditya #AndhraPradesh #Maharashtra #AjitPawar,https://twitter.com/SantoshKumarDw5/status/1213051200322465792
2020-01-03 10:54:27,marketcanteen,biggusdicus,0,0,We always limit the amount of vouchers we sell,,,https://twitter.com/marketcanteen/status/1213050986367004672
2020-01-03 10:53:06,rendering_soul,DVATW,0,0,Why the hell they are destroying the resources?,,,https://twitter.com/rendering_soul/status/1213050647190241280
2020-01-03 10:44:46,realjohnmurphy,maz_max_80,1,0,"You haven’t provided any facts, just your opinions. You also used name-calling to try to intimidate me. And it wasn’t the targeted part I was referring to. It was the harassment part. Standing quietly with a sign is not harassment, unless the sign is saying something abusive.",,,https://twitter.com/realjohnmurphy/status/1213048552454311942
2020-01-03 10:43:17,nickyjanek,LordBluntwell,0,0,Is this not a sin?? You are sinning all over the place. You really aren’t a very good Catholic now are you?? 🤣🤣,,,https://twitter.com/nickyjanek/status/1213048177529634816
2020-01-03 10:42:24,realjohnmurphy,maz_max_80,1,0,So targeted harassment is sometimes okay then?,,,https://twitter.com/realjohnmurphy/status/1213047954984046592
2020-01-03 10:38:42,DVATW,,95,754,"Ireland looking so enriched, as you can see. But it’s just not enough for @LeoVaradkar - he wants a million more to come by 2040. Bless. ",@LeoVaradkar,,https://twitter.com/DVATW/status/1213047025903767552
2020-01-03 10:38:23,RobanBrian,LeoVaradkar,0,0,Sure everyone loves a bit of protesting... mainly the government as you know it really does fuck all.... only one way to deal with the incompetence of you and that idiot Simon Harris... The French way is the best way !!!,,,https://twitter.com/RobanBrian/status/1213046943183785984
2020-01-03 10:37:43,ConnectIreland1,LucindasIreland,0,0,"Sad news guys, it is a tough business to be in...",,,https://twitter.com/ConnectIreland1/status/1213046777248698368
2020-01-03 10:34:55,xemon2000,mairenihuigin,0,0,The 'unsavoury' images don't even remotely compare to the unsavoury reality of this mass murder which they are protesting.,,,https://twitter.com/xemon2000/status/1213046071292813313
2020-01-03 10:30:41,DefnewsIrl,,0,1,So what us it to be in 2020 ? Pay review body or Full affiliation to ICTU taking defence out of the dark room when it comes to pay negotiation and collective bargaining either way @defenceforces is at that juncture and @campaign4kehoe @LeoVaradkar must decide ,@defenceforces @campaign4kehoe @LeoVaradkar,,https://twitter.com/DefnewsIrl/status/1213045006048649217
2020-01-03 10:29:19,chefwademurphy,LucindasIreland,0,0,Very sad news and I fear there’ll be more to come. Our game is tough and getting much tougher to survive.,,,https://twitter.com/chefwademurphy/status/1213044661742395392
2020-01-03 10:27:32,vaughanlodge,LucindasIreland,0,0,Through the ages we know the margins in food business are razor thin if present at all. Good minded people work on ignoring the signs and hoping cash flow will be strong enough to keep things going. Fundamentally many cafes Delis and small restaurants are loss making,,,https://twitter.com/vaughanlodge/status/1213044214461804545
2020-01-03 10:22:12,maz_max_80,realjohnmurphy,1,0,"1 Harassment 2 Patients are counselled both prior to referral and prior to procedure 3) Never ""needs"" to be outside mat wards unless by ""most effective"" you really mean targetting those having an abortion which actually proves point 1, 'targetted' harassment 4) Not how facts work",,,https://twitter.com/maz_max_80/status/1213042869625401345
2020-01-03 10:21:41,SRegenerated,TiceRichard,0,0,If I were @BorisJohnson I would not deal with @LeoVaradkar ,@BorisJohnson @LeoVaradkar,,https://twitter.com/SRegenerated/status/1213042740654747648
2020-01-03 10:20:59,Amalekite1,HSCORPI0,0,0,Articles in The Express rarely constitute ‘proof’ of anything.,,,https://twitter.com/Amalekite1/status/1213042565215326210
2020-01-03 10:18:38,WhipperWills,LurganLoyal,0,0,"I think you'll find Varadkar and @FineGael have more in common with @duponline and #Tories than they have with Irish citizens. Didn't the PSNI say it was a criminal element carrying out the attack: still, don't let that get in the way of a sectarian rant.",@FineGael @duponline,#Tories,https://twitter.com/WhipperWills/status/1213041972828524545
2020-01-03 10:18:06,altforire,1rorycowan,0,0,Is this equally horrible @1rorycowan?,@1rorycowan,,https://twitter.com/altforire/status/1213041841697951744
2020-01-03 10:15:01,maz_max_80,realjohnmurphy,1,0,Not the same thing. A movie as opposed to people going through real life experiences.,,,https://twitter.com/maz_max_80/status/1213041065676201985
2020-01-03 10:14:55,MickMeally,DefenceIreland,1,0,"👏🏼 There is no Neutrality to hide behind in this age of hybrid, non-conventional international aggression. This is no job for a Coast Guard or a Police force. Mr.Doran just publicly displayed a staggering lack of knowledge. @LeoVaradkar @RACO_DF @INMO_IRL #LiamDoran #KehoeMustGo",@LeoVaradkar @RACO_DF @INMO_IRL,#LiamDoran #KehoeMustGo,https://twitter.com/MickMeally/status/1213041039356891138
2020-01-03 10:08:04,JamesDo55944164,LeoVaradkar,0,0,"I can say im going to Build 50,000 houses and built 20 new hospitals, and raise min wage to €100k per year vote for me ...but you should only vote for what i actually have done and its the same for Leo and crew",,,https://twitter.com/JamesDo55944164/status/1213039316198469632
2020-01-03 10:05:02,AnGobanSaor,ASafiak,1,0,"Won’t take long, Aneta. Gemma’s only allowing one suitcase for each deportee.",,,https://twitter.com/AnGobanSaor/status/1213038553581719553
2020-01-03 10:02:47,cragleacailin,1984alt1,0,0,Disrespect,,,https://twitter.com/cragleacailin/status/1213037983554842629
2020-01-03 10:02:07,DunneDec,Pada1r,0,0,Absolutely,,,https://twitter.com/DunneDec/status/1213037815522627584
2020-01-03 10:00:25,DunneDec,mairenihuigin,0,0,"Won’t wash. No country in the world bans protest (not democratic ones anyway) looked at in Australia New Zealand US and all were deemed to be unconstitutional. May I add that drew Harris has said there is no need for them, and there is plenty of laws to deal with any trouble.",,,https://twitter.com/DunneDec/status/1213037389238743040
2020-01-03 10:00:06,AnGobanSaor,,4,1,"UPDATE: When the mass deportations of Irish people with dark skin/ funny names begins, Gemma will proceed in alphabetical order of @Twitter handles: @angelo_bottone @ASafiak @Ben_Scallan @bundeeaki12 @EbunJoseph1 @hazechu @IbrahimHalawa13 @LeoVaradkar @pcarvosso @RonitLentin",@Twitter @angelo_bottone @ASafiak @Ben_Scallan @bundeeaki12 @EbunJoseph1 @hazechu @IbrahimHalawa13 @LeoVaradkar @pcarvosso @RonitLentin,,https://twitter.com/AnGobanSaor/status/1213037311631474689
2020-01-03 09:59:56,71johnny,,0,0,"I have yet to hear condemnation of latest #US illegal, terrorist act in #Iraq from either @LeoVaradkar @BGriffinTD ? If only it was #Putin they would be wetting themselves to condemn him. #HYPOCRITES #IRELAND #Soleimani #USGOHOME #USOUTOFMIDDLEEAST #USOUTOFEUROPE #SHANNON",@LeoVaradkar @BGriffinTD,#US #Iraq #Putin #HYPOCRITES #IRELAND #Soleimani #USGOHOME #USOUTOFMIDDLEEAST #USOUTOFEUROPE #SHANNON,https://twitter.com/71johnny/status/1213037266744041472
2020-01-03 09:57:46,JacquelineDsou4,sunetrac,0,0,@LeoVaradkar is Indian ...Yet he is the PM of a foreign land !! Knowing how Mrs Gandhi is ridiculed...Some Indians sure are crude !! ,@LeoVaradkar,,https://twitter.com/JacquelineDsou4/status/1213036720746164225
2020-01-03 09:49:25,MIGA32,AltviewIreland,0,0,@LeoVaradkar @CharlieFlanagan @hazechu is this what you want for Ireland?!!,@LeoVaradkar @CharlieFlanagan @hazechu,,https://twitter.com/MIGA32/status/1213034622172499968
2020-01-03 09:45:18,MIGA32,IrishProtector,0,0,@LeoVaradkar we are a catholic country! Maybe open a history book and learn something! You seem to be more concerned with every other race and religion other than the citizens of Ireland ,@LeoVaradkar,,https://twitter.com/MIGA32/status/1213033585382477825
2020-01-03 09:43:04,KellieSocialist,,0,2,@LeoVaradkar and Co. You need to get US military out of Shannon NOW! ,@LeoVaradkar,,https://twitter.com/KellieSocialist/status/1213033021315698688
2020-01-03 09:38:45,Reality37986407,,0,0,"@LeoVaradkar Is the behaviour of Health ministers trying to bring down the government, one talking about hair products and another talking about forced detentions",@LeoVaradkar,,https://twitter.com/Reality37986407/status/1213031937650184193
2020-01-03 09:34:43,TheHillBilly,MiaRogue2,1,0,At least you had the decency not to include 'laugh until I cry' emojis.,,,https://twitter.com/TheHillBilly/status/1213030922704031744
2020-01-03 09:32:36,MIGA32,Niall_Boylan,0,0,@CharlieFlanagan @LeoVaradkar thank you for allowing these scumbags to run free and cause this kind of mayhem in our beautiful... FUCK YOU both ,@CharlieFlanagan @LeoVaradkar,,https://twitter.com/MIGA32/status/1213030388509097984
2020-01-03 09:30:10,PatsyBrady19,LeoVaradkar,0,0,Leo and ‘bandwagon’. See de connection guys?,,,https://twitter.com/PatsyBrady19/status/1213029776266551296
2020-01-03 09:29:38,ClionaQ,Alie77054964,0,0,Born in Ireland to an Irish parent he is Irish,,,https://twitter.com/ClionaQ/status/1213029642719973376
2020-01-03 09:26:27,PrivateData3,mairenihuigin,0,0,The people out side were praying. You were hanging out an open window with a camera. Please consider the Health & Safety Of Other's. Did You Do A Risk Assessment Beforehand ?,,,https://twitter.com/PrivateData3/status/1213028841175863296
2020-01-03 09:23:33,Alabama_Celt,LurganLoyal,0,0,Stop talking trash pal.,,,https://twitter.com/Alabama_Celt/status/1213028110616203264
2020-01-03 09:23:17,declancarty,,0,0,"No disrespect to the people, nor the town of Ennis, but it won awards for Clean Air ? Just shows the disconnect between Min Bruton and Reality, over Air Pollution @JackHoJo @DanielTMurray @joanburton @LeoVaradkar @alankellylabour @JohnSodeau @CRAClabUCC",@JackHoJo @DanielTMurray @joanburton @LeoVaradkar @alankellylabour @JohnSodeau @CRAClabUCC,,https://twitter.com/declancarty/status/1213028046837571584
2020-01-03 09:22:08,pipperino77,MartinO93446600,1,0,"Also adoption is widely recognised as a last resort, not a first. The very best place for a baby is with mum, given the choice of death or adoption I'm pretty sure adoption starts to look good from the baby's perspective.",,,https://twitter.com/pipperino77/status/1213027757376098305
2020-01-03 09:19:58,pipperino77,MartinO93446600,0,0,Thanks for hearing what I didn't say Martin. My point was questioning if any of the protestors are willing to help a woman in distress rather than just shout at them not to be sinners.,,,https://twitter.com/pipperino77/status/1213027208555585536
2020-01-03 09:11:49,Tina_Mulcahy,MarinSanna,0,0,Wouldn't it be a great thing if all countries adopted this attitude and the measures required to make it work @LeoVaradkar @simoncoveney @SimonHarrisTD,@LeoVaradkar @simoncoveney @SimonHarrisTD,,https://twitter.com/Tina_Mulcahy/status/1213025158614671360
2020-01-03 09:11:05,ConstuctD,LurganLoyal,0,0,How do you know it’s “dissident republicans”?,,,https://twitter.com/ConstuctD/status/1213024975386484736
2020-01-03 09:08:51,Aileenkilleen1,mairenihuigin,0,0,A demonstration by people with fixed mindsets totally lacking empathy.,,,https://twitter.com/Aileenkilleen1/status/1213024411172966400
2020-01-03 09:08:20,AllyouneedisC,IrexitFreedom,0,0,@CharlieFlanagan @FineGael @LeoVaradkar This is what you’re proposed hate laws will result in. They will drain Garda resources and be a complete waste of time. ,@CharlieFlanagan @FineGael @LeoVaradkar,,https://twitter.com/AllyouneedisC/status/1213024282827272192
2020-01-03 09:08:13,Carolin27095358,ForsythNeil,0,0,It's a shocking reflection of what their priorities are while those of us at the coal face are desperate to get funding for staff and services for vulnerable children and their families .,,,https://twitter.com/Carolin27095358/status/1213024254817640448
2020-01-03 09:01:52,kayteomalley,mairenihuigin,0,0,This is a fucking disgrace @LeoVaradkar @SimonHarrisTD,@LeoVaradkar @SimonHarrisTD,,https://twitter.com/kayteomalley/status/1213022654103539713
