date,username,to,replies,retweets,text,mentions,hashtags,permalink
2020-01-03 17:46:58,LeoVaradkar,,283,112,Today’s figures show the Government recorded a Budget surplus of €1.4bn or 0.4% of GDP in 2019. This was better than expected on Budget Day and means that for two years in a row we are taking in more revenue than we are spending,,,https://twitter.com/LeoVaradkar/status/1213154799753027584
2020-01-03 17:46:57,sforsavagery,,0,0,"@LeoVaradkar Irish people don’t want American plans landing in Shannon, especially not because they somehow get to tell us when war is just or not. Put a foot down for once if it comes to it",@LeoVaradkar,,https://twitter.com/sforsavagery/status/1213154796590567424
2020-01-03 17:46:23,walls2,Linden_Lad,2,0,Yes it does but decades of change at the helm has proven that it does nothing other than appease the eloctoral appetite for change. Far too many management tiers within The @HSELive that are suffocating the system from within.,@HSELive,,https://twitter.com/walls2/status/1213154652344266752
2020-01-03 17:45:49,sforsavagery,wantfrieswitdah,0,0,Omw to bully Varadkar into not letting it happen again,,,https://twitter.com/sforsavagery/status/1213154513126928386
2020-01-03 17:45:49,wantfrieswitdah,wantfrieswitdah,0,0,(I just saw this in tweets so it could be wrong) but even still I’m angry,,,https://twitter.com/wantfrieswitdah/status/1213154511692406784
2020-01-03 17:45:29,wantfrieswitdah,sforsavagery,2,0,Apparently they’ve used it in most attacks against the Middle East,,,https://twitter.com/wantfrieswitdah/status/1213154425604386816
2020-01-03 17:44:37,sforsavagery,wantfrieswitdah,1,0,Don’t tell me he’s already agreed to let them use it!!,,,https://twitter.com/sforsavagery/status/1213154210428129282
2020-01-03 17:44:16,sndmoore,Fingalcoco,0,0,Thanks for your response. I will email you the exact location details.,,,https://twitter.com/sndmoore/status/1213154123132162054
2020-01-03 17:39:31,fluffernutter99,wantfrieswitdah,0,0,WE DONT WANT THEM USING SHANNON AIRPORT @LeoVaradkar,@LeoVaradkar,,https://twitter.com/fluffernutter99/status/1213152924513325061
2020-01-03 17:38:31,Rene_Mullin,alicearts14,0,0,"Indeed Alice, though I fear (and hope in equal measure) to be hauled up in cork feeding the rower daughter as she trains for the competitions. We are overdue a west visit though!",,,https://twitter.com/Rene_Mullin/status/1213152674637590530
2020-01-03 17:38:14,wantfrieswitdah,,5,3,get the fucking yanks out of Ireland this is not our war and never will be @LeoVaradkar,@LeoVaradkar,,https://twitter.com/wantfrieswitdah/status/1213152603074441222
2020-01-03 17:35:40,McGettrickDamo,scolionetwork,0,0,@SimonHarrisTD @LeoVaradkar on your watch These suffering kids really really upsetting There's a lot wrong or broken with Health offering (I won't call it a service) in this country that's frustrating &amp; annoying as shouldn't be the case. But surgeries for these kids #please,@SimonHarrisTD @LeoVaradkar,#please,https://twitter.com/McGettrickDamo/status/1213151956228878336
2020-01-03 17:33:50,Sarklor,,0,0,@LeoVaradkar don't you fucking *dare* let the US keep refueling their warplanes at Shannon.,@LeoVaradkar,,https://twitter.com/Sarklor/status/1213151493810991104
2020-01-03 17:33:25,cos_niall,AnnHornigold,1,0,Ireland has developed from centuries of migration and invasion,,,https://twitter.com/cos_niall/status/1213151391440613376
2020-01-03 17:33:00,BrianRocks1964,shannonwatch,0,0,America are actually out reserve defence force!,,,https://twitter.com/BrianRocks1964/status/1213151284385263625
2020-01-03 17:29:08,AnnHornigold,cos_niall,1,0,I know little other than Irish blood going back many generations to Waterford and Cavan. Just personal observations,,,https://twitter.com/AnnHornigold/status/1213150313949093888
2020-01-03 17:29:05,TomOnDaInterWeb,LeoVaradkar,0,0,Scum,,,https://twitter.com/TomOnDaInterWeb/status/1213150302129606657
2020-01-03 17:27:49,Sarklor,williamhboney1,0,1,"Welfare cheats do Indeed, it seems, cheat us all 👀",,,https://twitter.com/Sarklor/status/1213149981475037184
2020-01-03 17:27:05,IntelligentCan2,gemmaod1,0,1,*Diversity is our strength!*,,,https://twitter.com/IntelligentCan2/status/1213149795776266240
2020-01-03 17:26:20,williamhboney1,williamhboney1,1,17,The unlawful approach of 'Test Cases' happened on ur watch as SW Minister @LeoVaradkar. The Chief Appeals Officer has denied that this happened despite the irrevocable evidence that it did. https://twitter.com/williamhboney1/status/1204005236186255361 A lie to an Oireachtas Committee is an extremely serious issue.,@LeoVaradkar,,https://twitter.com/williamhboney1/status/1213149610358792194
2020-01-03 17:25:35,Mary17Fahey,SimonHarrisTD,2,0,Fair play to you. That was a lovely thing to do. All the best to the family.,,,https://twitter.com/Mary17Fahey/status/1213149420759502849
2020-01-03 17:24:51,cos_niall,AnnHornigold,1,0,You need to look at our history,,,https://twitter.com/cos_niall/status/1213149236356890625
2020-01-03 17:22:59,ZoeHealy3,Pidge,0,0,"The G spine would be the one to tweak at the last bit, to create new connectivity in South Inner City Dublin between Guinness enterprise centre and the New silicon docks innovation area. Lots of private buses from. Merrion Square to Guinness só tourist demand for that route also",,,https://twitter.com/ZoeHealy3/status/1213148764132782080
2020-01-03 17:21:08,alicearts14,Rene_Mullin,1,0,"Would love to welcome you to the West ! Maybe next Summer, when both myself and Rosie are ‘in situ’ !!",,,https://twitter.com/alicearts14/status/1213148299278114816
2020-01-03 17:21:02,Right2changeMW,gemmaod1,0,0,Would you ever cop yourself on you silly silly woman!!,,,https://twitter.com/Right2changeMW/status/1213148273743142916
2020-01-03 17:18:32,path47,LeoVaradkar,0,0,Maybe you can be as committed to providing 24 hour cardiac care un Waterford,,,https://twitter.com/path47/status/1213147645549727744
2020-01-03 17:18:00,ZoeHealy3,Pidge,0,0,"I see that is good conne tovity but the G spine would be better planned to go to grand canal. Dock, since 150million investment going there, instead of duplicating LUAS red line for the last 5 mins of its journey.",,,https://twitter.com/ZoeHealy3/status/1213147511390638083
2020-01-03 17:17:24,Pidge,Pidge,2,0,"And from 7am-7pm, that O route means one every 8 minutes. Every 10-15 mins on weekends or before 7am/after 7pm.",,,https://twitter.com/Pidge/status/1213147359607164933
2020-01-03 17:16:14,ZoeHealy3,Pidge,0,0,"The G spine is fine until Christchurch but then goes right to cross quays and duplicate red line LUAS. It should turn right at Christchurch to go to Google, creating a new commuting route to new innovation district & Google.",,,https://twitter.com/ZoeHealy3/status/1213147066110746624
2020-01-03 17:14:34,Pidge,ZoeHealy3,2,0,O Direct from James to Grand Canal Dock station,,,https://twitter.com/Pidge/status/1213146645476626432
2020-01-03 17:12:49,ZoeHealy3,Pidge,1,0,Which orbital?,,,https://twitter.com/ZoeHealy3/status/1213146206957973505
2020-01-03 17:12:19,ZoeHealy3,DubLoony,0,0,"I think main conceptual issue with busconnects is not planning for urban villages. Liberties needs a bus gate as cars destroy the atmosphere on Thomas St. Bikes should go through Liberties, not North quays. Hopefully trial. Liffey cycle route will show that",,,https://twitter.com/ZoeHealy3/status/1213146079182643200
2020-01-03 17:10:59,JohnDee18283746,Howardparsons74,0,0,Definitely!!👍,,,https://twitter.com/JohnDee18283746/status/1213145746423394305
2020-01-03 17:09:30,JohnDee18283746,Howardparsons74,1,1,"Oh I luv starting you off, the complaints from choir boys and little fat aging boy scouts makes my day!!",,,https://twitter.com/JohnDee18283746/status/1213145373885243392
2020-01-03 17:09:30,shadey68,LeoVaradkar,0,0,Any thoughts on the riot in Dublin ???,,,https://twitter.com/shadey68/status/1213145371997851648
2020-01-03 17:09:06,ZoeHealy3,DubLoony,0,0,I got an email saying there is already a bus gate planned for children's hospital. I do not understand what they r doing?????,,,https://twitter.com/ZoeHealy3/status/1213145273142304769
2020-01-03 17:07:48,Pidge,ZoeHealy3,2,0,"The orbital goes from James to Grand Canal Dock station, pretty much door to door. Or to go the quays route, the 95 or G1 from Guinness to the convention centre, with a short walk across river.",,,https://twitter.com/Pidge/status/1213144943201595393
2020-01-03 17:07:43,ZoeHealy3,DubLoony,0,0,"G spine should not duplicate by going to the IFSC, should finish at silicon docks for commuters, not duplicate the red luas líne???",,,https://twitter.com/ZoeHealy3/status/1213144923635159046
2020-01-03 17:07:43,gerry4813,,0,0,"Why is @leovaradkar name showing up at episode 2, 38:54 of Don’t f*ck with cats on @netflix? Very strange, what’s going on @JOEdotie I can’t screenshot it, think Netflix don’t allow it",@LeoVaradkar @netflix @JOEdotie,,https://twitter.com/gerry4813/status/1213144922645319682
2020-01-03 17:06:49,ZoeHealy3,DubLoony,0,0,"I sent in about 30 submissions for the consultation from. Neighbours but I don't think there is any strategic plan. It's cause silicon docks is kind of expanding city centre out to the south. @BusConnects needs to plan ahead for silicon docks to b connected well, via Guinness",@BusConnects,,https://twitter.com/ZoeHealy3/status/1213144695792164869
2020-01-03 17:04:21,JohnDee18283746,Howardparsons74,1,0,Folk are lazy they dont vote nor do they see the damage this does and it gives the established parties such an edge but not a great share of the actual possible vote if it was mandatory but the mainstream parties don't want it mandatory because it because it benefits them not to!,,,https://twitter.com/JohnDee18283746/status/1213144077207769088
2020-01-03 17:02:58,DubLoony,ZoeHealy3,4,0,"Good point. I work in the area so am interested I its development. Bus systems easier to change than fixed rail. But as nothing is set in stone, nownis a good time to raise it.",,,https://twitter.com/DubLoony/status/1213143725947404295
2020-01-03 17:00:26,GregcraigGreg,LeoVaradkar,0,0,Watch this one fly over budget ! How many homeless in Cork ??,,,https://twitter.com/GregcraigGreg/status/1213143092313968641
2020-01-03 16:59:20,ballymazoo,Political_Irish,0,0,animals too!,,,https://twitter.com/ballymazoo/status/1213142814835523587
2020-01-03 16:58:45,JohnDee18283746,Howardparsons74,1,0,Only if the majority let it happen! Time they opened their eyes and their mouths and had their say!!,,,https://twitter.com/JohnDee18283746/status/1213142668370423809
2020-01-03 16:54:48,LordBluntwell,JonTron40841117,0,0,Wouldn't be surprised with the level of hate these people have within themselves,,,https://twitter.com/LordBluntwell/status/1213141673032720389
2020-01-03 16:54:47,Cathal63594867,Cathal63594867,0,0,Well @union_dublin . Do you believe the real economy grew 26.3% in 2015?,@union_dublin,,https://twitter.com/Cathal63594867/status/1213141668851048449
2020-01-03 16:54:45,Dublinman6,ChrisJa14208695,0,0,Nope!,,,https://twitter.com/Dublinman6/status/1213141658180739072
2020-01-03 16:54:04,ZoeHealy3,DubLoony,0,0,"10 muns is that time window between finishing work and the creche closing at 6pm. It is bad planning, on a new bus network to force mothers/parents, disabled ppl to walk 10 mins. Especially for wheelchairs. It's a barrier to work.",,,https://twitter.com/ZoeHealy3/status/1213141488177221633
2020-01-03 16:52:45,yurtyahearn,LeoVaradkar,0,0,Govt totally committed 😂😂😂😂 good one 👏👏,,,https://twitter.com/yurtyahearn/status/1213141158471360512
2020-01-03 16:52:31,ZoeHealy3,DubLoony,0,0,There would be a horrific 10 minute walk between Connolly Station and grand canal Dock where Google is. It is called silicon docks i think. I used to work there and it was impossible to get back to the creche for 6pm in the Liberties.,,,https://twitter.com/ZoeHealy3/status/1213141096525684736
2020-01-03 16:52:00,NigelEv97138643,gemmaod1,3,2,"My mothers ancestors are from Ireland, I've visited often but not again 'til they clean up their shit & get rid of the quisling Leo🤬🏴󠁧󠁢󠁷󠁬󠁳󠁿🇬🇧🇺🇸",,,https://twitter.com/NigelEv97138643/status/1213140967366287362
2020-01-03 16:51:38,Cathal63594867,Cathal63594867,0,0,You want to use GDP ratios to criticise Irish spending even though you know its nonsense for Ireland. That's ideology.,,,https://twitter.com/Cathal63594867/status/1213140875724894216
2020-01-03 16:50:42,ZoeHealy3,DubLoony,1,0,"It's not the canal I mean, it is Google. The dart station is called grand canal. I mean for commuting between Liberties, ballyfermot to. Google innovation district, because there is a lot of work there, and 150 mill gov investment going there, at Google area",,,https://twitter.com/ZoeHealy3/status/1213140639245881344
2020-01-03 16:50:01,Cathal63594867,union_dublin,1,0,"What a silly none-point. Why are you deflecting so hard? If the number is based off GDP ratios it's not a good measure, whether it's used by the CSO, eurostat, the OECD or anyone else.",,,https://twitter.com/Cathal63594867/status/1213140469267533824
2020-01-03 16:49:58,JohnDee18283746,Howardparsons74,1,0,"2/2 how important it is to vote nothing will change, the media in ireland is controlled by one man Denis O' Brien and that's why the corruption in ireland of @sinnfeinireland @fiannafailparty @FineGael is not published, @sinnfeinireland openly supports LGBTQ !!",@sinnfeinireland @fiannafailparty @FineGael @sinnfeinireland,,https://twitter.com/JohnDee18283746/status/1213140456252551169
2020-01-03 16:48:46,ZoeHealy3,DubLoony,0,0,"I can see a socio economic class boundary in this design. There needs to be route linking the Liberties to grand canal, an epi centre of tech wealth",,,https://twitter.com/ZoeHealy3/status/1213140153495109632
2020-01-03 16:48:43,DubLoony,ZoeHealy3,4,0,"Can't really see the full route but the 22 will go up SCR, then along the canal over to docklands, crossing Pearse st.",,,https://twitter.com/DubLoony/status/1213140143198093313
2020-01-03 16:47:33,AnnHornigold,cos_niall,1,0,"Inward Immigration ? Into Ireland? The rest of the world has benefitted greatly from Irish EMIGRATION , look at the USA. What Immigration ?",,,https://twitter.com/AnnHornigold/status/1213139848472801280
2020-01-03 16:47:09,ballymazoo,ihrobertson,0,0,and they call me mad?,,,https://twitter.com/ballymazoo/status/1213139747788513281
2020-01-03 16:47:09,ZoeHealy3,DubLoony,1,0,Yes across the bridge to North side. I need to get to grand canal. We can already get to east wall with the LUAS.,,,https://twitter.com/ZoeHealy3/status/1213139747364835330
2020-01-03 16:46:32,hegarty_ruth,WhistleIRL,0,3,@LeoVaradkar @MurphyEoghan Maybe take a look at what works?,@LeoVaradkar @MurphyEoghan,,https://twitter.com/hegarty_ruth/status/1213139591395520513
2020-01-03 16:46:20,union_dublin,Cathal63594867,1,0,"So you question and criticise stats from the same source (@OECD) you retweeted in the past, but in that case shows different figures that your ideology likes? #endof",@OECD,#endof,https://twitter.com/union_dublin/status/1213139542565363712
2020-01-03 16:46:04,PPeterburke,,0,0,"@LeoVaradkar any chance you could explain why Google paid no tax in the last 3 years on a €40billion profit here, asking for nearly 5 million people! #finegael #IrishNews #irishgovernment #fiannafail #newstalk #RTE #98fm #Financialtimes #thetelegraph #Google #Googleireland",@LeoVaradkar,#finegael #IrishNews #irishgovernment #fiannafail #newstalk #RTE #98fm #Financialtimes #thetelegraph #Google #Googleireland,https://twitter.com/PPeterburke/status/1213139476228259841
2020-01-03 16:44:03,BrenBlake2,DVATW,0,1,Some humans don't/won't/can't get along with other humans and are always going to be unhappy about everything. Why destroy perfectly good countries and their citizens to accommodate people that will never be happy and whatever you do will never be enough.,,,https://twitter.com/BrenBlake2/status/1213138968666968064
2020-01-03 16:43:14,DubLoony,ZoeHealy3,2,0,"Got a big leaflet through the door. There is an additional set of routes that are independent of the planned spines. Route 23 will go through James', down Thomas. St.. 22 will go to city centre to East Wall",,,https://twitter.com/DubLoony/status/1213138760436768769
2020-01-03 16:38:17,ZoeHealy3,ZoeHealy3,1,0,"I got an email. From. NTA and I am. Not going away. Just found out there is a huge investment planned at grand canal, but no bus across south inner city? It would get rid of a lot of car journeys and make ppl flow around city without having to go via North side, or north quay",,,https://twitter.com/ZoeHealy3/status/1213137514392903681
2020-01-03 16:37:36,shannonwatch,,17,227,"Today at @ShannonAirport another US troop carrier. Came from Biggs Air Base, Texas, most likely going to Kuwait. As #US tries to wage war with #Iran why is Ireland supporting them to do it? @SimonCoveney @LeoVaradkar @dfatirl you need to end this madness. #USMilitaryOutOfShannon",@ShannonAirport @simoncoveney @LeoVaradkar @dfatirl,#US #Iran #USMilitaryOutOfShannon,https://twitter.com/shannonwatch/status/1213137345681252360
2020-01-03 16:36:29,ZoeHealy3,ZoeHealy3,1,0,"It's the quays, the 1 way system, where traffic goes towards IFSC from Heuston and the other way on the south quay. We need a route from. Guinness along Thomas St then turning left onto Patrick Street and down then left up Kevin St towards Stephens Green then Merrion square",,,https://twitter.com/ZoeHealy3/status/1213137065107476482
2020-01-03 16:36:12,Rene_Mullin,,1,0,"Family life has taken me the complete length of Ireland in the last 24 hours, from Fanad Head to Cork city and the Lee Valley. I can only hope the journey is always as borderless and free as it was today. Counting on you all @sinnfeinireland @SDLPlive @LeoVaradkar @simoncoveney",@sinnfeinireland @SDLPlive @LeoVaradkar @simoncoveney,,https://twitter.com/Rene_Mullin/status/1213136992395046912
2020-01-03 16:35:40,JohnDee18283746,Howardparsons74,1,0,"Who me, crushed? Hahahaha I spend most of my time exposing irelands leading dung pusher @LeoVaradkar and his resident bum boy!! Only in #leosireland #secretcourtsinireland #angelaray #justiceforchildx",@LeoVaradkar,#leosireland #secretcourtsinireland #angelaray #justiceforchildx,https://twitter.com/JohnDee18283746/status/1213136856495382528
2020-01-03 16:35:36,visionbeyond14,DVATW,0,0,It is now the sotory of every country of the world.,,,https://twitter.com/visionbeyond14/status/1213136840972046338
2020-01-03 16:34:44,KimiStrauss,EoinPoil,0,0,Ireland inc owes 220 billion euro. This is a debt that is not and never was ours. FG have not got a clue about budgetary controls. Look around .... children’s hospital ( no final figure ). Broadband ( no final figure ). And we don’t even get to own it when rolled out 😂,,,https://twitter.com/KimiStrauss/status/1213136623669522432
2020-01-03 16:34:21,ZoeHealy3,DubLoony,2,0,"All I can see is the G spine going to the same destination in the IFSC. I can't see any bus route linking up grand canal dart station, to the south inner city. Also sir John Rogers Quay is very hard to reach. It all goes to connolly",,,https://twitter.com/ZoeHealy3/status/1213136524776214529
2020-01-03 16:33:47,charizarda,,0,0,@LeoVaradkar because Trump has killed the general dude and US could be at war soon. Is Ireland a target because US planes land in Shannon ? #wtf #IrishNews,@LeoVaradkar,#wtf #IrishNews,https://twitter.com/charizarda/status/1213136382333521920
2020-01-03 16:32:06,KimiStrauss,EoinPoil,0,0,What kind of work ? Minimum wage work ? Job schemes type work that massages the real unemployment figures ? Take your head out of the clouds lad.,,,https://twitter.com/KimiStrauss/status/1213135959165980672
2020-01-03 16:31:24,johnlikes2run,DanGeary69,0,0,Is that @LeoVaradkar and his mate?,@LeoVaradkar,,https://twitter.com/johnlikes2run/status/1213135785072959488
2020-01-03 16:29:03,Fingalcoco,sndmoore,2,0,"Hi Can you email casmuloparea@fingal.ie with the exact location, kind regards",,,https://twitter.com/Fingalcoco/status/1213135190853390336
2020-01-03 16:27:01,DavidRouquie,TJRyan_77,0,0,"Let’s think at the European level, Ireland, France or Germany alone are too small.",,,https://twitter.com/DavidRouquie/status/1213134679127339008
2020-01-03 16:25:53,WhistleIRL,btselem,0,4,"This is #Israel that @simoncoveney visits on behalf of @LeoVaradkar, and #PrinceCharles is about to make a state-visit to. #JonathanSugarman #Ireland #Jews for #FreePalestine #Gaza #UK @RoyalFamily @ClarenceHouse #فلسطين",@simoncoveney @LeoVaradkar @RoyalFamily @ClarenceHouse,#Israel #PrinceCharles #JonathanSugarman #Ireland #Jews #FreePalestine #Gaza #UK,https://twitter.com/WhistleIRL/status/1213134394812186632
2020-01-03 16:23:35,HughMur71016753,LeoVaradkar,0,0,Do you think of the ex Belfast Dockers suffering from Asbestos poisoning at this time of the year?,,,https://twitter.com/HughMur71016753/status/1213133814689673216
2020-01-03 16:22:54,CaptainMoonlig1,AllPassingThing,0,0,They did!,,,https://twitter.com/CaptainMoonlig1/status/1213133644702855169
2020-01-03 16:22:02,DubLoony,ZoeHealy3,1,0,I think the new route 22 will go south city to canal. Would need to check.,,,https://twitter.com/DubLoony/status/1213133427840626688
2020-01-03 16:21:04,Annie71436731,SimonHarrisTD,0,0,Ah Simon you’d want to do more than visiting people and thanking staff... the state of the health system won’t improve with that!!!,,,https://twitter.com/Annie71436731/status/1213133183232937986
2020-01-03 16:19:14,lenybhoy,gorevidalfan,0,0,How do you know that they dont give their time to these organisations as well..ya you know it all...abortion is murder.,,,https://twitter.com/lenybhoy/status/1213132723268784128
2020-01-03 16:16:43,chrissieA2,DVATW,0,1,Already their main hospital in Dublin can't cope with the numbers of patients. RoI is a very dangerous place to be ill.,,,https://twitter.com/chrissieA2/status/1213132090428084224
2020-01-03 16:16:00,MandhanVishu,DVATW,0,0,Who is boss in Ireland president or prime minister,,,https://twitter.com/MandhanVishu/status/1213131907245830145
2020-01-03 16:14:15,Linden_Lad,walls2,1,0,"John, the buck stops with your dear friends @SimonHarrisTD and @LeoVaradkar - there the chaps who should answer the questions ....",@SimonHarrisTD @LeoVaradkar,,https://twitter.com/Linden_Lad/status/1213131469117382657
2020-01-03 16:12:05,swimtwobirds,Cathal63594867,1,0,"That was the year they did the big readjustment right? I mean, they had to write a press release to explain what was going on, and if I recall, Paul Krugmam still took the absolute piss in the NYT.",,,https://twitter.com/swimtwobirds/status/1213130920817037313
2020-01-03 16:08:33,blue_pat,LeoVaradkar,0,0,"""Delays aren't good enough"" says Leo. Funding by the State, which it is understood could total €40 million was only formally guaranteed by the Taoiseach, Leo Varadkar, in September following protracted discussions over the terms of contracts.",,,https://twitter.com/blue_pat/status/1213130031469334528
2020-01-03 16:07:03,killicktw,besson_helene,0,0,"The Republic of Ireland and the UK both rely on each other for trade, don't sell out to the corrupt EU. Once you're no longer useful to them, they will toss you aside. The Irish republic and the UK will always trade.",,,https://twitter.com/killicktw/status/1213129654489567232
2020-01-03 16:05:42,FergalBeattie,breakingnewsie,0,0,@LeoVaradkar you still think we need lower taxes? How about funding our public services. €2500 from each pay packet of inflated TD salaries would cover the air ambulance. How about lifting the recruitment embargo in the HSE that has been extended to July?,@LeoVaradkar,,https://twitter.com/FergalBeattie/status/1213129317103886337
2020-01-03 16:05:16,OConnorOisin,CiaranJBreen,0,0,"The maddening thing is the country directors/CEOs of many of these companies have told @LeoVaradkar, @Paschald, @edbrophy &amp; co what kind of infrastructure they want built. It's a fraction of current investment in isolate rural motorways.",@LeoVaradkar @Paschald @edbrophy,,https://twitter.com/OConnorOisin/status/1213129206265241603
2020-01-03 16:03:20,OConnorOisin,obraonain,0,0,Is @LeoVaradkar aware that dozens of MNCs have written to @Shane_RossTD asking him to fund the *existing* plan for a safe cycling network in Dublin? It would cost a fraction of the rural roads projects that the govt have announced in recent months. https://dublin.cyclingworks.org,@LeoVaradkar,,https://twitter.com/OConnorOisin/status/1213128722242527236
2020-01-03 16:02:24,nickyjanek,PhilipN77528183,0,0,I’ll pray for you and hope that you never have to endure the bile and abuse being hurled by the sad old men and women standing outside that hospital.,,,https://twitter.com/nickyjanek/status/1213128483704053761
2020-01-03 15:56:12,Cathal63594867,swimtwobirds,2,0,GDP increased 26.3% in 2015. Does he actually believe the actual economy grew that much?,,,https://twitter.com/Cathal63594867/status/1213126923980824576
2020-01-03 15:53:16,mcconnot2,,0,0,@LeoVaradkar .....patiently pending your comments on the events in Iraq last night. You are very quiet on certain Trump matters. #Iran #US,@LeoVaradkar,#Iran #US,https://twitter.com/mcconnot2/status/1213126187570094080
2020-01-03 15:52:37,myusefulspare,LeoVaradkar,0,0,"Don't trust your own experience about how your life is going. Listen to an expert tell you that you have never had it so good. Now siddown, shaddup and watch some Netflix or something peasant. You wouldn't have spent your money properly anyway, that is why you get the sugar tax.",,,https://twitter.com/myusefulspare/status/1213126023488909314
