date,username,to,replies,retweets,text,mentions,hashtags,permalink
2020-01-03 20:16:35,annkenn71568464,LeoVaradkar,0,0,"i would like to understand, since the 'crash' we have more millionaires in the country than ever before and far more disadvantage than ever. how does your plan free up money to spend on schools, healthcare? i see no logic in your planning at all. I see pain and suffering A LOT",,,https://twitter.com/annkenn71568464/status/1213192454129770496
2020-01-03 20:16:32,MaryDarlington1,DrohanTom,1,0,"Tom you obviously know nothing about health and safety. it is not all about rules it is about creating safe places of work. I am highly trained, degree educated and work at preventing injuries and illnesses at work. I have many happy customers.",,,https://twitter.com/MaryDarlington1/status/1213192441832132608
2020-01-03 20:15:34,SrTz7Yo3O6SqGpq,LeoVaradkar,0,1,There are Lies Damned Lies and then there is Leo Varadkar,,,https://twitter.com/SrTz7Yo3O6SqGpq/status/1213192196989628416
2020-01-03 20:15:21,Reidyp87,LeoVaradkar,1,0,"The people of Portugal went a different way and said No to austerity. Put more money in people's pockets. Tax the big landlords, build more homes. Stop Ireland being a tax haven. Be a leader.",,,https://twitter.com/Reidyp87/status/1213192141452787714
2020-01-03 20:14:55,ladyfey12,MSAEKC,1,0,"I’ve counseled a friend not to have an abortion as it was not right for her/beliefs. Also acted as an escort/support for others. You seem to believe only one ‘answer’ is acceptable for women to have to abortion. That, right there, says it all.",,,https://twitter.com/ladyfey12/status/1213192033168441346
2020-01-03 20:14:42,GenuineCreep,LeoVaradkar,0,0,You want to lock Irish people up for having the wrong opinion. Why would anyone vote for someone who shares the same beliefs on free speech as communist China or nazi Germany?,,,https://twitter.com/GenuineCreep/status/1213191978713845765
2020-01-03 20:14:29,zozimus,AnGobanSaor,0,0,I often play this while I read herself or her minions,,,https://twitter.com/zozimus/status/1213191924590530560
2020-01-03 20:13:44,DawnWarder,LeoVaradkar,0,0,"Whatever you do, don't use corporation tax increases to increase current account spending.",,,https://twitter.com/DawnWarder/status/1213191735884623872
2020-01-03 20:13:23,Carrdonnrboyle,LeoVaradkar,1,0,Remind Irish citizens how much they and successive generations owe for the bank bail out and how long it will take to pay it off.,,,https://twitter.com/Carrdonnrboyle/status/1213191649691607040
2020-01-03 20:12:26,knight_ov,LurganLoyal,0,0,"They are actually allowed parade,they just chose not too out of fear of scumbags I imagine.",,,https://twitter.com/knight_ov/status/1213191409227968512
2020-01-03 20:12:24,mulfran1982,LeoVaradkar,1,2,Take away the Usc charge as you promised Leo.,,,https://twitter.com/mulfran1982/status/1213191401535606785
2020-01-03 20:10:57,POSearcaigh,WhatsHa49898368,1,0,Better than the @fiannafailparty (not that difficult in fairness),@fiannafailparty,,https://twitter.com/POSearcaigh/status/1213191037168050177
2020-01-03 20:10:08,POSearcaigh,GregPower12,1,0,Instead of all these different taxes on earned income... why not simplify into a single income tax with a third band for very high earners?,,,https://twitter.com/POSearcaigh/status/1213190828862181376
2020-01-03 20:10:02,CelticLuton,RENUAIreland,1,0,"Head in the sand, carry on. Nothing to see here.",,,https://twitter.com/CelticLuton/status/1213190803365023750
2020-01-03 20:08:24,Reilly4Alan,LeoVaradkar,0,0,Congratulations Leo and Pascal credit where credit is due.,,,https://twitter.com/Reilly4Alan/status/1213190394797793281
2020-01-03 20:07:13,HartmaaanFunny8,DVATW,0,0,I got a ban for telling you to die. I hope you know what im trying to say David.,,,https://twitter.com/HartmaaanFunny8/status/1213190096293421057
2020-01-03 20:06:57,MSAEKC,ladyfey12,1,0,"You can’t see that it is you who are projecting. You are so desperate to not hear women express any feeling of negativity around abortion, you are creating an atmosphere where they will feel they can’t. If you really have women’s wellbeing at heart, please consider this.",,,https://twitter.com/MSAEKC/status/1213190026798018561
2020-01-03 20:02:51,mackens_packin,LeoVaradkar,0,0,Spend some in rural ireland thanks I'm sick of all my tax being used up in the big smoke....cheers,,,https://twitter.com/mackens_packin/status/1213188998816059396
2020-01-03 20:01:12,oscarbaker76,LeoVaradkar,0,0,Please. Your spending record on #nbp and national children’s hospital show you don’t know how to properly use the money or follow proper scrutinised and auditable processes,,#nbp,https://twitter.com/oscarbaker76/status/1213188581243727874
2020-01-03 19:58:15,crowley_gavin,m0sthard2fathom,1,0,"Probably. It's not tax they owe us for their Irish activities, so it's due to someone else, presumably the US.",,,https://twitter.com/crowley_gavin/status/1213187841364307968
2020-01-03 19:57:00,MadICarMoody,masi_asylum,0,0,This is not safe. This has no dignity. Shane on you; @LeoVaradkar @CharlieFlanagan @DeptJusticeIRL,@LeoVaradkar @CharlieFlanagan @DeptJusticeIRL,,https://twitter.com/MadICarMoody/status/1213187524216184833
2020-01-03 19:56:59,ellentroy5,sndmoore,0,0,"Well done Sinead and all the gang who cleaned up it’s just not acceptable , more recycling bins needed too.",,,https://twitter.com/ellentroy5/status/1213187521292722177
2020-01-03 19:56:24,LiamK1916,LeoVaradkar,0,2,So our national debt is due to go down? Rather than increase every fucking day? This is a lie. Our national debt will continue to rise because our country is run by the central banking system and for their benefit only. The people are simply worker ants for your masters.,,,https://twitter.com/LiamK1916/status/1213187371832946688
2020-01-03 19:56:21,crowley_gavin,BaileAthaCliaD8,0,0,It does eventually get back to the US. Who are we to criticize the US tax system?,,,https://twitter.com/crowley_gavin/status/1213187360718032896
2020-01-03 19:55:38,DefnewsIrl,LeoVaradkar,0,0,"@LeoVaradkar false economy 1.2 million recieved a xmas bonus from dept of social welfare meaning 1.2 million people need state aid to survive 10,000 in hotels, a failing health system and defence force its really all going badly for your party in 2020.",@LeoVaradkar,,https://twitter.com/DefnewsIrl/status/1213187179750580224
2020-01-03 19:53:18,AnnHornigold,cos_niall,1,0,"Humans are still naive enough to seek a Vision,a Dream.When Parties offer the same, or doom and gloom,we vote for the Vision We seek Hope",,,https://twitter.com/AnnHornigold/status/1213186592355033089
2020-01-03 19:52:17,IrelandPatent,LeoVaradkar,0,0,Running a surplus isn’t the same as profit.,,,https://twitter.com/IrelandPatent/status/1213186339761541120
2020-01-03 19:51:25,buzz7775,LeoVaradkar,1,0,"Great news, so time to give it back to the people Taoiseach... no more wasting it On long term commitments to the public service unions... it’s my money, I want it back !",,,https://twitter.com/buzz7775/status/1213186119959007233
2020-01-03 19:51:14,DoomlordVek,LeoVaradkar,0,0,Sign me up for Ireland!,,,https://twitter.com/DoomlordVek/status/1213186073637072897
2020-01-03 19:49:08,Jimmydo53752074,LeoVaradkar,0,0,You can build more homes,,,https://twitter.com/Jimmydo53752074/status/1213185543934222336
2020-01-03 19:48:31,AnnHornigold,cos_niall,0,0,"The EU subsumed only the English.The other 3 Nations, had their identities threatened for Centuries by us ,but protected and elevated them",,,https://twitter.com/AnnHornigold/status/1213185387822231552
2020-01-03 19:47:44,DefenceIreland,LeoVaradkar,1,0,"We have the lowest defence spending in Europe and we have no credible military capability in land, sea, air, or cyber domains. So, exactly what experts do you listen to when it comes to defence and security then? Do not say Ciarán Murphy.",,,https://twitter.com/DefenceIreland/status/1213185193261064194
2020-01-03 19:47:01,SportsFenceJNC,LeoVaradkar,0,0,USC will be on the agenda so I take it,,,https://twitter.com/SportsFenceJNC/status/1213185014239825920
2020-01-03 19:46:26,cos_niall,AnnHornigold,1,0,I think Brexit is an awful mistake peddled by charlatan like Nigel Farage but we won't know for a year or 2. I just can't believe people voted for Bojo after years of austerity.,,,https://twitter.com/cos_niall/status/1213184866734485510
2020-01-03 19:46:15,BaileAthaCliaD8,crowley_gavin,1,0,Which it never is. They use the double Irish so as to avoid tax.,,,https://twitter.com/BaileAthaCliaD8/status/1213184818428686338
2020-01-03 19:45:40,irishmentrod,LeoVaradkar,0,0,We have no surplus We owe 64k per every man woman and child for the bank bailout Stop lying,,,https://twitter.com/irishmentrod/status/1213184671040909314
2020-01-03 19:44:41,Gillespie05,LeoVaradkar,0,0,That because your taxing the life out of us all .,,,https://twitter.com/Gillespie05/status/1213184425711882246
2020-01-03 19:44:15,crowley_gavin,BaileAthaCliaD8,2,0,Because they owe that tax in the USA which doesn't collect it until it's repatriated.,,,https://twitter.com/crowley_gavin/status/1213184315686821889
2020-01-03 19:43:51,irishmentrod,Knockadoo,0,0,Suggest you stop importing Masses of men from African and islamic countries If you want to protect Irish women from serious assaults. You won't,,,https://twitter.com/irishmentrod/status/1213184217095573505
2020-01-03 19:42:45,TW87,LeoVaradkar,1,1,Does this mean an abolishment of USC will be part of your manifesto?,,,https://twitter.com/TW87/status/1213183937490628608
2020-01-03 19:40:59,SrTz7Yo3O6SqGpq,ComhraDublin,1,1,It's what (((Fine Gael Masons))) always do. Bankrupt Garrett Fitzgerald (bailed out by Sutherland) doubled the National Debt debt from 11 Billion to 22 Billion during his 15 months in government in the early 1980's . The freestate was set up by Masons and Banksters !,,,https://twitter.com/SrTz7Yo3O6SqGpq/status/1213183493313830918
2020-01-03 19:40:30,theamberdaisy,masi_asylum,0,2,Unacceptable. We do not herd people like cattle or baggage.... Or do we..? @LeoVaradkar @MichealMartinTD @PresidentIRL,@LeoVaradkar @MichealMartinTD @PresidentIRL,,https://twitter.com/theamberdaisy/status/1213183373964988416
2020-01-03 19:39:35,Harkio,,0,0,@LeoVaradkar can you mention something about the american murder and attack against another nation in peace time ? Can we perhaps act against such behaviour? Irregardless of our relationship with the US this action should not go without some ramifications.,@LeoVaradkar,,https://twitter.com/Harkio/status/1213183143236317185
2020-01-03 19:39:32,TheConstantKnit,masi_asylum,0,1,Who is getting paid for this room with no windows housing 10 asylum seekers? @LeoVaradkar @MurphyEoghan @CharlieFlanagan,@LeoVaradkar @MurphyEoghan @CharlieFlanagan,,https://twitter.com/TheConstantKnit/status/1213183128438812678
2020-01-03 19:37:40,mickobrien0,eoghanol,1,0,Free money for developers over €50M yet we have 70plus on trollies in cork hospitals today @LeoVaradkar @SimonHarrisTD @simoncoveney shameful,@LeoVaradkar @SimonHarrisTD @simoncoveney,,https://twitter.com/mickobrien0/status/1213182659834372098
2020-01-03 19:35:02,ruthactyahooie1,masi_asylum,0,3,@LeoVaradkar @CharlieFlanagan What are you going to do about this?? #asylumseekers #directprovision,@LeoVaradkar @CharlieFlanagan,#asylumseekers #directprovision,https://twitter.com/ruthactyahooie1/status/1213181996375126017
2020-01-03 19:33:33,ComhraDublin,LeoVaradkar,0,1,@LeoVaradkar is increasing the national debt by €116 Billion to fund project #Ireland2040. Each year Leo will avoid spending €1bn of what he borrows so he can talk up a *budget surplus*.,@LeoVaradkar,#Ireland2040,https://twitter.com/ComhraDublin/status/1213181625028272128
2020-01-03 19:33:06,niallthomas,,0,0,Now might be a really really good time to review the landing permissions of any future US military flights in Shannon airport lads.... @simoncoveney @LeoVaradkar,@simoncoveney @LeoVaradkar,,https://twitter.com/niallthomas/status/1213181511685591040
2020-01-03 19:33:06,ComhraDublin,LeoVaradkar,2,6,.@LeoVaradkar is increasing the national debt by €116 Billion to fund project #Ireland2040. Each year he will avoid spending €1bn of what he borrows so he can talk up a *budget surplus*.,@LeoVaradkar,#Ireland2040,https://twitter.com/ComhraDublin/status/1213181509982720005
2020-01-03 19:32:19,finners_99,LeoVaradkar,0,0,"That's great, but Dublin needs world class infrastructure, the city is a logjam of traffic. And the country needs a strategic solution for housing. Its great to run a surplus but running a small deficit wouldn't hurt either!",,,https://twitter.com/finners_99/status/1213181314708447233
2020-01-03 19:32:06,AnnHornigold,AnnHornigold,0,0,Policies of previous Govts. Labour said ' There is no money left' and there wasn't. Cameron austerity was a major overreaction.,,,https://twitter.com/AnnHornigold/status/1213181256571269123
2020-01-03 19:30:48,Knockadoo,LeoVaradkar,1,2,Can we invest some of that in the prevention of violence against women? @SAFEIreland can work with you on prevention strategies. #vaw #makeirelandsafe #safehomessafecommunities,@SAFEIreland,#vaw #makeirelandsafe #safehomessafecommunities,https://twitter.com/Knockadoo/status/1213180932884180996
2020-01-03 19:28:43,AnnHornigold,cos_niall,2,0,"We obviously differ in our opinions of Brexit, but Austerity was caused ,USA and Global Banking problems apart, by Political reaction to the",,,https://twitter.com/AnnHornigold/status/1213180407291748352
2020-01-03 19:28:09,MiciG1991,LeoVaradkar,0,0,Can i have a slice of that cake Leo?,,,https://twitter.com/MiciG1991/status/1213180265507491841
2020-01-03 19:26:33,Gallow_Glass,AlanFox_,1,0,"""assigned"" lol. We've got a genius over here.",,,https://twitter.com/Gallow_Glass/status/1213179860350382080
2020-01-03 19:25:57,GoodmanjJames,LeoVaradkar,0,0,do Apple not owe us a few quid no?,,,https://twitter.com/GoodmanjJames/status/1213179709451853825
2020-01-03 19:24:59,Davida04102023,LeoVaradkar,2,0,What about the national debt,,,https://twitter.com/Davida04102023/status/1213179468275179523
2020-01-03 19:23:37,foxyslattery,RoryHearne,0,0,Homelessness is a political choice. By politicians..not the homeless @LeoVaradkar @FineGael @MurphyEoghan #vultures,@LeoVaradkar @FineGael @MurphyEoghan,#vultures,https://twitter.com/foxyslattery/status/1213179123897643011
2020-01-03 19:23:36,darraghobroin,LeoVaradkar,0,0,Homeless people are increasing while you house foreign people with no connection to Ireland. You are a traitor to suffering Irish people in need. Anyone who votes for your party is voting for traitorous governance which will destroy the lives & futures of Irish people. Shame on U,,,https://twitter.com/darraghobroin/status/1213179121414656000
2020-01-03 19:21:16,darraghobroin,LeoVaradkar,1,0,You are the worst Taoiseach Ireland has ever had to suffer. Young people better wake up. They will be paying high rent for life w/o ever getting to own their own home. Renting crap accommodation & sharing with strangers is no quality of life. You are ruining lives & futures.,,,https://twitter.com/darraghobroin/status/1213178532358213634
2020-01-03 19:20:02,cos_niall,AnnHornigold,1,0,There was no mention of the EU until austerity began to take its toll which had nothing to do with the EU. We're all a bit poorer for Brexit and I don't mean financially,,,https://twitter.com/cos_niall/status/1213178220968841222
2020-01-03 19:19:36,karenmeerkatmam,LeoVaradkar,0,0,"Yet you still do nothing about it special needs children...you sit in your ivory tower while I’m here struggling with my 13 yr old non verbal son who attends a special needs school that aren’t able to handle him, he gets 6 nights a month respite...because that’s all they can give",,,https://twitter.com/karenmeerkatmam/status/1213178110914498562
2020-01-03 19:18:56,LoaGong,sue_pfh,1,0,Karma. She always wins.,,,https://twitter.com/LoaGong/status/1213177947059822592
2020-01-03 19:14:53,Irishmaninrome,LeoVaradkar,1,0,Yeah the minister for children did a great job not spending her money and kids on the street or in hotels/hostels. Well done,,,https://twitter.com/Irishmaninrome/status/1213176926082351104
2020-01-03 19:11:49,DDerwoo,DVATW,0,0,So will the Ira be bombing Africa then?,,,https://twitter.com/DDerwoo/status/1213176155664273414
2020-01-03 19:10:18,AlanOmahoney,LeoVaradkar,1,0,Do you foresee a time with no national debt? Or does international finance mean you must carry national debt,,,https://twitter.com/AlanOmahoney/status/1213175772250329090
2020-01-03 19:09:10,cos_niall,AnnHornigold,0,0,It's going to be an interesting year while the trade agreement negotiations are going on.,,,https://twitter.com/cos_niall/status/1213175488543371267
2020-01-03 19:09:09,sheathcote972,DVATW,0,0,What does Ireland think about that for surely the good people must have all been consulted?,,,https://twitter.com/sheathcote972/status/1213175483489308678
2020-01-03 19:08:28,AnnHornigold,cos_niall,1,0,controlled the rate of new Immigration between EU Members .We didn't.This bred resentment. We asked the Govt.They said 'blame the EU. We did,,,https://twitter.com/AnnHornigold/status/1213175311925481475
2020-01-03 19:07:20,LythamLiving,DVATW,0,1,The UK could send him ma million of ours!,,,https://twitter.com/LythamLiving/status/1213175023931969541
2020-01-03 19:07:14,macgabhann31,sndmoore,0,0,Its great to see volunteers out doing the work of the council (Someone has to)... good of them to provide the bags. Yep... just perfect. Tea anyone. @joanburton @LeoVaradkar @RuthCoppingerTD @Fingalcoco @jackfchambers @sndmoore,@joanburton @LeoVaradkar @RuthCoppingerTD @Fingalcoco @jackfchambers @sndmoore,,https://twitter.com/macgabhann31/status/1213174998602522624
2020-01-03 19:07:09,waltlacey7,LeoVaradkar,1,1,And you denied our Senior Citizens a rise in the budget.,,,https://twitter.com/waltlacey7/status/1213174980160167936
2020-01-03 19:06:36,BillEbrill,RENUAIreland,0,0,You add nothing to any political debate.,,,https://twitter.com/BillEbrill/status/1213174842729652229
2020-01-03 19:05:42,mrmojorising76,LeoVaradkar,0,0,Well then get the lead out of ur ass n build something like affordable housing to alleviate the #homelessness in #Ireland,,#homelessness #Ireland,https://twitter.com/mrmojorising76/status/1213174614941151233
2020-01-03 19:05:06,Palari_Palari,AnGobanSaor,0,0,She's obviously going to suspend the Dáil.. Arrest Michel D. Install herself as Supreme Leader with Darby o'Gill as Minister for Haw-Haw. Looney,,,https://twitter.com/Palari_Palari/status/1213174464868954112
2020-01-03 19:04:47,AnnHornigold,cos_niall,1,0,"Our Parliament was always Sovereign but when we questioned they said ' can't do anything, blame the EU"" and we did. Other EU Countries",,,https://twitter.com/AnnHornigold/status/1213174383902175236
2020-01-03 19:03:14,gormmo,LeoVaradkar,0,1,A really good time to start investing in social housing builds then !!,,,https://twitter.com/gormmo/status/1213173992330317825
2020-01-03 19:02:57,AFarragher,IGS_95,0,1,"The #IGB might as well be categorised as Ireland's full time professional liars! There is no traceability, transparency or welfare. None! @MichaelCreedTD @LeoVaradkar @ADoyleTD @Shane_RossTD @conor_w_ryan @irishexaminer @Galwaybayfmnews @visit_galway @claregalwayinfo @galway2020",@MichaelCreedTD @LeoVaradkar @ADoyleTD @conor_w_ryan @irishexaminer @Galwaybayfmnews @visit_galway @claregalwayinfo @galway2020,#IGB,https://twitter.com/AFarragher/status/1213173922516090881
2020-01-03 19:02:36,daithilama,timewaits4nobod,0,0,@LeoVaradkar you AND your puppet show @rtenews are VERY quiet on all this..ANY Comment our dear leader?,@LeoVaradkar @rtenews,,https://twitter.com/daithilama/status/1213173836121804801
2020-01-03 19:02:03,AnnHornigold,cos_niall,0,0,"I agree. Each time we questioned, we were told' leave it to those who know', and we did. We BELIEVED in our Govts of both colours.",,,https://twitter.com/AnnHornigold/status/1213173695855943680
2020-01-03 19:00:40,Andrewm19444646,RENUAIreland,1,0,I suppose your electoral support sums up the validity of your stance.,,,https://twitter.com/Andrewm19444646/status/1213173348060082176
2020-01-03 18:59:47,sndmoore,,2,2,On December the 14th members of the cleaning group cleaned much of this park. Imagine how disheartening it is to see the park in such a state 2 weeks later!,,,https://twitter.com/sndmoore/status/1213173126768549891
2020-01-03 18:59:16,CA_Gerrard71,AllPassingThing,1,5,"Timeline is like an Irish Bridget Jones on steroids. Tues: wine 7, cigs 35. Was accosted by prolifer on way to hospital to miscarry.",,,https://twitter.com/CA_Gerrard71/status/1213172996447391745
2020-01-03 18:59:11,GottaRighttobe1,robinhowells,1,0,"Whatever about the 3rd world, we owe intelligence challenged septics nothing",,,https://twitter.com/GottaRighttobe1/status/1213172973697409024
2020-01-03 18:57:12,GottaRighttobe1,Julian57110360,2,0,Can anybody translate this please. Is it as retarded as I suspect?,,,https://twitter.com/GottaRighttobe1/status/1213172473996427266
2020-01-03 18:56:54,nickyjanek,PhilipN77528183,0,0,🤣🤣🤣. Of course you did. You are just the type to judge others. I’m still praying for you though. 🤣🤣,,,https://twitter.com/nickyjanek/status/1213172400180858880
2020-01-03 18:55:37,Sarklor,LeoVaradkar,0,1,"Oh good, use it to build social housing you Lidl discount Thatcherite",,,https://twitter.com/Sarklor/status/1213172078440001536
2020-01-03 18:55:28,maryhodgins9,LeoVaradkar,0,0,Excellent news - more resources please for the cornerstone of our economy #health &amp; #education 😊,,#health #education,https://twitter.com/maryhodgins9/status/1213172039009353728
2020-01-03 18:55:27,macgabhann31,,0,0,"Nothing was said to them by the relevant bodies for 8 years, then 2 years of reminders (Post reminder). Naturally you can bet they are not registered with revenue. Why would they do that? @joanburton @LeoVaradkar @RuthCoppingerTD @Fingalcoco @jackfchambers @RTBinfo @sndmoore",@joanburton @LeoVaradkar @RuthCoppingerTD @Fingalcoco @jackfchambers @RTBinfo @sndmoore,,https://twitter.com/macgabhann31/status/1213172035653947392
2020-01-03 18:54:29,AlanFox_,RENUAIreland,2,0,Gtfo with this racist crap. Renua not even trying to hide it anymore it seems. Looking forward to your funding running out and bank balance going to nil so ye can be assigned to history where ye belong.,,,https://twitter.com/AlanFox_/status/1213171791012732929
2020-01-03 18:52:53,macgabhann31,,1,0,All they keep telling me is the landlords are being reminded to register. One of them have tennants 10 years plus. They really arent going to care what the RTB have to say considering @joanburton @LeoVaradkar @RuthCoppingerTD @Fingalcoco @jackfchambers @RTBinfo @sndmoore,@joanburton @LeoVaradkar @RuthCoppingerTD @Fingalcoco @jackfchambers @RTBinfo @sndmoore,,https://twitter.com/macgabhann31/status/1213171388405731328
2020-01-03 18:51:47,Maebhcon,LeoVaradkar,0,0,How much better would that be if the government had chosen to prioritise the construction of social housing instead of throwing money at landlords through HAP?,,,https://twitter.com/Maebhcon/status/1213171111761977345
2020-01-03 18:51:08,LimerickViking,,0,0,"@CharlieFlanagan @LeoVaradkar Please consider a straightforward solution to the issues with the Fines Act. Create an enforcement agency responsible for enforcing all types of payments in the country to be used by private individuals, companies, government agencies etc.",@CharlieFlanagan @LeoVaradkar,,https://twitter.com/LimerickViking/status/1213170949991862272
2020-01-03 18:50:49,cos_niall,AnnHornigold,3,0,Your problem was Westminster and people will soon realise leaving the EU won't change the problems that are there,,,https://twitter.com/cos_niall/status/1213170870719590400
2020-01-03 18:49:46,erinstephanie84,LeoVaradkar,3,0,"The amount we pay in tax I am not surprised there is a surplus. How about giving us tax payers a bit of a break,",,,https://twitter.com/erinstephanie84/status/1213170605245239302
2020-01-03 18:49:44,macgabhann31,,1,0,@joanburton @LeoVaradkar @RuthCoppingerTD @Fingalcoco @jackfchambers There are dozens of un-registered landlords with tenants in the area. Been onto the #RTB about it but 2 years on and dozens of complaints nothing has been done. Who else will deal wit this! @RTBinfo @sndmoore,@joanburton @LeoVaradkar @RuthCoppingerTD @Fingalcoco @jackfchambers @RTBinfo @sndmoore,#RTB,https://twitter.com/macgabhann31/status/1213170596613361664
2020-01-03 18:49:40,cos_niall,AnnHornigold,1,0,The EU hardly subsumed the UK although the Welsh and Scots might feel that about England,,,https://twitter.com/cos_niall/status/1213170579454464008
2020-01-03 18:49:23,AnnHornigold,cos_niall,1,0,"Ireland , all ruled by England. I want FREEDOM from EU rule as much as many want freedom from Westminster. Hence the OUT vote",,,https://twitter.com/AnnHornigold/status/1213170510319763456
2020-01-03 18:48:38,gillianegolden,AddictionsPMC,0,2,I could've sworn the calendar says 2020 today and not 2012? A great thing @LeoVaradkar did for smoking cessation in Ireland was to make the distinction between smoking and #vaping bans when he did. Ireland now needs similar policy guidance to this : https://www.gov.uk/government/publications/use-of-e-cigarettes-in-public-places-and-workplaces,@LeoVaradkar,#vaping,https://twitter.com/gillianegolden/status/1213170319483125760
2020-01-03 18:48:04,ClareWithTheHai,LeoVaradkar,0,0,"Yet hospital wait times are rising , homeless is out of control , every day we hear of another person taken their life. Sorry but are you really trying to give yourself a patt on the babk here?!",,,https://twitter.com/ClareWithTheHai/status/1213170175220047874
