date,username,to,replies,retweets,text,mentions,hashtags,permalink
2020-01-03 23:59:55,ChrisDonnelly12,LeoVaradkar,1,0,Time for a United Ireland,,,https://twitter.com/ChrisDonnelly12/status/1213248658507845633
2020-01-03 23:57:36,2dream2day,LeoVaradkar,0,0,Glad you're happy😥.. But most paye workers are sick to their teeth of all the friggin taxes 😡,,,https://twitter.com/2dream2day/status/1213248072844791808
2020-01-03 23:57:16,MSAEKC,ladyfey12,1,0,"That is great that she could express it to you, because so many feel they can’t. Like they’re letting the sisterhood down somehow.",,,https://twitter.com/MSAEKC/status/1213247990833590273
2020-01-03 23:52:08,Bosheaswivel,JackZZDuffy,0,0,That's a bot lads,,,https://twitter.com/Bosheaswivel/status/1213246700028071942
2020-01-03 23:51:11,JackZZDuffy,Bosheaswivel,1,0,You lads are the greatest bunch of nonces on Twitter. Pack it in.,,,https://twitter.com/JackZZDuffy/status/1213246457668603907
2020-01-03 23:50:07,Bosheaswivel,AdIriseoir,1,0,"Statistics I have no issue with, I'm actually a big fan of stats as you'd well know but methodology and definitional accuracy matter. I prefer statistics that represent reality rather than statistics that operate to spin political narratives.",,,https://twitter.com/Bosheaswivel/status/1213246189489049602
2020-01-03 23:46:48,PaschalBergin,SportStrategyIE,0,0,"1,000’s of full time jobs in a League in this country is fairytale fiction.",,,https://twitter.com/PaschalBergin/status/1213245356852613121
2020-01-03 23:46:38,zoballz87,,0,0,@LeoVaradkar SOOO LEO ARE TOU GOING TALKING ABOUT THE ANTI SOCAIL BEHAVIOUR OR THE NOROVIRIOUS &amp; FLU ACADEMIC???? YOU FUCKED YOU CUNT??? #France #Riot #Freesrate,@LeoVaradkar,#France #Riot #Freesrate,https://twitter.com/zoballz87/status/1213245313701629956
2020-01-03 23:45:15,wellboy,p_g_n,1,0,Ireland keeps voting for the same.,,,https://twitter.com/wellboy/status/1213244965461143552
2020-01-03 23:44:51,theirondad,LeoVaradkar,0,0,"0.4% of GDP , or , as i like to call it - 777 printers.",,,https://twitter.com/theirondad/status/1213244863640158209
2020-01-03 23:43:49,tomholohan,LeoVaradkar,1,0,Abolish USC so.....,,,https://twitter.com/tomholohan/status/1213244605610770434
2020-01-03 23:43:47,RobFitzgerald5,Dermopj,1,0,ECB have said they won't raise for next two years. They'll end QE first then do in small quarter point and half point increases. Very slowly. All of this is mapped out,,,https://twitter.com/RobFitzgerald5/status/1213244595468939273
2020-01-03 23:43:22,OlwynG,joellegergis,0,0,"What's happening in Australia is terrifying and only the beginning of what's to come, we need action now. @LeoVaradkar what are you planning for Ireland's 2020 climate action? #crisis #ClimateEmegency #Ireland",@LeoVaradkar,#crisis #ClimateEmegency #Ireland,https://twitter.com/OlwynG/status/1213244491517366279
2020-01-03 23:43:02,annedonlon22,LeoVaradkar,0,0,"Have you no idea how tone deaf you are to the concerns of the people, my God it's shocking. Open your eyes and ears. Critical services such as health and homes are a shambles. Wake up.",,,https://twitter.com/annedonlon22/status/1213244406767202304
2020-01-03 23:41:28,theHumongou5,LeoVaradkar,0,0,No need for the introduction of a Carbon Tax then,,,https://twitter.com/theHumongou5/status/1213244015736508417
2020-01-03 23:41:04,AdIriseoir,andrewmcgill3,1,0,"“Lies, damned lies and statistics” The issue is your statistics are often artificially enhanced and behind what targets should be or were. Not enough housing being built, not enough areas rejuvenated and FDI doesn’t impact most citizens usefully",,,https://twitter.com/AdIriseoir/status/1213243913957453824
2020-01-03 23:36:53,Dermopj,RobFitzgerald5,1,0,Not in Europe there not .Plus banks are loaded with gov debt as reserves that does not bode well if to be bond rate start moving up.,,,https://twitter.com/Dermopj/status/1213242861870821378
2020-01-03 23:34:26,RobFitzgerald5,Dermopj,1,0,There is an increase. Deflation has been averted. Dunno what to tell ya Dermot. Things are in decent shape compared to ten years ago. If there is another global we are fecked like everyone else. Otherwise...,,,https://twitter.com/RobFitzgerald5/status/1213242244683186176
2020-01-03 23:33:43,Bosheaswivel,AdIriseoir,1,0,"The 3 metrics chosen give a fairly hollow indication of 'quality of life', you might say. Nice to see you are spending your early career hiding behind empty statistics though Andrew, you'll make a great housing minister someday.",,,https://twitter.com/Bosheaswivel/status/1213242064101683200
2020-01-03 23:33:16,ritchie97854981,LeoVaradkar,0,0,Tax cuts or investment in what is still an underdeveloped country,,,https://twitter.com/ritchie97854981/status/1213241950586978305
2020-01-03 23:30:58,gerood,LeoVaradkar,0,0,Not needed far more important ways to spend this money @LeoVaradkar @simoncoveney @MichealMartinTD,@LeoVaradkar @simoncoveney @MichealMartinTD,,https://twitter.com/gerood/status/1213241370405675008
2020-01-03 23:28:40,barryjmalone,LeoVaradkar,0,1,"When I see no cath lab, no university, no morgue, no city expansion for #Waterford I ask what is your vision for the #SouthEast",,#Waterford #SouthEast,https://twitter.com/barryjmalone/status/1213240790593523713
2020-01-03 23:26:05,ewoodphoto,mary53175953,0,0,To who did we sell out to?,,,https://twitter.com/ewoodphoto/status/1213240141407510529
2020-01-03 23:25:53,Dermopj,RobFitzgerald5,1,0,"Ya and what , they keep buying debt seeing as they are buying north of it. They have printed billions and no increase so now what .",,,https://twitter.com/Dermopj/status/1213240093554696194
2020-01-03 23:24:50,shannonwatch,GearoidODU,1,8,The Irish government waive the fees of US military planes passing through Ireland or Irish airspace. See https://www.irishtimes.com/news/military-overflights-cost-taxpayers-3-7-million-1.1312403 #USMilitaryOutOfShannon,,#USMilitaryOutOfShannon,https://twitter.com/shannonwatch/status/1213239827405123584
2020-01-03 23:24:27,PaulOBrienKil,LeoVaradkar,0,2,For a fraction of what ye are spending on a concert hall in Cork you could provide @247Cathlab for half a million people in the South-East. Who's getting the kick-backs on this I wonder?,@247Cathlab,,https://twitter.com/PaulOBrienKil/status/1213239729266855936
2020-01-03 23:23:45,RobFitzgerald5,Dermopj,1,0,ECB says they will do 'whatever it takes' to get 2% inflation and the market believes them,,,https://twitter.com/RobFitzgerald5/status/1213239556759334912
2020-01-03 23:23:15,Dermopj,RobFitzgerald5,0,0,"Oh they didn't explode back in what they call the great recession Greece, Ireland , Portugal?",,,https://twitter.com/Dermopj/status/1213239427457277953
2020-01-03 23:22:01,JRD0000,cos_niall,0,0,Exactly. We just need to wait a few hundred years for it to sort itself out. Some people are so impatient.,,,https://twitter.com/JRD0000/status/1213239120723677186
2020-01-03 23:21:25,Dermopj,RobFitzgerald5,1,0,Not when you get deflation,,,https://twitter.com/Dermopj/status/1213238969862897665
2020-01-03 23:20:44,karenmcinerney7,LeoVaradkar,0,0,Any comments on the rescue helicopter in cork being grounded if it doesn’t get more funding ? Just wondering,,,https://twitter.com/karenmcinerney7/status/1213238795316944902
2020-01-03 23:19:48,FiWlsh,98FM,0,0,@LeoVaradkar how many more will it take? ,@LeoVaradkar,,https://twitter.com/FiWlsh/status/1213238560414928897
2020-01-03 23:19:03,p_g_n,wellboy,1,0,"Don't blame Ireland, it's just him and his mates who hate Ireland. Who is he anyway? Never heard of Varadkar, Harris, Zappone, Murphy and the other clowns till they seized power in a coup, not even on their own merit. Puppets and TRAITORS! Tick tock...",,,https://twitter.com/p_g_n/status/1213238373915283456
2020-01-03 23:17:48,marmail,DVATW,0,0,Is that considered black Irish,,,https://twitter.com/marmail/status/1213238056569851904
2020-01-03 23:17:13,Mary_Morris1,,0,0,@jeremycorbyn Would you mind having a quiet word with @LeoVaradkar &amp; tell him we Irish refuse to be dragged into americas wars...again! Stop refuelling at #ShannonAirport #USMilitaryOutofShannon #NoWarInIran,@jeremycorbyn @LeoVaradkar,#ShannonAirport #USMilitaryOutofShannon #NoWarInIran,https://twitter.com/Mary_Morris1/status/1213237912248242178
2020-01-03 23:17:04,AdIriseoir,andrewmcgill3,0,0,"Not to mention, that’s a UN report. The same body that allows this",,,https://twitter.com/AdIriseoir/status/1213237874516201472
2020-01-03 23:15:53,RobFitzgerald5,Dermopj,2,0,No country pays off its debt. You just keep making payments. Inflation eats some of the debt. We are in the €. Rates won't explode,,,https://twitter.com/RobFitzgerald5/status/1213237574682251264
2020-01-03 23:15:53,Gomurphy3,DaithiLach,1,0,Oh sorry the world is not a better place without him...weirdo....,,,https://twitter.com/Gomurphy3/status/1213237573709111296
2020-01-03 23:13:58,AdIriseoir,andrewmcgill3,1,0,"That’s great, for the few who can afford it. Sadly it’s not trickling down to the thousands of homeless though.",,,https://twitter.com/AdIriseoir/status/1213237093364850692
2020-01-03 23:13:34,112Rusc,ianbell89,0,0,No they haven't. And this is a pack of lies for an anti-Irish bastard.,,,https://twitter.com/112Rusc/status/1213236990881214466
2020-01-03 23:11:06,Dermopj,RobFitzgerald5,1,0,"So they never pay it off until the debt explodes and rates go nuts , then the big default .",,,https://twitter.com/Dermopj/status/1213236371491561473
2020-01-03 23:06:32,RobFitzgerald5,Dermopj,1,0,Most of it is rollover. https://www.ntma.ie/ for more details,,,https://twitter.com/RobFitzgerald5/status/1213235220650057728
2020-01-03 23:05:43,JackieMeath,CareChampions1,0,1,@LeoVaradkar @SimonHarrisTD No child should have to wait 3 years for a specialist appointment. #CareCantWait,@LeoVaradkar @SimonHarrisTD,#CareCantWait,https://twitter.com/JackieMeath/status/1213235016764993536
2020-01-03 23:04:19,DOD_Ireland,shannonwatch,0,0,"It is not a question of whether we know, but whether we care. SPOILER ALERT: We don't care.",,,https://twitter.com/DOD_Ireland/status/1213234665252904960
2020-01-03 23:02:08,ellecyoulater,dli_an,1,0,"Ignore that “Patriot” person. They are a troll, and an ignorant one at that. Don’t let them feed you their lies love; they strive for and thrive on attention.",,,https://twitter.com/ellecyoulater/status/1213234114498891776
2020-01-03 23:01:23,LeoMcLaughlin13,LeoMcLaughlin13,0,0,Build homes for the Irish people that don’t have homes,,,https://twitter.com/LeoMcLaughlin13/status/1213233924526223360
2020-01-03 23:01:15,shannonwatch,,1,0,@simoncoveney @LeoVaradkar @dfatirl Do you know if the drone that could start a world war by assassinating #QassemSuleimani passed through Shannon? You don't inspect the US military planes. You appear not to know what is on board any of them.,@simoncoveney @LeoVaradkar @dfatirl,#QassemSuleimani,https://twitter.com/shannonwatch/status/1213233891168980992
2020-01-03 23:00:22,Mary_Morris1,,0,0,@campaign4kehoe @LeoVaradkar Are you going to allow MORE US military through #ShannonAirport now that #trump has declared war on #Iran? #NotInMyname #USMilitaryOutOfShannon,@campaign4kehoe @LeoVaradkar,#ShannonAirport #trump #Iran #NotInMyname #USMilitaryOutOfShannon,https://twitter.com/Mary_Morris1/status/1213233669080567808
2020-01-03 22:58:29,Dermopj,RobFitzgerald5,1,0,How many are rollovers and how many are new ?,,,https://twitter.com/Dermopj/status/1213233195946254341
2020-01-03 22:58:20,BennyN88,,0,0,Get lost,,,https://twitter.com/BennyN88/status/1213233160579944451
2020-01-03 22:58:20,Shakesp42633766,chezmik,0,0,100% correct,,,https://twitter.com/Shakesp42633766/status/1213233159304876035
2020-01-03 22:58:17,KeithEvans1970,DaveDalyFM,0,0,PAYE also Dave Businesses are nothing without hard working owners and employees,,,https://twitter.com/KeithEvans1970/status/1213233145186795520
2020-01-03 22:58:10,BrianAprilia,,0,0,@LeoVaradkar it's time to flatten Athy.,@LeoVaradkar,,https://twitter.com/BrianAprilia/status/1213233117189885953
2020-01-03 22:57:40,Dermopj,DavidAhernia,0,0,Ah sure anything is worth trying,,,https://twitter.com/Dermopj/status/1213232990744174592
2020-01-03 22:57:01,DaithiLach,Gomurphy3,1,0,Oh please shut up you GOWL,,,https://twitter.com/DaithiLach/status/1213232828722405379
2020-01-03 22:55:03,alxwlsdn,CollieMcLovin,0,0,This is Ireland. @LeoVaradkar @FineGael @fiannafailparty @gardainfo,@LeoVaradkar @FineGael @fiannafailparty @gardainfo,,https://twitter.com/alxwlsdn/status/1213232332917870592
2020-01-03 22:53:39,TheEarl2020,DVATW,0,0,Try driving into Gort. There’s no Irish left.,,,https://twitter.com/TheEarl2020/status/1213231978201399296
2020-01-03 22:53:21,lorcafan,chezmik,0,0,"BAM, BAM, Damn - thanks pixies! Keep the recovery going!",,,https://twitter.com/lorcafan/status/1213231905883205633
2020-01-03 22:53:18,AdIriseoir,andrewmcgill3,1,0,Capable leaders? Come off it. https://www.google.ca/amp/s/www.irishtimes.com/opinion/our-housing-system-is-broken-we-need-to-start-again-1.4125426%3fmode=amp https://www.google.ca/amp/s/www.joe.ie/amp/news/homelessness-figures-ireland-690075,,,https://twitter.com/AdIriseoir/status/1213231891622637569
2020-01-03 22:50:18,MiaRogue2,TheHillBilly,1,0,"You are right, I do have decency. I value another person's right to life. If you find people praying silently intimidating and unchristian then you most likely are the one who needs the prayers the most.",,,https://twitter.com/MiaRogue2/status/1213231136316559360
2020-01-03 22:48:39,FintanRyan11,IrishWater,0,0,https://youtu.be/NfBKW4_-KwE Watch this Story Incase you missed it. She can tell you a lot more @LeoVaradkar wise up.,@LeoVaradkar,,https://twitter.com/FintanRyan11/status/1213230722560999425
2020-01-03 22:45:35,Right2changeMW,LeoVaradkar,0,3,This is a lie as we know as a nation we are still servicing a legacy bank debt,,,https://twitter.com/Right2changeMW/status/1213229951396306950
2020-01-03 22:43:27,dpento01,LeoVaradkar,0,0,Already trying to butter the Irish people up for the cave in & sell out on corporation tax & sacrificing our tax sovereignty.,,,https://twitter.com/dpento01/status/1213229411836813320
2020-01-03 22:42:24,marie_laffey,LeoVaradkar,0,0,Perhaps you can increase spending on services for children with disabilities and learning needs. Current provision a joke.,,,https://twitter.com/marie_laffey/status/1213229147335614465
2020-01-03 22:41:50,knockcrock,Softwindroses,0,0,"How many dead babies and abortion killings, are this sick bunch of pro aborts responsible for? Maybe count the aborted dead on your watch, Dr Higgins?",,,https://twitter.com/knockcrock/status/1213229006998396931
2020-01-03 22:41:21,PaulMag54737386,LeoVaradkar,1,0,"Google paid no tax on €40 billion, the banks who had a big hand in the bust of 2008 won't pay tax for 20 years on profits of about 2 billion per year, give normal hardworking people a chance for once, tax the above companies and leave the normal workers alone.",,,https://twitter.com/PaulMag54737386/status/1213228884105281536
2020-01-03 22:40:46,Happywife151,mairenihuigin,0,0,Don't act like you care about women having miscarriages here. Those same women are looking at those pregnant women walking into an abortion clinic to kill their babies after desperately hoping to save theirs in absolute horror and contempt. This is about post abortive women.,,,https://twitter.com/Happywife151/status/1213228738047102981
2020-01-03 22:39:47,Mccoydonna29,LeoVaradkar,0,0,And still there are homeless people on the streets of Ireland,,,https://twitter.com/Mccoydonna29/status/1213228489899425792
2020-01-03 22:39:02,LeoMcLaughlin13,LeoVaradkar,1,0,Bail out the fai,,,https://twitter.com/LeoMcLaughlin13/status/1213228300056834050
2020-01-03 22:38:25,WvHHoward,,1,10,"A birth certificate issued in the #USA with both Irish dad’s names on it... It’s 2020, why are we still discriminating against #LGBTQ #Families? It’s obviously a complex piece of legislation, but come on we’ve been waiting since 2015. @SimonHarrisTD @LeoVaradkar @KZapponeTD",@SimonHarrisTD @LeoVaradkar @KZapponeTD,#USA #LGBTQ #Families,https://twitter.com/WvHHoward/status/1213228146251702274
2020-01-03 22:37:20,OReillyPaul,LeoVaradkar,0,0,We me we me we me we me bla bla bla,,,https://twitter.com/OReillyPaul/status/1213227873974325253
2020-01-03 22:37:03,DrohanTom,MaryDarlington1,0,0,"You don’t need a degree to know it has far surpassed creating safe work spaces and become union driven money wasting work to rule red tape. I have no doubt you have many happy clients, your ability was never called into doubt, just your ironic dig at a former party colleague.",,,https://twitter.com/DrohanTom/status/1213227801039515649
2020-01-03 22:35:55,ladyfey12,MSAEKC,1,0,"One, yes. She was okay saying it too...",,,https://twitter.com/ladyfey12/status/1213227519463346176
2020-01-03 22:34:27,James_pleddin,TwinkTwinkleie,0,0,"What neutrality, we supply troops for the EU, why not keep the states on side",,,https://twitter.com/James_pleddin/status/1213227149391532033
2020-01-03 22:30:38,DavidAhernia,PhilONe00893148,1,0,And your point is?,,,https://twitter.com/DavidAhernia/status/1213226189386633217
2020-01-03 22:30:26,gunker1,LeoVaradkar,0,0,"Next, deliver a budget with less spending than forecast. Use the difference to reduce the debt.",,,https://twitter.com/gunker1/status/1213226137423355905
2020-01-03 22:29:02,Patrick90251193,SimonHarrisTD,0,0,You have some neck!,,,https://twitter.com/Patrick90251193/status/1213225784132952066
2020-01-03 22:28:11,seanie4Ireland,LeoVaradkar,0,0,Is there something your not telling us regards the multinationals? Are they leaving soon or what ! Before they leave get the corporate rate fixed with scamming to pay less,,,https://twitter.com/seanie4Ireland/status/1213225571691446275
2020-01-03 22:27:59,cos_niall,JeanApplin,0,0,Luckily ours aren't,,,https://twitter.com/cos_niall/status/1213225519820496897
2020-01-03 22:27:03,Paul_J_Roche,Paul_J_Roche,0,0,Oops. I did it again.,,,https://twitter.com/Paul_J_Roche/status/1213225286218768384
2020-01-03 22:25:35,seanie4Ireland,LeoVaradkar,0,0,We would have a lot more if ye didn’t waste so much on a corrupt bank debt that’s not ours,,,https://twitter.com/seanie4Ireland/status/1213224915077341184
2020-01-03 22:24:12,JeanApplin,cos_niall,1,0,We can send you millions more if you like. Our jails are bursting at the seams with enrichment by people from 3rd world countries.,,,https://twitter.com/JeanApplin/status/1213224568132964355
2020-01-03 22:23:06,ethelcrowley2,shannonwatch,0,0,This makes me so ashamed.,,,https://twitter.com/ethelcrowley2/status/1213224290780405760
2020-01-03 22:22:53,seanie4Ireland,caulmick,0,0,"Yr on yr it’s getting worse and @MichealMartinTD minister for health is glad at progress, what does Mickie no balls martin boss @LeoVaradkar think of it all",@MichealMartinTD @LeoVaradkar,,https://twitter.com/seanie4Ireland/status/1213224235637891079
2020-01-03 22:21:38,JeanApplin,cos_niall,0,0,Well if that’s what you call enrichment then God help us.,,,https://twitter.com/JeanApplin/status/1213223924563099649
2020-01-03 22:19:35,DaveDalyFM,LeoVaradkar,1,0,Don’t forget @LeoVaradkar this is purely down to businesses paying corporation tax in Ireland. Hard working businesses contributing to keeping the ship a float ,@LeoVaradkar,,https://twitter.com/DaveDalyFM/status/1213223405287288833
2020-01-03 22:17:53,chezmik,adriang86518036,0,4,.@LeoVaradkar What a terrible dark period in Ireland’s political history ,@LeoVaradkar,,https://twitter.com/chezmik/status/1213222980060360704
2020-01-03 22:17:08,CCHickey,LeoVaradkar,0,0,I dont believe you.,,,https://twitter.com/CCHickey/status/1213222789177597952
2020-01-03 22:15:00,PKPlunkett,LeoVaradkar,1,0,@LeoVaradkar - I grew up on a Dublin Corporation-built 1950s housing estate. I achieved many of my dreams. It was the far-sighted perspective of 1940s and 1950s politicians (especially Donagh O’Malley - 1966) that allowed those dreams to realise. Have you got “The Vision” ?,@LeoVaradkar,,https://twitter.com/PKPlunkett/status/1213222253539790849
2020-01-03 22:14:45,BrexitDoor,DVATW,0,0,Im here working one year Its full of migrants Muslims Africans the country is in it's knees no go areas The Irish people are pissed off The area I'm in is full of foreigners Only English speaking person in the road,,,https://twitter.com/BrexitDoor/status/1213222189782241286
2020-01-03 22:13:03,ZazaFL,,0,2,Well @LeoVaradkar are you going to have more blood on your hands by enabling Trump's latest warcrimes? Or are you going to respect international law &amp; Irish neutrality by stopping US military use of Shannon Airport? #USMilitaryOutofShannon #NoWarWithIran,@LeoVaradkar,#USMilitaryOutofShannon #NoWarWithIran,https://twitter.com/ZazaFL/status/1213221764190416897
2020-01-03 22:12:53,JoeMacintyre1,RENUAIreland,0,0,"You are all corrupt, there is no difference by any political party.",,,https://twitter.com/JoeMacintyre1/status/1213221722654162945
2020-01-03 22:11:23,councilofgrongo,LeoVaradkar,0,0,It also highlights the fact that you underestimated inbound revenue by quite some distance. Typical FG taking credit for others work. The national children’s hospital will smash a huge hole in that by the time you clowns are done.,,,https://twitter.com/councilofgrongo/status/1213221343346462720
2020-01-03 22:11:11,Earthexit1,LeoVaradkar,0,0,Build houses and fix hospitals and shut up promising tax cuts and do your job,,,https://twitter.com/Earthexit1/status/1213221291291021314
2020-01-03 22:10:49,Kelly1Christy,JFTAXI,0,0,I will be one of them,,,https://twitter.com/Kelly1Christy/status/1213221201679699978
2020-01-03 22:10:30,brianlenehan,EmmaMurphy12150,0,0,He means you @LeoVaradkar. I wouldn’t take that if I were you. A bit of time warranted in the back-benches (if either of you get re-elected if course).,@LeoVaradkar,,https://twitter.com/brianlenehan/status/1213221122826784768
2020-01-03 22:10:25,Nanchene,danieldunne,0,0,"Also Daniel, Dept Vets walk away, and ISPCA +DSPCA dont get involved and only work Monday to Friday 9-5. It's the non profit charities that r covering for the governments lack of effort. Again Daniel, thanks for ur response. You are the first person to reply to me in 5 months!",,,https://twitter.com/Nanchene/status/1213221101104508928
2020-01-03 22:08:35,mathewm50706486,GottaRighttobe1,0,0,He speaks in gibberish. A notoriously difficult language to translate.,,,https://twitter.com/mathewm50706486/status/1213220639974264832
2020-01-03 22:06:06,SC0TTR0BERTSON,DVATW,0,0,Is there anywhere these fuckwits won’t turn up?,,,https://twitter.com/SC0TTR0BERTSON/status/1213220015899660289
2020-01-03 22:05:51,Nanchene,danieldunne,0,0,"Thanks for replying Daniel.There is virtually no enforcement of the law Theyr all supposed to be microchipped, theyr not. So No 1 can b prosecuted.Police only involved if horses become a traffic hazard. Creed denies there is any issue at all (easy option) Some1 needs to own this",,,https://twitter.com/Nanchene/status/1213219952104226816
2020-01-03 22:04:42,traceybrougham,LeoVaradkar,0,0,Any chance of lowering the USC or getting rid of it?,,,https://twitter.com/traceybrougham/status/1213219661468327937
2020-01-03 22:04:06,NayNayCoffee,PhilipN77528183,0,0,Oh shut up. She was pointing out the fact that they will not be the ones who need to make such a choice. Your comment is ageist.,,,https://twitter.com/NayNayCoffee/status/1213219509596762114
2020-01-03 22:03:50,DavidAhernia,Dermopj,1,0,"Sounds a bit pie in the sky. The entire system would be rigged against you for a start - media, judiciary, police, politicians, corporations... they're all hand in glove.",,,https://twitter.com/DavidAhernia/status/1213219445193216000
2020-01-03 22:03:04,IntelligentCan2,mairenihuigin,0,0,"Freedom of speech and freedom of peaceful assembly are unalienable rights that are off limits to government intrusion. They are not government granted privileges, nor are those rights given by government; rather they preexist government.",,,https://twitter.com/IntelligentCan2/status/1213219248505544708
2020-01-03 22:02:58,RobFitzgerald5,Dermopj,2,0,You can. The debt pile of approx €205bn is broken up into loads of different tranches all owed at different times. The NTMA borrows approx €12bn a year. Mostly 10 year bonds but also shorter term and manages the debt pile that way.,,,https://twitter.com/RobFitzgerald5/status/1213219224900001799
2020-01-03 22:02:51,peterwfry,LeoVaradkar,0,0,How about the 10 Billion in interest ??,,,https://twitter.com/peterwfry/status/1213219197473439749
2020-01-03 22:01:28,Thedeise,LeoVaradkar,0,1,Nice to see Government priorities put the building of an Event Centre before 24/7 Cardiac Care for the South East Region.,,,https://twitter.com/Thedeise/status/1213218846452207617
2020-01-03 21:59:06,chezmik,lorcafan,0,4,.@LeoVaradkar Keep the bullshite going ,@LeoVaradkar,,https://twitter.com/chezmik/status/1213218250340913153
2020-01-03 21:58:28,MacL0ve,williamhboney1,1,0,I really hope the Government act on this @LeoVaradkar,@LeoVaradkar,,https://twitter.com/MacL0ve/status/1213218094920994818
2020-01-03 21:58:17,RobertFrogert,,0,0,@LeoVaradkar why are we allowing a foreign imperial power to land and refuel their military aircraft at Shannon airport? Aren't we neutral?,@LeoVaradkar,,https://twitter.com/RobertFrogert/status/1213218048561336321
2020-01-03 21:57:19,EoinPoil,circlete,0,0,"easy known an election is coming,even @KatieGHannon getting in on act for RTE, next up @PascalSheehy who in 2016 said sun was shining on Michael Martin",@KatieGHannon @PascalSheehy,,https://twitter.com/EoinPoil/status/1213217802976407553
